eid,doi,pii,pubmed_id,title,subtype,subtypeDescription,creator,afid,affilname,affiliation_city,affiliation_country,author_count,author_names,author_ids,author_afids,coverDate,coverDisplayDate,publicationName,issn,source_id,eIssn,aggregationType,volume,issueIdentifier,article_number,pageRange,description,authkeywords,citedby_count,openaccess,freetoread,freetoreadLabel,fund_acr,fund_no,fund_sponsor
2-s2.0-84987859185,10.1089/brain.2016.0430,,27353747,Children with Poor Reading Skills at the Word Level Show Reduced Fractional Anisotropy in White Matter Tracts of Both Hemispheres,ar,Article,De Moura L.M.,,King's College London;Universidade Federal de São Paulo,London;Sao Paulo,United Kingdom;Brazil,,,,,2016-09-01,1 September 2016,Brain Connectivity,21580014,21100299401,21580022,Journal,6,7,,519-523,,,7,0,,,,,
2-s2.0-84987811127,10.1111/ejn.13340,,27421820,Hemispheric asymmetries in subcortical visual and auditory relay structures in congenital deafness,ar,Article,Amaral L.,,"Faculdade de Psicologia e de Ciências da Educação;Universidade de Coimbra, Centro de Investigação do Núcleo de Estudos e Intervenção Cognitivo-Comportamental",Coimbra;Coimbra,Portugal;Portugal,,,,,2016-09-01,1 September 2016,European Journal of Neuroscience,0953816X,15550,14609568,Journal,44,6,,2334-2339,,,14,2,all repository repositoryvor,All Open Access Green,,,
2-s2.0-84987621965,10.1093/scan/nsw053,,27107298,Racial stereotypes impair flexibility of emotional learning,ar,Article,Dunsmoor J.E.,,New York University,New York,United States,,,,,2016-09-01,1 September 2016,Social Cognitive and Affective Neuroscience,17495016,7000153204,17495024,Journal,11,9,nsw053,1363-1373,,,13,1,all publisherhybridgold repository repositoryvor repositoryam,All Open Access Hybrid Gold Green,,,
2-s2.0-84986301151,10.3171/2016.2.SPINE151039,,27104288,Evaluation of the reliability and validity of the newer AOSpine subaxial cervical injury classification (C-3 to C-7),ar,Article,Da Silva O.T.,,Universidade Estadual de Campinas,Campinas,Brazil,,,,,2016-09-01,September 2016,Journal of Neurosurgery Spine,15475654,37369,15475646,Journal,25,3,,303-308,,,37,1,all publisherfree2read,All Open Access Bronze,,,
2-s2.0-84986267641,10.1111/jnc.13713,,27333343,Synaptopathies: synaptic dysfunction in neurological disorders – A review from students to students,re,Review,Lepeta K.,,Nencki Institute of Experimental Biology of the Polish Academy of Sciences,Warsaw,Poland,,,,,2016-09-01,1 September 2016,Journal of Neurochemistry,00223042,17620,14714159,Journal,,,,785-805,,,273,1,all publisherhybridgold repository repositoryvor,All Open Access Hybrid Gold Green,,,
2-s2.0-84986237572,10.1152/jn.00023.2016,,27306670,α1- and α2-adrenergic receptors in the retrotrapezoid nucleus differentially regulate breathing in anesthetized adult rats,ar,Article,Oliveira L.,,Universidade de São Paulo,Sao Paulo,Brazil,,,,,2016-09-01,September 2016,Journal of Neurophysiology,00223077,23475,15221598,Journal,116,3,,1036-1048,,,29,1,all publisherfree2read repository repositoryvor,All Open Access Bronze Green,,,
2-s2.0-84986203176,10.1152/jn.00022.2016,,27306669,In vitro characterization of noradrenergic modulation of chemosensitive neurons in the retrotrapezoid nucleus,ar,Article,Kuo F.S.,,University of Connecticut,Storrs,United States,,,,,2016-09-01,September 2016,Journal of Neurophysiology,00223077,23475,15221598,Journal,116,3,,1024-1035,,,18,1,all publisherfree2read repository repositoryvor,All Open Access Bronze Green,,,
2-s2.0-84985955339,10.1002/ana.24732,,27438337,New diagnostic criteria for neurocysticercosis: Reliability and validity,ar,Article,Carpio A.,,Gertrude H. Sergievsky Center;University of Cuenca,New York;Cuenca,United States;Ecuador,,,,,2016-09-01,1 September 2016,Annals of Neurology,03645134,14179,15318249,Journal,80,3,,434-442,,,101,1,all publisherhybridgold repository repositoryvor,All Open Access Hybrid Gold Green,,,
2-s2.0-84984783394,10.1503/jpn.160151,S1180488216300464,27575857,Staging model raises fundamental questions about the nature of bipolar disorder,ed,Editorial,Alda M.,,"Dalhousie University, Faculty of Medicine",Halifax,Canada,,,,,2016-09-01,September 2016,Journal of Psychiatry and Neuroscience,11804882,16816,14882434,Journal,41,5,,291-293,,,11,1,all publisherfree2read repository repositoryvor,All Open Access Bronze Green,,,
2-s2.0-84983755377,,,27238155,Brain magnetic stimulation in animal models: A valuable lesson for clinical applications,re,Review,Escribano B.M.,,Universidad de Córdoba;Instituto Maimónides de Investigación Biomédica de Córdoba (IMIBIC),Cordoba;Cordoba,Spain;Spain,,,,,2016-09-01,1 September 2016,CNS and Neurological Disorders Drug Targets,18715273,4500151409,19963181,Journal,15,7,,845-856,,,6,0,,,,,
2-s2.0-84983350852,10.1097/MAO.0000000000001148,,27518131,Moving beyond GDP: Cost Effectiveness of Cochlear Implantation and Deaf Education in Latin America,cp,Conference Paper,Emmett S.D.,,Johns Hopkins University School of Medicine;Johns Hopkins Bloomberg School of Public Health,Baltimore;Baltimore,United States;United States,,,,,2016-09-01,1 September 2016,Otology and Neurotology,15317129,14314,15374505,Journal,37,8,,1040-1048,,,20,0,,,,,
2-s2.0-84983049716,10.1177/0165025415594030,,,Is the ideal mother a sensitive mother? Beliefs about early childhood parenting in mothers across the globe,ar,Article,Mesman J.,,Universiteit Leiden,Leiden,Netherlands,,,,,2016-09-01,1 September 2016,International Journal of Behavioral Development,01650254,14871,14640651,Journal,40,5,,385-397,,,84,2,all repository repositoryam,All Open Access Green,,,
2-s2.0-84982992667,10.1002/hbm.23231,,27133613,Large-scale brain networks are distinctly affected in right and left mesial temporal lobe epilepsy,ar,Article,de Campos B.M.,,Universidade Estadual de Campinas,Campinas,Brazil,,,,,2016-09-01,1 September 2016,Human Brain Mapping,10659471,16101,10970193,Journal,37,9,,3137-3152,,,100,1,all publisherhybridgold repository repositoryvor,All Open Access Hybrid Gold Green,,,
2-s2.0-84982187322,10.1111/dmcn.13134,,27060691,"Nutritional status and gross motor function in children with cerebral palsy, and implications for Zika virus infection",no,Note,Leandro C.,,Universidade Federal de Pernambuco,Recife,Brazil,,,,,2016-09-01,1 September 2016,Developmental Medicine and Child Neurology,00121622,14987,14698749,Journal,58,9,,893-894,,,6,1,all publisherfree2read,All Open Access Bronze,,,
2-s2.0-84981484506,10.2174/1567205013666160401114415,,27033057,"Inflammation, oxidation, caloric expenditure and cognitive impairment in Brazilian elderly assisted at primary care",ar,Article,Nogueira G.M.,,Pontifícia Universidade Católica do Rio Grande do Sul,Porto Alegre,Brazil,,,,,2016-09-01,1 September 2016,Current Alzheimer Research,15672050,130034,18755828,Journal,13,9,,1056-1063,,,4,0,,,,,
2-s2.0-84981164919,10.1097/MAO.0000000000001136,,27509294,"Ménière's Disease: Molecular Analysis of Aquaporins 2, 3 and Potassium Channel KCNE1 Genes in Brazilian Patients",ar,Article,Lopes K.,,Universidade Federal de São Paulo,Sao Paulo,Brazil,,,,,2016-09-01,1 September 2016,Otology and Neurotology,15317129,14314,15374505,Journal,37,8,,1117-1121,,,17,0,,,,,
2-s2.0-84980385740,10.1016/j.msard.2016.07.018,S2211034816301274,27645359,"Serological prevalence of celiac disease in brazilian population of multiple sclerosis, neuromyelitis optica and myelitis",ar,Article,de Oliveira P.,,SARAH Network of Rehabilitation Hospitals,Brasilia,Brazil,,,,,2016-09-01,1 September 2016,Multiple Sclerosis and Related Disorders,22110348,20000195097,22110356,Journal,9,,,125-128,,,8,0,,,,,
2-s2.0-84980027979,10.1111/mbe.12122,,,A Naturalistic Assessment of the Organization of Children's Memories Predicts Cognitive Functioning and Reading Ability,ar,Article,Mota N.B.,,Universidade Federal do Rio Grande do Norte,Natal,Brazil,,,,,2016-09-01,1 September 2016,Mind Brain and Education,17512271,12100156320,1751228X,Journal,10,3,,184-195,,,41,2,all repository repositoryvor,All Open Access Green,,,
2-s2.0-84979993800,10.1038/nrn.2016.102,,27466142,Meanings of self-grooming depend on an inverted U-shaped function with aversiveness,le,Letter,Fernández-Teruel A.,,"Instituto de Neurociencias, Universitat Autònoma de Barcelona",Cerdanyola del Valles,Spain,,,,,2016-09-01,1 September 2016,Nature Reviews Neuroscience,1471003X,17437,14710048,Journal,17,9,,591,,,53,0,,,,,
2-s2.0-84979953918,10.1007/s11064-016-1961-6,,27230882,Alteration of Cytokines Levels in the Striatum of Rats: Possible Participation in Vacuous Chewing Movements Induced by Antipsycotics,ar,Article,Peroza L.R.,,Universidade Federal de Santa Maria,Santa Maria,Brazil,,,,,2016-09-01,1 September 2016,Neurochemical Research,03643190,17484,15736903,Journal,41,9,,2481-2489,,,14,0,,,,,
2-s2.0-84979746800,10.1111/ane.12530,,26553747,Sequential brief neuropsychological evaluation of migraineurs is identical to controls,ar,Article,Gil-Gouveia R.,,Faculdade de Medicina da Universidade de Lisboa;Hospital da Luz,Lisbon;Lisbon,Portugal;Portugal,,,,,2016-09-01,1 September 2016,Acta Neurologica Scandinavica,00016314,17548,16000404,Journal,134,3,,197-204,,,14,1,all publisherfullgold,All Open Access Gold,,,
2-s2.0-84979731402,10.1016/j.euroneuro.2016.06.012,S0924977X16300967,27480019,Meta-analysis of the DRD5 VNTR in persistent ADHD,ar,Article,Klein M.,,Radboud University Medical Center,Nijmegen,Netherlands,,,,,2016-09-01,1 September 2016,European Neuropsychopharmacology,0924977X,15576,18737862,Journal,26,9,,1527-1532,,,5,2,all repository repositoryvor,All Open Access Green,,,
2-s2.0-84979608062,10.1016/j.neuro.2016.07.009,S0161813X1630136X,27456245,Sex- and structure-specific differences in antioxidant responses to methylmercury during early development,ar,Article,Ruszkiewicz J.A.,,Albert Einstein College of Medicine,New York,United States,,,,,2016-09-01,1 September 2016,Neurotoxicology,0161813X,18073,18729711,Journal,56,,,118-126,,,26,2,all repository repositoryam,All Open Access Green,,,
2-s2.0-84978795118,10.1016/j.heares.2016.05.017,S037859551530280X,27262450,Detection efficiency of auditory steady state evoked by modulated noise,ar,Article,Santos T.S.,,Universidade Federal de Minas Gerais,Belo Horizonte,Brazil,,,,,2016-09-01,1 September 2016,Hearing Research,03785955,13707,18785891,Journal,339,,,125-131,,,9,0,,,,,
2-s2.0-84978496115,10.1016/j.yebeh.2016.06.037,S1525505016302189,27448240,Rosmarinic acid is anticonvulsant against seizures induced by pentylenetetrazol and pilocarpine in mice,ar,Article,Grigoletto J.,,Universidade Federal de Santa Maria,Santa Maria,Brazil,,,,,2016-09-01,1 September 2016,Epilepsy and Behavior,15255050,13163,15255069,Journal,62,,,27-34,,,36,1,,,,,
2-s2.0-84978468799,10.1016/j.yebeh.2016.05.031,S1525505016301238,27441815,Echoes of the association between autism and epilepsy: A long translational research explanation,le,Letter,Scorza F.A.,,Universidade Federal de São Paulo,Sao Paulo,Brazil,,,,,2016-09-01,1 September 2016,Epilepsy and Behavior,15255050,13163,15255069,Journal,62,,,12-13,,,0,0,,,,,
2-s2.0-84978289264,10.1016/j.neuro.2016.06.002,S0161813X16301036,27350176,Exposure to pesticides and mental disorders in a rural population of Southern Brazil,ar,Article,Campos É.,,Instituto Nacional de Cancer,Rio de Janeiro,Brazil,,,,,2016-09-01,1 September 2016,Neurotoxicology,0161813X,18073,18729711,Journal,56,,,7-16,,,56,0,,,,,
2-s2.0-84978289214,10.1016/j.neubiorev.2016.06.040,S0149763415301263,27377693,"Mitochondrial dysfunction in bipolar disorder: Evidence, pathophysiology and translational implications",re,Review,Scaini G.,,McGovern Medical School;Universidade do Extremo Sul Catarinense,Houston;Criciuma,United States;Brazil,,,,,2016-09-01,1 September 2016,Neuroscience and Biobehavioral Reviews,01497634,18045,18737528,Journal,68,,,694-713,,,139,0,,,,,
2-s2.0-84978224761,10.1016/j.beproc.2016.07.003,S0376635716301565,27397574,Correlations among stimuli affect stimulus matching and stimulus liking,ar,Article,Pimenta D.,,Universidade Federal do Pará,Belem,Brazil,,,,,2016-09-01,1 September 2016,Behavioural Processes,03766357,14288,18728308,Journal,130,,,36-38,,,4,0,,,,,
2-s2.0-84978127449,10.1037/pne0000057,,,A reliable depression-like model in zebrafish (Danio rerio): Learned helplessness,ar,Article,do Nascimento G.,,Universidade Federal do Pará,Belem,Brazil,,,,,2016-09-01,1 September 2016,Psychology and Neuroscience,19843054,19700175781,19833288,Journal,9,3,,390-397,,,8,0,,,,,
2-s2.0-84978091651,10.1016/j.brainres.2016.06.037,S0006899316304607,27350078,Egg white hydrolysate promotes neuroprotection for neuropathic disorders induced by chronic exposure to low concentrations of mercury,ar,Article,Rizzetti D.A.,,Universidade Federal do Pampa,Bage,Brazil,,,,,2016-09-01,1 September 2016,Brain Research,00068993,14346,18726240,Journal,1646,,,482-489,,,23,2,all repository repositoryam,All Open Access Green,,,
2-s2.0-84977638390,10.1016/j.brs.2016.06.004,S1935861X16301401,27372845,Safety of Transcranial Direct Current Stimulation: Evidence Based Update 2016,re,Review,Bikson M.,,The Grove School of Engineering,New York,United States,,,,,2016-09-01,1 September 2016,Brain Stimulation,1935861X,11700154204,18764754,Journal,9,5,,641-661,,,1062,1,all publisherfree2read repository repositoryam,All Open Access Bronze Green,,,
2-s2.0-84977613554,10.1016/j.brs.2016.06.053,S1935861X16301905,,Center of Pressure Speed Changes with tDCS Versus GVS in Patients with Lateropulsion after Stroke,le,Letter,Babyar S.,,Hunter College,New York,United States,,,,,2016-09-01,1 September 2016,Brain Stimulation,1935861X,11700154204,18764754,Journal,9,5,,796-798,,,16,0,,,,,
2-s2.0-84977107133,10.1016/j.neubiorev.2016.06.028,S0149763416301452,27345144,Effects of experimental sleep deprivation on anxiety-like behavior in animal research: Systematic review and meta-analysis,re,Review,Pires G.N.,,Universidade Federal de São Paulo,Sao Paulo,Brazil,,,,,2016-09-01,1 September 2016,Neuroscience and Biobehavioral Reviews,01497634,18045,18737528,Journal,68,,,575-589,,,57,0,,,,,
2-s2.0-84976566733,10.1016/j.neubiorev.2016.06.021,S014976341630032X,27328784,An overview of maternal separation effects on behavioural outcomes in mice: Evidence from a four-stage methodological systematic review,re,Review,Tractenberg S.G.,,Pontifícia Universidade Católica do Rio Grande do Sul,Porto Alegre,Brazil,,,,,2016-09-01,1 September 2016,Neuroscience and Biobehavioral Reviews,01497634,18045,18737528,Journal,68,,,489-503,,,222,0,,,,,
2-s2.0-84976563077,10.1016/j.neubiorev.2016.06.010,S014976341630046X,27328785,The role of DNA methylation in the pathophysiology and treatment of bipolar disorder,re,Review,Fries G.R.,,McGovern Medical School,Houston,United States,,,,,2016-09-01,1 September 2016,Neuroscience and Biobehavioral Reviews,01497634,18045,18737528,Journal,68,,,474-488,,,62,2,all repository repositoryam,All Open Access Green,,,
2-s2.0-84976292415,10.1016/j.jneumeth.2016.06.010,S0165027016301315,27328370,Investigation of rat exploratory behavior via evolving artificial neural networks,ar,Article,Costa A.d.A.,,Universidade de São Paulo,Sao Paulo,Brazil,,,,,2016-09-01,1 September 2016,Journal of Neuroscience Methods,01650270,16765,1872678X,Journal,270,,,102-110,,,1,0,,,,,
2-s2.0-84975882051,10.1016/j.neuroimage.2016.05.003,S1053811916301112,27157789,Towards motion insensitive EEG-fMRI: Correcting motion-induced voltages and gradient artefact instability in EEG using an fMRI prospective motion correction (PMC) system,ar,Article,Maziero D.,,Universidade de São Paulo;UCL Great Ormond Street Institute of Child Health,Sao Paulo;London,Brazil;United Kingdom,,,,,2016-09-01,1 September 2016,Neuroimage,10538119,17495,10959572,Journal,138,,,13-27,,,33,1,all publisherhybridgold repository repositoryvor,All Open Access Hybrid Gold Green,,,
2-s2.0-84975880685,10.1016/j.ensci.2016.06.002,S2405650216300235,,How do people with drug-resistant mesial temporal lobe epilepsy sleep? A clinical and video-EEG with EOG and submental EMG for sleep staging study,ar,Article,Scarlatelli-Lima A.V.,,Hospital Governador Celso Ramos,Florianopolis,Brazil,,,,,2016-09-01,1 September 2016,Eneurologicalsci,,21100416114,24056502,Journal,4,,,34-41,,,29,1,all publisherfullgold repository repositoryvor,All Open Access Gold Green,,,
2-s2.0-84975706573,10.1016/j.brainres.2016.06.024,S0006899316304474,27321158,Leptin receptor-positive and leptin receptor-negative proopiomelanocortin neurons innervate an identical set of brain structures,ar,Article,Lima L.,,Universidade de São Paulo,Sao Paulo,Brazil,,,,,2016-09-01,1 September 2016,Brain Research,00068993,14346,18726240,Journal,1646,,,366-376,,,16,0,,,,,
2-s2.0-84974777300,10.1016/j.brainres.2016.06.004,S0006899316304279,27270234,"Antidepressant-like activity of liposomal formulation containing nimodipine treatment in the tail suspension test, forced swim test and MAOB activity in mice",ar,Article,Moreno L.C.G.E.A.I.,,Universidade Federal de Pernambuco;Universidade Federal do Piauí,Recife;Teresina,Brazil;Brazil,,,,,2016-09-01,1 September 2016,Brain Research,00068993,14346,18726240,Journal,1646,,,235-240,,,24,1,all publisherhybridgold,All Open Access Hybrid Gold,,,
2-s2.0-84974603013,10.1016/j.jpsychires.2016.05.007,S0022395616300917,27302873,Exploring the latent trait of opioid use disorder criteria among frequent nonmedical prescription opioid users,ar,Article,Castaldelli-Maia J.M.,,Universidade de São Paulo;Centro Universitário FMABC,Sao Paulo;Santo Andre,Brazil;Brazil,,,,,2016-09-01,1 September 2016,Journal of Psychiatric Research,00223956,16812,18791379,Journal,80,,,79-86,,,13,2,all repository repositoryvor repositoryam,All Open Access Green,,,
2-s2.0-84974602212,10.1016/j.resp.2016.06.001,S1569904816300957,27267466,Cationic liposomes containing antioxidants reduces pulmonary injury in experimental model of sepsis: Liposomes antioxidants reduces pulmonary damage,ar,Article,Galvão A.M.,,Universidade Federal de Pernambuco,Recife,Brazil,,,,,2016-09-01,1 September 2016,Respiratory Physiology and Neurobiology,15699048,24030,18781519,Journal,231,,,55-62,,,15,1,all publisherhybridgold,All Open Access Hybrid Gold,,,
2-s2.0-84973902083,10.1016/j.jpsychires.2016.06.002,S0022395616301091,27302872,"Pleiotropic effects of Chr15q25 nicotinic gene cluster and the relationship between smoking, cognition and ADHD",ar,Article,Schuch J.,,Universidade Federal do Rio Grande do Sul,Porto Alegre,Brazil,,,,,2016-09-01,1 September 2016,Journal of Psychiatric Research,00223956,16812,18791379,Journal,80,,,73-78,,,12,0,,,,,
2-s2.0-84973533395,10.1016/j.brs.2016.05.004,S1935861X16301000,27261431,A Systematic Review on the Acceptability and Tolerability of Transcranial Direct Current Stimulation Treatment in Neuropsychiatry Trials,re,Review,Aparício L.V.M.,,Universidade de São Paulo,Sao Paulo,Brazil,,,,,2016-09-01,1 September 2016,Brain Stimulation,1935861X,11700154204,18764754,Journal,9,5,,671-681,,,140,0,,,,,
2-s2.0-84973514474,10.1016/j.physbeh.2016.05.038,S0031938416303006,,Erratum: Corrigendum to “Dawn-song onset coincides with increased HVC androgen receptor expression but is decoupled from high circulating testosterone in an equatorial songbird” (Physiol. Behav. (2016) (156) 1–7),er,Erratum,Quispe R.,,Max-Planck-Institut für Ornithologie,Pocking,Germany,,,,,2016-09-01,1 September 2016,Physiology and Behavior,00319384,24007,1873507X,Journal,163,,,334,,,0,0,,,,,
2-s2.0-84973397835,10.1016/j.resp.2016.05.016,S1569904816300933,27238370,Role of central hydrogen sulfide on ventilatory and cardiovascular responses to hypoxia in spontaneous hypertensive rats,ar,Article,Sabino J.,,Universidade de São Paulo,Sao Paulo,Brazil,,,,,2016-09-01,1 September 2016,Respiratory Physiology and Neurobiology,15699048,24030,18781519,Journal,231,,,21-27,,,16,0,,,,,
2-s2.0-84973128298,10.1016/j.neubiorev.2016.05.028,S0149763415300403,27235083,"Self, cortical midline structures and the resting state: Implications for Alzheimer's disease",re,Review,Weiler M.,,Universidade Estadual de Campinas,Campinas,Brazil,,,,,2016-09-01,1 September 2016,Neuroscience and Biobehavioral Reviews,01497634,18045,18737528,Journal,68,,,245-255,,,36,0,,,,,
2-s2.0-84973102988,10.1016/j.jpsychires.2016.05.014,S0022395616301054,27281261,"Bipolar disorder course, impaired glucose metabolism and antioxidant enzymes activities: A preliminary report",ar,Article,Mansur R.B.,,Universidade Federal de São Paulo;University Health Network,Sao Paulo;Toronto,Brazil;Canada,,,,,2016-09-01,1 September 2016,Journal of Psychiatric Research,00223956,16812,18791379,Journal,80,,,38-44,,,17,0,,,,,
2-s2.0-84971468246,10.1016/j.psyneuen.2016.05.015,S0306453016301469,27258821,Association of serum interleukin-6 with mental health problems in children exposed to perinatal complications and social disadvantage,ar,Article,Mansur R.B.,,Universidade Federal de São Paulo;University Health Network;National Institute of Developmental Psychiatry for Children and Adolescents,Sao Paulo;Toronto;Sao Paulo,Brazil;Canada;Brazil,,,,,2016-09-01,1 September 2016,Psychoneuroendocrinology,03064530,18745,18733360,Journal,71,,,94-101,,,8,0,,,,,
2-s2.0-84971421817,10.1016/j.brainres.2016.05.039,S0006899316304012,27216571,Brain-machine interface facilitated neurorehabilitation via spinal stimulation after spinal cord injury: Recent progress and future perspectives,re,Review,Alam M.,,National University of Singapore,Singapore City,Singapore,,,,,2016-09-01,1 September 2016,Brain Research,00068993,14346,18726240,Journal,1646,,,25-33,,,53,0,,,,,
2-s2.0-84970024969,10.1002/ajmg.b.32455,,27184105,The role of protein intrinsic disorder in major psychiatric disorders,ar,Article,Tovo-Rodrigues L.,,Universidade Federal do Rio Grande do Sul;Universidade Federal de Pelotas,Porto Alegre;Pelotas,Brazil;Brazil,,,,,2016-09-01,1 September 2016,American Journal of Medical Genetics Part B Neuropsychiatric Genetics,15524841,145178,1552485X,Journal,171,6,,848-860,,,10,0,,,,,
2-s2.0-84969776495,10.1016/j.psyneuen.2016.04.016,S0306453016301068,27235636,"Cognitive impairment effects of early life stress in adolescents can be predicted with early biomarkers: Impacts of sex, experience, and cytokines",ar,Article,Grassi-Oliveira R.,,Pontifícia Universidade Católica do Rio Grande do Sul,Porto Alegre,Brazil,,,,,2016-09-01,1 September 2016,Psychoneuroendocrinology,03064530,18745,18733360,Journal,71,,,19-30,,,86,2,all repository repositoryam,All Open Access Green,,,
2-s2.0-84969706647,10.1016/j.neuropharm.2016.04.018,S0028390816301587,27091486,Unraveling a new circuitry for sleep regulation in Parkinson's disease,ar,Article,Targa A.D.S.,,Universidade Federal do Parana,Curitiba,Brazil,,,,,2016-09-01,1 September 2016,Neuropharmacology,00283908,20435,18737064,Journal,108,,,161-171,,,21,0,,,,,
2-s2.0-84969674397,10.1016/j.neuropharm.2016.04.011,S0028390816301472,27079841,Functional lateralization of the medial prefrontal cortex in the modulation of anxiety in mice: Left or right?,ar,Article,Costa N.S.,,"Universidade Estadual Paulista ""Júlio de Mesquita Filho""",Sao Paulo,Brazil,,,,,2016-09-01,1 September 2016,Neuropharmacology,00283908,20435,18737064,Journal,108,,,82-90,,,28,2,all repository repositoryvor,All Open Access Green,,,
2-s2.0-84969217106,10.1016/j.physbeh.2016.05.003,S0031938416302153,27163523,"Effects of interleukin-1 beta injections into the subfornical organ and median preoptic nucleus on sodium appetite, blood pressure and body temperature of sodium-depleted rats",ar,Article,Cerqueira D.,,Universidade Federal da Bahia,Salvador,Brazil,,,,,2016-09-01,1 September 2016,Physiology and Behavior,00319384,24007,1873507X,Journal,163,,,149-160,,,4,0,,,,,
2-s2.0-84966713803,10.1016/j.physbeh.2016.04.053,S0031938416302013,27143251,Assessment of the differences in masticatory behavior between male and female adolescents,ar,Article,Scudine K.G.d.O.,,Universidade Estadual de Campinas,Campinas,Brazil,,,,,2016-09-01,1 September 2016,Physiology and Behavior,00319384,24007,1873507X,Journal,163,,,115-122,,,35,0,,,,,
2-s2.0-84966691977,10.1007/s00221-016-4663-z,,27161552,Tactile perception during action observation,ar,Article,Vastano R.,,Istituto Italiano di Tecnologia,Genoa,Italy,,,,,2016-09-01,1 September 2016,Experimental Brain Research,00144819,15585,14321106,Journal,234,9,,2585-2594,,,11,0,,,,,
2-s2.0-84966602568,10.1007/s11064-016-1933-x,,27161368,"Ornithine and Homocitrulline Impair Mitochondrial Function, Decrease Antioxidant Defenses and Induce Cell Death in Menadione-Stressed Rat Cortical Astrocytes: Potential Mechanisms of Neurological Dysfunction in HHH Syndrome",ar,Article,Zanatta Â.,,Universidade Federal do Rio Grande do Sul,Porto Alegre,Brazil,,,,,2016-09-01,1 September 2016,Neurochemical Research,03643190,17484,15736903,Journal,41,9,,2190-2198,,,19,0,,,,,
2-s2.0-84962747595,10.1016/j.pneurobio.2016.03.010,S0301008215300502,27048624,Astrocytes as a target for neuroprotection: Modulation by progesterone and dehydroepiandrosterone,re,Review,Arbo B.D.,,Universidade Federal do Rio Grande do Sul;CSIC - Instituto Cajal (IC),Porto Alegre;Madrid,Brazil;Spain,,,,,2016-09-01,1 September 2016,Progress in Neurobiology,03010082,24025,18735118,Journal,144,,,27-47,,,44,0,,,,,
2-s2.0-84962173553,10.1136/bjophthalmol-2015-307393,,26817482,"Association between light-to-dark changes in angle width and iris parameters in light, dark and changes from light-to-dark conditions",ar,Article,Lee R.Y.,,UCSF School of Medicine;Wake Forest University School of Medicine,San Francisco;Winston Salem,United States;United States,,,,,2016-09-01,1 September 2016,British Journal of Ophthalmology,00071161,13736,14682079,Journal,100,9,,1274-1279,,,5,0,,,,,
