eid,doi,pii,pubmed_id,title,subtype,subtypeDescription,creator,afid,affilname,affiliation_city,affiliation_country,author_count,author_names,author_ids,author_afids,coverDate,coverDisplayDate,publicationName,issn,source_id,eIssn,aggregationType,volume,issueIdentifier,article_number,pageRange,description,authkeywords,citedby_count,openaccess,freetoread,freetoreadLabel,fund_acr,fund_no,fund_sponsor
2-s2.0-84953431582,10.1016/j.neuroscience.2015.12.037,S0306452215011306,26724582,Older adults with history of falls are unable to perform walking and prehension movements simultaneously,ar,Article,Rinaldi N.,,Universidade de São Paulo,Sao Paulo,Brazil,,,,,2016-03-01,"March 01, 2016",Neuroscience,03064522,18042,18737544,Journal,316,,,249-260,,,19,0,,,,,
2-s2.0-84952897686,10.1016/j.physbeh.2015.12.023,S0031938415302201,26724713,Circadian activity rhythm in pre-pubertal and pubertal marmosets (Callithrix jacchus) living in family groups,ar,Article,Melo P.R.,,Universidade Federal do Rio Grande do Norte,Natal,Brazil,,,,,2016-03-01,"March 01, 2016",Physiology and Behavior,00319384,24007,1873507X,Journal,155,,,242-249,,,10,1,all publisherhybridgold repository repositoryvor,All Open Access Hybrid Gold Green,,,
2-s2.0-84952683678,10.1016/j.arr.2015.12.006,S1568163715300428,26732034,Systematic review of the association between chronic social stress and telomere length: A life course perspective,re,Review,Oliveira B.S.,,Universidade Federal do Rio Grande do Norte,Natal,Brazil,,,,,2016-03-01,"March 01, 2016",Ageing Research Reviews,15681637,28475,18729649,Journal,26,,,37-52,,,121,0,,,,,
2-s2.0-84951998916,10.1016/j.euroneuro.2015.12.032,S0924977X15004150,26749090,5-Hydroxytryptamine 1A receptors in the dorsomedial hypothalamus connected to dorsal raphe nucleus inputs modulate defensive behaviours and mediate innate fear-induced antinociception,ar,Article,Biagioni A.F.,,Universidade de São Paulo;Instituto de Neurociências e Comportamento,Sao Paulo;Ribeirao Preto,Brazil;Brazil,,,,,2016-03-01,1 March 2016,European Neuropsychopharmacology,0924977X,15576,18737862,Journal,26,3,,532-545,,,31,0,,,,,
2-s2.0-84949964319,10.1016/j.beproc.2015.11.021,S0376635715300863,26655891,How Betta splendens finds its way,ar,Article,Luchiari A.,,Universidade Federal do Rio Grande do Norte,Natal,Brazil,,,,,2016-03-01,"March 01, 2016",Behavioural Processes,03766357,14288,18728308,Journal,124,,,47-51,,,6,0,,,,,
2-s2.0-84949654390,10.1016/j.physbeh.2015.12.005,S003193841530202X,26683533,Playing match venue does not affect resting salivary steroids in elite Futsal players,ar,Article,Arruda A.,,Universidade de São Paulo,Sao Paulo,Brazil,,,,,2016-03-01,"March 01, 2016",Physiology and Behavior,00319384,24007,1873507X,Journal,155,,,77-82,,,12,0,,,,,
2-s2.0-84949495459,10.1142/S0219635216500047,,26620193,Neonatal handling causes impulsive behavior and decreased pharmacological response to methylphenidate in male adult wistar rats,ar,Article,Lazzaretti C.,,Universidade Federal do Rio Grande do Sul,Porto Alegre,Brazil,,,,,2016-03-01,1 March 2016,Journal of Integrative Neuroscience,02196352,16722,1757448X,Journal,15,1,,81-95,,,12,0,,,,,
2-s2.0-84948991732,10.1016/j.physbeh.2015.11.038,S0031938415301979,26657020,Diphenyl diselenide ameliorates monosodium glutamate induced anxiety-like behavior in rats by modulating hippocampal BDNF-Akt pathway and uptake of GABA and serotonin neurotransmitters,ar,Article,Rosa S.,,Universidade Federal de Santa Maria,Santa Maria,Brazil,,,,,2016-03-01,"March 01, 2016",Physiology and Behavior,00319384,24007,1873507X,Journal,155,,,1-8,,,48,1,all publisherhybridgold,All Open Access Hybrid Gold,,,
2-s2.0-84943311243,10.1159/000439277,,26445481,The effect of melatonin adsorbed to polyethylene glycol microspheres on the survival of MCF-7 cells,ar,Article,França E.L.,,Universidade Federal de Mato Grosso;Universidade Federal de Sao Joao del-Rei,Cuiaba;Sao Joao del Rei,Brazil;Brazil,,,,,2016-03-01,1 March 2016,Neuroimmunomodulation,10217401,21336,14230216,Journal,23,1,,27-32,,,17,0,,,,,
2-s2.0-84941710565,10.1111/bpa.12296,,26260327,Higher prevalence of TDP-43 proteinopathy in cognitively normal Asians: A clinicopathological study on a multiethnic sample,ar,Article,Nascimento C.,,Universidade de São Paulo,Sao Paulo,Brazil,,,,,2016-03-01,1 March 2016,Brain Pathology,10156305,14344,17503639,Journal,26,2,,177-185,,,27,2,all repository repositoryvor repositoryam,All Open Access Green,,,
2-s2.0-84959423374,10.3791/53597,,26967310,CN-GELFrEE - Clear native gel-eluted liquid fraction entrapment electrophoresis,ar,Article,Melani R.D.,,Northwestern University Feinberg School of Medicine;Universidade Federal do Rio de Janeiro,Chicago;Rio de Janeiro,United States;Brazil,,,,,2016-02-29,29 February 2016,Journal of Visualized Experiments,1940087X,19900191993,,Journal,2016,108,e53597,,,,12,2,all repository repositoryvor,All Open Access Green,,,
2-s2.0-84955697730,10.1016/j.neucom.2015.12.012,S0925231215019281,,A tutorial on signal energy and its applications,ar,Article,Guido R.C.,,"Universidade Estadual Paulista ""Júlio de Mesquita Filho""",Sao Paulo,Brazil,,,,,2016-02-29,29 February 2016,Neurocomputing,09252312,24807,18728286,Journal,179,,,264-282,,,42,0,,,,,
2-s2.0-84957435648,10.1016/j.psychres.2015.12.029,S0165178115308696,26763110,Personality traits in the differentiation of major depressive disorder and bipolar disorder during a depressive episode,ar,Article,Araujo J.M.G.,,Universidade Catolica de Pelotas,Pelotas,Brazil,,,,,2016-02-28,28 February 2016,Psychiatry Research,01651781,18729,18727123,Journal,236,,,75-79,,,2,0,,,,,
2-s2.0-84957864959,10.1016/j.neulet.2016.01.030,S0304394016300295,26806863,Val66Met BDNF polymorphism is associated with Parkinson's disease cognitive impairment,ar,Article,Altmann V.,,Universidade Federal do Rio Grande do Sul,Porto Alegre,Brazil,,,,,2016-02-26,"February 26, 2016",Neuroscience Letters,03043940,18046,18727972,Journal,615,,,88-91,,,42,1,all publisherfree2read,All Open Access Bronze,,,
2-s2.0-84979620557,10.7554/eLife.13212,,26910011,Temporal modulation of collective cell behavior controls vascular network topology,ar,Article,Kur E.,,Harvard Medical School,Boston,United States,,,,,2016-02-24,24 February 2016,Elife,,21100242814,2050084X,Journal,5,FEBRUARY2016,e13212,,,,16,1,all publisherfullgold repository repositoryvor repositoryam,All Open Access Gold Green,,,
2-s2.0-84961267144,10.7554/eLife.11285,,26910315,Evaluating probabilistic dengue risk forecasts from a prototype early warning system for Brazil,ar,Article,Lowe R.,,Institut Català de Ciències del Clima,Barcelona,Spain,,,,,2016-02-24,24 February 2016,Elife,,21100242814,2050084X,Journal,5,FEBRUARY2016,e11285,,,,61,1,all publisherfullgold repository repositoryam,All Open Access Gold Green,,,
2-s2.0-84959449987,10.1523/JNEUROSCI.3285-15.2016,,26911689,Embedding a panoramic representation of infrared light in the adult rat somatosensory cortex through a sensory neuroprosthesis,ar,Article,Hartmann K.,,Humboldt-Universität zu Berlin;Duke University Medical Center,Berlin;Durham,Germany;United States,,,,,2016-02-24,24 February 2016,Journal of Neuroscience,02706474,16764,15292401,Journal,36,8,,2406-2424,,,22,1,all publisherhybridgold repository repositoryvor,All Open Access Hybrid Gold Green,,,
2-s2.0-84959164602,10.1038/nn.4224,,26807950,Separate circuitries encode the hedonic and nutritional values of sugar,ar,Article,Tellez L.A.,,Yale School of Medicine;John B. Pierce Foundation Laboratory,New Haven;New Haven,United States;United States,,,,,2016-02-23,23 February 2016,Nature Neuroscience,10976256,17436,15461726,Journal,19,3,,465-470,,,183,2,all repository repositoryam,All Open Access Green,,,
2-s2.0-84952911994,10.1016/j.neuroscience.2015.12.018,S030645221501101X,26704636,High sucrose consumption induces memory impairment in rats associated with electrophysiological modifications but not with metabolic changes in the hippocampus,ar,Article,Lemos C.,,"Universidade de Coimbra, Faculdade de Ciências e Tecnologia;University of Coimbra, Center for Neuroscience and Cell Biology",Coimbra;Coimbra,Portugal;Portugal,,,,,2016-02-19,"February 19, 2016",Neuroscience,03064522,18042,18737544,Journal,315,,,196-205,,,25,0,,,,,
2-s2.0-84959543541,10.1371/journal.pbio.1002373,,26886064,A Guide to Scientific Crowdfunding,ar,Article,Vachelard J.,,Beagle Bioinformatics;Dodo Funding,Santiago;Santiago,Chile;Chile,,,,,2016-02-17,17 February 2016,Plos Biology,15449173,12977,15457885,Journal,14,2,e1002373,,,,54,1,all publisherfullgold repository repositoryvor repositoryam,All Open Access Gold Green,,,
2-s2.0-84959259565,10.3109/15622975.2015.1132007,,26912127,Assessment and management of agitation in psychiatry: Expert consensus,ar,Article,Garriga M.,,Universitat de Barcelona,Barcelona,Spain,,,,,2016-02-17,17 February 2016,World Journal of Biological Psychiatry,15622975,94948,18141412,Journal,17,2,,86-128,,,207,0,,,,,
2-s2.0-84964403863,10.3389/fnins.2016.00032,,,Differential expression of AMPA subunits induced by NMDA intrahippocampal injection in rats,ar,Article,Fachim H.A.,,Universidade de São Paulo;Instituto de Neurociências e Comportamento,Sao Paulo;Ribeirao Preto,Brazil;Brazil,,,,,2016-02-15,15 February 2016,Frontiers in Neuroscience,16624548,21100199812,1662453X,Journal,10,FEB,32,,,,13,1,all publisherfullgold repository repositoryvor,All Open Access Gold Green,,,
2-s2.0-84953639361,10.1002/cne.23792,,25891512,Corticalization of motor control in humans is a consequence of brain scaling in primate evolution,ar,Article,Herculano-Houzel S.,,Universidade Federal do Rio de Janeiro;Ministério de Ciência e Tecnologia,Rio de Janeiro;Sao Paulo,Brazil;Brazil,,,,,2016-02-15,15 February 2016,Journal of Comparative Neurology,00219967,16689,10969861,Journal,524,3,,448-455,,,47,0,,,,,
2-s2.0-84953889033,10.1016/j.neulet.2015.12.046,S0304394015303372,26733302,Association study of the BIN1 and IL-6 genes on Alzheimer's disease,ar,Article,Ramos dos Santos L.,,Universidade Federal do Espírito Santo,Vitoria,Brazil,,,,,2016-02-12,"February 12, 2016",Neuroscience Letters,03043940,18046,18727972,Journal,614,,,65-69,,,15,1,all publisherfree2read,All Open Access Bronze,,,
2-s2.0-84964409605,10.3389/fnins.2016.00018,,,Potential mechanisms supporting the value of motor cortex stimulation to treat chronic pain syndromes,re,Review,DosSantos M.F.,,Universidade Federal do Rio de Janeiro,Rio de Janeiro,Brazil,,,,,2016-02-11,11 February 2016,Frontiers in Neuroscience,16624548,21100199812,1662453X,Journal,10,FEB,18,,,,96,1,all publisherfullgold repository repositoryvor,All Open Access Gold Green,,,
2-s2.0-84946422906,10.1016/j.pnpbp.2015.10.008,S027858461530052X,26596986,Involvement of monoaminergic system in the antidepressant-like effect of (octylseleno)-xylofuranoside in the mouse tail suspension test,ar,Article,Pinto Brod L.M.,,Universidade Federal de Pelotas,Pelotas,Brazil,,,,,2016-02-04,"February 04, 2016",Progress in Neuro Psychopharmacology and Biological Psychiatry,02785846,21767,18784216,Journal,65,,,201-207,,,48,0,,,,,
2-s2.0-84945144047,10.1016/j.pnpbp.2015.10.004,S0278584615300488,26485403,Robust and enduring atorvastatin-mediated memory recovery following the 4-vessel occlusion/internal carotid artery model of chronic cerebral hypoperfusion in middle-aged rats,ar,Article,Zaghi G.G.D.,,Health Science Center,Santa Maria,Brazil,,,,,2016-02-04,"February 04, 2016",Progress in Neuro Psychopharmacology and Biological Psychiatry,02785846,21767,18784216,Journal,65,,,179-187,,,13,0,,,,,
2-s2.0-84942342655,10.1016/j.pnpbp.2015.08.016,S027858461530035X,26348786,The role of oxidative and nitrosative stress in accelerated aging and major depressive disorder,re,Review,Maurya P.K.,,Universidade Federal de São Paulo;Amity University,Sao Paulo;Noida,Brazil;India,,,,,2016-02-04,"February 04, 2016",Progress in Neuro Psychopharmacology and Biological Psychiatry,02785846,21767,18784216,Journal,65,,,134-144,,,152,0,,,,,
2-s2.0-84983528920,10.3389/fnbeh.2015.00364,,,Ethological Evaluation of the Effects of Social Defeat Stress in Mice: Beyond the Social Interaction Ratio,ar,Article,Henriques-Alves A.M.,,Universidade Federal do Rio Grande do Norte,Natal,Brazil,,,,,2016-02-03,3 February 2016,Frontiers in Behavioral Neuroscience,16625153,19700175166,,Journal,9,,364,,,,56,1,all publisherfullgold repository repositoryvor,All Open Access Gold Green,,,
2-s2.0-84963682724,10.1016/j.physbeh.2016.03.028,S0031938416301159,27039281,"Lunch-time food choices in preschoolers: Relationships between absolute and relative intakes of different food categories, and appetitive characteristics and weight",ar,Article,Carnell S.,,Johns Hopkins University School of Medicine,Baltimore,United States,,,,,2016-02-02,2 February 2016,Physiology and Behavior,00319384,24007,1873507X,Journal,162,,,151-160,,,28,2,all repository repositoryam,All Open Access Green,,,
2-s2.0-84955386302,10.1016/j.neucom.2014.10.095,S0925231215005421,,A Robust Extreme Learning Machine for pattern classification with outliers,ar,Article,Barreto G.A.,,Universidade Federal do Ceará,Fortaleza,Brazil,,,,,2016-02-02,2 February 2016,Neurocomputing,09252312,24807,18728286,Journal,176,,,3-13,,,39,0,,,,,
2-s2.0-84955350055,10.1016/j.neucom.2014.12.100,S0925231215005482,,Noise detection in the meta-learning level,ar,Article,Garcia L.P.F.,,Universidade de São Paulo,Sao Paulo,Brazil,,,,,2016-02-02,2 February 2016,Neurocomputing,09252312,24807,18728286,Journal,176,,,14-25,,,49,0,,,,,
2-s2.0-84955348633,10.1016/j.neucom.2015.04.088,S0925231215007249,,Recent advancements in hybrid artificial intelligence systems and its application to real-world problems,ed,Editorial,Corchado E.,,Universidad de Salamanca,Salamanca,Spain,,,,,2016-02-02,2 February 2016,Neurocomputing,09252312,24807,18728286,Journal,176,,,1-2,,,0,0,,,,,
2-s2.0-84952700756,10.1016/j.neulet.2015.12.037,S0304394015303311,26724225,The role of taurine on anxiety-like behaviors in zebrafish: A comparative study using the novel tank and the light-dark tasks,ar,Article,Mezzomo N.J.,,Universidade Federal de Santa Maria,Santa Maria,Brazil,,,,,2016-02-02,"February 02, 2016",Neuroscience Letters,03043940,18046,18727972,Journal,613,,,19-24,,,77,0,,,,,
2-s2.0-85016496582,10.1590/1414-431X20154890,S0100879X2016000200703,26871969,Effects of continuous vs interval exercise training on oxygen uptake efficiency slope in patients with coronary artery disease,ar,Article,Prado D.M.L.,,Universidade Santa Cecilia,Santos,Brazil,,,,,2016-02-01,1 February 2016,Brazilian Journal of Medical and Biological Research Revista Brasileira De Pesquisas Medicas E Biologicas,,28675,1414431X,Journal,49,2,,e4890,,,29,1,all publisherfullgold repository repositoryvor repositoryam,All Open Access Gold Green,,,
2-s2.0-85007618538,10.1177/0031512516631070,,27420312,Estimation of the maximal lactate steady state intensity by the rating of perceived exertion,ar,Article,Madrid B.,,Universidade Católica de Brasília;Universidade Paulista,Brasilia;Sao Paulo,Brazil;Brazil,,,,,2016-02-01,February 2016,Perceptual and Motor Skills,00315125,12798,1558688X,Journal,122,1,,136-149,,,7,0,,,,,
2-s2.0-85007524412,10.1177/0031512516629272,,27420324,Relationship between training volume and ratings of perceived exertion in swimmers,ar,Article,de Andrade Nogueira F.C.,,Universidade Federal de Juiz de Fora,Juiz de Fora,Brazil,,,,,2016-02-01,February 2016,Perceptual and Motor Skills,00315125,12798,1558688X,Journal,122,1,,319-335,,,10,0,,,,,
2-s2.0-84995466966,10.3171/2015.4.SPINE1584,,,Is there a regional difference in morphology interpretation of A3 and A4 fractures among different cultures?,ar,Article,Schroeder G.D.,,Thomas Jefferson University,Philadelphia,United States,,,,,2016-02-01,February 2016,Journal of Neurosurgery Spine,15475654,37369,15475646,Journal,24,2,,332-339,,,24,0,,,,,
2-s2.0-84983186297,10.1038/sc.2015.112,sc2015112,26169165,Neurological manifestations in individuals with HTLV-1-associated myelopathy/tropical spastic paraparesis in the Amazon,ar,Article,Dias G.A.S.,,Universidade Federal do parad,Belem,Brazil,,,,,2016-02-01,1 February 2016,Spinal Cord,13624393,19884,14765624,Journal,54,2,,154-157,,,13,1,all publisherfree2read,All Open Access Bronze,,,
2-s2.0-84983111563,10.1038/sc.2015.126,sc2015126,26215910,Predictors of musculoskeletal pain in the upper extremities of individuals with spinal cord injury,ar,Article,Barbetta D.C.,,SARAH Network of Rehabilitation Hospitals,Brasilia,Brazil,,,,,2016-02-01,1 February 2016,Spinal Cord,13624393,19884,14765624,Journal,54,2,,145-149,,,11,1,all publisherfree2read,All Open Access Bronze,,,
2-s2.0-84975784157,10.1016/j.neucli.2015.12.003,S0987705316000058,26924308,Normative data of cortical excitability measurements obtained by transcranial magnetic stimulation in healthy subjects,ar,Article,Cueva A.S.,,Universidade de São Paulo;Octavio Frias de Oliveira,Sao Paulo;Sao Paulo,Brazil;Brazil,,,,,2016-02-01,1 February 2016,Neurophysiologie Clinique,09877053,17997,17697131,Journal,46,1,,43-51,,,48,0,,,,,
2-s2.0-84962571362,10.4103/1673-5374.177709,,,Exergames: Neuroplastic hypothesis about cognitive improvement and biological effects on physical function of institutionalized older persons,re,Review,Monteiro-Junior R.S.,,Universidade Federal do Rio de Janeiro;Universidade Federal Fluminense;Universidade Estadual de Montes Claros,Rio de Janeiro;Niteroi;Montes Claros,Brazil;Brazil;Brazil,,,,,2016-02-01,February 2016,Neural Regeneration Research,16735374,17400154834,18767958,Journal,11,2,,201-204,,,71,1,all publisherfullgold repository repositoryvor,All Open Access Gold Green,,,
2-s2.0-84962071139,10.1016/j.jab.2015.04.005,S1214021X15000289,,Pharmacological study of a cannabinoid-containing eyedrop formulation in dogs and mice,ar,Article,Stolf A.M.,,Universidade Federal do Parana,Curitiba,Brazil,,,,,2016-02-01,February 2016,Journal of Applied Biomedicine,1214021X,130045,12140287,Journal,14,1,,41-48,,,1,0,,,,,
2-s2.0-84962068269,10.1016/j.jab.2015.06.001,S1214021X15000411,,"Effect of dietary supplementation of ginger and turmeric rhizomes on ectonucleotidases, adenosine deaminase and acetylcholinesterase activities in synaptosomes from the cerebral cortex of hypertensive rats",ar,Article,Akinyemi A.J.,,"Universidade Federal de Santa Maria;Federal University of Technology, Akure;Afe Babalola University",Santa Maria;Akure;Ado-Ekiti,Brazil;Nigeria;Nigeria,,,,,2016-02-01,February 2016,Journal of Applied Biomedicine,1214021X,130045,12140287,Journal,14,1,,59-70,,,31,0,,,,,
2-s2.0-84961137549,10.1016/j.neucli.2016.01.003,S0987705316000149,26970808,"Neurophysiological measurements of affected and unaffected motor cortex from a cross-sectional, multi-center individual stroke patient data analysis study",ar,Article,Simis M.,,Universidade de São Paulo;Faculdade de Ciencias Medicas da Santa Casa de Sao Paulo;Spaulding Rehabilitation Hospital Network,Sao Paulo;Sao Paulo;Boston,Brazil;Brazil;United States,,,,,2016-02-01,1 February 2016,Neurophysiologie Clinique,09877053,17997,17697131,Journal,46,1,,53-61,,,21,0,,,,,
2-s2.0-84960427155,10.1016/j.jelekin.2015.12.011,S1050641116000031,26799604,Flexion-relaxation ratio in computer workers with and without chronic neck pain,ar,Article,Pinheiro C.F.,,Universidade de São Paulo,Sao Paulo,Brazil,,,,,2016-02-01,"February 01, 2016",Journal of Electromyography and Kinesiology,10506411,14897,18735711,Journal,26,,,8-17,,,13,0,,,,,
2-s2.0-84960299194,10.1016/j.jelekin.2015.10.012,S1050641115002023,26617182,Delayed onset of electromyographic activity of the vastus medialis relative to the vastus lateralis may be related to physical activity levels in females with patellofemoral pain,ar,Article,Briani R.V.,,"Universidade Estadual Paulista ""Júlio de Mesquita Filho""",Sao Paulo,Brazil,,,,,2016-02-01,"February 01, 2016",Journal of Electromyography and Kinesiology,10506411,14897,18735711,Journal,26,,,137-142,,,26,2,all repository repositoryvor,All Open Access Green,,,
2-s2.0-84959524619,10.1016/j.autneu.2016.02.008,S1566070216300133,26924537,Does the median preoptic nucleus contribute to sympathetic hyperactivity in spontaneously hypertensive rats?,ar,Article,Mourão A.A.,,Institute of Biological Science,Goiania,Brazil,,,,,2016-02-01,1 February 2016,Autonomic Neuroscience Basic and Clinical,15660702,14255,18727484,Journal,195,,,29-33,,,2,2,all repository repositoryvor,All Open Access Green,,,
2-s2.0-84959473805,10.1111/epi.13292,,26749250,"Technical aspects of pediatric epilepsy surgery: Report of a multicenter, multinational web-based survey by the ILAE Task Force on Pediatric Epilepsy Surgery",re,Review,Cukiert A.,,Centro Universitário FMABC,Santo Andre,Brazil,,,,,2016-02-01,1 February 2016,Epilepsia,00139580,15510,15281167,Journal,57,2,,194-200,,,16,1,all publisherfree2read,All Open Access Bronze,,,
2-s2.0-84959262902,10.1016/j.bpsc.2016.01.001,S2451902216000616,,Individualized Prediction and Clinical Staging of Bipolar Disorders Using Neuroanatomical Biomarkers,ar,Article,Mwangi B.,,McGovern Medical School,Houston,United States,,,,,2016-02-01,1 February 2016,Biological Psychiatry Cognitive Neuroscience and Neuroimaging,24519022,21100445639,,Journal,1,2,,186-194,,,84,2,all repository repositoryam,All Open Access Green,,,
2-s2.0-84959261314,10.2174/1567202612666151026105915,,26500102,Endogenous acetylcholine controls the severity of polymicrobial sepsisassociated inflammatory response in mice,ar,Article,Amaral F.A.,,Universidade Federal de Minas Gerais,Belo Horizonte,Brazil,,,,,2016-02-01,1 February 2016,Current Neurovascular Research,15672026,130017,18755739,Journal,13,1,,4-9,,,8,0,,,,,
2-s2.0-84959254013,10.1007/s11538-015-0135-z,,26763222,Modeling Importations and Exportations of Infectious Diseases via Travelers,ar,Article,Lopez L.F.,,Universidade de São Paulo;Florida International University,Sao Paulo;Miami,Brazil;United States,,,,,2016-02-01,1 February 2016,Bulletin of Mathematical Biology,00928240,13845,15229602,Journal,78,2,,185-209,,,46,2,all repository repositoryvor,All Open Access Green,,,
2-s2.0-84959139030,10.1016/j.heares.2015.10.008,S0378595515300307,26548740,High doses of salicylate reduces glycinergic inhibition in the dorsal cochlear nucleus of the rat,ar,Article,Zugaib J.,,Universidade de São Paulo,Sao Paulo,Brazil,,,,,2016-02-01,"February 01, 2016",Hearing Research,03785955,13707,18785891,Journal,332,,,188-198,,,25,0,,,,,
2-s2.0-84958976920,10.1016/j.jpsychires.2015.12.012,S0022395615300261,26714201,Hippocampal volume and verbal memory performance in late-stage bipolar disorder,ar,Article,Cao B.,,McGovern Medical School,Houston,United States,,,,,2016-02-01,"February 01, 2016",Journal of Psychiatric Research,00223956,16812,18791379,Journal,73,,,102-107,,,75,2,all repository repositoryam,All Open Access Green,,,
2-s2.0-84958868587,10.1016/j.schres.2016.01.001,S0920996416300056,26782636,Physical activity as a vital sign in patients with schizophrenia: Evidence and clinical recommendations,ar,Article,Vancampfort D.,,KU Leuven;Departement Revalidatiewetenschappen,Leuven;Leuven,Belgium;Belgium,,,,,2016-02-01,1 February 2016,Schizophrenia Research,09209964,19355,15732509,Journal,170,2-3,,336-340,,,33,0,,,,,
2-s2.0-84958766524,10.1016/j.neuint.2015.12.013,S0197018615300826,26796203,Changes in structure and function of diaphragm neuromuscular junctions from BACHD mouse model for Huntington's disease,ar,Article,De Aragão B.,,Universidade Federal de Minas Gerais,Belo Horizonte,Brazil,,,,,2016-02-01,1 February 2016,Neurochemistry International,01970186,17486,18729754,Journal,93,,,64-72,,,14,0,,,,,
2-s2.0-84958758295,10.1515/ijdhd-2014-0024,,,Impact of school participation on quality of life of Brazilian children with cerebral palsy,ar,Article,Presumido Braccialli L.M.,,"Universidade Estadual Paulista ""Júlio de Mesquita Filho""",Sao Paulo,Brazil,,,,,2016-02-01,1 February 2016,International Journal on Disability and Human Development,21911231,5300152517,21910367,Journal,15,1,,23-27,,,5,0,,,,,
2-s2.0-84958692251,10.1016/j.eplepsyres.2015.11.011,S0920121115300735,26709876,Circulating CD4 and CD8 T cells expressing pro-inflammatory cytokines in a cohort of mesial temporal lobe epilepsy patients with hippocampal sclerosis,ar,Article,Rosa D.V.,,Universidade Federal de Minas Gerais,Belo Horizonte,Brazil,,,,,2016-02-01,1 February 2016,Epilepsy Research,09201211,15514,18726844,Journal,120,,,1-6,,,27,0,,,,,
2-s2.0-84958653577,10.1111/bdi.12360,,26876913,Cognitive impairment in late-life bipolar disorder is not associated with Alzheimer's disease pathological signature in the cerebrospinal fluid,ar,Article,Forlenza O.V.,,Universidade de São Paulo,Sao Paulo,Brazil,,,,,2016-02-01,1 February 2016,Bipolar Disorders,13985647,14313,13995618,Journal,18,1,,63-70,,,32,0,,,,,
2-s2.0-84958647258,10.1111/bdi.12367,,26877211,Apolipoprotein E genotype is not associated with cognitive impairment in older adults with bipolar disorder,ar,Article,Kerr D.S.,,Universidade de São Paulo,Sao Paulo,Brazil,,,,,2016-02-01,1 February 2016,Bipolar Disorders,13985647,14313,13995618,Journal,18,1,,71-77,,,11,0,,,,,
2-s2.0-84958580562,10.1111/joss.12185,,,Cross-Cultural Study of Dry-Cured Sheep Meat Acceptability by Native and Immigrant Consumers in Spain,ar,Article,Sañudo C.,,Universidad de Zaragoza;Universidade Estadual de Maringá,Zaragoza;Maringa,Spain;Brazil,,,,,2016-02-01,1 February 2016,Journal of Sensory Studies,08878250,16818,1745459X,Journal,31,1,,12-21,,,11,0,,,,,
2-s2.0-84958238853,10.2174/1871527315666151110125227,,26553162,"Folic acid can contribute to memory deficit and Na+, K+- ATPase failure in the hippocampus of adolescent rats submitted to hypoxia-Ischemia",ar,Article,Carletti J.V.,,Universidade Federal do Rio Grande do Sul,Porto Alegre,Brazil,,,,,2016-02-01,1 February 2016,CNS and Neurological Disorders Drug Targets,18715273,4500151409,19963181,Journal,15,1,,64-72,,,13,0,,,,,
