eid,doi,pii,pubmed_id,title,subtype,subtypeDescription,creator,afid,affilname,affiliation_city,affiliation_country,author_count,author_names,author_ids,author_afids,coverDate,coverDisplayDate,publicationName,issn,source_id,eIssn,aggregationType,volume,issueIdentifier,article_number,pageRange,description,authkeywords,citedby_count,openaccess,freetoread,freetoreadLabel,fund_acr,fund_no,fund_sponsor
2-s2.0-84963546216,10.1002/jnr.23741,,27091311,The epileptic amygdala: Toward the development of a neural prosthesis by temporally coded electrical stimulation,re,Review,Cota V.R.,,Universidade Federal de Sao Joao del-Rei,Sao Joao del Rei,Brazil,,,,,2016-06-01,1 June 2016,Journal of Neuroscience Research,03604012,16766,10974547,Journal,94,6,,463-485,,,28,0,,,,,
2-s2.0-84962909521,10.1016/j.physbeh.2016.04.003,S003193841630138X,27063244,"Evaluating ""anxiety"" and social behavior in jundiá (Rhamdia quelen)",ar,Article,Abreu M.S.,,Universidade Federal de Santa Maria,Santa Maria,Brazil,,,,,2016-06-01,"June 01, 2016",Physiology and Behavior,00319384,24007,1873507X,Journal,160,,,59-65,,,15,0,,,,,
2-s2.0-84962835852,10.1016/j.brainresbull.2016.04.001,S0361923016300752,27063286,The lesion of dorsolateral funiculus changes the antiallodynic effect of the intrathecal muscimol and baclofen in distinct phases of neuropathic pain induced by spinal nerve ligation in rats,ar,Article,Dias Q.,,Fundacao Oswaldo Cruz,Rio de Janeiro,Brazil,,,,,2016-06-01,"June 01, 2016",Brain Research Bulletin,03619230,14347,18732747,Journal,124,,,103-115,,,8,0,,,,,
2-s2.0-84962833174,10.1002/mus.25093,,26930139,Many names and a single disease: The plurality of the Sensory Neuronopathies,le,Letter,Martinez A.,,Universidade Estadual de Campinas,Campinas,Brazil,,,,,2016-06-01,1 June 2016,Muscle and Nerve,0148639X,15771,10974598,Journal,53,6,,999,,,2,0,,,,,
2-s2.0-84962815422,10.1016/j.jelekin.2016.03.008,S1050641116300219,27088395,Use of a backpack alters gait initiation of high school students,ar,Article,Vieira M.F.,,Universidade Federal de Goiás,Goiania,Brazil,,,,,2016-06-01,"June 01, 2016",Journal of Electromyography and Kinesiology,10506411,14897,18735711,Journal,28,,,82-89,,,11,0,,,,,
2-s2.0-84962480718,10.1016/j.jpsychires.2016.02.021,S002239561630036X,27017287,Insomnia and risk of dementia in older adults: Systematic review and meta-analysis,re,Review,de Almondes K.M.,,Universidade Federal do Rio Grande do Norte,Natal,Brazil,,,,,2016-06-01,"June 01, 2016",Journal of Psychiatric Research,00223956,16812,18791379,Journal,77,,,109-115,,,170,0,,,,,
2-s2.0-84962446587,10.1016/j.euroneuro.2016.03.009,S0924977X16300074,27061850,Agmatine produces antidepressant-like effects by activating AMPA receptors and mTOR signaling,ar,Article,Neis V.,,Universidade Federal de Santa Catarina,Florianopolis,Brazil,,,,,2016-06-01,1 June 2016,European Neuropsychopharmacology,0924977X,15576,18737862,Journal,26,6,,959-971,,,60,0,,,,,
2-s2.0-84962437276,10.1016/j.brainresbull.2016.03.022,S0361923016300739,27040712,Platelet-activating factor receptor (PAFR) plays a crucial role in experimental global cerebral ischemia and reperfusion,ar,Article,Toscano E.C.d.B.,,Departamento de Patologia Geral,Belo Horizonte,Brazil,,,,,2016-06-01,"June 01, 2016",Brain Research Bulletin,03619230,14347,18732747,Journal,124,,,55-61,,,36,0,,,,,
2-s2.0-84962426728,10.1016/j.physbeh.2016.03.025,S0031938416301123,27018089,"The primary motor cortex is associated with learning the absolute, but not relative, timing dimension of a task: A tDCS study",ar,Article,Apolinário-Souza T.,,Universidade Federal de Minas Gerais,Belo Horizonte,Brazil,,,,,2016-06-01,"June 01, 2016",Physiology and Behavior,00319384,24007,1873507X,Journal,160,,,18-25,,,21,0,,,,,
2-s2.0-84962323390,10.1016/j.expneurol.2016.03.015,S0014488616300589,26995324,Impact of rapamycin on status epilepticus induced hippocampal pathology and weight gain,ar,Article,Hester M.S.,,Cincinnati Children's Hospital Medical Center,Cincinnati,United States,,,,,2016-06-01,"June 01, 2016",Experimental Neurology,00144886,15598,10902430,Journal,280,,,1-12,,,34,2,all repository repositoryam,All Open Access Green,,,
2-s2.0-84962230990,10.1037/pne0000047,,,How do we evaluate facial emotion recognition?,ar,Article,de Paiva-Silva A.I.,,Universidade de Brasília;Universidade Federal de Goiás,Brasília;Goiania,Brazil;Brazil,,,,,2016-06-01,1 June 2016,Psychology and Neuroscience,19843054,19700175781,19833288,Journal,9,2,,153-175,,,37,0,,,,,
2-s2.0-84962033744,10.1159/000444529,,27031648,Intravitreous injection of interleukin-6 leads to a sprouting in the retinotectal pathway at different stages of development,ar,Article,Menezes G.D.,,Universidade Federal Fluminense,Niteroi,Brazil,,,,,2016-06-01,1 June 2016,Neuroimmunomodulation,10217401,21336,14230216,Journal,23,2,,81-87,,,5,1,all publisherfree2read,All Open Access Bronze,,,
2-s2.0-84961662283,10.1016/j.neuropharm.2016.02.019,S002839081630051X,26907804,Naringenin reduces inflammatory pain in mice,ar,Article,Pinho-Ribeiro F.,,Universidade Estadual de Londrina,Londrina,Brazil,,,,,2016-06-01,1 June 2016,Neuropharmacology,00283908,20435,18737064,Journal,105,,,508-519,,,167,0,,,,,
2-s2.0-84961191440,10.1007/s10286-016-0351-0,,26979171,Correlation between indexes of autonomic maneuvers and heart rate variability in hemodialysis patients,ar,Article,Vieira C.F.D.,,Universidade Federal dos Vales do Jequitinhonha e Mucuri,Diamantina,Brazil,,,,,2016-06-01,1 June 2016,Clinical Autonomic Research,09599851,29306,16191560,Journal,26,3,,181-188,,,2,0,,,,,
2-s2.0-84960338278,10.1016/j.jpsychires.2016.02.023,S0022395616300383,26978184,Exercise as a treatment for depression: A meta-analysis adjusting for publication bias,ar,Article,Schuch F.B.,,Universidade Federal do Rio Grande do Sul;Hospital de Clinicas de Porto Alegre,Porto Alegre;Porto Alegre,Brazil;Brazil,,,,,2016-06-01,"June 01, 2016",Journal of Psychiatric Research,00223956,16812,18791379,Journal,77,,,42-51,,,1103,2,all repository repositoryam,All Open Access Green,,,
2-s2.0-84960153340,10.1111/joss.12204,,,Hedonic and Word Association Techniques Confirm a Successful Way of Introducing Fish into Public School Meals,ar,Article,Latorres J.M.,,Universidade Federal do Rio Grande;Coordenação de Aperfeiçoamento de Pessoal de Nível Superior,Rio Grande;Brasilia,Brazil;Brazil,,,,,2016-06-01,1 June 2016,Journal of Sensory Studies,08878250,16818,1745459X,Journal,31,3,,206-212,,,27,0,,,,,
2-s2.0-84960111249,10.1007/s11302-016-9504-9,,26939579,Variations of ATP and its metabolites in the hippocampus of rats subjected to pilocarpine-induced temporal lobe epilepsy,ar,Article,Doná F.,,Universidade Federal de São Paulo;Universidade Anhanguera de São Paulo,Sao Paulo;Sao Paulo,Brazil;Brazil,,,,,2016-06-01,1 June 2016,Purinergic Signalling,15739538,130009,15739546,Journal,12,2,,295-302,,,29,2,all repository repositoryvor,All Open Access Green,,,
2-s2.0-84959492606,10.1016/j.beproc.2016.02.009,S0376635716300304,26927319,Discrete and continuous stimulus control in the A-not-B sandbox task,ar,Article,Covarrubias P.,,Universidad de Guadalajara,Guadalajara,Mexico,,,,,2016-06-01,June 2016,Behavioural Processes,03766357,14288,18728308,Journal,127,,,109-115,,,0,0,,,,,
2-s2.0-84959420664,10.1016/j.psyneuen.2016.02.018,S030645301630049X,26943345,Heart rate variability measure in breast cancer patients and survivors: A systematic review,re,Review,Arab C.,,Universidade Federal de São Paulo,Sao Paulo,Brazil,,,,,2016-06-01,"June 01, 2016",Psychoneuroendocrinology,03064530,18745,18733360,Journal,68,,,57-68,,,81,0,,,,,
2-s2.0-84959146828,10.1007/s11302-016-9505-8,,26910734,Methotrexate up-regulates ecto-5′-nucleotidase/CD73 and reduces the frequency of T lymphocytes in the glioblastoma microenvironment,ar,Article,Figueiró F.,,Universidade Federal do Rio Grande do Sul,Porto Alegre,Brazil,,,,,2016-06-01,1 June 2016,Purinergic Signalling,15739538,130009,15739546,Journal,12,2,,303-312,,,36,2,all repository repositoryvor,All Open Access Green,,,
2-s2.0-84958819002,10.1016/j.neuropharm.2016.02.003,S0028390816300387,26867504,Beta-arrestin 2 rather than G protein efficacy determines the anxiolytic-versus antidepressant-like effects of nociceptin/orphanin FQ receptor ligands,ar,Article,Asth L.,,Universidade Federal do Rio Grande do Norte,Natal,Brazil,,,,,2016-06-01,1 June 2016,Neuropharmacology,00283908,20435,18737064,Journal,105,,,434-442,,,42,2,all repository repositoryam,All Open Access Green,,,
2-s2.0-84958780916,10.1111/jnc.13542,,26801685,Developmental alcohol exposure leads to a persistent change on astrocyte secretome,ar,Article,Trindade P.,,University of Maryland School of Medicine,Baltimore,United States,,,,,2016-06-01,1 June 2016,Journal of Neurochemistry,00223042,17620,14714159,Journal,137,5,,730-743,,,23,1,all publisherfree2read repository repositoryam,All Open Access Bronze Green,,,
2-s2.0-84958246103,10.1007/s00221-016-4586-8,,26879768,Tactile stimulation during development alters the neuroanatomical organization of the optic nerve in normal rats,ar,Article,Horiquini-Barbosa E.,,Universidade de São Paulo,Sao Paulo,Brazil,,,,,2016-06-01,1 June 2016,Experimental Brain Research,00144819,15585,14321106,Journal,234,6,,1737-1746,,,9,0,,,,,
2-s2.0-84957968408,10.1007/s11064-016-1851-y,,26875731,Insulin Stimulates S100B Secretion and These Proteins Antagonistically Modulate Brain Glucose Metabolism,ar,Article,Wartchow K.,,Universidade Federal do Rio Grande do Sul,Porto Alegre,Brazil,,,,,2016-06-01,1 June 2016,Neurochemical Research,03643190,17484,15736903,Journal,41,6,,1420-1429,,,19,0,,,,,
2-s2.0-84957574816,10.1007/s11064-016-1853-9,,26846140,The Effects of Ellagic Acid upon Brain Cells: A Mechanistic View and Future Directions,re,Review,de Oliveira M.,,Universidade Federal de Mato Grosso,Cuiaba,Brazil,,,,,2016-06-01,1 June 2016,Neurochemical Research,03643190,17484,15736903,Journal,41,6,,1219-1228,,,59,0,,,,,
2-s2.0-84955613306,10.1007/s11011-016-9792-3,,26815786,Alterations in white matter volume and integrity in obesity and type 2 diabetes,ar,Article,van Bloemendaal L.,,Amsterdam UMC - Vrije Universiteit Amsterdam,Amsterdam,Netherlands,,,,,2016-06-01,1 June 2016,Metabolic Brain Disease,08857490,19015,15737365,Journal,31,3,,621-629,,,67,1,all publisherhybridgold repository repositoryvor,All Open Access Hybrid Gold Green,,,
2-s2.0-84955561308,10.1007/s00221-016-4554-3,,26821314,Motor imagery training promotes motor learning in adolescents with cerebral palsy: comparison between left and right hemiparesis,ar,Article,Cabral-Sequeira A.,,Universidade de São Paulo;Association for Assistance to Deficient Children,Sao Paulo;Sao Paulo,Brazil;Brazil,,,,,2016-06-01,1 June 2016,Experimental Brain Research,00144819,15585,14321106,Journal,234,6,,1515-1524,,,28,0,,,,,
2-s2.0-84955315769,10.1007/s00401-016-1539-z,,26810070,"Genetic alterations in uncommon low-grade neuroepithelial tumors: BRAF, FGFR1, and MYB mutations occur at high frequency and align with morphology",ar,Article,Qaddoumi I.,,St. Jude Children's Research Hospital,Memphis,United States,,,,,2016-06-01,1 June 2016,Acta Neuropathologica,00016322,17552,14320533,Journal,131,6,,833-845,,,333,2,all repository repositoryam,All Open Access Green,,,
2-s2.0-84955246060,10.1002/hipo.22560,,26669934,Spatial learning and neurogenesis: Effects of cessation of wheel running and survival of novel neurons by engagement in cognitive tasks,ar,Article,Motta-Teixeira L.,,Universidade de São Paulo,Sao Paulo,Brazil,,,,,2016-06-01,1 June 2016,Hippocampus,10509631,13923,10981063,Journal,26,6,,794-803,,,24,0,,,,,
2-s2.0-84954324251,10.1007/s11302-015-9494-z,,26769247,"Hyperglycemia alters E-NTPDases, ecto-5′-nucleotidase, and ectosolic and cytosolic adenosine deaminase activities and expression from encephala of adult zebrafish (Danio rerio)",ar,Article,Capiotti K.M.,,Pontifícia Universidade Católica do Rio Grande do Sul,Porto Alegre,Brazil,,,,,2016-06-01,1 June 2016,Purinergic Signalling,15739538,130009,15739546,Journal,12,2,,211-220,,,17,2,all repository repositoryvor,All Open Access Green,,,
2-s2.0-84949684549,10.1016/j.resp.2015.10.012,S1569904815300665,26563455,Coordinated autonomic and respiratory responses evoked by alerting stimuli: Role of the midbrain colliculi,ar,Article,Müller-Ribeiro F.C.F.,,"Universidade Federal de Minas Gerais;The Faculty of Medicine, Health and Human Sciences",Belo Horizonte;Macquarie Park,Brazil;Australia,,,,,2016-06-01,1 June 2016,Respiratory Physiology and Neurobiology,15699048,24030,18781519,Journal,226,,,87-93,,,14,1,all publisherhybridgold,All Open Access Hybrid Gold,,,
2-s2.0-84948174233,10.1007/s11011-015-9770-1,,26608284,Reestablishment of the hyperglycemia to the normal levels seems not to be essential to the anxiolytic-like effect induced by insulin,ar,Article,Gambeta E.,,Universidade Federal do Parana,Curitiba,Brazil,,,,,2016-06-01,1 June 2016,Metabolic Brain Disease,08857490,19015,15737365,Journal,31,3,,563-571,,,21,0,,,,,
2-s2.0-84947125113,10.1007/s11011-015-9763-0,,26573865,Phenylalanine induces oxidative stress and decreases the viability of rat astrocytes: possible relevance for the pathophysiology of neurodegeneration in phenylketonuria,ar,Article,Preissler T.,,Universidade Federal do Rio Grande do Sul,Porto Alegre,Brazil,,,,,2016-06-01,1 June 2016,Metabolic Brain Disease,08857490,19015,15737365,Journal,31,3,,529-537,,,30,0,,,,,
2-s2.0-84946105717,10.1017/neu.2015.58,S0924270815000587,26522380,"Stress, depression, quality of life and salivary cortisol levels in community health agents",ar,Article,Knuth B.,,Universidade Federal de Pelotas,Pelotas,Brazil,,,,,2016-06-01,1 June 2016,Acta Neuropsychiatrica,09242708,17554,16015215,Journal,28,3,,165-172,,,14,0,,,,,
2-s2.0-84944698866,10.1038/sc.2015.172,sc2015172,26481712,Effects of tacrolimus and erythropoietin in experimental spinal cord lesion in rats: Functional and histological evaluation,ar,Article,De Mesquita Coutinho P.,,Universidade de São Paulo,Sao Paulo,Brazil,,,,,2016-06-01,1 June 2016,Spinal Cord,13624393,19884,14765624,Journal,54,6,,439-444,,,11,1,all publisherhybridgold repository repositoryvor,All Open Access Hybrid Gold Green,,,
2-s2.0-84943169075,10.1038/sc.2015.162,sc2015162,26439843,Construction of recombinant adenovirus containing picorna-viral 2A-peptide sequence for the co-expression of neuro-protective growth factors in human umbilical cord blood cells,ar,Article,Garanina E.E.,,Kazan Federal University,Kazan,Russian Federation,,,,,2016-06-01,1 June 2016,Spinal Cord,13624393,19884,14765624,Journal,54,6,,423-430,,,7,1,all publisherfree2read repository repositoryvor,All Open Access Bronze Green,,,
2-s2.0-84938631454,10.1007/s00406-015-0626-9,,26233433,MAP1B and NOS1 genes are associated with working memory in youths with attention-deficit/hyperactivity disorder,ar,Article,Salatino-Oliveira A.,,Universidade Federal do Rio Grande do Sul,Porto Alegre,Brazil,,,,,2016-06-01,1 June 2016,European Archives of Psychiatry and Clinical Neuroscience,09401334,15546,14338491,Journal,266,4,,359-366,,,10,0,,,,,
2-s2.0-84936112934,10.1016/j.peptides.2015.06.004,S0196978115001874,26116782,"Isolation and characterization of Ts19 Fragment II, a new long-chain potassium channel toxin from Tityus serrulatus venom",ar,Article,Cerni F.,,Universidade de São Paulo,Sao Paulo,Brazil,,,,,2016-06-01,1 June 2016,Peptides,01969781,14222,18735169,Journal,80,,,9-17,,,27,0,,,,,
2-s2.0-84933566949,10.1016/j.peptides.2015.05.013,S0196978115001692,26056922,[des-Arg1]-Proctolin: A novel NEP-like enzyme inhibitor identified in Tityus serrulatus venom,ar,Article,Duzzi B.,,Instituto Butantan,Sao Paulo,Brazil,,,,,2016-06-01,1 June 2016,Peptides,01969781,14222,18735169,Journal,80,,,18-24,,,8,0,,,,,
2-s2.0-84922822260,10.1016/j.schres.2015.01.005,S0920996415000092,25623601,Effects of endurance training on brain structures in chronic schizophrenia patients and healthy controls,ar,Article,Malchow B.,,Klinikum der Universität München,Munich,Germany,,,,,2016-06-01,1 June 2016,Schizophrenia Research,09209964,19355,15732509,Journal,173,3,,182-191,,,63,0,,,,,
2-s2.0-84962520042,10.1016/j.psychres.2016.03.027,S0165178115300391,27016879,Impulsivity is relevant for trauma exposure and PTSD symptoms in a non-clinical population,ar,Article,Netto L.R.,,Universidade Federal da Bahia,Salvador,Brazil,,,,,2016-05-30,"May 30, 2016",Psychiatry Research,01651781,18729,18727123,Journal,239,,,204-211,,,28,2,all repository repositoryvor,All Open Access Green,,,
2-s2.0-84960917452,10.1016/j.psychres.2016.03.020,S0165178115308593,27137976,Prevalence and correlates of electroconvulsive therapy delivery in 1001 obsessive-compulsive disorder outpatients,ar,Article,dos Santos-Ribeiro S.,,Universidade Federal do Rio de Janeiro,Rio de Janeiro,Brazil,,,,,2016-05-30,"May 30, 2016",Psychiatry Research,01651781,18729,18727123,Journal,239,,,145-148,,,3,0,,,,,
2-s2.0-84959515946,10.1016/j.psychres.2016.03.002,S016517811630381X,26952828,"Comments on ""Heart rate and respiratory response to doxapram in patients with panic disorder""",le,Letter,Perna G.,,University of Miami Leonard M. Miller School of Medicine;Universiteit Maastricht;Villa San Benedetto Menni Hospital,Miami;Maastricht;Como,United States;Netherlands;Italy,,,,,2016-05-30,30 May 2016,Psychiatry Research,01651781,18729,18727123,Journal,239,,,362-363,,,1,0,,,,,
2-s2.0-84978525637,10.1179/1476830515Y.0000000033,,26076770,Analysis of electrocorticographic patterns in rats fed standard or hyperlipidic diets in a normal state or during status epilepticus,ar,Article,Pessoa D.,,Universidade Federal Rural de Pernambuco,Recife,Brazil,,,,,2016-05-27,27 May 2016,Nutritional Neuroscience,1028415X,18122,14768305,Journal,19,5,,206-212,,,6,0,,,,,
2-s2.0-84978524187,10.1179/1476830515Y.0000000013,,25760797,Effects of environmental enrichment on blood vessels in the optic tract of malnourished rats: A morphological and morphometric analysis,ar,Article,Barbosa E.H.,,Universidade de São Paulo,Sao Paulo,Brazil,,,,,2016-05-27,27 May 2016,Nutritional Neuroscience,1028415X,18122,14768305,Journal,19,5,,224-230,,,4,0,,,,,
2-s2.0-84964556092,10.1016/j.neulet.2016.04.049,S0304394016302701,27113204,Time course study of microglial and behavioral alterations induced by 6-hydroxydopamine in rats,ar,Article,Silva T.,,Universidade Federal de Santa Catarina,Florianopolis,Brazil,,,,,2016-05-27,27 May 2016,Neuroscience Letters,03043940,18046,18727972,Journal,622,,,83-87,,,36,1,all publisherhybridgold,All Open Access Hybrid Gold,,,
2-s2.0-84963852842,10.1016/j.neulet.2016.04.029,S0304394016302427,27091501,κ-Opioid receptor participates of NSAIDs peripheral antinociception,ar,Article,Silva L.C.R.,,Universidade Federal de Minas Gerais,Belo Horizonte,Brazil,,,,,2016-05-27,"May 27, 2016",Neuroscience Letters,03043940,18046,18727972,Journal,622,,,6-9,,,18,0,,,,,
2-s2.0-84963831839,10.1016/j.neulet.2016.04.028,S0304394016302336,27085535,Age-related differences in EEG beta activity during an assessment of ankle proprioception,ar,Article,Toledo D.R.,,Universidade de São Paulo,Sao Paulo,Brazil,,,,,2016-05-27,"May 27, 2016",Neuroscience Letters,03043940,18046,18727972,Journal,622,,,1-5,,,14,2,all repository repositoryvor,All Open Access Green,,,
2-s2.0-84969931988,10.1186/s12974-016-0579-6,,27222120,Impairment of toll-like receptors 2 and 4 leads to compensatory mechanisms after sciatic nerve axotomy,ar,Article,Freria C.M.,,Universidade Estadual de Campinas,Campinas,Brazil,,,,,2016-05-24,24 May 2016,Journal of Neuroinflammation,,50032,17422094,Journal,13,1,118,,,,33,1,all publisherfullgold repository repositoryvor,All Open Access Gold Green,,,
2-s2.0-84958056601,10.3109/21678421.2016.1143011,,26854959,Amyotrophic lateral sclerosis in Brazil: Case series and review of the Brazilian literature,ar,Article,De Godoy Rousseff Prado L.,,Universidade Federal de Minas Gerais;University Hospital,Belo Horizonte;Belo Horizonte,Brazil;Brazil,,,,,2016-05-18,18 May 2016,Amyotrophic Lateral Sclerosis and Frontotemporal Degeneration,21678421,21100235630,21679223,Journal,17,3-4,,282-288,,,19,0,,,,,
2-s2.0-84958045668,10.3109/21678421.2016.1140210,,26850047,Ethnic and demographic incidence of amyotrophic lateral sclerosis (ALS) in Brazil: A population based study,ar,Article,Moura M.C.,,Hospital Regional da Asa Norte,Brasilia,Brazil,,,,,2016-05-18,18 May 2016,Amyotrophic Lateral Sclerosis and Frontotemporal Degeneration,21678421,21100235630,21679223,Journal,17,3-4,,275-281,,,15,0,,,,,
2-s2.0-84971672839,10.7554/eLife.14552,,27185408,"Mitochondrial genetic diversity, selection and recombination in a canine transmissible cancer",ar,Article,Strakova A.,,University of Cambridge,Cambridge,United Kingdom,,,,,2016-05-17,17 May 2016,Elife,,21100242814,2050084X,Journal,5,MAY2016,e14552,,,,53,1,all publisherfullgold repository repositoryvor repositoryam,All Open Access Gold Green,,,
2-s2.0-84962867336,10.1016/j.neulet.2016.04.017,S0304394016302221,27080425,Inhibition of spinal c-Jun-NH2-terminal kinase (JNK) improves locomotor activity of spinal cord injured rats,ar,Article,Martini A.C.,,"University of California, Irvine;Universidade Federal de Santa Catarina",Irvine;Florianopolis,United States;Brazil,,,,,2016-05-16,"May 16, 2016",Neuroscience Letters,03043940,18046,18727972,Journal,621,,,54-61,,,8,0,,,,,
2-s2.0-84978481297,10.1016/j.bbr.2016.02.023,S0166432816300900,26921691,Decreased forelimb ability in mice intracerebroventricularly injected with low dose 6-hydroxidopamine: A model on the dissociation of bradykinesia from hypokinesia,ar,Article,Ribeiro R.P.,,"Universidade Federal de Santa Catarina;Federal Institute of Education, Science and Technology of Santa Catarina",Florianopolis;Florianopolis,Brazil;Brazil,,,,,2016-05-15,15 May 2016,Behavioural Brain Research,01664328,14285,18727549,Journal,305,,,30-36,,,8,0,,,,,
2-s2.0-84961768087,10.1016/j.physbeh.2016.03.012,S0031938416300981,26988283,Hippotherapy acute impact on heart rate variability non-linear dynamics in neurological disorders,ar,Article,Cabiddu R.,,Universidade Federal de São Carlos,Sao Carlos,Brazil,,,,,2016-05-15,"May 15, 2016",Physiology and Behavior,00319384,24007,1873507X,Journal,159,,,88-94,,,21,0,,,,,
2-s2.0-84961202825,10.1016/j.physbeh.2016.03.010,S0031938416300877,26976740,"Correlations between behavior, memory, sleep-wake and melatonin in Williams-Beuren syndrome",ar,Article,Santoro S.,,"Universidade Estadual Paulista ""Júlio de Mesquita Filho""",Sao Paulo,Brazil,,,,,2016-05-15,"May 15, 2016",Physiology and Behavior,00319384,24007,1873507X,Journal,159,,,14-19,,,25,1,all publisherfree2read repository repositoryvor,All Open Access Bronze Green,,,
2-s2.0-84960876084,10.1016/j.bbr.2016.02.025,S0166432816301012,26924015,"Conessine, an H3 receptor antagonist, alters behavioral and neurochemical effects of ethanol in mice",ar,Article,Morais-Silva G.,,"Universidade Estadual Paulista ""Júlio de Mesquita Filho"";Universidade Federal de Uberlândia",Sao Paulo;Uberlandia,Brazil;Brazil,,,,,2016-05-15,"May 15, 2016",Behavioural Brain Research,01664328,14285,18727549,Journal,305,,,100-107,,,13,2,all repository repositoryvor,All Open Access Green,,,
2-s2.0-84960402801,10.1016/j.bbr.2016.03.013,S0166432816301401,26965566,"The activation and blockage of CRF type 2 receptors of the medial amygdala alter elevated T-maze inhibitory avoidance, an anxiety-related response",ar,Article,Alves S.,,Universidade Federal de São Paulo,Sao Paulo,Brazil,,,,,2016-05-15,"May 15, 2016",Behavioural Brain Research,01664328,14285,18727549,Journal,305,,,191-197,,,13,0,,,,,
2-s2.0-84960097831,10.1016/j.brainres.2016.02.036,S0006899316300956,26923163,Can physical exercise have a protective effect in an animal model of sleep-related movement disorder?,ar,Article,Esteves A.M.,,Universidade Estadual de Campinas,Campinas,Brazil,,,,,2016-05-15,15 May 2016,Brain Research,00068993,14346,18726240,Journal,1639,,,47-57,,,4,0,,,,,
2-s2.0-84958569029,10.1016/j.jns.2016.01.059,S0022510X16300594,26902641,Acute bilateral vestibulocochlear neuritis following cultured cell vaccine administration for rabies post-exposure prophylaxis,le,Letter,Mesquita E.C.,,Centro de Referência para Imunobiológicos Especiais,Rio de Janeiro,Brazil,,,,,2016-05-15,15 May 2016,Journal of the Neurological Sciences,0022510X,16820,18785883,Journal,364,,,198-199,,,0,0,,,,,
2-s2.0-84978338881,10.1016/B978-0-12-800634-4.00006-8,B9780128006344000068,,Sleep and Drug Addiction,ch,Book Chapter,Berro L.F.,,Universidade Federal de São Paulo,Sao Paulo,Brazil,,,,,2016-05-13,13 May 2016,Neuropathology of Drug Addictions and Substance Misuse,,21100462860,,Book,3,,,58-67,,,1,0,,,,,
2-s2.0-84960449022,10.1016/j.neuroscience.2016.02.033,S0306452216001731,26926962,Intrauterine growth restriction modifies the hedonic response to sweet taste in newborn pups - Role of the accumbal μ-opioid receptors,ar,Article,Laureano D.,,Universidade Federal do Rio Grande do Sul,Porto Alegre,Brazil,,,,,2016-05-13,"May 13, 2016",Neuroscience,03064522,18042,18737544,Journal,322,,,500-508,,,23,0,,,,,
2-s2.0-84960407021,10.1016/j.neuroscience.2016.02.067,S0306452216002165,26951941,Estradiol and angiotensin II crosstalk in hydromineral balance: Role of the ERK1/2 and JNK signaling pathways,ar,Article,Almeida-Pereira G.,,Universidade de São Paulo,Sao Paulo,Brazil,,,,,2016-05-13,"May 13, 2016",Neuroscience,03064522,18042,18737544,Journal,322,,,525-538,,,16,0,,,,,
2-s2.0-84966560498,10.1523/JNEUROSCI.3452-15.2016,,27170130,A respiration-coupled rhythm in the rat hippocampus independent of theta and slow oscillations,ar,Article,Lockmann A.,,Universidade Federal do Rio Grande do Norte,Natal,Brazil,,,,,2016-05-11,11 May 2016,Journal of Neuroscience,02706474,16764,15292401,Journal,36,19,,5338-5352,,,106,1,all publisherhybridgold repository repositoryvor,All Open Access Hybrid Gold Green,,,
