eid,doi,pii,pubmed_id,title,subtype,subtypeDescription,creator,afid,affilname,affiliation_city,affiliation_country,author_count,author_names,author_ids,author_afids,coverDate,coverDisplayDate,publicationName,issn,source_id,eIssn,aggregationType,volume,issueIdentifier,article_number,pageRange,description,authkeywords,citedby_count,openaccess,freetoread,freetoreadLabel,fund_acr,fund_no,fund_sponsor
2-s2.0-84940374786,10.7120/09627286.24.3.291,,,Assessment of temperament traits of white-lipped (Tayassu pecari) and collared peccaries (Pecari tajacu) during handling in a farmed environment,ar,Article,Nogueira S.S.C.,,Universidade Estadual de Santa Cruz,Ilheus,Brazil,,,,,2015-08-01,1 August 2015,Animal Welfare,09627286,38539,,Journal,24,3,,291-298,,,17,0,,,,,
2-s2.0-84939469326,10.1016/j.jevs.2015.06.019,S0737080615004268,,Enteral Electrolyte Solutions With Different Osmolarities: Clinical and Laboratory Assessment in Equines,ar,Article,Filho J.D.R.,,Universidade Federal de Vicosa,Vicosa,Brazil,,,,,2015-08-01,1 August 2015,Journal of Equine Veterinary Science,07370806,18296,,Journal,35,8,,673-678,,,6,0,,,,,
2-s2.0-84938959901,10.1016/j.cimid.2015.05.002,S0147957115000375,26031474,Serum levels of nitric oxide and protein oxidation in goats seropositive for Toxoplasma gondii and Neospora caninum,ar,Article,Tonin A.A.,,Universidade do Oeste de Santa Catarina,Joacaba,Brazil,,,,,2015-08-01,1 August 2015,Comparative Immunology Microbiology and Infectious Diseases,01479571,19660,18781667,Journal,41,,,55-58,,,12,0,,,,,
2-s2.0-84938704257,10.1016/j.rvsc.2015.05.021,S0034528815001666,26267086,A conformational epitope mapped in the bovine herpesvirus type 1 envelope glycoprotein B by phage display and the HSV-1 3D structure,ar,Article,Almeida G.R.,,Universidade Federal de Goiás,Goiania,Brazil,,,,,2015-08-01,1 August 2015,Research in Veterinary Science,00345288,18851,15322661,Journal,101,,,34-37,,,4,0,,,,,
2-s2.0-84938703465,10.1016/j.rvsc.2015.05.014,S0034528815001599,26267083,"Systemic leukopenia, evaluation of laminar leukocyte infiltration and laminar lesions in horses with naturally occurring colic syndrome",ar,Article,Laskoski L.M.,,Universidade Federal do Parana,Curitiba,Brazil,,,,,2015-08-01,1 August 2015,Research in Veterinary Science,00345288,18851,15322661,Journal,101,,,15-21,,,8,0,,,,,
2-s2.0-84938685006,10.1016/j.rvsc.2015.05.016,S0034528815001617,26267087,Torque teno sus virus 1 (TTSuV1) and 2 (TTSuV2) viral loads in serum of postweaning multisystemic wasting syndrome (PMWS)-affected and healthy pigs in Brazil,ar,Article,Teixeira T.F.,,Universidade Federal do Rio Grande do Sul;Virology,"Porto Alegre;Eldorado do Sul, RS",Brazil;Brazil,,,,,2015-08-01,1 August 2015,Research in Veterinary Science,00345288,18851,15322661,Journal,101,,,38-41,,,12,0,,,,,
2-s2.0-84938680147,10.1016/j.rvsc.2015.05.010,S0034528815001551,26267084,Concomitance and interactions of pathogens in the Iberian wolf (Canis lupus),ar,Article,Oleaga A.,,CSIC-UCLM - Instituto de Investigacion en Recursos Cinegeticos (IREC);Grupo Tragsa,Ciudad Real;Madrid,Spain;Spain,,,,,2015-08-01,1 August 2015,Research in Veterinary Science,00345288,18851,15322661,Journal,101,,,22-27,,,23,0,,,,,
2-s2.0-84938359643,,,,Blood pressure in dogs acessed at Veterinary Hospital of Universidade Estadual do Norte Fluminense Darcy Ribeiro,ar,Article,Chacar F.C.,,Universidade de São Paulo,Sao Paulo,Brazil,,,,,2015-08-01,1 August 2015,Revista Electronica De Veterinaria,,19900193646,16957504,Journal,16,8,,,,,1,0,,,,,
2-s2.0-84938313334,,,,Use of fire as alternative in weed control,re,Review,Burin P.C.,,Universidade Federal da Grande Dourados,Dourados,Brazil,,,,,2015-08-01,1 August 2015,Revista Electronica De Veterinaria,,19900193646,16957504,Journal,16,8,,,,,1,0,,,,,
2-s2.0-84937893110,10.1016/j.cveq.2015.04.010,S0749073915000346,26210953,Neurologic Diseases in Horses,re,Review,Rech R.,,Texas A&M College of Veterinary Medicine & Biomedical Sciences,College Station,United States,,,,,2015-08-01,1 August 2015,Veterinary Clinics of North America Equine Practice,07490739,19510,,Journal,31,2,,281-306,,,15,0,,,,,
2-s2.0-84937739079,10.1111/jsap.12373,,26046229,Acoustic radiation force impulse (ARFI) elastography of kidneys in healthy adult cats: Preliminary results,ar,Article,Garcia P.H.S.,,"Universidade Estadual Paulista ""Júlio de Mesquita Filho""",Sao Paulo,Brazil,,,,,2015-08-01,1 August 2015,Journal of Small Animal Practice,00224510,18300,17485827,Journal,56,8,,505-509,,,14,0,,,,,
2-s2.0-84937526670,10.1016/j.anireprosci.2015.06.022,S0378432015001530,26149219,Sperm storage in Hemidactylus mabouia: Morphological and ultrastructural aspects of a reproductive strategy,ar,Article,Nogueira K.d.O.P.C.,,Universidade Federal de Ouro Preto,Ouro Preto,Brazil,,,,,2015-08-01,1 August 2015,Animal Reproduction Science,03784320,36360,,Journal,159,,,212-216,,,1,2,all repository repositoryvor,All Open Access Green,,,
2-s2.0-84937523186,10.1016/j.smallrumres.2015.06.006,S092144881500259X,,Crude glycerin for Santa Inês and F1 Dorper × Santa Inês lambs,re,Review,Souza L.L.,,Universidade Estadual do Sudoeste da Bahia,Vitoria da Conquista,Brazil,,,,,2015-08-01,1 August 2015,Small Ruminant Research,09214488,92166,,Journal,129,,,1-5,,,8,0,,,,,
2-s2.0-84937523051,10.1016/j.smallrumres.2015.05.005,S0921448815001959,,"Intake, digestibility, performance, and carcass traits of rams provided with dehydrated passion fruit (Passiflora edulis f. flavicarpa) peel, as a substitute of Tifton 85 (Cynodon spp.)",ar,Article,Sena J.A.B.,,Universidade Federal dos Vales do Jequitinhonha e Mucuri,Diamantina,Brazil,,,,,2015-08-01,1 August 2015,Small Ruminant Research,09214488,92166,,Journal,129,,,18-24,,,15,1,all publisherhybridgold,All Open Access Hybrid Gold,,,
2-s2.0-84937521986,10.1016/j.livsci.2015.05.026,S1871141315002553,,"Intake, digestibility, and nitrogen efficiency in Holstein heifers fed treated jatropha (Jatropha curcas L.) kernel cake",ar,Article,da Silva L.D.,,Universidade Federal de Vicosa,Vicosa,Brazil,,,,,2015-08-01,1 August 2015,Livestock Science,18711413,3300147807,,Journal,178,,,100-107,,,1,0,,,,,
2-s2.0-84937521387,10.1016/j.anireprosci.2015.05.018,S0378432015001311,26070909,Perspectives on mammalian chromatoid body research,re,Review,Peruquetti R.L.,,Universidade do Sagrado Coracao,Bauru,Brazil,,,,,2015-08-01,1 August 2015,Animal Reproduction Science,03784320,36360,,Journal,159,,,8-16,,,12,0,,,,,
2-s2.0-84937520628,10.1016/j.livsci.2015.06.027,S1871141315003157,,Performance and body composition of light and heavy early-weaning piglets subject to different dietary energy levels,ar,Article,Vieira M.S.,,Universidade Federal do Rio Grande do Sul,Porto Alegre,Brazil,,,,,2015-08-01,1 August 2015,Livestock Science,18711413,3300147807,,Journal,178,,,272-278,,,10,0,,,,,
2-s2.0-84937514872,10.1016/j.livsci.2015.06.016,S1871141315003042,,"Crude glycerin changes ruminal parameters, in vitro greenhouse gas profile, and bacterial fractions of beef cattle",ar,Article,van Cleef E.H.C.B.,,"Universidade Estadual Paulista ""Júlio de Mesquita Filho""",Sao Paulo,Brazil,,,,,2015-08-01,1 August 2015,Livestock Science,18711413,3300147807,,Journal,178,,,158-164,,,31,2,all repository repositoryvor,All Open Access Green,,,
2-s2.0-84937513880,10.1016/j.livsci.2015.05.032,S1871141315002826,,Breeding programs for dairy goats generate profits in Brazil,ar,Article,dos Santos L.H.,,Universidade Federal do Ceará,Fortaleza,Brazil,,,,,2015-08-01,1 August 2015,Livestock Science,18711413,3300147807,,Journal,178,,,27-34,,,5,2,all repository repositoryvor,All Open Access Green,,,
2-s2.0-84937513512,10.1016/j.anireprosci.2015.06.005,S0378432015001360,26071650,Efficacious long-term cooling and freezing of Sapajus apella semen in ACP-118®,ar,Article,Leão D.L.,,Universidade Federal do Pará,Belem,Brazil,,,,,2015-08-01,1 August 2015,Animal Reproduction Science,03784320,36360,,Journal,159,,,118-123,,,17,0,,,,,
2-s2.0-84937513287,10.1016/j.anireprosci.2015.05.012,S0378432015001177,26051611,Natriuretic peptides stimulate oocyte meiotic resumption in bovine,ar,Article,De Cesaro M.P.,,Universidade Federal de Santa Maria,Santa Maria,Brazil,,,,,2015-08-01,1 August 2015,Animal Reproduction Science,03784320,36360,,Journal,159,,,52-59,,,26,0,,,,,
2-s2.0-84937513215,10.1016/j.anireprosci.2015.06.009,S0378432015001402,26112799,"Capture, adaptation and artificial control of reproduction of Lophiosilurus alexandri: A carnivorous freshwater species",ar,Article,Costa D.C.,,Universidade Federal de Minas Gerais,Belo Horizonte,Brazil,,,,,2015-08-01,1 August 2015,Animal Reproduction Science,03784320,36360,,Journal,159,,,148-154,,,37,0,,,,,
2-s2.0-84937164235,10.1111/ahe.12133,,25091030,"Aspects of the Macroscopic Testicular and Epididymal Morphology in the Greater Rhea, Rhea Americana (Linneaus - 1758) Birds",ar,Article,Carvalho S.F.M.,,Universidade Federal de Goiás,Goiania,Brazil,,,,,2015-08-01,1 August 2015,Journal of Veterinary Medicine Series C Anatomia Histologia Embryologia,03402096,17124,14390264,Journal,44,4,,255-261,,,6,0,,,,,
2-s2.0-84937164189,10.1111/ahe.12134,,25091087,Morphological and Morphometric Description of Female Reproductive Tract of Sapajus apella (Capuchin monkey),ar,Article,Lima A.R.,,Federal Rural University of Amazonia (UFRA),"Montese, Belem, Para",Brazil,,,,,2015-08-01,1 August 2015,Journal of Veterinary Medicine Series C Anatomia Histologia Embryologia,03402096,17124,14390264,Journal,44,4,,262-268,,,6,0,,,,,
2-s2.0-84937162758,10.1111/ahe.12135,,25087455,"Gonadal Development of the Piau Leporinus copelandii (Characiformes, Anostomidae) in a Tropical River in South-eastern Brazil",ar,Article,Araújo F.G.,,Universidade Federal Rural do Rio de Janeiro,Seropedica,Brazil,,,,,2015-08-01,1 August 2015,Journal of Veterinary Medicine Series C Anatomia Histologia Embryologia,03402096,17124,14390264,Journal,44,4,,269-274,,,0,0,,,,,
2-s2.0-84934271711,10.1111/tbed.12160,,24034351,Detection of Toxoplasma gondii in the milk of naturally infected goats in the Northeast of Brazil,ar,Article,Bezerra M.J.G.,,Universidade Federal Rural de Pernambuco,Recife,Brazil,,,,,2015-08-01,1 August 2015,Transboundary and Emerging Diseases,18651674,10300153305,18651682,Journal,62,4,,421-424,,,43,1,all publisherfullgold,All Open Access Gold,,,
2-s2.0-84929161667,10.1016/j.actatropica.2015.04.018,S0001706X1500114X,25917716,High selective antileishmanial activity of vanadium complex with stilbene derivative,ar,Article,Machado P.,,Universidade Federal de Juiz de Fora,Juiz de Fora,Brazil,,,,,2015-08-01,"August 01, 2015",Acta Tropica,0001706X,21288,18736254,Journal,148,,,120-127,,,34,0,,,,,
2-s2.0-84929083146,10.1016/j.actatropica.2015.04.008,S0001706X15001047,25917715,"Epidemiology of canine leishmaniasis in southern Bahia, Brazil",ar,Article,Leça Júnior N.,,Mestre em Ciência Animal,Ilheus,Brazil,,,,,2015-08-01,"August 01, 2015",Acta Tropica,0001706X,21288,18736254,Journal,148,,,115-119,,,22,0,,,,,
2-s2.0-84938413688,10.1590/0103-8478cr20140860,,,Technique characterization and hydraulic performance of four self-compensating drippers used in Brazil,ar,Article,Dalri A.B.,,"Universidade Estadual Paulista ""Júlio de Mesquita Filho""",Sao Paulo,Brazil,,,,,2015-07-31,31 July 2015,Ciencia Rural,01038478,4000151812,16784596,Journal,45,8,,1439-1444,,,3,1,all publisherfullgold repository repositoryvor repositoryam,All Open Access Gold Green,,,
2-s2.0-84938412388,10.1590/0103-8478cr20141309,,,Tolerance of soybean genotypes to Asian rust,ar,Article,de Melo C.L.P.,,Empresa Brasileira de Pesquisa Agropecuária - Embrapa,Brasilia,Brazil,,,,,2015-07-31,31 July 2015,Ciencia Rural,01038478,4000151812,16784596,Journal,45,8,,1353-1360,,,7,1,all publisherfullgold repository repositoryvor repositoryam,All Open Access Gold Green,,,
2-s2.0-84938410015,10.1590/S1413-70542015000400006,,,Reproductive traits selection in nelore beef cattle,ar,Article,Moreira H.,,Instituto de Zootecnia,Nova Odessa,Brazil,,,,,2015-07-31,31 July 2015,Ciencia E Agrotecnologia,14137054,19200157040,19811829,Journal,39,4,,355-362,,,13,1,all publisherfullgold repository repositoryvor,All Open Access Gold Green,,,
2-s2.0-84938408621,10.1590/0103-8478cr20130177,,,Energy productivity of forest species in short rotation plantings,ar,Article,Eloy E.,,Universidade Federal de Santa Maria,Santa Maria,Brazil,,,,,2015-07-31,31 July 2015,Ciencia Rural,01038478,4000151812,16784596,Journal,45,8,,1424-1431,,,19,1,all publisherfullgold repository repositoryam,All Open Access Gold Green,,,
2-s2.0-84938408421,10.1590/0103-8478cr20141447,,,"Histopathological, immunohistochemical and biomolecular diagnosis of myocarditis due to Clostridium chauvoei in a bovine",no,Note,Casagrande R.A.,,Universidade do Estado de Santa Catarina,Florianopolis,Brazil,,,,,2015-07-31,31 July 2015,Ciencia Rural,01038478,4000151812,16784596,Journal,45,8,,1472-1475,,,15,1,all publisherfullgold repository repositoryam,All Open Access Gold Green,,,
2-s2.0-84938396743,10.1590/S1413-70542015000400005,,,Thermal stability of Pinus oocarpa and maize cob particleboards,ar,Article,Scatolino M.,,Universidade Federal de Lavras,Lavras,Brazil,,,,,2015-07-31,31 July 2015,Ciencia E Agrotecnologia,14137054,19200157040,19811829,Journal,39,4,,348-354,,,8,1,all publisherfullgold repository repositoryam,All Open Access Gold Green,,,
2-s2.0-84938396024,10.1590/0103-8478cr20140581,,,Identification of toxigenic Aspergillus species from diet dairy goat using a polyphasic approach,ar,Article,da Silva J.L.,,Instituto Biologico - Sao Paulo,Sao Paulo,Brazil,,,,,2015-07-31,31 July 2015,Ciencia Rural,01038478,4000151812,16784596,Journal,45,8,,1466-1471,,,7,1,all publisherfullgold repository repositoryvor repositoryam,All Open Access Gold Green,,,
2-s2.0-84938395193,10.1590/S1413-70542015000400004,,,Physiological and sanitary qualities of maize landrace seeds stored under two conditions,ar,Article,Stefanello R.,,Universidade Federal de Santa Maria,Santa Maria,Brazil,,,,,2015-07-31,31 July 2015,Ciencia E Agrotecnologia,14137054,19200157040,19811829,Journal,39,4,,339-347,,,8,1,all publisherfullgold,All Open Access Gold,,,
2-s2.0-84938392371,10.1590/0103-8478cr20141369,,,Fecal collection methods for the determination of protein digestibility in bullfrogs,ar,Article,de Stéfani M.V.,,"Universidade Estadual Paulista ""Júlio de Mesquita Filho""",Sao Paulo,Brazil,,,,,2015-07-31,31 July 2015,Ciencia Rural,01038478,4000151812,16784596,Journal,45,8,,1492-1495,,,3,1,all publisherfullgold repository repositoryvor repositoryam,All Open Access Gold Green,,,
2-s2.0-84938392328,10.1590/0103-8478cr20140705,,,Photosynthetic restriction of soybean plants under variation of water availability,ar,Article,Chavarria G.,,Universidade de Passo Fundo,Passo Fundo,Brazil,,,,,2015-07-31,31 July 2015,Ciencia Rural,01038478,4000151812,16784596,Journal,45,8,,1387-1393,,,23,1,all publisherfullgold repository repositoryam,All Open Access Gold Green,,,
2-s2.0-84938390197,10.1590/0103-8478cr20140284,,,"pH, sodium, potassium, calcium, magnesium and aluminum in soils contaminated with petroleum drilling fluid after leaching tests",ar,Article,de Freitas F.C.,,Universidade Federal Rural do Rio de Janeiro,Seropedica,Brazil,,,,,2015-07-31,31 July 2015,Ciencia Rural,01038478,4000151812,16784596,Journal,45,8,,1418-1423,,,6,1,all publisherfullgold repository repositoryam,All Open Access Gold Green,,,
2-s2.0-84938388254,10.1590/S1413-70542015000400009,,,Oxidative and microbiological stability of fresh pork sausage with added sun mushroom powder,ar,Article,Stefanello F.,,Universidade Federal de Santa Maria,Santa Maria,Brazil,,,,,2015-07-31,31 July 2015,Ciencia E Agrotecnologia,14137054,19200157040,19811829,Journal,39,4,,381-389,,,16,1,all publisherfullgold repository repositoryvor repositoryam,All Open Access Gold Green,,,
2-s2.0-84938384330,10.1590/0103-8478cr20140338,,,Hygroscopic behaviour of cassava flour from dry and water groups,ar,Article,Chisté R.C.,,Universidade do Porto,Porto,Portugal,,,,,2015-07-31,31 July 2015,Ciencia Rural,01038478,4000151812,16784596,Journal,45,8,,1515-1521,,,14,1,all publisherfullgold repository repositoryvor repositoryam,All Open Access Gold Green,,,
2-s2.0-84938382436,10.1590/0103-8478cr20140622,,,Period of bunch formation and growth regulators on yield and quality of banana ‘Grande Naine’,ar,Article,Lima J.D.,,"Universidade Estadual Paulista ""Júlio de Mesquita Filho""",Sao Paulo,Brazil,,,,,2015-07-31,31 July 2015,Ciencia Rural,01038478,4000151812,16784596,Journal,45,8,,1451-1454,,,1,1,all publisherfullgold repository repositoryam,All Open Access Gold Green,,,
2-s2.0-84938379515,10.1590/s1413-70542015000400008,,,Fatty acid composition of capsicum genus peppers,ar,Article,de Souza Sora G.T.,,Universidade Estadual de Maringá,Maringa,Brazil,,,,,2015-07-31,31 July 2015,Ciencia E Agrotecnologia,14137054,19200157040,19811829,Journal,39,4,,372-380,,,14,1,all publisherfullgold,All Open Access Gold,,,
2-s2.0-84938378894,10.1590/0103-8478cr20131502,,,Radiculares e caulinares de framboeseira cold storage and treatment with plant growth regulators in rooting of root and stems cutting of raspberry,ar,Article,Tiberti A.S.,,Universidade Federal de Lavras,Lavras,Brazil,,,,,2015-07-31,31 July 2015,Ciencia Rural,01038478,4000151812,16784596,Journal,45,8,,1445-1450,,,6,1,all publisherfullgold repository repositoryam,All Open Access Gold Green,,,
2-s2.0-84938377610,10.1590/S1413-70542015000400001,,,Effectiveness of postharvest solutions for the conservation of cut Oncidium varicosum (orchidaceae) inflorescences,ar,Article,Mattiuz C.F.M.,,Centro Universitário Moura Lacerda,Ribeirao Preto,Brazil,,,,,2015-07-31,31 July 2015,Ciencia E Agrotecnologia,14137054,19200157040,19811829,Journal,39,4,,315-322,,,5,1,all publisherfullgold repository repositoryvor repositoryam,All Open Access Gold Green,,,
2-s2.0-84938375792,10.1590/0103-8478cr20140414,,,Comparison of adaptability and stability estimates in upright peanut genotypes cultivated in Northeast and midwest regions,ar,Article,de Vasconcelos F.M.T.,,Universidade Federal Rural de Pernambuco,Recife,Brazil,,,,,2015-07-31,31 July 2015,Ciencia Rural,01038478,4000151812,16784596,Journal,45,8,,1375-1380,,,9,1,all publisherfullgold repository repositoryvor repositoryam,All Open Access Gold Green,,,
2-s2.0-84938371424,10.1590/0103-8478cr20141530,,,Quality of potato tubers from cultivar ‘atlantic’ as affected by phosphorus fertilization,ar,Article,Fernandes A.M.,,"Universidade Estadual Paulista ""Júlio de Mesquita Filho""",Sao Paulo,Brazil,,,,,2015-07-31,31 July 2015,Ciencia Rural,01038478,4000151812,16784596,Journal,45,8,,1401-1407,,,3,1,all publisherfullgold repository repositoryvor repositoryam,All Open Access Gold Green,,,
2-s2.0-84938368891,10.1590/0103-8478cr20141304,,,Jejunal hemorrhage syndrome in a Zebu cow in Brazil,no,Note,Pires P.S.,,Universidade Federal de Minas Gerais,Belo Horizonte,Brazil,,,,,2015-07-31,31 July 2015,Ciencia Rural,01038478,4000151812,16784596,Journal,45,8,,1476-1479,,,1,1,all publisherfullgold repository repositoryvor repositoryam,All Open Access Gold Green,,,
2-s2.0-84938365315,10.1590/0103-8478cr20130040,,,"Plant parasitic nematodes in anthurium growing areas from são paulo, paraná and Santa Catarina States, Brazil",ar,Article,de Oliveira C.M.G.,,Universidade Estadual de Campinas,Campinas,Brazil,,,,,2015-07-31,31 July 2015,Ciencia Rural,01038478,4000151812,16784596,Journal,45,8,,1349-1352,,,0,1,all publisherfullgold repository repositoryam,All Open Access Gold Green,,,
2-s2.0-84938364011,10.1590/s1413-70542015000400011,,,Rice parboiling wastewater in the maximization of carotenoids bioproduction by Phaffia rhodozyma,ar,Article,da Silva Rios D.A.,,Universidade Federal do Rio Grande,Rio Grande,Brazil,,,,,2015-07-31,31 July 2015,Ciencia E Agrotecnologia,14137054,19200157040,19811829,Journal,39,4,,401-410,,,24,1,all publisherfullgold repository repositoryvor,All Open Access Gold Green,,,
2-s2.0-84938354932,10.1590/0103-8478cr20140661,,,Nutritional requirement of digestible lysine for white-egg laying hens in production,ar,Article,Pastore S.M.,,Universidade Federal de Vicosa,Vicosa,Brazil,,,,,2015-07-31,31 July 2015,Ciencia Rural,01038478,4000151812,16784596,Journal,45,8,,1496-1502,,,2,1,all publisherfullgold repository repositoryvor repositoryam,All Open Access Gold Green,,,
2-s2.0-84938352937,10.1590/s1413-70542015000400003,,,Pedotransfer functions for water retention in the main soils from the brazilian coastal plains,ar,Article,da Silva E.,,Universidade Federal de Lavras,Lavras,Brazil,,,,,2015-07-31,31 July 2015,Ciencia E Agrotecnologia,14137054,19200157040,19811829,Journal,39,4,,331-338,,,9,1,all publisherfullgold repository repositoryvor,All Open Access Gold Green,,,
2-s2.0-84938347281,10.1590/0103-8478cr20141225,,,"Leaf water potential, nutritional status and must composition in grapes ‘pinot nero’ with and without irrigation",no,Note,Ciotta M.N.,,Universidade Federal de Santa Maria,Santa Maria,Brazil,,,,,2015-07-31,31 July 2015,Ciencia Rural,01038478,4000151812,16784596,Journal,45,8,,1408-1411,,,1,1,all publisherfullgold repository repositoryvor repositoryam,All Open Access Gold Green,,,
2-s2.0-84938345294,10.1590/0103-8478cr20140760,,,Nutritional efficiency of maize in intercropping with signalgrass,ar,Article,Silva D.V.,,Universidade Federal Rural do Semi-Árido,Mossoro,Brazil,,,,,2015-07-31,31 July 2015,Ciencia Rural,01038478,4000151812,16784596,Journal,45,8,,1394-1400,,,11,1,all publisherfullgold repository repositoryvor repositoryam,All Open Access Gold Green,,,
2-s2.0-84938344151,10.1590/0103-8478cr20130102,,,Adaptability and stability in apomictic genotypes of the genus Paspalum,ar,Article,Pereira E.A.,,Universidade Federal do Rio Grande do Sul,Porto Alegre,Brazil,,,,,2015-07-31,31 July 2015,Ciencia Rural,01038478,4000151812,16784596,Journal,45,8,,1361-1367,,,5,1,all publisherfullgold repository repositoryvor repositoryam,All Open Access Gold Green,,,
2-s2.0-84938343870,10.1590/S1413-70542015000400007,,,Carotenoid retention in minimally processed biofortified green corn stored under retail marketing conditions,ar,Article,Barbosa N.A.,,Universidade Federal de Lavras,Lavras,Brazil,,,,,2015-07-31,31 July 2015,Ciencia E Agrotecnologia,14137054,19200157040,19811829,Journal,39,4,,363-371,,,1,1,all publisherfullgold repository repositoryvor repositoryam,All Open Access Gold Green,,,
2-s2.0-84938341555,10.1590/0103-8478cr20140625,,,Carcass quality and yield of pork cuts with the use of ractopamine,ar,Article,Martins D.d.S.,,Universidade Regional Integrada do Alto Uruguai e das Missões,Erechim,Brazil,,,,,2015-07-31,31 July 2015,Ciencia Rural,01038478,4000151812,16784596,Journal,45,8,,1503-1508,,,3,1,all publisherfullgold repository repositoryam,All Open Access Gold Green,,,
2-s2.0-84938337322,10.1590/0103-8478cr20131572,,,"Production of blackberry and redberry in lavras – MG, Brazil",ar,Article,Curi P.N.,,Universidade Federal de Lavras,Lavras,Brazil,,,,,2015-07-31,31 July 2015,Ciencia Rural,01038478,4000151812,16784596,Journal,45,8,,1368-1374,,,26,1,all publisherfullgold repository repositoryam,All Open Access Gold Green,,,
2-s2.0-84938335740,10.1590/s1413-70542015000400010,,,Physicochemical and rheological characterization of avocado oils,ar,Article,de Souza Jorge T.S.,,"Universidade Estadual Paulista ""Júlio de Mesquita Filho""",Sao Paulo,Brazil,,,,,2015-07-31,31 July 2015,Ciencia E Agrotecnologia,14137054,19200157040,19811829,Journal,39,4,,390-400,,,23,1,all publisherfullgold repository repositoryvor,All Open Access Gold Green,,,
2-s2.0-84938332882,10.1590/0103-8478cr20140557,,,Potato somaclones identified by minimum descriptors sprout,ar,Article,Santiago G.,,Universidade Federal de Santa Maria,Santa Maria,Brazil,,,,,2015-07-31,31 July 2015,Ciencia Rural,01038478,4000151812,16784596,Journal,45,8,,1381-1386,,,0,1,all publisherfullgold repository repositoryam,All Open Access Gold Green,,,
2-s2.0-84938331246,10.1590/0103-8478cr20130624,,,"Polychlorinated biphenyls in rice and beans from Rio Grande do Sul state, Brazil",ar,Article,Cocco R.,,Universidade Federal de Santa Maria,Santa Maria,Brazil,,,,,2015-07-31,31 July 2015,Ciencia Rural,01038478,4000151812,16784596,Journal,45,8,,1522-1527,,,2,1,all publisherfullgold repository repositoryam,All Open Access Gold Green,,,
2-s2.0-84938322091,10.1590/0103-8478cr20141239,,,Myelopathy associated with cervical epidural spinal metastasis of follicular-compact thyroid carcinoma in two dogs,no,Note,Tochetto C.,,Universidade Federal de Santa Maria,Santa Maria,Brazil,,,,,2015-07-31,31 July 2015,Ciencia Rural,01038478,4000151812,16784596,Journal,45,8,,1487-1491,,,2,1,all publisherfullgold repository repositoryam,All Open Access Gold Green,,,
2-s2.0-84938319547,10.1590/0103-8478cr20131590,,,Genetic divergence between meat type quails for performance traits,ar,Article,De Veloso R.C.,,Universidade Federal de Vicosa,Vicosa,Brazil,,,,,2015-07-31,31 July 2015,Ciencia Rural,01038478,4000151812,16784596,Journal,45,8,,1509-1514,,,2,1,all publisherfullgold repository repositoryvor repositoryam,All Open Access Gold Green,,,
2-s2.0-84938318883,10.1590/0103-8478cr20140907,,,Boundary conditions for calibration of reflectometer used to measure soil water,ar,Article,Gubiani P.I.,,Universidade Federal de Santa Maria,Santa Maria,Brazil,,,,,2015-07-31,31 July 2015,Ciencia Rural,01038478,4000151812,16784596,Journal,45,8,,1412-1417,,,2,1,all publisherfullgold repository repositoryvor repositoryam,All Open Access Gold Green,,,
2-s2.0-84938312553,10.1590/0103-8478cr20140764,,,Thunbergia mysorensis (Wight) propagation by cutting stem,ar,Article,Heintze W.,,Universidade Federal do Rio Grande do Sul,Porto Alegre,Brazil,,,,,2015-07-31,31 July 2015,Ciencia Rural,01038478,4000151812,16784596,Journal,45,8,,1455-1458,,,1,1,all publisherfullgold repository repositoryvor repositoryam,All Open Access Gold Green,,,
