eid,doi,pii,pubmed_id,title,subtype,subtypeDescription,creator,afid,affilname,affiliation_city,affiliation_country,author_count,author_names,author_ids,author_afids,coverDate,coverDisplayDate,publicationName,issn,source_id,eIssn,aggregationType,volume,issueIdentifier,article_number,pageRange,description,authkeywords,citedby_count,openaccess,freetoread,freetoreadLabel,fund_acr,fund_no,fund_sponsor
2-s2.0-84939153081,10.1590/1678-4162-7291,,,Relevant peptides of Taenia crassiceps for the diagnosis of bovine cysticercosis by immunoblot,ar,Article,Silva L.,,Universidade Federal de Vicosa,Vicosa,Brazil,,,,,2015-01-01,2015,Arquivo Brasileiro De Medicina Veterinaria E Zootecnia,01020935,17672,16784162,Journal,67,3,,891-898,,,5,1,all publisherfullgold repository repositoryvor,All Open Access Gold Green,,,
2-s2.0-84939150583,10.1590/1678-4162-7551,,,Recognition of colors of objects and food opposite chromaticities by broiler chicks,ar,Article,Fernandes D.,,Universidade de São Paulo,Sao Paulo,Brazil,,,,,2015-01-01,2015,Arquivo Brasileiro De Medicina Veterinaria E Zootecnia,01020935,17672,16784162,Journal,67,3,,873-881,,,5,1,all publisherfullgold repository repositoryvor repositoryam,All Open Access Gold Green,,,
2-s2.0-84939150340,10.1590/1678-4162-7643,,,Performance and parasite control of different genetic groups of lambs finished in irrigated pasture,ar,Article,Fernandes Júnior G.A.,,"Universidade Estadual Paulista ""Júlio de Mesquita Filho""",Sao Paulo,Brazil,,,,,2015-01-01,2015,Arquivo Brasileiro De Medicina Veterinaria E Zootecnia,01020935,17672,16784162,Journal,67,3,,732-740,,,1,1,all publisherfullgold repository repositoryvor repositoryam,All Open Access Gold Green,,,
2-s2.0-84939147946,10.1590/1678-4162-8119,,,"Enumeration, identification and safety proprieties of lactic acid bacteria isolated from pork sausage",ar,Article,Dias F.,,Fundacao Universidade Federal do Vale do Sao Francisco,Petrolina,Brazil,,,,,2015-01-01,2015,Arquivo Brasileiro De Medicina Veterinaria E Zootecnia,01020935,17672,16784162,Journal,67,3,,918-926,,,14,1,all publisherfullgold repository repositoryvor repositoryam,All Open Access Gold Green,,,
2-s2.0-84939147772,10.1590/1678-4162-7056,,,Vocalization as a welfare indicative for pigs subjected to stress situations,ar,Article,Moi M.,,Universidade Federal da Grande Dourados,Dourados,Brazil,,,,,2015-01-01,2015,Arquivo Brasileiro De Medicina Veterinaria E Zootecnia,01020935,17672,16784162,Journal,67,3,,837-845,,,8,1,all publisherfullgold,All Open Access Gold,,,
2-s2.0-84939146218,10.1590/1678-4162-6752,,,Performance of crossbred cows as a result of energetic and protein supplementation in corn silage based diets,ar,Article,Vargas L.I.M.,,"Corporación Colombiana de Investigación Agropecuaria, AGROSAVIA",Bogota,Colombia,,,,,2015-01-01,2015,Arquivo Brasileiro De Medicina Veterinaria E Zootecnia,01020935,17672,16784162,Journal,67,3,,827-836,,,3,1,all publisherfullgold,All Open Access Gold,,,
2-s2.0-84939136908,10.1590/1678-4162-6501,,,Alkalinizing effect of lactated Ringer's solution in healthy and acidotic sheep,ar,Article,Cosenza M.,,Centro Universitário Filadélfia,Londrina,Brazil,,,,,2015-01-01,2015,Arquivo Brasileiro De Medicina Veterinaria E Zootecnia,01020935,17672,16784162,Journal,67,3,,855-863,,,5,1,all publisherfullgold,All Open Access Gold,,,
2-s2.0-84939133913,10.1590/1678-4162-7787,,,"Bone and muscular bases of commercial cuts from the Yacare Caiman (Caiman yacare, Daudin 1802) tail",ar,Article,Figueiredo S.,,Universidade Federal de Mato Grosso,Cuiaba,Brazil,,,,,2015-01-01,2015,Arquivo Brasileiro De Medicina Veterinaria E Zootecnia,01020935,17672,16784162,Journal,67,3,,909-917,,,1,1,all publisherfullgold,All Open Access Gold,,,
2-s2.0-84939131498,10.1590/1678-4162-7400,,,"Surgical time and complications of total transvaginal (total-NOTES), single-port laparoscopic-assisted and conventional ovariohysterectomy in bitches",ar,Article,Silva M.A.M.,,Universidade de Passo Fundo,Passo Fundo,Brazil,,,,,2015-01-01,2015,Arquivo Brasileiro De Medicina Veterinaria E Zootecnia,01020935,17672,16784162,Journal,67,3,,647-654,,,8,1,all publisherfullgold repository repositoryvor repositoryam,All Open Access Gold Green,,,
2-s2.0-84939129915,10.1590/1678-4162-6804,,,Genetic parameters for production and biometrics traits in honey bee Melipona quadrifasciata anthidioides LEPELETIER,ar,Article,Oliveira K.N.,,Universidade Federal do Reconcavo da Bahia,Cruz das Almas,Brazil,,,,,2015-01-01,2015,Arquivo Brasileiro De Medicina Veterinaria E Zootecnia,01020935,17672,16784162,Journal,67,3,,819-826,,,6,1,all publisherfullgold,All Open Access Gold,,,
2-s2.0-84939129895,10.1590/1678-4162-7930,,,"Detection of Theileria equi, Babesia caballi and anti-Ehrlichia spp antibodies in equides from the Pantanal of Mato Grosso State",ar,Article,Barros E.,,Universidade Federal de Mato Grosso,Cuiaba,Brazil,,,,,2015-01-01,2015,Arquivo Brasileiro De Medicina Veterinaria E Zootecnia,01020935,17672,16784162,Journal,67,3,,716-722,,,10,1,all publisherfullgold repository repositoryvor repositoryam,All Open Access Gold Green,,,
2-s2.0-84938901272,10.1007/s00436-014-4172-6,,25324134,Prokineticin receptor identified by phage display is an entry receptor for Trypanosoma cruzi into mammalian cells,ar,Article,Khusal K.,,Universidade de São Paulo,Sao Paulo,Brazil,,,,,2015-01-01,1 January 2015,Parasitology Research,09320113,20340,14321955,Journal,114,1,,155-165,,,13,0,,,,,
2-s2.0-84938857946,10.1007/s00436-014-4181-5,,25346195,Physiological changes in Rhipicephalus microplus (Acari: Ixodidae) experimentally infected with entomopathogenic fungi,ar,Article,Angelo I.C.,,Universidade Federal Rural do Rio de Janeiro,Seropedica,Brazil,,,,,2015-01-01,1 January 2015,Parasitology Research,09320113,20340,14321955,Journal,114,1,,219-225,,,7,0,,,,,
2-s2.0-84938604371,10.1590/1089-6891v16i327069,,,Gestational echo biometry in brachycephalic pregnant bitches,ar,Article,Feliciano M.A.R.,,"Universidade Estadual Paulista ""Júlio de Mesquita Filho""",Sao Paulo,Brazil,,,,,2015-01-01,2015,Ciencia Animal Brasileira,15182797,21100212320,18096891,Journal,16,3,,419-427,,,5,1,all publisherfullgold repository repositoryvor repositoryam,All Open Access Gold Green,,,
2-s2.0-84938597574,10.1590/1089-6891V16I321039,,,Use of different extenders to cryopreservation of mangalarga marchador sperm,ar,Article,Nascimento J.,,,,,,,,,2015-01-01,2015,Ciencia Animal Brasileira,15182797,21100212320,18096891,Journal,16,3,,324-330,,,4,1,all publisherfullgold repository repositoryvor,All Open Access Gold Green,,,
2-s2.0-84938595977,10.1590/1089-6891v16i327208,,,Prevalence of arbovirus antibodies against the family bunyaviridae in water buffaloes,ar,Article,Casseb A.R.,,Universidade Federal Rural da Amazonia,Belem,Brazil,,,,,2015-01-01,2015,Ciencia Animal Brasileira,15182797,21100212320,18096891,Journal,16,3,,428-436,,,5,1,all publisherfullgold repository repositoryam,All Open Access Gold Green,,,
2-s2.0-84938594706,10.1590/1089-6891v16i318694,,,Non-carcass components of nellore bovines slaughtered with different weights,ar,Article,Vaz F.N.,,Universidade Federal de Santa Maria,Santa Maria,Brazil,,,,,2015-01-01,2015,Ciencia Animal Brasileira,15182797,21100212320,18096891,Journal,16,3,,313-323,,,8,1,all publisherfullgold repository repositoryvor,All Open Access Gold Green,,,
2-s2.0-84938592667,10.1590/1089-6891v16i34117,,,"Development and distribution of the brachial plexus in blue-fronted parrot (Amazona aestiva, Linnaeus, 1758)",ar,Article,Da Silva R.,,Universidade de Brasília,Brasília,Brazil,,,,,2015-01-01,2015,Ciencia Animal Brasileira,15182797,21100212320,18096891,Journal,16,3,,464-473,,,3,1,all publisherfullgold repository repositoryvor,All Open Access Gold Green,,,
2-s2.0-84938589510,10.1590/1089-6891v16i324160,,,Ponderal and reproductive performance during rain season of nellore primiparous heifers previously supplemented with protein in dry season,ar,Article,Nogueira A.P.C.,,Universidade Federal de Uberlândia,Uberlandia,Brazil,,,,,2015-01-01,2015,Ciencia Animal Brasileira,15182797,21100212320,18096891,Journal,16,3,,331-342,,,2,1,all publisherfullgold repository repositoryvor,All Open Access Gold Green,,,
2-s2.0-84938588087,10.1590/1089-6891v16i327573,,,Hematological profile of santa inês ewes supplemented on pasture at the last third of pregnancy and postpartum,ar,Article,Pereira F.B.,,Universidade Federal do Piauí,Teresina,Brazil,,,,,2015-01-01,2015,Ciencia Animal Brasileira,15182797,21100212320,18096891,Journal,16,3,,350-357,,,6,1,all publisherfullgold,All Open Access Gold,,,
2-s2.0-84938582965,10.1590/1089-6891v16i323894,,,Interception of animal-origin products at land borders in Brazil,ar,Article,Eidt M.,,"Universidade de Brasília;Ministerio da Agricultura, Pecuaria e Abastecimento",Brasília;Brasilia,Brazil;Brazil,,,,,2015-01-01,2015,Ciencia Animal Brasileira,15182797,21100212320,18096891,Journal,16,3,,388-398,,,8,1,all publisherfullgold repository repositoryvor,All Open Access Gold Green,,,
2-s2.0-84938582729,10.1590/1089-6891v16i328122,,,Description of surveillance actions in outbreaks of aujeszkýs disease,ar,Article,De Oliveira L.,,"Universidade Estadual Paulista ""Júlio de Mesquita Filho""",Sao Paulo,Brazil,,,,,2015-01-01,2015,Ciencia Animal Brasileira,15182797,21100212320,18096891,Journal,16,3,,437-447,,,1,1,all publisherfullgold repository repositoryvor,All Open Access Gold Green,,,
2-s2.0-84938580124,10.1590/1089-6891v16i330969,,,"Immunolocalization of enteroglucagon in endocrine cells in the stomach of scorpion mud turtle Kinosternon scorpioides (Reptilia, Chelonia, Kinosternidae)",ar,Article,Pereira J.G.,,Universidade Estadual do Maranhão,Sao Luis,Brazil,,,,,2015-01-01,2015,Ciencia Animal Brasileira,15182797,21100212320,18096891,Journal,16,3,,448-455,,,2,1,all publisherfullgold,All Open Access Gold,,,
2-s2.0-84938578129,10.1590/1089-6891v16i326131,,,"Occurrence of antibodies against equine herpesvirus and equine arteritis virus in horse herds of rio de janeiro state, Brazil",ar,Article,Diaz K.A.F.,,Universidade Federal Fluminense,Niteroi,Brazil,,,,,2015-01-01,2015,Ciencia Animal Brasileira,15182797,21100212320,18096891,Journal,16,3,,410-418,,,5,1,all publisherfullgold repository repositoryvor,All Open Access Gold Green,,,
2-s2.0-84938569760,10.1590/1089-6891v16i332156,,,Production of in vitro embryo using sexed sperm of 5/8 girolando bulls,ar,Article,Nascimento P.,,Universidade Federal Rural de Pernambuco,Recife,Brazil,,,,,2015-01-01,2015,Ciencia Animal Brasileira,15182797,21100212320,18096891,Journal,16,3,,358-368,,,3,1,all publisherfullgold,All Open Access Gold,,,
2-s2.0-84938566086,10.1590/1089-6891v16i317474,,,Creatine phosphokinase isoenzyme-mb mass (ck-mb mass) and troponin i (ctni) in dogs (Canis familiaris),ar,Article,Freitas M.V.,,Clínica Veterinária VetMaster,Belo Horizonte,Brazil,,,,,2015-01-01,2015,Ciencia Animal Brasileira,15182797,21100212320,18096891,Journal,16,3,,369-376,,,1,1,all publisherfullgold repository repositoryvor repositoryam,All Open Access Gold Green,,,
2-s2.0-84938565706,10.1590/1089-6891v16i319865,,,Serological evidence of exposure to anaplasma phagocytophilum in horses from the rio de janeiro state mounted police bred in the urban zone,ar,Article,Rolim M.F.,,Instituto Municipal de Medicina Veterinária Jorge Vaitsman,Rio de Janeiro,Brazil,,,,,2015-01-01,2015,Ciencia Animal Brasileira,15182797,21100212320,18096891,Journal,16,3,,377-387,,,6,1,all publisherfullgold repository repositoryam,All Open Access Gold Green,,,
2-s2.0-84938561670,10.1590/1089-6891v16i324342,,,Inclusion of guava wastes in the diet of european quails,ar,Article,Camelo L.C.L.,,Universidade Federal Rural de Pernambuco,Recife,Brazil,,,,,2015-01-01,2015,Ciencia Animal Brasileira,15182797,21100212320,18096891,Journal,16,3,,343-349,,,10,1,all publisherfullgold repository repositoryam,All Open Access Gold Green,,,
2-s2.0-84938561446,10.1590/1089-6891v16i331640,,,Monitoring positivity for schistosoma mansoni in rodents holochilus sp. naturally infected,ar,Article,Miranda G.,,Universidade Estadual do Maranhão,Sao Luis,Brazil,,,,,2015-01-01,2015,Ciencia Animal Brasileira,15182797,21100212320,18096891,Journal,16,3,,456-463,,,8,1,all publisherfullgold repository repositoryam,All Open Access Gold Green,,,
2-s2.0-84938559620,10.1590/1089-6891v16i326476,,,"Clinical, hematological, and seminal alterations and parasitemia of male goats experimentally infected with Toxoplasma gondii",ar,Article,Santana L.F.,,"Instituto Federal de Educação, Ciência e Tecnologia do Triangulo Mineiro (IFTM)",Uberaba,Brazil,,,,,2015-01-01,2015,Ciencia Animal Brasileira,15182797,21100212320,18096891,Journal,16,3,,399-409,,,4,1,all publisherfullgold repository repositoryvor,All Open Access Gold Green,,,
2-s2.0-84938097790,10.4067/S0301-732X2015000100002,,,Is cryptosporidiosis an underestimated disease in cats?,re,Review,Da Silveira-Neto L.,,"Universidade Estadual Paulista ""Júlio de Mesquita Filho""",Sao Paulo,Brazil,,,,,2015-01-01,2015,Archivos De Medicina Veterinaria,0301732X,17660,07176201,Journal,47,1,,1-6,,,2,1,all publisherfullgold repository repositoryvor repositoryam,All Open Access Gold Green,,,
2-s2.0-84938084607,10.14202/vetworld.2015.823-830,,,"Modeling of spatial distribution for scorpions of medical importance in the São Paulo State, Brazil",ar,Article,Brites-Neto J.,,Secretariat of Health,Americana,Brazil,,,,,2015-01-01,2015,Veterinary World,09728988,21100201717,22310916,Journal,8,7,,823-830,,,21,1,all publisherfullgold repository repositoryvor repositoryam,All Open Access Gold Green,,,
2-s2.0-84938077036,10.4067/s0301-732x2015000100017,,,Assessment of the risk for introduction of African horse sickness into South American southern cone countries via import of live animals,ar,Article,Marcos A.,,Dirección de Epidemiología y Análisis de Riesgo,Buenos Aires,Argentina,,,,,2015-01-01,2015,Archivos De Medicina Veterinaria,0301732X,17660,07176201,Journal,47,1,,101-105,,,1,1,all publisherfullgold repository repositoryvor,All Open Access Gold Green,,,
2-s2.0-84937580974,,,,Videolaparoscopic splenectomy with bipolar electrosurgery in dog with splenic mass,ar,Article,de Oliveira M.T.,,Universidade Federal de Santa Maria,Santa Maria,Brazil,,,,,2015-01-01,2015,Acta Scientiae Veterinariae,16780345,19900191821,16799216,Journal,43,,70,,,,0,0,,,,,
2-s2.0-84937580736,,,,Fatal Rhodococcus equi infection in goats in southern Brazil,ar,Article,Hill J.A.G.,,Instituto Agronomico do Parana,Londrina,Brazil,,,,,2015-01-01,2015,Acta Scientiae Veterinariae,16780345,19900191821,16799216,Journal,43,,73,,,,1,0,,,,,
2-s2.0-84937579627,,,,Calcium oxalate ureterolithiasis in a cat,ar,Article,Pereira C.d.O.,,Mais Gatos Clínica de Felinos,Porto Alegre,Brazil,,,,,2015-01-01,2015,Acta Scientiae Veterinariae,16780345,19900191821,16799216,Journal,43,,77,,,,0,0,,,,,
2-s2.0-84937578533,,,,Bilateral hip dysplasia in cat,ar,Article,Spiller P.R.,,Universidade Federal de Mato Grosso,Cuiaba,Brazil,,,,,2015-01-01,2015,Acta Scientiae Veterinariae,16780345,19900191821,16799216,Journal,43,,68,,,,0,0,,,,,
2-s2.0-84937575815,,,,Classical scrapie diagnosis in ARR/ARR sheep in Brazil,ar,Article,Leal J.,,Universidade Federal do Rio Grande do Sul,Porto Alegre,Brazil,,,,,2015-01-01,2015,Acta Scientiae Veterinariae,16780345,19900191821,16799216,Journal,43,,69,,,,6,0,,,,,
2-s2.0-84937571866,,,,Sebaceous adenitis in a cat,ar,Article,Possebom J.,,Pontifícia Universidade Católica do Paraná,Curitiba,Brazil,,,,,2015-01-01,2015,Acta Scientiae Veterinariae,16780345,19900191821,16799216,Journal,43,,71,,,,0,0,,,,,
2-s2.0-84937567652,,,,Strigea falconis infection in Buteo magnirostris in Brazil,ar,Article,Olinda R.,,Universidade Federal de Campina Grande,Campina Grande,Brazil,,,,,2015-01-01,2015,Acta Scientiae Veterinariae,16780345,19900191821,16799216,Journal,43,,76,,,,0,0,,,,,
2-s2.0-84937566385,,,,Craniomandibular osteopathy in a West Highland White Terrier,ar,Article,Macedo A.S.,,"Universidade Estadual Paulista ""Júlio de Mesquita Filho""",Sao Paulo,Brazil,,,,,2015-01-01,2015,Acta Scientiae Veterinariae,16780345,19900191821,16799216,Journal,43,,78,,,,4,0,,,,,
2-s2.0-84937563063,,,,Rigid endoscopy to aid the treatment of cervical mucocele in a dog,ar,Article,Feranti J.,,Universidade Federal de Santa Maria,Santa Maria,Brazil,,,,,2015-01-01,2015,Acta Scientiae Veterinariae,16780345,19900191821,16799216,Journal,43,,74,,,,0,0,,,,,
2-s2.0-84937562811,,,,B cell lymphoma with Mott cell differentiation in a dog,ar,Article,Guimarães L.,,Universidade Federal do Rio Grande do Sul,Porto Alegre,Brazil,,,,,2015-01-01,2015,Acta Scientiae Veterinariae,16780345,19900191821,16799216,Journal,43,,79,,,,1,0,,,,,
2-s2.0-84937550716,,,,Laparoscopic-assisted approach to the pelvic flexure for surgical treatment of sand impaction in a horse,ar,Article,Teixeira P.,,Universidade Estadual do Centro Oeste,Guarapuava,Brazil,,,,,2015-01-01,2015,Acta Scientiae Veterinariae,16780345,19900191821,16799216,Journal,43,,75,,,,1,0,,,,,
2-s2.0-84937546468,,,,Outbreak of cumarin poisoning in suckling piglets,ar,Article,Amaral A.,,Universidade Federal do Rio Grande do Sul,Porto Alegre,Brazil,,,,,2015-01-01,2015,Acta Scientiae Veterinariae,16780345,19900191821,16799216,Journal,43,,80,,,,3,0,,,,,
2-s2.0-84937544949,,,,Extrusion intervertebral disc multifocal in a dog,ar,Article,Chaves R.,,Universidade Federal de Santa Maria,Santa Maria,Brazil,,,,,2015-01-01,2015,Acta Scientiae Veterinariae,16780345,19900191821,16799216,Journal,43,,72,,,,0,0,,,,,
2-s2.0-84937541597,,,,Immobilization with modified thomas splint synthetic casting for long bone fracture correction in large animals,ar,Article,Orlandini C.,,Universidade Paranaense,Umuarama,Brazil,,,,,2015-01-01,2015,Acta Scientiae Veterinariae,16780345,19900191821,16799216,Journal,43,,82,,,,2,0,,,,,
2-s2.0-84937442048,10.1590/S0100-736X2015000400007,,,Effect of Lactobacillus sp. isolates supernatant on Escherichia coli O157: H7 enhances the role of organic acids production as a factor for pathogen control,ar,Article,Poppi L.B.,,Universidade de São Paulo,Sao Paulo,Brazil,,,,,2015-01-01,2015,Pesquisa Veterinaria Brasileira,0100736X,18819,16785150,Journal,35,4,,353-359,,,32,1,all publisherfullgold repository repositoryvor repositoryam,All Open Access Gold Green,,,
2-s2.0-84937438719,10.1590/S0100-736X2015000300009,,,Reproductive efficiency of asymptomatic Theileria equi carriers mares submitted to an embryo transfer program,ar,Article,Bezerra L.,,Universidade Federal Rural do Rio de Janeiro,Seropedica,Brazil,,,,,2015-01-01,2015,Pesquisa Veterinaria Brasileira,0100736X,18819,16785150,Journal,35,3,,265-269,,,0,1,all publisherfullgold repository repositoryam,All Open Access Gold Green,,,
2-s2.0-84937438241,10.1590/S0100-736X2015000400006,,,Occurrence of Campylobacter jejuni and C. Coli on broiler carcasses after chilling in southern Brazil,ar,Article,Perdoncini G.,,Universidade Federal do Rio Grande do Sul,Porto Alegre,Brazil,,,,,2015-01-01,2015,Pesquisa Veterinaria Brasileira,0100736X,18819,16785150,Journal,35,4,,349-352,,,11,1,all publisherfullgold repository repositoryvor repositoryam,All Open Access Gold Green,,,
2-s2.0-84937436817,10.1590/S0100-736X2015000300010,,,Efficacy of fipronil for dogs with different parasite burdens of Ctenocephalides felis felis (Siphonaptera: Pulicidae),ar,Article,Coelho C.,,Universidade Federal Rural do Rio de Janeiro,Seropedica,Brazil,,,,,2015-01-01,2015,Pesquisa Veterinaria Brasileira,0100736X,18819,16785150,Journal,35,3,,270-273,,,2,1,all publisherfullgold repository repositoryam,All Open Access Gold Green,,,
2-s2.0-84937435463,10.1590/S0100-736X2015000400009,,,"Occurrence and characterization of Campylobacter spp. isolates in dogs, cats and children",ar,Article,Rodrigues C.G.,,Universidade Federal de Uberlândia,Uberlandia,Brazil,,,,,2015-01-01,2015,Pesquisa Veterinaria Brasileira,0100736X,18819,16785150,Journal,35,4,,365-370,,,20,1,all publisherfullgold,All Open Access Gold,,,
2-s2.0-84937430351,10.1590/S0100-736X2015000400002,,,"Economic losses caused by injuries in carcasses of cattle slaughtered in northern Mato Grosso, Brazil",ar,Article,Neto A.,,Universidade Federal de Mato Grosso,Cuiaba,Brazil,,,,,2015-01-01,2015,Pesquisa Veterinaria Brasileira,0100736X,18819,16785150,Journal,35,4,,324-328,,,12,1,all publisherfullgold repository repositoryvor,All Open Access Gold Green,,,
2-s2.0-84937424432,10.1590/S0100-736X2015000300004,,,Effects of intramammary infection on whey proteinograms of sheep during lactation,ar,Article,Lemos V.F.,,Universidade Federal Rural de Pernambuco,Recife,Brazil,,,,,2015-01-01,2015,Pesquisa Veterinaria Brasileira,0100736X,18819,16785150,Journal,35,3,,230-236,,,4,1,all publisherfullgold repository repositoryvor repositoryam,All Open Access Gold Green,,,
2-s2.0-84937416216,10.1590/S0100-736X2015000400004,,,"Histopathological, immunohistochemical, and molecular study of BHV-5 infection in the central nervous system of experimentally infected calves",ar,Article,Cagnini D.Q.,,"Universidade Estadual Paulista ""Júlio de Mesquita Filho""",Sao Paulo,Brazil,,,,,2015-01-01,2015,Pesquisa Veterinaria Brasileira,0100736X,18819,16785150,Journal,35,4,,337-343,,,8,1,all publisherfullgold repository repositoryvor repositoryam,All Open Access Gold Green,,,
2-s2.0-84937415391,10.1590/S0100-736X2015000400008,,,Natural poisoning by Baccharis megapotamica var. weirii in goats,ar,Article,Panziera W.,,Universidade Federal do Rio Grande do Sul,Porto Alegre,Brazil,,,,,2015-01-01,2015,Pesquisa Veterinaria Brasileira,0100736X,18819,16785150,Journal,35,4,,360-364,,,7,1,all publisherfullgold,All Open Access Gold,,,
2-s2.0-84937414169,10.1590/S0100-736X2015000300015,,,Reproductive endocrine and socio-sexual behavior study of black-tufted-marmoset (Callithrix penicillata) kept in captivity,ar,Article,Sgai M.,,,,,,,,,2015-01-01,2015,Pesquisa Veterinaria Brasileira,0100736X,18819,16785150,Journal,35,3,,304-310,,,4,1,all publisherfullgold repository repositoryvor,All Open Access Gold Green,,,
2-s2.0-84937413441,10.1590/S0100-736X2015000400012,,,"Plasma cholinesterase activity as environmental impact biomarker for green turtles (Chelonia mydas) on the coast of Fernando de Noronha, Pernambuco, Brazil",ar,Article,Fonseca L.A.,,Universidade Federal de Vicosa,Vicosa,Brazil,,,,,2015-01-01,2015,Pesquisa Veterinaria Brasileira,0100736X,18819,16785150,Journal,35,4,,385-389,,,4,1,all publisherfullgold,All Open Access Gold,,,
2-s2.0-84937412542,10.1590/S0100-736X2015000300006,,,Evaluation of immune response of the intestinal mucosa in broilers challenged with different Salmonella serovars,ar,Article,Muniz E.,,Universidade Federal do Parana,Curitiba,Brazil,,,,,2015-01-01,2015,Pesquisa Veterinaria Brasileira,0100736X,18819,16785150,Journal,35,3,,241-248,,,5,1,all publisherfullgold,All Open Access Gold,,,
2-s2.0-84937412342,10.1590/S0100-736X2015000300008,,,"Molecular typing and antimicrobial resistance in isolates of Escherichia coli from poultry and farmers in the Metropolitan Region of Curitiba, Paraná",ar,Article,Korb A.,,Universidade do Estado de Santa Catarina,Florianopolis,Brazil,,,,,2015-01-01,2015,Pesquisa Veterinaria Brasileira,0100736X,18819,16785150,Journal,35,3,,258-264,,,6,2,all repository repositoryvor repositoryam,All Open Access Green,,,
2-s2.0-84937412094,10.1590/S0100-736X2015000300014,,,"Quantitative analysis of testicular echogenicity by technical histogram in sheep of the western lowland region of Maranhão, Brazil",ar,Article,Silva E.G.,,Universidade Federal do Piauí,Teresina,Brazil,,,,,2015-01-01,2015,Pesquisa Veterinaria Brasileira,0100736X,18819,16785150,Journal,35,3,,297-303,,,8,1,all publisherfullgold,All Open Access Gold,,,
2-s2.0-84937410807,10.1590/S0100-736X2015000300002,,,Increased expression of Interleukin-6 related to nephritis in chickens challenged with an Avian infectious bronchitis virus variant,ar,Article,Fernando F.S.,,"Universidade Estadual Paulista ""Júlio de Mesquita Filho""",Sao Paulo,Brazil,,,,,2015-01-01,2015,Pesquisa Veterinaria Brasileira,0100736X,18819,16785150,Journal,35,3,,216-222,,,12,1,all publisherfullgold repository repositoryvor,All Open Access Gold Green,,,
2-s2.0-84937410178,10.1590/S0100-736X2015000400011,,,"Morfometric comparative analysis of the hoof of Nelore, Pantaneira and Curraleira breeds of cattle and buffaloes and their relationship with the pathogenesis of digital diseases",ar,Article,Silva L.A.F.,,Universidade Federal de Goiás,Goiania,Brazil,,,,,2015-01-01,2015,Pesquisa Veterinaria Brasileira,0100736X,18819,16785150,Journal,35,4,,377-384,,,6,1,all publisherfullgold,All Open Access Gold,,,
2-s2.0-84937408568,10.1590/S0100-736X2015000300013,,,"Performance and morphology of the intestinal mucosa of broilers during growth, with or without nucleotides, at different protein levels",ar,Article,Faveri J.,,Universidade Federal da Bahia,Salvador,Brazil,,,,,2015-01-01,2015,Pesquisa Veterinaria Brasileira,0100736X,18819,16785150,Journal,35,3,,291-296,,,3,1,all publisherfullgold,All Open Access Gold,,,
2-s2.0-84937399954,10.1590/S0100-736X2015000300007,,,Serum mineral profile of Girolanda cows during transition period in semi-intensive system in two seasons,ar,Article,Moreira T.,,Universidade Federal de Minas Gerais,Belo Horizonte,Brazil,,,,,2015-01-01,2015,Pesquisa Veterinaria Brasileira,0100736X,18819,16785150,Journal,35,3,,249-257,,,6,1,all publisherfullgold repository repositoryvor,All Open Access Gold Green,,,
2-s2.0-84937399831,10.1590/S0100-736X2015000400010,,,Morphological and immunohistochemical characterization of angiogenic and apoptotic factors and the expression of thyroid receptors in the ovary of tilapia Oreochromis niloticus in captivity,ar,Article,Santos F.C.,,Universidade Federal de Minas Gerais,Belo Horizonte,Brazil,,,,,2015-01-01,2015,Pesquisa Veterinaria Brasileira,0100736X,18819,16785150,Journal,35,4,,371-376,,,5,1,all publisherfullgold,All Open Access Gold,,,
