eid,doi,pii,pubmed_id,title,subtype,subtypeDescription,creator,afid,affilname,affiliation_city,affiliation_country,author_count,author_names,author_ids,author_afids,coverDate,coverDisplayDate,publicationName,issn,source_id,eIssn,aggregationType,volume,issueIdentifier,article_number,pageRange,description,authkeywords,citedby_count,openaccess,freetoread,freetoreadLabel,fund_acr,fund_no,fund_sponsor
2-s2.0-85050189517,10.3920/CEP150012,,,Aerobic exercise produces changes in plasma IL-6 but not IL-1b in four-beat gaited horses,ar,Article,Ferreira L.M.C.,,Universidade Federal Rural de Pernambuco,Recife,Brazil,,,,,2015-01-01,2015,Comparative Exercise Physiology,17552540,21100786232,17552559,Journal,11,3,,159-165,,,4,0,,,,,
2-s2.0-85050180724,10.3920/CEP140019,,,Chronic physical stress differences between genders in a military training on the amazon jungle,ar,Article,de Souza Y.R.,,Fundacao Universidade Federal de Rondonia,Porto Velho,Brazil,,,,,2015-01-01,2015,Comparative Exercise Physiology,17552540,21100786232,17552559,Journal,11,1,,17-21,,,0,0,,,,,
2-s2.0-85048318576,10.1155/2015/350794,,,A case report of avian polyomavirus infection in a blue fronted parrot (Amazona aestiva) Associated with anemia,ar,Article,Philadelpho N.,,Universidade de São Paulo,Sao Paulo,Brazil,,,,,2015-01-01,2015,Case Reports in Veterinary Medicine,20907001,21100863709,2090701X,Journal,2015,,350794,,,,2,1,all publisherfullgold repository repositoryvor repositoryam,All Open Access Gold Green,,,
2-s2.0-85047406963,10.1177/2055116915589835,,,Esophageal stricture caused by rib osteoma in a cat: case report,ar,Article,Cunha S.C.S.,,Universidade Federal Fluminense,Niteroi,Brazil,,,,,2015-01-01,January-June 2015,Journal of Feline Medicine and Surgery Open Reports,,21100945250,20551169,Journal,1,1,,,,,5,1,all publisherfullgold repository repositoryvor,All Open Access Gold Green,,,
2-s2.0-85026678526,,,,Oral fluid: Technological advances and clinical implications in swine,re,Review,Baptista R.I.A.A.,,Universidade Federal Rural de Pernambuco,Recife,Brazil,,,,,2015-01-01,2015,Medicina Veterinaria Brazil,18094678,21100829266,,Journal,9,1-4,,1-9,,,0,0,,,,,
2-s2.0-85026646401,,,,Perineal hernia in dogs: Literature review,re,Review,Penaforte Junior M.A.,,Universidade Federal Rural de Pernambuco,Recife,Brazil,,,,,2015-01-01,2015,Medicina Veterinaria Brazil,18094678,21100829266,,Journal,9,1-4,,26-35,,,1,0,,,,,
2-s2.0-85026639791,,,,Pediatric spay in dogs and cats: Literature review,re,Review,Silva T.C.,,Universidade Federal Rural de Pernambuco,Recife,Brazil,,,,,2015-01-01,2015,Medicina Veterinaria Brazil,18094678,21100829266,,Journal,9,1-4,,20-25,,,0,0,,,,,
2-s2.0-85026628232,,,,Canine lymphoma: Literature review,re,Review,Ribeiro R.C.S.,,Universidade Federal de Campina Grande,Campina Grande,Brazil,,,,,2015-01-01,2015,Medicina Veterinaria Brazil,18094678,21100829266,,Journal,9,1-4,,10-19,,,1,0,,,,,
2-s2.0-85021961699,10.1136/vetreco-2014-000072,,,Endectocide activity of a pour-on formulation containing 1.5 per cent ivermectin +0.5 per cent abamectin in cattle,ar,Article,Silva H.C.,,"Universidade Estadual Paulista ""Júlio de Mesquita Filho"";Universidade Federal da Bahia",Sao Paulo;Salvador,Brazil;Brazil,,,,,2015-01-01,January 2015,Veterinary Record Open,23992050,21100869971,20526113,Journal,2,1,e000072,,,,14,1,all publisherfullgold repository repositoryvor,All Open Access Gold Green,,,
2-s2.0-85018749584,10.5380/avs.v20i2.47097,,,Effect of magnetic plate in memory of rats,ar,Article,Gonçalves N.M.F.d.M.,,Kobe University;Universidade Federal do Parana,Kobe;Curitiba,Japan;Brazil,,,,,2015-01-01,2015,Archives of Veterinary Science,1517784X,8600153122,,Journal,20,,,31-37,,,0,1,all publisherfullgold repository repositoryam,All Open Access Gold Green,,,
2-s2.0-85015487418,10.1017/CBO9781107447189.017,,,Best practice for the study of escape behavior,ch,Book Chapter,Blumstein D.T.,,"University of California, Los Angeles",Los Angeles,United States,,,,,2015-01-01,1 January 2015,Escaping from Predators an Integrative View of Escape Decisions,,21100802394,,Book,,,,407-419,,,25,0,,,,,
2-s2.0-85013993973,10.1079/PAVSNNR201510051,,,Economic impacts of parasitic diseases in cattle,re,Review,Lopes L.B.,,Empresa Brasileira de Pesquisa Agropecuária - Embrapa,Brasilia,Brazil,,,,,2015-01-01,2015,Cab Reviews Perspectives in Agriculture Veterinary Science Nutrition and Natural Resources,,19400158376,17498848,Journal,10,,051,,,,21,0,,,,,
2-s2.0-85013974306,10.1079/PAVSNNR201510048,,,Improved in vitro production systems for bovine embryos,re,Review,Penitente-Filho J.,,Universidade Federal de Vicosa,Vicosa,Brazil,,,,,2015-01-01,2015,Cab Reviews Perspectives in Agriculture Veterinary Science Nutrition and Natural Resources,,19400158376,17498848,Journal,10,,048,,,,2,0,,,,,
2-s2.0-85013954829,10.1079/PAVSNNR201510008,,,Medicinal plant extracts and nematode control,re,Review,Chagas A.C.S.,,Empresa Brasileira de Pesquisa Agropecuária - Embrapa,Brasilia,Brazil,,,,,2015-01-01,2015,Cab Reviews Perspectives in Agriculture Veterinary Science Nutrition and Natural Resources,,19400158376,17498848,Journal,10,,201510008,,,,19,0,,,,,
2-s2.0-84983122117,10.11606/issn.1678-4456.v52i4p310-318,,,"Detection, quantification and genetic variability of Mycoplasma hyopneumoniae from apparently healthy and pneumonic swine",ar,Article,Pulgarón Y.B.,,National Center for Animal and Plant Health,"San José de las Lajas, Mayabeque",Cuba,,,,,2015-01-01,2015,Brazilian Journal of Veterinary Research and Animal Science,14139596,19700182219,16784456,Journal,52,4,,310-318,,,4,1,all publisherfullgold,All Open Access Gold,,,
2-s2.0-84982766568,10.1590/S0100-736X2015000500005,,,"Indicators of quality and composition of informal milk marketed in the in the Southeast region of São Paulo, Brazil",ar,Article,Motta R.,,"Universidade Estadual Paulista ""Júlio de Mesquita Filho""",Sao Paulo,Brazil,,,,,2015-01-01,2015,Pesquisa Veterinaria Brasileira,0100736X,18819,16785150,Journal,35,5,,417-423,,,10,1,all publisherfullgold repository repositoryvor repositoryam,All Open Access Gold Green,,,
2-s2.0-84982758317,10.1590/S0100-736X-2015000500016,,,Caracterization of caveolin -1 and -2 proteins in cloned and transgenic placenta of cattle,ar,Article,Peres K.C.,,"Universidade Estadual Paulista ""Júlio de Mesquita Filho""",Sao Paulo,Brazil,,,,,2015-01-01,2015,Pesquisa Veterinaria Brasileira,0100736X,18819,16785150,Journal,35,5,,477-485,,,1,1,all publisherfullgold repository repositoryvor repositoryam,All Open Access Gold Green,,,
2-s2.0-84982747192,10.1590/S0100-736X2015000500008,,,Paratuberculosis in beef cattle in Southern Brazil,ar,Article,Fiss L.,,Universidade Federal de Pelotas,Pelotas,Brazil,,,,,2015-01-01,2015,Pesquisa Veterinaria Brasileira,0100736X,18819,16785150,Journal,35,5,,437-442,,,9,1,all publisherfullgold,All Open Access Gold,,,
2-s2.0-84982743483,10.1590/S0100-736X2015000500010,,,Poisoning by Metternichia princeps (Solanaceae) in goats in the State of Bahia,ar,Article,Pedroso P.,,Universidade Federal do Reconcavo da Bahia,Cruz das Almas,Brazil,,,,,2015-01-01,2015,Pesquisa Veterinaria Brasileira,0100736X,18819,16785150,Journal,35,5,,448-450,,,1,1,all publisherfullgold repository repositoryvor,All Open Access Gold Green,,,
2-s2.0-84982738429,10.1590/S0100-736X2015000500014,,,Pathological and parasitological aspects of the peacock (Pavo cristatus) infection by Tanaisia (Paratanaisia) bragai,ar,Article,Costa R.C.,,Universidade Federal de Lavras,Lavras,Brazil,,,,,2015-01-01,2015,Pesquisa Veterinaria Brasileira,0100736X,18819,16785150,Journal,35,5,,466-469,,,3,1,all publisherfullgold repository repositoryvor,All Open Access Gold Green,,,
2-s2.0-84982735835,10.1590/S0100-736X2015000500017,,,Occurrence of DNM1 SNP c.767G>T responsible for exercise-induced collapse in Labrador Retriever in the Sao Paulo state,ar,Article,Basso R.M.,,"Universidade Estadual Paulista ""Júlio de Mesquita Filho""",Sao Paulo,Brazil,,,,,2015-01-01,2015,Pesquisa Veterinaria Brasileira,0100736X,18819,16785150,Journal,35,5,,486-490,,,0,1,all publisherfullgold repository repositoryvor repositoryam,All Open Access Gold Green,,,
2-s2.0-84982717678,10.1590/S0100-736X2015000500001,,,Stomatitis vesicular in cattle and horse in the Maranhão state,ar,Article,de Arruda R.C.N.,,Superintendência Federal de Agricultura do Maranhão,Sao Luis,Brazil,,,,,2015-01-01,2015,Pesquisa Veterinaria Brasileira,0100736X,18819,16785150,Journal,35,5,,391-395,,,4,1,all publisherfullgold,All Open Access Gold,,,
2-s2.0-84982706058,10.1590/S0100-736X2015000500004,,,"Mineral deficiencies in lactating cows from the dairy basin of Rondon do Pará, Brazil",ar,Article,Bomjardim H.A.,,Universidade Federal do Pará,Belem,Brazil,,,,,2015-01-01,2015,Pesquisa Veterinaria Brasileira,0100736X,18819,16785150,Journal,35,5,,409-416,,,7,1,all publisherfullgold repository repositoryvor,All Open Access Gold Green,,,
2-s2.0-84982703185,10.1590/S0100-736X2015000500006,,,Effectiveness of Chenopodium ambrosioides (santa maria herb) for controlling Coturnix japonica (japanese quail) endoparasites.,ar,Article,Vita G.F.,,Universidade Federal Rural do Rio de Janeiro,Seropedica,Brazil,,,,,2015-01-01,2015,Pesquisa Veterinaria Brasileira,0100736X,18819,16785150,Journal,35,5,,424-430,,,4,1,all publisherfullgold repository repositoryam,All Open Access Gold Green,,,
2-s2.0-84982699499,10.1590/S0100-736X2015000500007,,,"Molecular characterization of bovine Deltapapillomavirus (BPV1, 2, and 13) DNA in equine sarcoids",ar,Article,de Alcântara B.K.,,Universidade Estadual de Londrina,Londrina,Brazil,,,,,2015-01-01,2015,Pesquisa Veterinaria Brasileira,0100736X,18819,16785150,Journal,35,5,,431-436,,,10,1,all publisherfullgold,All Open Access Gold,,,
2-s2.0-84982698648,10.1590/S0100-736X2015000500013,,,"Serosurvey of leptospira interrogans, brucella abortus and chlamydophila abortus infection in free-ranging giant anteaters (myrmecophaga tridactyla) from Brazil",ar,Article,Miranda F.R.,,,,,,,,,2015-01-01,2015,Pesquisa Veterinaria Brasileira,0100736X,18819,16785150,Journal,35,5,,462-465,,,8,1,all publisherfullgold,All Open Access Gold,,,
2-s2.0-84982694916,10.1590/S0100-736X2015000500011,,,"Weight gain, feed consumption and histology of organs from piglets fed rations containing low levels of fumonisin B1",ar,Article,Souto P.C.M.C.,,Universidade de São Paulo,Sao Paulo,Brazil,,,,,2015-01-01,2015,Pesquisa Veterinaria Brasileira,0100736X,18819,16785150,Journal,35,5,,451-455,,,4,1,all publisherfullgold repository repositoryam,All Open Access Gold Green,,,
2-s2.0-84982694904,10.1590/S0100-736X2015000500009,,,Equine proliferative enteropathy on a Brazilian farm,ar,Article,Gabardo M.P.,,Universidade Federal de Minas Gerais,Belo Horizonte,Brazil,,,,,2015-01-01,2015,Pesquisa Veterinaria Brasileira,0100736X,18819,16785150,Journal,35,5,,443-447,,,7,1,all publisherfullgold,All Open Access Gold,,,
2-s2.0-84982690174,10.1590/S0100-736X2015000500015,,,Follicle and corpus luteum size and vascularity as predictors of fertility at the time of artificial insemination and embryo transfer in beef cattle1,ar,Article,Pinaffi F.L.V.,,Universidade de São Paulo,Sao Paulo,Brazil,,,,,2015-01-01,2015,Pesquisa Veterinaria Brasileira,0100736X,18819,16785150,Journal,35,5,,470-476,,,26,1,all publisherfullgold,All Open Access Gold,,,
2-s2.0-84982672497,10.1590/S0100-736X2015000500012,,,"Babesia canis vogeli infection in dogs and ticks in the semiarid region of Pernambuco, Brazil",ar,Article,Araujo A.C.,,Fundacao Universidade Federal do Vale do Sao Francisco,Petrolina,Brazil,,,,,2015-01-01,2015,Pesquisa Veterinaria Brasileira,0100736X,18819,16785150,Journal,35,5,,456-461,,,28,1,all publisherfullgold,All Open Access Gold,,,
2-s2.0-84982659144,10.1590/S0100-736X2015000500002,,,Cytokine gene expression and molecular detection of Mycobacterium avium subspecies paratuberculosis in organs of experimentally infected mice,ar,Article,Schwarz D.G.G.,,Universidade Federal de Vicosa,Vicosa,Brazil,,,,,2015-01-01,2015,Pesquisa Veterinaria Brasileira,0100736X,18819,16785150,Journal,35,5,,396-402,,,2,1,all publisherfullgold repository repositoryvor,All Open Access Gold Green,,,
2-s2.0-84980400916,10.1590/1678-4162-7374,,,Investigation of antibodies against Sarcocystis neurona and Sarcocystis cruzi in equines,ar,Article,Antonello A.,,Universidade Federal de Santa Maria,Santa Maria,Brazil,,,,,2015-01-01,2015,Arquivo Brasileiro De Medicina Veterinaria E Zootecnia,01020935,17672,16784162,Journal,67,5,,1465-1468,,,5,1,all publisherfullgold,All Open Access Gold,,,
2-s2.0-84980357092,10.17221/7985-VETMED,,,Biphasic pericardial and pleural mesothelioma in a cat: A case report,ar,Article,Gabriel Filho S.,,Institute of Veterinary Cardiology,Ribeirao Preto,Brazil,,,,,2015-01-01,2015,Veterinarni Medicina,03758427,19494,,Journal,60,2,,105-108,,,4,1,all publisherfullgold,All Open Access Gold,,,
2-s2.0-84980348007,10.1590/1678-4162-8080,,,Stocking density in the juvenile production of two characins species in a recirculating system,ar,Article,Jatobá A.,,"Instituto Federal De Educação, Ciência E Tecnologia Catarinense - IFC",Blumenau,Brazil,,,,,2015-01-01,2015,Arquivo Brasileiro De Medicina Veterinaria E Zootecnia,01020935,17672,16784162,Journal,67,5,,1469-1474,,,12,1,all publisherfullgold,All Open Access Gold,,,
2-s2.0-84980347817,10.1590/1678-4162-6732,,,Using Tetra Pak® packaging as insulation coating piglets' creeps,ar,Article,Sartor K.,,Universidade Federal de Santa Maria,Santa Maria,Brazil,,,,,2015-01-01,2015,Arquivo Brasileiro De Medicina Veterinaria E Zootecnia,01020935,17672,16784162,Journal,67,5,,1449-1456,,,2,1,all publisherfullgold,All Open Access Gold,,,
2-s2.0-84980320140,10.1590/1678-4162-8435,,,Association of number of tandem repeats in two important adhesins in Mycoplasma hyopneumoniae,ar,Article,dos Santos L.F.,,Universidade Federal de Vicosa;College of Veterinary Medicine,Vicosa;Saint Paul,Brazil;United States,,,,,2015-01-01,2015,Arquivo Brasileiro De Medicina Veterinaria E Zootecnia,01020935,17672,16784162,Journal,67,5,,1461-1464,,,0,1,all publisherfullgold repository repositoryam,All Open Access Gold Green,,,
2-s2.0-84978255028,10.1590/0034-737X201562010015,,,Growth and yield of corn hybrids in response to association with Azospirillum brasilense and nitrogen fertilization1,ar,Article,Marini D.,,Universidade Estadual do Oeste do Paraná,Cascavel,Brazil,,,,,2015-01-01,January 2015,Revista Ceres,0034737X,82230,21773491,Journal,62,1,,117-123,,,30,1,all publisherfullgold repository repositoryam,All Open Access Gold Green,,,
2-s2.0-84978175721,10.5380/avs.v20i4.43739,,,Alternative methods to animal use for the detection of pyrogen: Opportunities and challenges in controlling the quality of biological products,ar,Article,Navega E.C.A.,,Fundacao Oswaldo Cruz,Rio de Janeiro,Brazil,,,,,2015-01-01,2015,Archives of Veterinary Science,1517784X,8600153122,,Journal,20,4,,71-81,,,2,1,all publisherfullgold repository repositoryvor,All Open Access Gold Green,,,
2-s2.0-84978147690,,,,Comparative analysis between ELFA ELISA using a recombinant bacteriophage protein and other diagnostic methods for Salmonella spp. detection in products of animal origin,ar,Article,Gava F.,,Universidade do Estado de Santa Catarina,Florianopolis,Brazil,,,,,2015-01-01,2015,Archives of Veterinary Science,1517784X,8600153122,,Journal,20,4,,54-61,,,3,0,,,,,
2-s2.0-84978062612,10.5380/avs.v20i4.43195,,,"Timed artificial insemination (TAI) based on CIDR first, second or third use in Bos indicus cows",ar,Article,Souza A.L.B.,,Vet-Maxi Consultoria Pecuária,Curitiba,Brazil,,,,,2015-01-01,2015,Archives of Veterinary Science,1517784X,8600153122,,Journal,20,4,,82-87,,,1,0,,,,,
2-s2.0-84978062593,10.5380/avs.v20i4.41053,,,"Perception of users of public places of Curitiba, Parana, on the presence of pigeons (Columba livia)",ar,Article,Martins C.M.,,Universidade de São Paulo,Sao Paulo,Brazil,,,,,2015-01-01,2015,Archives of Veterinary Science,1517784X,8600153122,,Journal,20,4,,10-19,,,0,1,all publisherfullgold repository repositoryam,All Open Access Gold Green,,,
2-s2.0-84971500196,10.1590/S0100-736X2015000500003,,,"Molecular survey of Porcine Teschovirus, Porcine Sapelovirus, and Enterovirus G in captive wild boars (Sus Scrofa Scrofa) of Paraná state, Brazil",ar,Article,Donin D.,,Universidade Federal do Parana,Curitiba,Brazil,,,,,2015-01-01,2015,Pesquisa Veterinaria Brasileira,0100736X,18819,16785150,Journal,35,5,,403-408,,,16,1,all publisherfullgold,All Open Access Gold,,,
2-s2.0-84963988133,,,,Rumen environment of sheep fed with cashew bagasse dehydrated in replacement sorghum silage,ar,Article,De Lima Lopes K.T.,,,,,,,,,2015-01-01,2015,Acta Veterinaria Brasilica,,21100202112,19815484,Journal,9,4,,335-341,,,0,0,,,,,
2-s2.0-84963988106,,,,"Intestinal protozoan in chinchillas (Chinchilla lanigera) created in captivity, the region serrana of state of Espirito Santo, Brazil",ar,Article,Petroneto B.,,Discente do Depart. de Med. Veter. do Inst. de Ensino Superior do Espirito Santo Multivix-Castelo,,Brazil,,,,,2015-01-01,2015,Acta Veterinaria Brasilica,,21100202112,19815484,Journal,9,1,,65-70,,,2,0,,,,,
2-s2.0-84963984585,10.21708/avb.2015.9.1.4291,,,"Influence of somatic cells levels on milk componentes in southwest Paraná, Brazil",ar,Article,Ferreira B.P.M.,,PROSUPP/CAPES,,Brazil,,,,,2015-01-01,2015,Acta Veterinaria Brasilica,,21100202112,19815484,Journal,9,1,,19-22,,,1,1,all publisherfullgold repository repositoryam,All Open Access Gold Green,,,
2-s2.0-84963984074,,,,"Capybara diet (Hydrochoerus hydrochaeris Linnaeus, 1766) in urban environment, municipal park Tingui, Curitiba-PR",ar,Article,Tonetti A.,,Curso de Pós-Graduação em Engenharia Florestal - UFPR,,Brazil,,,,,2015-01-01,2015,Acta Veterinaria Brasilica,,21100202112,19815484,Journal,9,4,,316-326,,,2,0,,,,,
2-s2.0-84963983750,,,,Propolis and wax antimicrobial potential of different species of bees stingless,ar,Article,Da Silva Campêlo M.C.,,Universidade Federal Rural do Semi-Árido,Mossoro,Brazil,,,,,2015-01-01,2015,Acta Veterinaria Brasilica,,21100202112,19815484,Journal,9,4,,397-400,,,4,0,,,,,
2-s2.0-84963983663,,,,"Canine rabies in Corumbá town, Mato Grosso do Sul state, Brazil, 2015: Case report",ar,Article,Da Silva W.A.,,Centro de Controle de Zoonoses,Sao Paulo,Brazil,,,,,2015-01-01,2015,Acta Veterinaria Brasilica,,21100202112,19815484,Journal,9,4,,386-390,,,4,0,,,,,
2-s2.0-84963976321,,,,Hematological abnormalities in dogs naturally infected by Leishmania spp,ar,Article,Braz P.H.,,Médica Veterinária do Curso de Medicina Veterinária,Dourados,Brazil,,,,,2015-01-01,2015,Acta Veterinaria Brasilica,,21100202112,19815484,Journal,9,1,,87-90,,,7,0,,,,,
2-s2.0-84963974345,,,,Behavior hygienic in colony of bees africanized submitted to ingestion of transgenic and conventional corn pollens,ar,Article,De Abreu L.,,Universidade Federal de Santa Catarina,Florianopolis,Brazil,,,,,2015-01-01,2015,Acta Veterinaria Brasilica,,21100202112,19815484,Journal,9,4,,375-380,,,0,0,,,,,
2-s2.0-84963969052,,,,Microbiological quality of refrigerated raw milk and water used on dairy farms from Garanhuns-PE micro Region,ar,Article,Dos Santos J.F.,,Universidade Federal Rural de Pernambuco,Recife,Brazil,,,,,2015-01-01,2015,Acta Veterinaria Brasilica,,21100202112,19815484,Journal,9,1,,71-76,,,0,0,,,,,
2-s2.0-84963968498,,,,In vitro susceptibility of the Sporothrix brasiliensis TO aqueous extracts of the green tea (Camellia sinensis L. Kuntze),ar,Article,Waller S.B.,,Universidade Federal de Pelotas,Pelotas,Brazil,,,,,2015-01-01,2015,Acta Veterinaria Brasilica,,21100202112,19815484,Journal,9,4,,342-347,,,5,0,,,,,
2-s2.0-84963967692,,,,Variation in concentration glucose serum in dogs stored samples a 4C,ar,Article,Oliveira G.G.,,Universidade Federal de Mato Grosso do Sul,Campo Grande,Brazil,,,,,2015-01-01,2015,Acta Veterinaria Brasilica,,21100202112,19815484,Journal,9,1,,77-81,,,0,0,,,,,
2-s2.0-84963964144,,,,In vitro adsorption of ochratoxin A by probiotics used in aquaculture,ar,Article,Pinheiro R.E.E.,,Universidade Federal do Piauí,Teresina,Brazil,,,,,2015-01-01,2015,Acta Veterinaria Brasilica,,21100202112,19815484,Journal,9,1,,59-64,,,2,0,,,,,
2-s2.0-84963964053,,,,Use of portable glucometer for glycemia measurement in Mangalarga Marchador neonatal foals,ar,Article,Bromerschenkel I.,,"Universidade Estadual Paulista ""Júlio de Mesquita Filho""",Sao Paulo,Brazil,,,,,2015-01-01,2015,Acta Veterinaria Brasilica,,21100202112,19815484,Journal,9,4,,369-374,,,2,0,,,,,
2-s2.0-84963963373,,,,Prevalence of salmonella and staphylococcus aureus. Built-in meat recorded in municipal inspection service - yes and analyzed in 2012 by the central laboratory of the state of paran,ar,Article,Perlin G.O.,,Fiscal de Defasa Agropecuaria do Instituto de Defesa Agropecuaria do Estado do Mato Grosso,Umuarama,Brazil,,,,,2015-01-01,2015,Acta Veterinaria Brasilica,,21100202112,19815484,Journal,9,1,,43-49,,,2,0,,,,,
2-s2.0-84963960870,,,,Responsible pet ownership: A multidisciplinary issue,ar,Article,De Andrade F.T.M.,,Universidade de Franca,Franca,Brazil,,,,,2015-01-01,2015,Acta Veterinaria Brasilica,,21100202112,19815484,Journal,9,1,,91-97,,,5,0,,,,,
2-s2.0-84963959804,,,,Physical and chemical study and honey microbiological quality apis mellifera sold in the state of paraiba,ar,Article,Gois G.,,Doutorado Integrado Em Zootecnia CCA/UFPB/UFRPE/UFC,,Brazil,,,,,2015-01-01,2015,Acta Veterinaria Brasilica,,21100202112,19815484,Journal,9,1,,50-58,,,4,0,,,,,
2-s2.0-84963959625,,,,Diagnosis of gastrointestinal parasites in cats: A comparison of different methodologies,ar,Article,De Souza Ribeiro É.,,"Universidade Estadual Paulista ""Júlio de Mesquita Filho""",Sao Paulo,Brazil,,,,,2015-01-01,2015,Acta Veterinaria Brasilica,,21100202112,19815484,Journal,9,4,,381-385,,,2,0,,,,,
2-s2.0-84963958988,,,,Physical and chemical parameters of goats meat fed different diets to 60 days,ar,Article,De Assis A.P.P.,,Universidade Federal Rural do Semi-Árido,Mossoro,Brazil,,,,,2015-01-01,2015,Acta Veterinaria Brasilica,,21100202112,19815484,Journal,9,4,,327-334,,,3,0,,,,,
2-s2.0-84963957371,10.21708/avb.2015.9.1.4438,,,"Zoosanitary profile of breeding goats and sheep in three mesoregion of Maranhão State, Brazil",ar,Article,Teixeira W.C.,,Universidade Federal Rural de Pernambuco,Recife,Brazil,,,,,2015-01-01,2015,Acta Veterinaria Brasilica,,21100202112,19815484,Journal,9,1,,34-42,,,9,1,all publisherfullgold,All Open Access Gold,,,
2-s2.0-84963957315,,,,Clinical and therapeutic characterization of nonneoplastic mammary lesions in feline species females,ar,Article,Filgueira K.D.,,Universidade Federal Rural do Semi-Árido,Mossoro,Brazil,,,,,2015-01-01,2015,Acta Veterinaria Brasilica,,21100202112,19815484,Journal,9,1,,98-107,,,2,0,,,,,
2-s2.0-84963956751,,,,"Cytomorphological aspects and frequency of canine transmissible venereal tumor subtypes in the municipality of Campo Grande, Mato Grosso do Sul, Brazil",ar,Article,Valençola R.A.,,Medica Veterinaria Autonoma Especialista em Patologia Clinica Veterinaria,Campo Grande,Brazil,,,,,2015-01-01,2015,Acta Veterinaria Brasilica,,21100202112,19815484,Journal,9,1,,82-86,,,8,0,,,,,
2-s2.0-84963955013,,,,Evaluation morphostructural measures in horses of the Quarter horse Breed using image analysis,ar,Article,De Albuquerque Mariz T.M.,,Universidade Federal de Alagoas,Maceio,Brazil,,,,,2015-01-01,2015,Acta Veterinaria Brasilica,,21100202112,19815484,Journal,9,4,,362-368,,,7,0,,,,,
2-s2.0-84963954593,,,,"Sanitary-higienic conditions of food tradein art and craft fair, recife/PE, Brazil",ar,Article,Santos V.V.M.,,,,,,,,,2015-01-01,2015,Acta Veterinaria Brasilica,,21100202112,19815484,Journal,9,1,,23-33,,,0,0,,,,,
2-s2.0-84963954509,,,,Behavior of dairy cows in manual milking system in the semiarid,ar,Article,Urbano S.A.,,Universidade Federal do Rio Grande do Norte,Natal,Brazil,,,,,2015-01-01,2015,Acta Veterinaria Brasilica,,21100202112,19815484,Journal,9,4,,348-353,,,2,0,,,,,
2-s2.0-84963954454,,,,Economic viability and morphometry body and carcass characteristics on sheep fed sunflower cake,ar,Article,Da Silva D.,,Universidade Federal Rural do Semi-Árido,Mossoro,Brazil,,,,,2015-01-01,2015,Acta Veterinaria Brasilica,,21100202112,19815484,Journal,9,4,,306-315,,,6,0,,,,,
2-s2.0-84963949121,,,,Evaluation of meloxicam for the treatment of inflammation and pain associated to orthopedic surgery in dogs,ar,Article,Junior J.A.V.,,Pontifícia Universidade Católica do Paraná,Curitiba,Brazil,,,,,2015-01-01,2015,Acta Veterinaria Brasilica,,21100202112,19815484,Journal,9,4,,354-361,,,0,0,,,,,
2-s2.0-84963944028,,,,Intraparenchymal distribution of hepatic artery in rabbits (Orictolagus cuniculus),ar,Article,Da Cunha Bianchi P.K.F.,,Universidade de São Paulo,Sao Paulo,Brazil,,,,,2015-01-01,2015,Acta Veterinaria Brasilica,,21100202112,19815484,Journal,9,4,,301-305,,,0,0,,,,,
2-s2.0-84963940289,,,,Canine pythiosis: An unnoticed disease in the small animal clinic,ar,Article,De Macêdo L.B.,,Universidade Federal Rural do Semi-Árido,Mossoro,Brazil,,,,,2015-01-01,2015,Acta Veterinaria Brasilica,,21100202112,19815484,Journal,9,1,,1-11,,,2,0,,,,,
2-s2.0-84963938383,,,,Intralesional cisplatin in the treatment of squamous cell carcinoma in Santa Ines sheep breed - Case Report,ar,Article,Dos Anjos C.,,Universidade de São Paulo,Sao Paulo,Brazil,,,,,2015-01-01,2015,Acta Veterinaria Brasilica,,21100202112,19815484,Journal,9,4,,391-396,,,1,0,,,,,
2-s2.0-84963934427,10.21708/avb.2015.9.1.4212,,,Nutritional value and digestibility of sunflower grain in diets for Label Rouge pullets and roosters,ar,Article,Fernandes R.,,Universidade Federal Rural do Semi-Árido,Mossoro,Brazil,,,,,2015-01-01,2015,Acta Veterinaria Brasilica,,21100202112,19815484,Journal,9,1,,12-18,,,1,0,,,,,
