eid,doi,pii,pubmed_id,title,subtype,subtypeDescription,creator,afid,affilname,affiliation_city,affiliation_country,author_count,author_names,author_ids,author_afids,coverDate,coverDisplayDate,publicationName,issn,source_id,eIssn,aggregationType,volume,issueIdentifier,article_number,pageRange,description,authkeywords,citedby_count,openaccess,freetoread,freetoreadLabel,fund_acr,fund_no,fund_sponsor
2-s2.0-85092088160,10.1108/IJLM-01-2020-0038,,,Food loss and waste in the Brazilian beef supply chain: an empirical analysis,ar,Article,Magalhães V.S.M.,,"University of Coimbra, Centre for Mechanical Engineering, Materials and Processes",Coimbra,Portugal,,,,,2021-01-30,30 Jan 2021,International Journal of Logistics Management,09574093,19700201449,17586550,Journal,32,1,,214-236,,,30,0,,,,,
2-s2.0-85090476849,10.1108/IJLM-10-2019-0284,,,Supply chain collaboration: differing perspectives of Brazilian companies,ar,Article,Carvalho N.L.,,Universidade Federal de São Carlos,Sao Carlos,Brazil,,,,,2021-01-30,30 Jan 2021,International Journal of Logistics Management,09574093,19700201449,17586550,Journal,32,1,,118-137,,,16,0,,,,,
2-s2.0-85088783735,10.1108/IJLM-02-2020-0091,,,Brazilian logistics practitioners' perceptions on sustainability: an exploratory study,ar,Article,Martins V.W.B.,,Universidade Estadual de Campinas;Universidade do Estado do Para,Campinas;Belem,Brazil;Brazil,,,,,2021-01-30,30 Jan 2021,International Journal of Logistics Management,09574093,19700201449,17586550,Journal,32,1,,190-213,,,19,2,all repository repositoryam,All Open Access Green,,,
2-s2.0-85088691166,10.1108/IJLM-01-2020-0039,,,Structure and complexity in six supply chains of the Brazilian wind turbine industry,ar,Article,Adami V.S.,,Universidade do Vale do Rio dos Sinos,Sao Leopoldo,Brazil,,,,,2021-01-30,30 Jan 2021,International Journal of Logistics Management,09574093,19700201449,17586550,Journal,32,1,,23-39,,,9,0,,,,,
2-s2.0-85086860834,10.1108/IJLM-10-2019-0292,,,Postponement practices in the Brazilian Southeast wine sector,ar,Article,Ferreira K.A.,,Universidade Federal de Ouro Preto,Ouro Preto,Brazil,,,,,2021-01-30,30 Jan 2021,International Journal of Logistics Management,09574093,19700201449,17586550,Journal,32,1,,6-23,,,13,0,,,,,
2-s2.0-85083727239,10.1108/IJPPM-11-2018-0396,,,Two-stage incentives system for commercial banks based on centralized resource allocation model in DEA-R,ar,Article,Kamyab P.,,"Islamic Azad University, Rasht Branch",Rasht,Iran,,,,,2021-01-28,28 Jan 2021,International Journal of Productivity and Performance Management,17410401,145293,,Journal,70,2,,427-458,,,8,0,,,,,
2-s2.0-85120528690,10.1007/978-3-030-59467-1_9,,,Digital health technology implementation: Is it effective in a healthy healthcare perspective?,ch,Book Chapter,Stein A.T.,,Universidade Federal de Ciencias da Saúde de Porto Alegre,Porto Alegre,Brazil,,,,,2021-01-25,25 January 2021,Integrating the Organization of Health Services Worker Wellbeing and Quality of Care Towards Healthy Healthcare,,21101138637,,Book,,,,197-220,,,6,0,,,,,
2-s2.0-85098605180,10.1016/j.jclepro.2020.125275,S0959652620353191,,Correlation of customer experience with the acceptance of product-service systems and circular economy,ar,Article,Pecorari P.M.,,Universidade Metodista de Piracicaba,Piracicaba,Brazil,,,,,2021-01-25,25 January 2021,Journal of Cleaner Production,09596526,19167,,Journal,281,,125275,,,,38,0,,,,,
2-s2.0-85096374215,10.1016/j.jclepro.2020.124781,S0959652620348253,,Sustainable industries: Production planning and control as an ally to implement strategy,tb,Retracted,Satyro W.C.,,Universidade de São Paulo;Universidade Nove de Julho,Sao Paulo;Sao Paulo,Brazil;Brazil,,,,,2021-01-25,25 January 2021,Journal of Cleaner Production,09596526,19167,,Journal,281,,124781,,,,27,0,,,,,
2-s2.0-85095456774,10.1108/BPMJ-10-2019-0407,,,A systematic literature review of process modeling guidelines and their empirical support,re,Review,Avila D.T.,,Universidade Federal do Rio Grande do Sul,Porto Alegre,Brazil,,,,,2021-01-25,25 Jan 2021,Business Process Management Journal,14637154,145291,,Journal,27,1,,1-23,,,19,0,,,,,
2-s2.0-85093916010,10.1108/BPMJ-05-2020-0207,,,A systematic literature review on the usage of eye-tracking in understanding process models,ar,Article,Batista Duarte R.,,Universidade de Pernambuco,Recife,Brazil,,,,,2021-01-25,25 Jan 2021,Business Process Management Journal,14637154,145291,,Journal,27,1,,346-367,,,20,0,,,,,
2-s2.0-85090760272,10.1108/JAAR-03-2020-0034,,,The impact of countries' transfer pricing rules on profit shifting,ar,Article,Rathke A.A.T.,,Universidade de São Paulo,Sao Paulo,Brazil,,,,,2021-01-25,25 Jan 2021,Journal of Applied Accounting Research,09675426,19900192334,,Journal,22,1,,22-49,,,6,0,,,,,
2-s2.0-85090480939,10.1016/j.jclepro.2020.123922,S0959652620339676,,Liquid ammonia pretreatment optimization for improved release of fermentable sugars from sugarcane bagasse,ar,Article,Hans M.,,Universidade de São Paulo;Guru Nanak Dev University;Sardar Swaran Singh National Institute of Renewable Energy,Sao Paulo;Amritsar;Kapurthala,Brazil;India;India,,,,,2021-01-25,25 January 2021,Journal of Cleaner Production,09596526,19167,,Journal,281,,123922,,,,29,0,,,,,
2-s2.0-85089029846,10.1108/BPMJ-03-2020-0129,,,What influences the innovation environment in BPO companies?,ar,Article,Ponciano E.S.,,Centro Universitário Campo Limpo Paulista,Campo Limpo Paulista,Brazil,,,,,2021-01-25,25 Jan 2021,Business Process Management Journal,14637154,145291,,Journal,27,1,,106-123,,,3,0,,,,,
2-s2.0-85083665952,10.1108/IJOA-10-2019-1911,,,Subjectivities behind the wheel: transformations in work relations of drivers in Brazil,ar,Article,Capaverde C.B.,,Pontifícia Universidade Católica do Rio Grande do Sul,Porto Alegre,Brazil,,,,,2021-01-25,25 Jan 2021,International Journal of Organizational Analysis,19348835,10400153306,,Journal,29,1,,155-171,,,3,0,,,,,
2-s2.0-85084434655,10.1108/MD-05-2019-0560,,,Measuring dynamic absorptive capacity in national innovation surveys,ar,Article,Alves M.F.R.,,"Instituto Federal de Educação, Ciência e Tecnologia de São Paulo",Sao Paulo,Brazil,,,,,2021-01-22,22 Jan 2021,Management Decision,00251747,144656,,Journal,59,2,,463-477,,,18,0,,,,,
2-s2.0-85095816625,10.1108/IJMPB-02-2020-0043,,,Insider action research towards companywide sustainable product innovation: ecodesign transition framework,ar,Article,Brones F.,,Universidade de São Paulo,Sao Paulo,Brazil,,,,,2021-01-21,21 Jan 2021,International Journal of Managing Projects in Business,17538378,21100446517,17538386,Journal,14,1,,150-178,,,12,0,,,,,
2-s2.0-85092483530,10.1016/j.jclepro.2020.124263,S0959652620343080,,Environmental agate mining impacts and potential use of agate residue in rangeland,ar,Article,Tonello M.S.,,Universidade de Passo Fundo,Passo Fundo,Brazil,,,,,2021-01-20,20 January 2021,Journal of Cleaner Production,09596526,19167,,Journal,280,,124263,,,,7,0,,,,,
2-s2.0-85092072991,10.1016/j.jclepro.2020.124334,S0959652620343791,,The effect of meso-institutions on adoption of sustainable agricultural technology: A case study of the Brazilian Low Carbon Agriculture Plan,ar,Article,de Mello Brandão Vinholis M.,,Empresa Brasileira de Pesquisa Agropecuária - Embrapa,Brasilia,Brazil,,,,,2021-01-20,20 January 2021,Journal of Cleaner Production,09596526,19167,,Journal,280,,124334,,,,56,0,,,,,
2-s2.0-85092070465,10.1016/j.jclepro.2020.124293,S0959652620343389,,"Compressive strength, modulus of elasticity and hardness of geopolymeric cement synthetized from non-calcined natural kaolin",ar,Article,Pelisser F.,,Universidade Federal de Santa Catarina,Florianopolis,Brazil,,,,,2021-01-20,20 January 2021,Journal of Cleaner Production,09596526,19167,,Journal,280,,124293,,,,26,0,,,,,
2-s2.0-85091996235,10.1016/j.jclepro.2020.124324,S0959652620343699,,Quantification of the bark Myrcia eximia DC tannins from the Amazon rainforest and its application in the formulation of natural adhesives for wood,ar,Article,da Silva Araujo E.,,Universidade Federal de Lavras,Lavras,Brazil,,,,,2021-01-20,20 January 2021,Journal of Cleaner Production,09596526,19167,,Journal,280,,124324,,,,30,0,,,,,
2-s2.0-85088598798,10.1108/CCSM-04-2019-0081,,,An international market segmentation model based on susceptibility to global consumer culture,ar,Article,Hernani-Merino M.,,Universidad del Pacífico,Lima,Peru,,,,,2021-01-20,20 Jan 2021,Cross Cultural and Strategic Management,20595794,21100803392,,Journal,28,1,,108-128,,,4,0,,,,,
2-s2.0-85137738753,10.4018/978-1-7998-6605-3.ch012,,,Gif as a narrative tool,ch,Book Chapter,Gonçalves W.T.,,UNIVASF,Juazeiro - BA,Brazil,,,,,2021-01-15,15 January 2021,Handbook of Research on Contemporary Storytelling Methods Across New Media and Disciplines,,21101107126,,Book,,,,224-239,,,0,0,,,,,
2-s2.0-85137532390,10.4018/978-1-7998-6512-4.ch009,,,Knowledge management and its interrelations with organizational memory: Focus on the repertoire memory,ch,Book Chapter,dos Santos J.C.,,Universidade Estadual de Londrina,Londrina,Brazil,,,,,2021-01-15,15 January 2021,Role of Information Science in A Complex Society,,21101105541,,Book,,,,145-162,,,1,0,,,,,
2-s2.0-85137503190,10.4018/978-1-7998-6512-4.ch003,,,"Knowledge, organizational learning, and memory at software companies",ch,Book Chapter,de Moraes C.R.B.,,"Universidade Estadual Paulista ""Júlio de Mesquita Filho""",Sao Paulo,Brazil,,,,,2021-01-15,15 January 2021,Role of Information Science in A Complex Society,,21101105541,,Book,,,,35-44,,,0,0,,,,,
2-s2.0-85137498620,,,,Preface,ed,Editorial,da Silva E.,,"Universidade Estadual Paulista ""Júlio de Mesquita Filho""",Sao Paulo,Brazil,,,,,2021-01-15,15 January 2021,Role of Information Science in A Complex Society,,21101105541,,Book,,,,xvi-xix,,,0,0,,,,,
2-s2.0-85137495992,10.4018/978-1-7998-6512-4.ch011,,,The impacts of complexity on knowledge management processes: Why does information science contribute to conscious capitalism?,ch,Book Chapter,Martins Damian I.P.,,Universidade de São Paulo,Sao Paulo,Brazil,,,,,2021-01-15,15 January 2021,Role of Information Science in A Complex Society,,21101105541,,Book,,,,184-201,,,0,0,,,,,
2-s2.0-85137492073,10.4018/978-1-7998-6512-4.ch012,,,Information and document flows in organizational environments,ch,Book Chapter,do Nascimento N.M.,,Universidade Estadual de Londrina,Londrina,Brazil,,,,,2021-01-15,15 January 2021,Role of Information Science in A Complex Society,,21101105541,,Book,,,,202-223,,,0,0,,,,,
2-s2.0-85137482568,10.4018/978-1-7998-6512-4.ch007,,,The innovation that information science proposes,ch,Book Chapter,da Conceição Matui N.,,Universidade Federal de São Carlos,Sao Carlos,Brazil,,,,,2021-01-15,15 January 2021,Role of Information Science in A Complex Society,,21101105541,,Book,,,,98-123,,,0,0,,,,,
2-s2.0-85137482322,10.4018/978-1-7998-6512-4.ch013,,,"Scientific knowledge, innovation, and economic and social development",ch,Book Chapter,da Silva E.,,"Universidade Estadual Paulista ""Júlio de Mesquita Filho""",Sao Paulo,Brazil,,,,,2021-01-15,15 January 2021,Role of Information Science in A Complex Society,,21101105541,,Book,,,,224-238,,,2,0,,,,,
2-s2.0-85137477139,10.4018/978-1-7998-6512-4.ch006,,,Mediation of information on eliminating violence against women,ch,Book Chapter,de Souza Brandão Guaraldo T.,,"Universidade Estadual Paulista ""Júlio de Mesquita Filho""",Sao Paulo,Brazil,,,,,2021-01-15,15 January 2021,Role of Information Science in A Complex Society,,21101105541,,Book,,,,81-97,,,0,0,,,,,
2-s2.0-85137454057,,,,Foreword,ed,Editorial,Carvalho Teixeira T.M.,,Universidade Estadual do Ceará,Fortaleza,Brazil,,,,,2021-01-15,15 January 2021,Role of Information Science in A Complex Society,,21101105541,,Book,,,,xiv-xv,,,0,0,,,,,
2-s2.0-85137441351,10.4018/978-1-7998-6512-4.ch005,,,Information mediation and its role in the development of complex societies,ch,Book Chapter,dos Santos Neto J.A.,,Universidade Estadual de Londrina,Londrina,Brazil,,,,,2021-01-15,15 January 2021,Role of Information Science in A Complex Society,,21101105541,,Book,,,,65-80,,,0,0,,,,,
2-s2.0-85137440476,10.4018/978-1-7998-6512-4.ch008,,,Information literacy practices using active teaching-learning methodologies in higher education,ch,Book Chapter,Maia C.M.,,Universidade Federal de São Carlos,Sao Carlos,Brazil,,,,,2021-01-15,15 January 2021,Role of Information Science in A Complex Society,,21101105541,,Book,,,,124-144,,,0,0,,,,,
2-s2.0-85137425926,10.4018/978-1-7998-6512-4,,,Role of information science in a complex society,bk,Book,da Silva E.,,"Universidade Estadual Paulista ""Júlio de Mesquita Filho""",Sao Paulo,Brazil,,,,,2021-01-15,15 January 2021,Role of Information Science in A Complex Society,,21101105541,,Book,,,,1-297,,,0,0,,,,,
2-s2.0-85137418829,10.4018/978-1-7998-6512-4.ch002,,,The records management as a valuable asset for corporate governance,ch,Book Chapter,Moro-Cabero M.,,Universidad de Salamanca,Salamanca,Spain,,,,,2021-01-15,15 January 2021,Role of Information Science in A Complex Society,,21101105541,,Book,,,,17-34,,,0,0,,,,,
2-s2.0-85135624563,10.4018/978-1-7998-6512-4.ch010,,,Knowledge management in agro-industrial productive chains: An initial discussion,ch,Book Chapter,Bitencourt Jorge C.F.,,Universidade de Marilia,Marilia,Brazil,,,,,2021-01-15,15 January 2021,Role of Information Science in A Complex Society,,21101105541,,Book,,,,163-183,,,1,0,,,,,
2-s2.0-85129237322,10.4018/978-1-7998-6512-4.ch004,,,Contributions of information science in the data science era: Analysis from the Cynefin framework,ch,Book Chapter,Sá Ramalho R.A.,,Universidade Federal de São Carlos,Sao Carlos,Brazil,,,,,2021-01-15,15 January 2021,Role of Information Science in A Complex Society,,21101105541,,Book,,,,45-64,,,1,0,,,,,
2-s2.0-85108232470,10.4018/978-1-7998-6512-4.ch001,,,21st century skills and competences: Challenges with a focus in information and communication,ch,Book Chapter,Baptista Belluzzo R.C.,,"Universidade Estadual Paulista ""Júlio de Mesquita Filho""",Sao Paulo,Brazil,,,,,2021-01-15,15 January 2021,Role of Information Science in A Complex Society,,21101105541,,Book,,,,1-16,,,2,0,,,,,
2-s2.0-85149673520,10.1007/978-3-030-58827-4_19,,,"Governmental policies to promote biogas production, boosting role of biogas in economic growth of developing nations",ch,Book Chapter,Cruz-Santos M.M.,,Universidad Autónoma de Coahuila,Coahuila,Mexico,,,,,2021-01-11,11 January 2021,Biogas Production from Anaerobic Digestion to A Sustainable Bioenergy Industry,,21101140147,,Book,,,,447-469,,,2,0,,,,,
2-s2.0-85149662907,10.1007/978-3-030-58827-4_7,,,Comparative analysis of biogas with renewable fuels and energy: Physicochemical properties and carbon footprints,ch,Book Chapter,Mier-Alba E.,,Universidade de São Paulo,Sao Paulo,Brazil,,,,,2021-01-11,11 January 2021,Biogas Production from Anaerobic Digestion to A Sustainable Bioenergy Industry,,21101140147,,Book,,,,125-143,,,0,0,,,,,
2-s2.0-85149627381,,,,Preface,ed,Editorial,Balagurusamy N.,,Universidad Autónoma de Coahuila,Coahuila,Mexico,,,,,2021-01-11,11 January 2021,Biogas Production from Anaerobic Digestion to A Sustainable Bioenergy Industry,,21101140147,,Book,,,,v-vi,,,4,0,,,,,
2-s2.0-85145464613,10.1007/978-3-030-58827-4_8,,,Potential feedstock for sustainable biogas production and its supply chain management,ch,Book Chapter,Singh R.,,"I.K. Gujral Punjab Technical University, Jalandhar;Sardar Swaran Singh National Institute of Bio-Energy",Jalandhar;Kapurthala,India;India,,,,,2021-01-11,11 January 2021,Biogas Production from Anaerobic Digestion to A Sustainable Bioenergy Industry,,21101140147,,Book,,,,147-165,,,5,0,,,,,
2-s2.0-85142830327,10.1007/978-3-030-58827-4_1,,,Technological routes for biogas production: Current status and future perspectives,ch,Book Chapter,Sánchez-Muñoz S.,,Universidade de São Paulo,Sao Paulo,Brazil,,,,,2021-01-11,11 January 2021,Biogas Production from Anaerobic Digestion to A Sustainable Bioenergy Industry,,21101140147,,Book,,,,3-17,,,4,0,,,,,
2-s2.0-85129846936,10.1007/978-3-030-58827-4,,,Biogas production: From anaerobic digestion to a sustainable bioenergy industry,bk,Book,Balagurusamy N.,,Universidad Autónoma de Coahuila,Coahuila,Mexico,,,,,2021-01-11,11 January 2021,Biogas Production from Anaerobic Digestion to A Sustainable Bioenergy Industry,,21101140147,,Book,,,,1-469,,,12,0,,,,,
2-s2.0-85128354673,10.1007/978-3-030-58827-4_17,,,Biogas in circular bio-economy: Sustainable practice for rural farm waste management and techno-economic analyses,ch,Book Chapter,Silva-González J.A.,,Universidad Autónoma de Coahuila,Coahuila,Mexico,,,,,2021-01-11,11 January 2021,Biogas Production from Anaerobic Digestion to A Sustainable Bioenergy Industry,,21101140147,,Book,,,,389-414,,,5,0,,,,,
2-s2.0-85111547454,10.1007/978-3-030-58827-4_14,,,Potentials and challenges of biogas upgradation as liquid biomethane,ch,Book Chapter,Chandra R.,,Indian Institute of Technology Delhi,New Delhi,India,,,,,2021-01-11,11 January 2021,Biogas Production from Anaerobic Digestion to A Sustainable Bioenergy Industry,,21101140147,,Book,,,,307-328,,,10,0,,,,,
2-s2.0-85105471415,,,,Work stress research in Brazil,ch,Book Chapter,Ferreira M.C.,,Universidade Salgado de Oliveira,Sao Goncalo,Brazil,,,,,2021-01-11,11 January 2021,Organizational Stress Around the World Research and Practice,,21101044890,,Book,,,,23-42,,,1,0,,,,,
2-s2.0-85090944038,10.1016/j.jclepro.2020.123700,S0959652620337458,,Humic substances reduce the erodibility of soils in mining areas,ar,Article,Portillo Miranda G.A.,,Pontifícia Universidade Católica do Rio de Janeiro,Rio de Janeiro,Brazil,,,,,2021-01-10,10 January 2021,Journal of Cleaner Production,09596526,19167,,Journal,279,,123700,,,,11,0,,,,,
2-s2.0-85090426061,10.1016/j.jclepro.2020.123555,S0959652620336003,,"Development of a natural polymeric bioadsorbent based on sericin, alginate and poly(vinyl alcohol) for the recovery of ytterbium from aqueous solutions",ar,Article,Barcelos da Costa T.,,Universidade Estadual de Campinas,Campinas,Brazil,,,,,2021-01-10,10 January 2021,Journal of Cleaner Production,09596526,19167,,Journal,279,,123555,,,,31,0,,,,,
2-s2.0-85090276362,10.1016/j.jclepro.2020.123775,S0959652620338208,,Tetracycline adsorption by tilapia fish bone-based biochar: Mass transfer assessment and fixed-bed data prediction by hybrid statistical-phenomenological modeling,ar,Article,Módenes A.N.,,Universidade Estadual do Oeste do Paraná,Cascavel,Brazil,,,,,2021-01-10,10 January 2021,Journal of Cleaner Production,09596526,19167,,Journal,279,,123775,,,,57,0,,,,,
2-s2.0-85090270688,10.1016/j.jclepro.2020.123814,S0959652620338592,,Economic assessment of hydrogen and electricity cogeneration through steam reforming-SOFC system in the Brazilian biodiesel industry,ar,Article,de Souza T.A.Z.,,Universidade Federal de Itajubá,Itajuba,Brazil,,,,,2021-01-10,10 January 2021,Journal of Cleaner Production,09596526,19167,,Journal,279,,123814,,,,35,0,,,,,
2-s2.0-85090210793,10.1016/j.jclepro.2020.123789,S0959652620338348,,Towards an integrative framework of collaborative capabilities for sustainability: A systematic review and research agenda,re,Review,de Almeida J.M.G.,,Universidade Federal da Paraíba,Joao Pessoa,Brazil,,,,,2021-01-10,10 January 2021,Journal of Cleaner Production,09596526,19167,,Journal,279,,123789,,,,43,0,,,,,
2-s2.0-85090194450,10.1016/j.jclepro.2020.123730,S0959652620337756,,Study of the incorporation of fabric shavings from the clothing industry in coating mortars,ar,Article,de Oliveira E.M.,,Universidade do Extremo Sul Catarinense,Criciuma,Brazil,,,,,2021-01-10,10 January 2021,Journal of Cleaner Production,09596526,19167,,Journal,279,,123730,,,,12,0,,,,,
2-s2.0-85090038784,10.1016/j.jclepro.2020.123871,S0959652620339160,,"Chemical modification of Dendrocalamus asper bamboo with citric acid and boron compounds: Effects on the physical-chemical, mechanical and thermal properties",ar,Article,Gauss C.,,Universidade de São Paulo;The University of Waikato;Swanson School of Engineering,Sao Paulo;Hamilton;Pittsburgh,Brazil;New Zealand;United States,,,,,2021-01-10,10 January 2021,Journal of Cleaner Production,09596526,19167,,Journal,279,,123871,,,,44,1,all publisherfree2read repository repositoryam,All Open Access Bronze Green,,,
2-s2.0-85090023154,10.1016/j.jclepro.2020.123752,S0959652620337975,,Integrative multi-attribute negotiation model to define stakeholders’ responsibilities in the reverse flow channel,ar,Article,Silva W.D.O.,,Universidade Federal de Pernambuco,Recife,Brazil,,,,,2021-01-10,10 January 2021,Journal of Cleaner Production,09596526,19167,,Journal,279,,123752,,,,20,0,,,,,
2-s2.0-85090015765,10.1016/j.jclepro.2020.123696,S0959652620337410,,"Life-cycle assessment of municipal solid waste management options: A case study of refuse derived fuel production in the city of Brasilia, Brazil",ar,Article,Silva V.,,Universidade de Brasília,Brasília,Brazil,,,,,2021-01-10,10 January 2021,Journal of Cleaner Production,09596526,19167,,Journal,279,,123696,,,,44,0,,,,,
2-s2.0-85090010221,10.1016/j.jclepro.2020.123902,S0959652620339470,,"Effect of oil extraction on the composition, structure, and coagulant effect of Moringa oleifera seeds",ar,Article,Magalhães E.R.B.,,Universidade Federal do Rio Grande do Norte;National Institute of the Semiarid (INSA),Natal;Campina Grande,Brazil;Brazil,,,,,2021-01-10,10 January 2021,Journal of Cleaner Production,09596526,19167,,Journal,279,,123902,,,,59,2,all repository repositoryvor,All Open Access Green,,,
2-s2.0-85089842247,10.1016/j.jclepro.2020.123484,S0959652620335290,,"Valorization of acai bio-residue as biomass for bioenergy: Determination of effective thermal conductivity by experimental approach, empirical correlations and artificial neural networks",ar,Article,Souto B.A.,,Universidade Federal de Itajubá,Itajuba,Brazil,,,,,2021-01-10,10 January 2021,Journal of Cleaner Production,09596526,19167,,Journal,279,,123484,,,,19,0,,,,,
2-s2.0-85089749718,10.1016/j.jclepro.2020.123668,S0959652620337136,,Release kinetics of multi-nutrients from volcanic rock mining by-products: Evidences for their use as a soil remineralizer,ar,Article,Plata L.G.,,Universidade Federal do Rio Grande do Sul,Porto Alegre,Brazil,,,,,2021-01-10,10 January 2021,Journal of Cleaner Production,09596526,19167,,Journal,279,,123668,,,,35,0,,,,,
2-s2.0-85089561125,10.1016/j.jclepro.2020.123369,S0959652620334144,,Assessment of public lighting systems considering mesopic vision,ar,Article,de Oliveira Grando F.,,Universidade Federal de Santa Catarina,Florianopolis,Brazil,,,,,2021-01-10,10 January 2021,Journal of Cleaner Production,09596526,19167,,Journal,279,,123369,,,,7,0,,,,,
2-s2.0-85090570915,10.1108/MBR-01-2020-0020,,,Does origin matter? The impact of the institutional environment of the origin country on the internationalization of franchise chains,ar,Article,Lanfranchi A.G.,,Escola Superior de Propaganda e Marketing,Rio de Janeiro,Brazil,,,,,2021-01-07,7 Jan 2021,Multinational Business Review,1525383X,5700169068,20541686,Journal,29,1,,96-115,,,3,0,,,,,
2-s2.0-85097339709,10.1016/j.knosys.2020.106603,S0950705120307322,,Effective and unburdensome forecast of highway traffic flow with adaptive computing,ar,Article,Alves M.A.C.,,Universidade de São Paulo,Sao Paulo,Brazil,,,,,2021-01-05,5 January 2021,Knowledge Based Systems,09507051,24772,,Journal,212,,106603,,,,25,0,,,,,
2-s2.0-85096554176,10.1108/JMTM-08-2020-0302,,,Lean production myths: an exploratory study,ar,Article,Saurin T.A.,,Universidade Federal do Rio Grande do Sul,Porto Alegre,Brazil,,,,,2021-01-05,5 Jan 2021,Journal of Manufacturing Technology Management,1741038X,18644,,Journal,32,1,,1-19,,,19,0,,,,,
2-s2.0-85076568946,10.1108/EJIM-06-2019-0166,,,Effects of budget system use on innovation performance,ar,Article,Beuren I.M.,,Universidade Federal de Santa Catarina,Florianopolis,Brazil,,,,,2021-01-05,5 Jan 2021,European Journal of Innovation Management,14601060,144961,,Journal,24,1,,109-129,,,11,0,,,,,
2-s2.0-85148826099,10.1007/978-3-030-54414-0_3,,,Incentives to engage blockchain and ecosystem actors,ch,Book Chapter,Tanniru M.,,The University of Arizona,Tucson,United States,,,,,2021-01-04,4 January 2021,Building Decentralized Trust Multidisciplinary Perspectives on the Design of Blockchains and Distributed Ledgers,,21101137198,,Book,,,,35-61,,,3,0,,,,,
2-s2.0-85123865507,10.5007/1518-2924.2021.E82627,,,Public libraries’ contributions to smart cities’ development,ar,Article,De Barros Cianconi R.,,Universidade Federal Fluminense,Niteroi,Brazil,,,,,2021-01-04,4 January 2021,Encontros Bibli,,21101039156,15182924,Journal,26,,,,,,0,1,all publisherfullgold,All Open Access Gold,,,
2-s2.0-85121007645,10.5007/1518-2924.2021.e83369,,,Dimensions of information mediation and its contributionsto the training of the reading mediator: Theoretical and empirical approaches,ar,Article,de Jesus I.P.,,Universidade Federal da Bahia,Salvador,Brazil,,,,,2021-01-04,4 January 2021,Encontros Bibli,,21101039156,15182924,Journal,26,,,,,,0,1,all publisherfullgold,All Open Access Gold,,,
2-s2.0-85120996144,10.5007/1518-2924.2021.e82384,,,60 years of international cataloguing principles: History and development,ar,Article,Braga G.d.R.,,Instituto Brasileiro de Geografia e Estatistica,,Brazil,,,,,2021-01-04,4 January 2021,Encontros Bibli,,21101039156,15182924,Journal,26,,,,,,0,1,all publisherfullgold,All Open Access Gold,,,
2-s2.0-85120799088,10.5007/1518-2924.2021.e79646,,,Open science to the perspective of brazilian specialists: Taxonomy proposal,ar,Article,da Silveira L.,,Universidade Federal do Rio Grande do Sul,Porto Alegre,Brazil,,,,,2021-01-04,4 January 2021,Encontros Bibli,,21101039156,15182924,Journal,26,,,,,,12,1,all publisherfullgold repository repositoryvor repositoryam,All Open Access Gold Green,,,
