eid,doi,pii,pubmed_id,title,subtype,subtypeDescription,creator,afid,affilname,affiliation_city,affiliation_country,author_count,author_names,author_ids,author_afids,coverDate,coverDisplayDate,publicationName,issn,source_id,eIssn,aggregationType,volume,issueIdentifier,article_number,pageRange,description,authkeywords,citedby_count,openaccess,freetoread,freetoreadLabel,fund_acr,fund_no,fund_sponsor
2-s2.0-85118214227,10.15446/innovar.v31n82.98422,,,Healthily crazy business! solidarity economy and financial education as emancipation tools for the mentally ill,ar,Article,Genta Maragni F.T.,,Universidade de São Paulo,Sao Paulo,Brazil,,,,,2021-01-01,2021,Innovar,01215051,11600153630,22486968,Journal,31,82,,203-222,,,2,1,all publisherfullgold,All Open Access Gold,,,
2-s2.0-85118142980,10.1007/978-3-030-80832-7_5,,,Towards a Regional Policy: Transformative Innovation in Colombia,ch,Book Chapter,Rodríguez N.G.,,Universidade Estadual de Campinas,Campinas,Brazil,,,,,2021-01-01,2021,Palgrave Studies in Democracy Innovation and Entrepreneurship for Growth,26623641,21101032313,2662365X,Book Series,,978-3-030-80831-0,,81-104,,,1,0,,,,,
2-s2.0-85117965949,,,,Similarities and differences in the concepts of technique and tactics by handball and beach handball coaches,ar,Article,Di Gilio J.P.T.,,Universidade de São Paulo,Sao Paulo,Brazil,,,,,2021-01-01,2021,E Balonmano Com Revista De Ciencias Del Deporte,,21101044732,18857019,Journal,17,2,,93-102,,,0,0,,,,,
2-s2.0-85117924890,10.1590/S0034-759020210609,,,RETHINKING CITIES IN ORGANIZATIONAL STUDIES: A MULTIDISCIPLINARY APPROACH,re,Review,Costa V.,,Universidade Estadual de Maringá,Maringa,Brazil,,,,,2021-01-01,2021,RAE Revista De Administracao De Empresas,00347590,21100212700,2178938X,Journal,61,6,,1-3,,,0,1,all publisherfullgold repository repositoryam,All Open Access Gold Green,,,
2-s2.0-85117908358,,,,Influence of a strength training program on the motor capacity of beginning basketball players,ar,Article,Camara L.S.,,"Instituto Federal de Educação, Ciência e Tecnologia de Roraima – IFRR",Boa Vista,Brazil,,,,,2021-01-01,2021,E Balonmano Com Revista De Ciencias Del Deporte,,21101044732,18857019,Journal,17,2,,103-110,,,1,0,,,,,
2-s2.0-85117839384,10.1016/B978-0-12-823304-7.00025-8,,,Current knowledge on the health benefits of carotenoids: Focus on the scientific evidence,ch,Book Chapter,Rodriguez-Amaya D.B.,,Universidade Estadual de Campinas,Campinas,Brazil,,,,,2021-01-01,1 January 2021,Global Perspectives on Astaxanthin from Industrial Production to Food Health and Pharmaceutical Applications,,21101084634,,Book,,,,693-717,,,5,0,,,,,
2-s2.0-85117729122,,,,Management accounting practices and contingency factors in paraiban agro-industries,ar,Article,Barreto K.A.,,Universidade Federal da Paraíba,Joao Pessoa,Brazil,,,,,2021-01-01,2021,Custos E Agronegocio,18082882,19700174746,,Journal,17,2,,326-349,,,1,0,,,,,
2-s2.0-85117691470,10.1590/1807-7692bar2021210009,,,Pandemic and innovation in healthcare: The end-to-end innovation adoption model,ar,Article,Guarcello C.,,Universidade Federal do Rio de Janeiro,Rio de Janeiro,Brazil,,,,,2021-01-01,2021,Bar Brazilian Administration Review,,19600157006,18077692,Journal,18,3,e210009,,,,6,1,all publisherfullgold repository repositoryam,All Open Access Gold Green,,,
2-s2.0-85117418600,10.1590/S0034-759020210602X,,,Successful succession: The role of the environment and the succession plan,ar,Article,García G.M.,,Universidad de La Rioja,Logrono,Spain,,,,,2021-01-01,2021,RAE Revista De Administracao De Empresas,00347590,21100212700,2178938X,Journal,61,6,,1-17,,,1,1,all publisherfullgold repository repositoryvor repositoryam,All Open Access Gold Green,,,
2-s2.0-85117374561,10.1590/S0034-759020210604,,,Behavioral combinations that explain collaboration in the supply network,ar,Article,de Cássia Macedo R.,,Universidade Federal de Minas Gerais;Universidade FUMEC;Centro Universitário UNA,Belo Horizonte;Belo Horizonte;Belo Horizonte,Brazil;Brazil;Brazil,,,,,2021-01-01,2021,RAE Revista De Administracao De Empresas,00347590,21100212700,2178938X,Journal,61,6,,1-16,,,1,1,all publisherfullgold repository repositoryvor,All Open Access Gold Green,,,
2-s2.0-85117202281,10.17323/2500-2597.2021.3.66.80,,,Innovation ecosystems in the automotive industry between opportunities and limitations,ar,Article,da Silva R.H.,,Universidade de São Paulo;Polytechnique Montréal,Sao Paulo;Montreal,Brazil;Canada,,,,,2021-01-01,2021,Foresight and Sti Governance,25002597,21100775412,,Journal,15,3,,66-80,,,4,1,all publisherfullgold,All Open Access Gold,,,
2-s2.0-85117194745,10.1080/16258312.2021.1984166,,,Supply chain roles and performance measurement procedures: evidence from Brazilian agribusiness companies,ar,Article,Callado A.A.C.,,Universidade Federal Rural de Pernambuco,Recife,Brazil,,,,,2021-01-01,2021,Supply Chain Forum,16258312,21100299408,16246039,Journal,22,4,,370-380,,,1,1,all publisherhybridgold,All Open Access Hybrid Gold,,,
2-s2.0-85117147922,10.1504/IJPLM.2021.118038,,,Functionality roadmap to define a configuration scope for implementing a PLM system,ar,Article,Vieira D.,,Université du Québec à Trois-Rivières,Trois-Rivieres,Canada,,,,,2021-01-01,2021,International Journal of Product Lifecycle Management,17435110,4000149501,17435129,Journal,13,3,,224-243,,,1,0,,,,,
2-s2.0-85117122192,10.1080/00213624.2021.1948278,,,A Coherentist Defense of Economics as an Interdisciplinary Social Science,ar,Article,Cruz-e-Silva V.,,University Federal of Uberlandia,Uberlandia,Brazil,,,,,2021-01-01,2021,Journal of Economic Issues,00213624,28952,1946326X,Journal,55,3,,820-836,,,0,0,,,,,
2-s2.0-85117100464,10.1080/00213624.2021.1940039,,,The Future of Heterodox Economics: An Institutional Perspective,re,Review,Dequech D.,,Universidade Estadual de Campinas,Campinas,Brazil,,,,,2021-01-01,2021,Journal of Economic Issues,00213624,28952,1946326X,Journal,55,3,,578-583,,,10,0,,,,,
2-s2.0-85116994159,10.1590/1807-7692BAR2021210004,,,Servitization as a strategy for remanufacturing: An experimental study,ar,Article,Tondolo V.A.G.,,Universidade Federal de Pelotas;Fundacao Getulio Vargas,Pelotas;Rio de Janeiro,Brazil;Brazil,,,,,2021-01-01,2021,Bar Brazilian Administration Review,,19600157006,18077692,Journal,18,3,e210004,,,,3,1,all repository repositoryvor repositoryam,All Open Access Green,,,
2-s2.0-85116931494,10.1590/1807-7692BAR2021200036,,,Entrepreneurship and strategy: Analyzing themes from bibliometric studies in the light of the concept of strategic entrepreneurship,ar,Article,Machado H.P.V.,,Universidade do Oeste de Santa Catarina,Joacaba,Brazil,,,,,2021-01-01,2021,Bar Brazilian Administration Review,,19600157006,18077692,Journal,18,3,e200036,,,,4,1,all repository repositoryvor repositoryam,All Open Access Green,,,
2-s2.0-85116889423,10.1590/1807-7692BAR2021200126,,,Does ecological sustainability really matter? Evaluation of its mediating role in the relationship between innovation and competitiveness,ar,Article,Jacomossi R.R.,,Centro Universitario da FEI,Sao Paulo,Brazil,,,,,2021-01-01,2021,Bar Brazilian Administration Review,,19600157006,18077692,Journal,18,3,e200126,,,,11,1,all repository repositoryvor repositoryam,All Open Access Green,,,
2-s2.0-85116484545,10.1108/RMJ-11-2020-0039,,,Climate change and web archives: an Ibero-American study based on the Portuguese and Brazilian contexts,ar,Article,Rockembach M.,,Universidade Federal do Rio Grande do Sul,Porto Alegre,Brazil,,,,,2021-01-01,2021,Records Management Journal,09565698,144979,,Journal,31,3,,222-239,,,3,0,,,,,
2-s2.0-85116276545,10.5947/jeod.2021.005,,,"Ciriec world conference in latin america: Social and solidarity economy as an inclusive, sustainable and resilient development model in a post-covid-19 world",cp,Conference Paper,MORAIS L.P.,,"Universidade Estadual Paulista ""Júlio de Mesquita Filho""",Sao Paulo,Brazil,,,,,2021-01-01,2021,Journal of Entrepreneurial and Organizational Diversity,,21101060495,22818642,Journal,10,1,,84-87,,,0,1,all publisherfree2read,All Open Access Bronze,,,
2-s2.0-85116067519,10.1504/IJLSM.2021.117687,,,A multiple ant colony system with random variable neighbourhood descent for the vehicle routing problem with time windows,ar,Article,Silva O.S.,,Instituto Militar de Engenharia,Rio de Janeiro,Brazil,,,,,2021-01-01,2021,International Journal of Logistics Systems and Management,17427967,4700151504,17427975,Journal,40,1,,52-69,,,5,0,,,,,
2-s2.0-85116031466,10.1504/IJTPM.2021.117777,,,Critical factors of innovation in Brazilian firms,ar,Article,de Amorim Carvalho J.C.,,Unidade de Ensino Superior Dom Bosco,Sao Luis,Brazil,,,,,2021-01-01,2021,International Journal of Technology Policy and Management,14684322,12764,17415292,Journal,21,3,,177-194,,,1,0,,,,,
2-s2.0-85115693932,10.1080/10978526.2021.1976652,,,Mapping the Key Stakeholders toward Supply Chain Sustainability: Evidence from the Brazilian Beef Supply Chains,ar,Article,Ferreira Alves A.P.,,"Instituto Federal de Educação, Ciȇncia e Tecnologia do Rio Grande do Sul",Bento Goncalves,Brazil,,,,,2021-01-01,2021,Latin American Business Review,10978526,4700152760,15286932,Journal,22,4,,423-454,,,4,0,,,,,
2-s2.0-85115645266,10.3127/ajis.v25i0.3223,,,“Humanized Robots”: A Proposition of Categories to Understand Virtual Influencers,ar,Article,da Silva Oliveira A.B.,,Universidade Federal do Rio de Janeiro,Rio de Janeiro,Brazil,,,,,2021-01-01,2021,Australasian Journal of Information Systems,14498618,21100204505,,Journal,25,,,1-27,,,128,1,all publisherfullgold,All Open Access Gold,,,
2-s2.0-85115616569,10.3127/ajis.v25i0.3141,,,Information Technology Governance and the Individual's Behavior: A cross-sectional study,ar,Article,Fernandes P.,,Iscte – Instituto Universitário de Lisboa,Lisbon,Portugal,,,,,2021-01-01,2021,Australasian Journal of Information Systems,14498618,21100204505,,Journal,25,,,1-25,,,5,1,all publisherfullgold repository repositoryvor,All Open Access Gold Green,,,
2-s2.0-85115424950,10.1504/IJSOM.2021.117642,,,"Relationship between service quality, consumer values, satisfaction and loyalty: An empirical study of a shopping mall",ar,Article,Campos D.F.,,Universidade Potiguar,Natal,Brazil,,,,,2021-01-01,2021,International Journal of Services and Operations Management,17442370,4000148902,17442389,Journal,39,4,,541-562,,,3,0,,,,,
2-s2.0-85115419819,10.1504/IJGSB.2021.117677,,,Determinants of credit access of small and medium enterprises in emerging economies: Evidence from the World Bank enterprise surveys,re,Review,dos Santos M.A.,,Universidade de Marilia,Marilia,Brazil,,,,,2021-01-01,2021,International Journal of Globalisation and Small Business,14793059,4700152236,14793067,Journal,12,3,,266-298,,,4,0,,,,,
2-s2.0-85115325635,10.15728/BBR.2021.18.5.5,,,The impact of academic titles of board member and directors over the performance of companies traded at B3,ar,Article,Perlin M.,,Universidade Federal do Rio Grande do Sul,Porto Alegre,Brazil,,,,,2021-01-01,2021,Brazilian Business Review,,21100894527,18082386,Journal,18,5,,561-584,,,3,1,all publisherfullgold,All Open Access Gold,,,
2-s2.0-85115316091,10.15728/BBR.2021.18.5.3,,,Perceived value of organizational foresight processes: Effects of the illusion of control and individual foresight,ar,Article,Borges N.,,Universidade Federal do Rio Grande do Sul,Porto Alegre,Brazil,,,,,2021-01-01,2021,Brazilian Business Review,,21100894527,18082386,Journal,18,5,,516-535,,,1,0,,,,,
2-s2.0-85115312139,10.15728/BBR.2021.18.5.6,,,Are altruists environmentally responsible and materialists environmentally irresponsible? An analysis on the moderation of social desirability and mediation of environmental awareness,re,Review,Costa T.,,Universidade Nove de Julho,Sao Paulo,Brazil,,,,,2021-01-01,2021,Brazilian Business Review,,21100894527,18082386,Journal,18,5,,585-604,,,4,1,all publisherfullgold,All Open Access Gold,,,
2-s2.0-85115306899,10.15728/BBR.2021.18.5.2,,,"Routines, generative systems analyzed as a function based on time and innovation",ar,Article,da Costa Júnior J.C.,,Universidade Federal de Pernambuco,Recife,Brazil,,,,,2021-01-01,2021,Brazilian Business Review,,21100894527,18082386,Journal,18,5,,490-515,,,3,1,all publisherfullgold,All Open Access Gold,,,
2-s2.0-85115291428,10.15728/BBR.2021.18.5.4,,,The effect of absorptive capacity on the financial performance of Brazilian and Portuguese companies in a low technological intensity sector,ar,Article,Laviniki J.,,ATITUS Educação,Passo Fundo,Brazil,,,,,2021-01-01,2021,Brazilian Business Review,,21100894527,18082386,Journal,18,5,,537-560,,,6,1,all publisherfullgold,All Open Access Gold,,,
2-s2.0-85115289010,10.15728/BBR.2021.18.5.1,,,The personal values of small-business entrepreneurs: Evidence from Brazil,ar,Article,Lima D.,,Universidade Municipal de Sao Caetano do Sul,Sao Caetano do Sul,Brazil,,,,,2021-01-01,2021,Brazilian Business Review,,21100894527,18082386,Journal,18,5,,468-489,,,2,1,all publisherfullgold repository repositoryvor,All Open Access Gold Green,,,
2-s2.0-85115105023,10.1108/JMTM-10-2021-501,,,Guest editorialRethinking international manufacturing in times of global turbulence,ar,Article,Cheng Y.,,Aalborg University;Jiangxi University of Finance and Economics,Aalborg;Nanchang,Denmark;China,,,,,2021-01-01,2021,Journal of Manufacturing Technology Management,1741038X,18644,,Journal,32,6,,1113-1120,,,5,1,all publisherfree2read repository repositoryam,All Open Access Bronze Green,,,
2-s2.0-85115061738,10.18461/ijfsd.v12i2.88,,,Food Retail as the Coordinator Agent of Food Supply Chain: Challenges and Opportunities for Reducing Loss and Waste,ar,Article,Lemos F.K.,,Universidade Ibirapuera,Sao Paulo,Brazil,,,,,2021-01-01,2021,International Journal on Food System Dynamics,,21100456788,18696945,Journal,12,3,,246-254,,,4,0,,,,,
2-s2.0-85115038964,10.3233/SJI-210842,,,"EmpoderaData: Sharing a successful work-placement data skills training model within Latin America, to develop capacity to deliver the SDGs",ar,Article,Carter J.,,The University of Manchester,Manchester,United Kingdom,,,,,2021-01-01,2021,Statistical Journal of the Iaos,18747655,14500154708,,Journal,37,3,,1009-1021,,,5,1,all publisherhybridgold,All Open Access Hybrid Gold,,,
2-s2.0-85114819106,10.1080/00207543.2021.1970845,,,World Class Manufacturing performance measurement using a maturity model and the FlowSort method,ar,Article,de Andrade C.T.A.,,Universidade Federal de Pernambuco,Recife,Brazil,,,,,2021-01-01,2021,International Journal of Production Research,00207543,27656,1366588X,Journal,59,24,,7374-7389,,,14,0,,,,,
2-s2.0-85114752326,10.1590/S0034-759020210507,,,Food Waste: Evidence From A University Dining Hall In Brazil,ar,Article,Deliberador L.R.,,Universidade Federal de São Carlos,Sao Carlos,Brazil,,,,,2021-01-01,2021,RAE Revista De Administracao De Empresas,00347590,21100212700,2178938X,Journal,61,5,,1-17,,,6,0,,,,,
2-s2.0-85114746284,10.1590/S0034-759020210502,,,FOOD WASTE: CHALLENGES AND OPPORTUNITIES IN SUSTAINABLE OPERATIONS,ar,Article,Vieira L.M.,,Fundacao Getulio Vargas,Rio de Janeiro,Brazil,,,,,2021-01-01,2021,RAE Revista De Administracao De Empresas,00347590,21100212700,2178938X,Journal,61,5,,1-4,,,4,1,all publisherfullgold repository repositoryvor repositoryam,All Open Access Gold Green,,,
2-s2.0-85114717388,10.1590/S0034-759020210508,,,The Sharing Economy In Practice: An Exploratory Study Of The Acceptance And Use Of Digital Platforms In Food Waste Reduction,ar,Article,Moltene L.,,Fundacao Getulio Vargas,Rio de Janeiro,Brazil,,,,,2021-01-01,2021,RAE Revista De Administracao De Empresas,00347590,21100212700,2178938X,Journal,61,5,,1-20,,,12,0,,,,,
2-s2.0-85114647399,10.1504/WREMSD.2021.117444,,,Achieving sustainable value chains by adopting sustainable development goals: A mapping exercise,ar,Article,Lourenção M.,,Universidade de São Paulo,Sao Paulo,Brazil,,,,,2021-01-01,2021,World Review of Entrepreneurship Management and Sustainable Development,17460573,5400152653,17460581,Journal,17,5,,599-623,,,3,0,,,,,
2-s2.0-85114627952,10.1080/00207543.2021.1963875,,,Integrated approaches for logistics network planning: a systematic literature review,re,Review,Jalal A.M.,,Universidade Federal de São Carlos,Sao Carlos,Brazil,,,,,2021-01-01,2021,International Journal of Production Research,00207543,27656,1366588X,Journal,,,,,,,19,0,,,,,
2-s2.0-85114477363,10.1590/1806-9649-2021V28E5676,,,Dynamic method to identify and analyze waste by making-do in construction sites,ar,Article,Do Amaral T.G.,,Universidade Federal de Goiás,Goiania,Brazil,,,,,2021-01-01,2021,Gestao E Producao,0104530X,4700152225,18069649,Journal,28,3,e5676,,,,1,1,all publisherfullgold repository repositoryvor,All Open Access Gold Green,,,
2-s2.0-85114470865,,,,"Environmentally responsible behaviour, place authenticity and openness to experience for community-based tourism (CBT) destinations",ar,Article,da Silva T.P.G.,,Universidade Federal de Pernambuco,Recife,Brazil,,,,,2021-01-01,2021,International Journal of Tourism Policy,17504090,19700173309,17504104,Journal,11,2,,93-116,,,0,0,,,,,
2-s2.0-85114444854,10.1590/S0034-759020210509,,,Methodological Approaches To Tackling Food Waste: Moving The Agenda Forward,ar,Article,Vieira L.M.,,Fundacao Getulio Vargas,Rio de Janeiro,Brazil,,,,,2021-01-01,2021,RAE Revista De Administracao De Empresas,00347590,21100212700,2178938X,Journal,61,5,,1-7,,,6,1,all publisherfullgold repository repositoryvor repositoryam,All Open Access Gold Green,,,
2-s2.0-85114438559,10.1590/S0034-759020210505x,,,Food Waste And Performance Measurement Systems: A Systematic Review Of The Literature,ar,Article,Santos P.H.A.,,Universidade Federal de São Carlos,Sao Carlos,Brazil,,,,,2021-01-01,2021,RAE Revista De Administracao De Empresas,00347590,21100212700,2178938X,Journal,61,5,,1-24,,,4,0,,,,,
2-s2.0-85114396946,10.1007/978-981-33-6808-8_1,,,Sustainable Buildings and Biodiversity: A Critical Analysis,ch,Book Chapter,Pimentel D.,,Universidade Federal Fluminense,Niteroi,Brazil,,,,,2021-01-01,2021,Accounting Finance Sustainability Governance and Fraud,25097873,21101021168,25097881,Book Series,,,,3-15,,,0,0,,,,,
2-s2.0-85114377190,10.1590/S0034-759020210504,,,"PROCRASTINATION, CONTROL AND PERCEIVED EFFORT IN FOOD WASTE BEHAVIOR",ar,Article,da Costa M.F.,,Universidade Federal de Pernambuco,Recife,Brazil,,,,,2021-01-01,2021,RAE Revista De Administracao De Empresas,00347590,21100212700,2178938X,Journal,61,5,,1-19,,,1,1,all publisherfullgold repository repositoryvor repositoryam,All Open Access Gold Green,,,
2-s2.0-85114340937,10.1504/ijmp.2021.10038971,,,The role of institutional pressure in knowledge internalisation: A longitudinal case,ar,Article,De Castro J.M.,,Pontificia Universidade Catolica de Minas Gerais,Belo Horizonte,Brazil,,,,,2021-01-01,2021,International Journal of Management Practice,14779064,4700153105,17418143,Journal,14,5,,561-579,,,2,0,,,,,
2-s2.0-85114333520,10.13052/jicts2245-800X.929,,,Intent-driven closed loops for autonomous networks,ar,Article,Gomes P.H.,,Telefonaktiebolaget LM Ericsson,Stockholm,Sweden,,,,,2021-01-01,2021,Journal of ICT Standardization,2245800X,21100936589,22460853,Journal,9,2,,257-290,,,27,1,all publisherfree2read,All Open Access Bronze,,,
2-s2.0-85114247521,10.13052/jicts2245-800X.923,,,End-to-end service monitoring for Zero-touch networks,ar,Article,Saraiva de Sousa N.F.,,Universidade Estadual de Campinas,Campinas,Brazil,,,,,2021-01-01,2021,Journal of ICT Standardization,2245800X,21100936589,22460853,Journal,9,2,,91-112,,,11,1,all publisherfullgold,All Open Access Gold,,,
2-s2.0-85114234194,,,,Value drivers in product-service systems: An empirical study of two sharing business models,cp,Conference Paper,Moro S.R.,,Universidade Federal de Santa Catarina,Florianopolis,Brazil,,,,,2021-01-01,2021,Proceedings of the International Conference on Industrial Engineering and Operations Management,,21100810604,21698767,Conference Proceeding,,,,2030-2040,,,1,0,,,,,
2-s2.0-85114230009,,,,Productive arrangement for strengthening local microeconomics through school feeding,cp,Conference Paper,Estender A.C.,,Universidade Paulista,Sao Paulo,Brazil,,,,,2021-01-01,2021,Proceedings of the International Conference on Industrial Engineering and Operations Management,,21100810604,21698767,Conference Proceeding,,,,5836-5838,,,0,0,,,,,
2-s2.0-85114158460,10.18089/tms.2021.170303,,,The impact of customer involvement in airline loyalty programs: A multi-group analysis,ar,Article,Limberger P.F.,,Universidade do Vale do Itajai,Itajai,Brazil,,,,,2021-01-01,2021,Tourism and Management Studies,21828458,21101041553,21828466,Journal,17,3,,37-49,,,9,1,all publisherfullgold repository repositoryam,All Open Access Gold Green,,,
2-s2.0-85114000537,10.1590/1678-6971/ERAMR210083,,,"Absorptive capacity, innovation, and external sources of knowledge: The Brazilian power sector",re,Review,Versiani Â.F.,,Pontificia Universidade Catolica de Minas Gerais,Belo Horizonte,Brazil,,,,,2021-01-01,2021,Revista De Administracao Mackenzie,15186776,21100896892,16786971,Journal,22,5,eRAMR210083,,,,4,1,all repository repositoryvor repositoryam,All Open Access Green,,,
2-s2.0-85113954578,10.1177/09721509211036798,,,Do Market Conditions Affect the Tracking Efficiency of Exchange-traded Funds? Evidence from Developed and Emerging Markets,ar,Article,Neto A.F.d.C.,,Pontifícia Universidade Católica do Rio de Janeiro,Rio de Janeiro,Brazil,,,,,2021-01-01,2021,Global Business Review,09721509,17600154910,09730664,Journal,,,,,,,3,0,,,,,
2-s2.0-85113848611,10.1504/IJPQM.2021.117251,,,Statistical thinking and techniques: Use and benefits in manufacturing companies,ar,Article,De Toledo J.C.,,Universidade Federal de São Carlos,Sao Carlos,Brazil,,,,,2021-01-01,2021,International Journal of Productivity and Quality Management,17466474,5700165165,17466482,Journal,33,4,,471-492,,,4,0,,,,,
2-s2.0-85113779696,10.1504/IJISM.2021.117238,,,Pressures driving the adoption of green practices,ar,Article,Franco D.,,Universidade Federal de Mato Grosso do Sul,Campo Grande,Brazil,,,,,2021-01-01,2021,International Journal of Integrated Supply Management,14775360,3900148211,17418097,Journal,14,3,,249-270,,,7,0,,,,,
2-s2.0-85113713886,10.1080/08956308.2021.1947605,,,"Boosting Radical Innovation Using Ambidextrous Portfolio Management: To manage radical innovation effectively, companies can build ambidextrous portfolio management systems and adopt a multilevel organizational approach.",ar,Article,Brasil V.C.,,Universidade de São Paulo;Leonard N. Stern School of Business,Sao Paulo;New York,Brazil;United States,,,,,2021-01-01,2021,Research Technology Management,08956308,22949,19300166,Journal,64,5,,39-49,,,19,0,,,,,
2-s2.0-85113662093,10.1108/JHTT-06-2020-0143,,,The effect of online reviews on restaurant visit intentions: applying signaling and involvement theories,ar,Article,Aureliano-Silva L.,,Escola Superior de Propaganda e Marketing,Rio de Janeiro,Brazil,,,,,2021-01-01,2021,Journal of Hospitality and Tourism Technology,17579880,21100220156,17579899,Journal,12,4,,672-688,,,46,0,,,,,
2-s2.0-85113579302,10.5007/1518-2924.2021.e80155,,,"Datasets for scientometric research: Retrieving qualis, sjr, snip from the web of data",ar,Article,Rautenberg S.,,Universidade Estadual do Centro Oeste,Guarapuava,Brazil,,,,,2021-01-01,2021,Encontros Bibli,,21101039156,15182924,Journal,26,,,,,,0,1,all publisherfullgold,All Open Access Gold,,,
2-s2.0-85113566805,10.5007/1518-2924.2021.e79534,,,"Biblio saúde oer repository: Contribution to socialization of knowledge and practices by and among health sciences librarians, and dialogues with kolb's theory of learning by experience",ar,Article,Da Silva Prudencio D.,,Universidade Federal do Estado do Rio de Janeiro,Rio de Janeiro,Brazil,,,,,2021-01-01,2021,Encontros Bibli,,21101039156,15182924,Journal,26,,,,,,0,1,all publisherfullgold,All Open Access Gold,,,
2-s2.0-85113558199,10.5007/1518-2924.2021.e78697,,,Transparency and access to information: An analysis of the demand for tax information in brazil's federal revenue,ar,Article,Grigoleto M.C.,,Universidade Federal do Espírito Santo,Vitoria,Brazil,,,,,2021-01-01,2021,Encontros Bibli,,21101039156,15182924,Journal,26,,,,,,0,1,all publisherfullgold,All Open Access Gold,,,
2-s2.0-85113557819,10.5007/1518-2924.2021.e79506,,,Open peer review: An analysis of scientific journals indexed in the directory of open access journals,ar,Article,De Andrade Maia F.C.,,Universidade Federal do Ceará,Fortaleza,Brazil,,,,,2021-01-01,2021,Encontros Bibli,,21101039156,15182924,Journal,26,,,,,,2,1,all publisherfullgold,All Open Access Gold,,,
2-s2.0-85113460255,10.5007/1518-2924.2021.e79913,,,Tattoo as a document and biometric element for human identification,ar,Article,Reis P.,,Universidade Federal da Bahia,Salvador,Brazil,,,,,2021-01-01,2021,Encontros Bibli,,21101039156,15182924,Journal,26,,,,,,0,1,all publisherfullgold,All Open Access Gold,,,
2-s2.0-85113411061,10.3727/154427321X16201192810523,,,Generation z and non-generation z as potential sea cruisers,ar,Article,Tavares J.M.,,Pontificia Universidade Catolica de Minas Gerais,Belo Horizonte,Brazil,,,,,2021-01-01,2021,Tourism in Marine Environments,1544273X,5800173391,,Journal,16,2,,113-124,,,2,0,,,,,
2-s2.0-85113322739,10.1504/ijbidm.2021.117111,,,Performance evaluation of outlier rules for labelling outliers in multidimensional dataset,ar,Article,Da Silva K.C.R.,,Universidade de São Paulo,Sao Paulo,Brazil,,,,,2021-01-01,2021,International Journal of Business Intelligence and Data Mining,17438187,4100151706,17438195,Journal,19,2,,135-152,,,0,0,,,,,
2-s2.0-85113190703,10.1590/1806-9649-2021V28E5120,,,"Economic, social and environmental aspects of the sustainability of a construction waste recycling plant",ar,Article,Brum E.M.,,Universidade de Passo Fundo,Passo Fundo,Brazil,,,,,2021-01-01,2021,Gestao E Producao,0104530X,4700152225,18069649,Journal,28,3,e1520,,,,7,1,all publisherfullgold repository repositoryvor,All Open Access Gold Green,,,
