eid,doi,pii,pubmed_id,title,subtype,subtypeDescription,creator,afid,affilname,affiliation_city,affiliation_country,author_count,author_names,author_ids,author_afids,coverDate,coverDisplayDate,publicationName,issn,source_id,eIssn,aggregationType,volume,issueIdentifier,article_number,pageRange,description,authkeywords,citedby_count,openaccess,freetoread,freetoreadLabel,fund_acr,fund_no,fund_sponsor
2-s2.0-85096012184,10.1007/s00418-020-01937-y,,33175185,Immunocytochemical assessment of cell differentiation of podoplanin-positive osteoblasts into osteocytes in murine bone,ar,Article,Nagai T.,,Hokkaido University,Sapporo,Japan,,,,,2021-03-01,March 2021,Histochemistry and Cell Biology,09486143,18548,1432119X,Journal,155,3,,369-380,,,10,0,,,,,
2-s2.0-85095460415,10.1055/a-1263-0898,,33075830,Metabolic Syndrome Pathophysiology and Predisposing Factors,ar,Article,Bovolini A.,,Universidade do Porto,Porto,Portugal,,,,,2021-03-01,1 March 2021,International Journal of Sports Medicine,01724622,19864,14393964,Journal,42,3,,199-214,,,257,0,,,,,
2-s2.0-85094978502,10.1136/bjsports-2020-102330,,32796018,Infographic. Effects of exercise in patients with fibromyalgia: An umbrella review,no,Note,Andrade A.,,Universidade do Estado de Santa Catarina,Florianopolis,Brazil,,,,,2021-03-01,1 March 2021,British Journal of Sports Medicine,03063674,19817,14730480,Journal,55,5,,279-280,,,4,0,,,,,
2-s2.0-85094956560,10.1177/0269215520966694,,33143438,Surgery is no more effective than conservative treatment for Femoroacetabular impingement syndrome: Systematic review and meta-analysis of randomized controlled trials,ar,Article,Bastos R.M.,,Universidade do Vale do Paraiba;Trata Institute,Sao Jose dos Campos;Sao Jose dos Campos,Brazil;Brazil,,,,,2021-03-01,March 2021,Clinical Rehabilitation,02692155,16317,14770873,Journal,35,3,,332-341,,,25,0,,,,,
2-s2.0-85094956199,10.1177/0962280220964953,,33146585,Random changepoint segmented regression with smooth transition,ar,Article,Singer J.M.,,Universidade de São Paulo,Sao Paulo,Brazil,,,,,2021-03-01,March 2021,Statistical Methods in Medical Research,09622802,14231,14770334,Journal,30,3,,643-654,,,0,0,,,,,
2-s2.0-85094944812,10.1177/0269215520967940,,33143436,Letter to the editor concerning the article: Scapular exercise combined with cognitive functional therapy is more effective at reducing chronic neck pain and kinesiophobia than scapular exercise alone: A randomized controlled trial,le,Letter,Castro J.,,Centro Universitário Augusto Motta (UNISUAM),Rio de Janeiro,Brazil,,,,,2021-03-01,March 2021,Clinical Rehabilitation,02692155,16317,14770873,Journal,35,3,,459-461,,,1,0,,,,,
2-s2.0-85094871213,10.1055/a-1263-1185,,33063309,Effect of Protein and Carbohydrate Combined with Resistance Training on Muscular Adaptation,ar,Article,Santos P.C.,,"Universidade Estadual Paulista ""Júlio de Mesquita Filho""",Sao Paulo,Brazil,,,,,2021-03-01,1 March 2021,International Journal of Sports Medicine,01724622,19864,14393964,Journal,42,3,,259-263,,,1,0,,,,,
2-s2.0-85093972953,10.1055/a-1263-1124,,33053597,Blood pressure response to muscle metaboreflex activation is impaired in men living with HIV,ar,Article,Gama G.,,Universidade Federal do Estado do Rio de Janeiro,Rio de Janeiro,Brazil,,,,,2021-03-01,1 March 2021,International Journal of Sports Medicine,01724622,19864,14393964,Journal,42,3,,246-252,,,3,0,,,,,
2-s2.0-85093917540,10.1016/j.apmr.2020.08.020,S0003999320309667,33035513,Interrater Reliability Across 7 Established Risk Stratification Protocols in Cardiac Rehabilitation,ar,Article,Ramos Haddad Garcia M.I.,,"Universidade Estadual Paulista ""Júlio de Mesquita Filho""",Sao Paulo,Brazil,,,,,2021-03-01,March 2021,Archives of Physical Medicine and Rehabilitation,00039993,16270,1532821X,Journal,102,3,,470-479,,,3,0,,,,,
2-s2.0-85092654907,10.1055/a-1231-5410,,32947637,Biomarkers and Redox Balance in Aging Rats after Dynamic and Isometric Resistance Training,ar,Article,Neves R.V.P.,,Universidade Católica de Brasília,Brasilia,Brazil,,,,,2021-03-01,1 March 2021,International Journal of Sports Medicine,01724622,19864,14393964,Journal,42,3,,283-290,,,1,0,,,,,
2-s2.0-85091466874,10.1002/jemt.23605,,32978851,"Morphological, optical, and elemental analysis of dental enamel after debonding laminate veneer with Er,Cr:YSGG laser: A pilot study",ar,Article,Zanini N.A.,,"Instituto de Pesquisas Energeticas e Nucleares, Sao Paulo",Sao Paulo,Brazil,,,,,2021-03-01,March 2021,Microscopy Research and Technique,1059910X,20920,10970029,Journal,84,3,,489-498,,,9,0,,,,,
2-s2.0-85091201664,10.1002/jemt.23601,,32959456,Pollen morphology and viability of Tillandsia (Bromeliaceae) species by light microscopy and scanning electron microscopy,ar,Article,de Oliveira Souza S.,,Universidade Federal do Reconcavo da Bahia,Cruz das Almas,Brazil,,,,,2021-03-01,March 2021,Microscopy Research and Technique,1059910X,20920,10970029,Journal,84,3,,441-459,,,18,0,,,,,
2-s2.0-85091146660,10.1007/s00261-020-02766-2,,32949272,Abdominal and pelvic 18F-FDG PET/MR: a review of current and emerging oncologic applications,re,Review,Ward R.D.,,Cleveland Clinic Foundation,Cleveland,United States,,,,,2021-03-01,March 2021,Abdominal Radiology,2366004X,21100454916,23660058,Journal,46,3,,1236-1248,,,7,0,,,,,
2-s2.0-85089823687,10.1016/j.bjpt.2020.08.001,S1413355520300149,32855073,Scapular movement training versus standardized exercises for individuals with chronic shoulder pain: protocol for a randomized controlled trial,ar,Article,Kamonseki D.H.,,Universidade Federal de São Carlos,Sao Carlos,Brazil,,,,,2021-03-01,1 March 2021,Brazilian Journal of Physical Therapy,14133555,10800153305,18099246,Journal,25,2,,221-229,,,19,2,all repository repositoryvor,All Open Access Green,,,
2-s2.0-85089297065,10.1016/j.bjpt.2020.07.009,S1413355520305505,32798201,Strategies for a safe and assertive telerehabilitation practice,ed,Editorial,Fioratti I.,,"Universidade Cidade de São Paulo;Centre for Pain, Health and Lifestyle",Sao Paulo;,Brazil;Brazil,,,,,2021-03-01,1 March 2021,Brazilian Journal of Physical Therapy,14133555,10800153305,18099246,Journal,25,2,,113-116,,,33,2,all repository repositoryvor,All Open Access Green,,,
2-s2.0-85087033887,10.1016/j.bjpt.2020.05.010,S1413355519306185,32605886,Current physical therapy care of patients undergoing breast reconstruction for breast cancer: a survey of practice in the United Kingdom and Brazil,ar,Article,Mazuquin B.,,Warwick Medical School,Coventry,United Kingdom,,,,,2021-03-01,1 March 2021,Brazilian Journal of Physical Therapy,14133555,10800153305,18099246,Journal,25,2,,175-185,,,6,2,all repository repositoryam,All Open Access Green,,,
2-s2.0-85086699373,10.1016/j.bjpt.2020.05.008,S1413355519307142,32586617,Construct and criterion validity of the functional gait assessment—Brazil in community-dwelling older adults,ar,Article,Marques L.B.F.,,Universidade Federal de Minas Gerais,Belo Horizonte,Brazil,,,,,2021-03-01,1 March 2021,Brazilian Journal of Physical Therapy,14133555,10800153305,18099246,Journal,25,2,,186-193,,,18,2,all repository repositoryvor,All Open Access Green,,,
2-s2.0-85086568904,10.1016/j.bjpt.2020.05.007,S1413355519304459,32540329,Association between sensory processing and activity performance in children with cerebral palsy levels I-II on the gross motor function classification system,ar,Article,Pavão S.L.,,Universidade Federal do Parana;Universidade Federal de São Carlos,Curitiba;Sao Carlos,Brazil;Brazil,,,,,2021-03-01,1 March 2021,Brazilian Journal of Physical Therapy,14133555,10800153305,18099246,Journal,25,2,,194-202,,,18,0,,,,,
2-s2.0-85086515317,10.1016/j.bjpt.2020.05.011,S1413355519303223,32563664,Is pelvic floor muscle strength and thickness associated with pelvic organ prolapse in Nepali women? – A cross-sectional study,ar,Article,Caagbay D.,,The University of Sydney,Sydney,Australia,,,,,2021-03-01,1 March 2021,Brazilian Journal of Physical Therapy,14133555,10800153305,18099246,Journal,25,2,,214-220,,,6,2,all repository repositoryvor,All Open Access Green,,,
2-s2.0-85085592588,10.1016/j.bjpt.2020.05.004,S1413355519307129,32487449,Analysis of the measurement properties of the Brazilian-Portuguese version of the Tampa Scale for Kinesiophobia-11 in patients with fibromyalgia,ar,Article,Salvador E.M.E.S.,,Universidade Cidade de São Paulo,Sao Paulo,Brazil,,,,,2021-03-01,1 March 2021,Brazilian Journal of Physical Therapy,14133555,10800153305,18099246,Journal,25,2,,168-174,,,18,2,all repository repositoryvor,All Open Access Green,,,
2-s2.0-85085350284,10.1016/j.bjpt.2020.05.002,S141335551930320X,32475778,Impaired performance of women with patellofemoral pain during functional tests,ar,Article,Zamboti C.L.,,Universidade Estadual de Londrina,Londrina,Brazil,,,,,2021-03-01,1 March 2021,Brazilian Journal of Physical Therapy,14133555,10800153305,18099246,Journal,25,2,,156-161,,,7,2,all repository repositoryvor,All Open Access Green,,,
2-s2.0-85083722534,10.1016/j.physio.2020.03.002,S0031940620300249,32349866,What is the best clinical assessment tool for identification of adults aged ≥80 years at high risk of falls?,ar,Article,Magnani P.E.,,Universidade de São Paulo,Sao Paulo,Brazil,,,,,2021-03-01,March 2021,Physiotherapy United Kingdom,00319406,16938,18731465,Journal,110,,,63-69,,,7,0,,,,,
2-s2.0-85082810170,10.1016/j.bjpt.2020.03.002,S1413355519303090,32276877,Resistance training decreases matrix metalloproteinase-2 activity in quadriceps tendon in a rat model of osteoarthritis,ar,Article,Vasilceac F.A.,,Universidade Federal de São Carlos,Sao Carlos,Brazil,,,,,2021-03-01,1 March 2021,Brazilian Journal of Physical Therapy,14133555,10800153305,18099246,Journal,25,2,,147-155,,,12,0,,,,,
2-s2.0-85079128624,10.1136/bjsports-2019-101812,,32024645,Letter in response to: 'Which specific modes of exercise training are most effective for treating low back pain? Network meta-analysis' by Owen et al,no,Note,Maher C.G.,,The University of Sydney School of Public Health,Sydney,Australia,,,,,2021-03-01,1 March 2021,British Journal of Sports Medicine,03063674,19817,14730480,Journal,55,5,,285-286,,,3,0,,,,,
2-s2.0-85078098972,10.1177/0023830919898886,,31957542,The Role of the Auditory and Visual Modalities in the Perceptual Identification of Brazilian Portuguese Statements and Echo Questions,ar,Article,Miranda L.,,Universidade Federal do Rio de Janeiro,Rio de Janeiro,Brazil,,,,,2021-03-01,March 2021,Language and Speech,00238309,23108,17566053,Journal,64,1,,3-23,,,13,2,all repository repositoryam,All Open Access Green,,,
2-s2.0-85075440592,10.1016/j.jvoice.2019.08.030,S0892199719300396,31706691,Risk Factors for Recurrent Perceived Voice Disorders in Elementary School Teachers—A Longitudinal Study,ar,Article,da Rocha L.M.,,Universidade Catolica de Pelotas,Pelotas,Brazil,,,,,2021-03-01,March 2021,Journal of Voice,08921997,13783,18734588,Journal,35,2,,325-325.e27,,,10,0,,,,,
2-s2.0-85074517230,10.1016/j.jvoice.2019.08.018,S0892199719302978,31679924,Aerodynamic Vocal Measurements in Female Teachers: Finger Kazoo Intensive Short-Term Vocal Therapy,ar,Article,Christmann M.K.,,Universidade do Vale do Itajai;Associação Educacional Luterana Bom Jesus,Itajai;Joinville,Brazil;Brazil,,,,,2021-03-01,March 2021,Journal of Voice,08921997,13783,18734588,Journal,35,2,,259-270,,,11,0,,,,,
2-s2.0-85074105114,10.1519/JSC.0000000000002722,,29979273,"Comparison of Isolated Lumbar Extension Strength in Competitive and Noncompetitive Powerlifters, and Recreationally Trained Men",ar,Article,Androulakis-Korakakis P.,,Southampton Solent University,Southampton,United Kingdom,,,,,2021-03-01,1 March 2021,Journal of Strength and Conditioning Research,10648011,19889,15334287,Journal,35,3,,652-658,,,2,2,all repository repositoryam,All Open Access Green,,,
2-s2.0-85073820033,10.1016/j.jvoice.2019.09.012,S0892199719303340,31648859,Vocal Characteristics of Patients With Morbid Obesity,ar,Article,Bosso J.R.,,"Universidade Estadual Paulista ""Júlio de Mesquita Filho""",Sao Paulo,Brazil,,,,,2021-03-01,March 2021,Journal of Voice,08921997,13783,18734588,Journal,35,2,,329-329.e11,,,10,0,,,,,
2-s2.0-85073519111,10.1016/j.jvoice.2019.08.024,S0892199719302693,31623947,Vocal and Laryngeal Symptoms and Associated Factors in Wind Instrumentalists: A Systematic Review,ar,Article,de Lima Silva C.R.,,Universidade Federal do Rio Grande do Norte,Natal,Brazil,,,,,2021-03-01,March 2021,Journal of Voice,08921997,13783,18734588,Journal,35,2,,284-290,,,4,0,,,,,
2-s2.0-85072703899,10.1016/j.jvoice.2019.08.004,S0892199719302851,31575435,"Fundamental Voice Frequency: Acoustic, Electroglottographic, and Accelerometer Measurement in Individuals With and Without Vocal Alteration",ar,Article,Cristina Oliveira R.,,Universidade Federal de Minas Gerais,Belo Horizonte,Brazil,,,,,2021-03-01,March 2021,Journal of Voice,08921997,13783,18734588,Journal,35,2,,174-180,,,16,0,,,,,
2-s2.0-85103777115,10.47197/RETOS.V41I0.79362,,,The parental influence on the career of young Artistic Gymnastics,ar,Article,Costa A.R.,,Universidade Federal de Pelotas,Pelotas,Brazil,,,,,2021-02-26,26 February 2021,Retos,15791726,21100468901,19882041,Journal,41,,,804-811,,,7,1,all publisherfullgold,All Open Access Gold,,,
2-s2.0-85103797813,10.47197/RETOS.V41I0.85497,,,Facilitators and barriers for sports practice by athletes with impairments in Brazil,ar,Article,Vieira Y.V.,,Universidade Federal do Parana,Curitiba,Brazil,,,,,2021-02-22,22 February 2021,Retos,15791726,21100468901,19882041,Journal,41,,,812-822,,,15,1,all publisherfullgold,All Open Access Gold,,,
2-s2.0-85102708553,10.3389/fspor.2021.621055,,,"A Multicomponent Intervention Program With Overweight and Obese Adolescents Improves Body Composition and Cardiorespiratory Fitness, but Not Insulin Biomarkers",ar,Article,Schneiders L.d.B.,,Universidade de Santa Cruz do Sul,Santa Cruz do Sul,Brazil,,,,,2021-02-22,22 February 2021,Frontiers in Sports and Active Living,,21101063028,26249367,Journal,3,,621055,,,,4,1,all publisherfullgold repository repositoryvor,All Open Access Gold Green,,,
2-s2.0-85101798993,10.1088/1361-6560/abd671,,33561008,In silico dosimetry of low-dose rate brachytherapy using radioactive nanoparticles,ar,Article,Seniwal B.,,Universidade Federal de Minas Gerais,Belo Horizonte,Brazil,,,,,2021-02-21,21 February 2021,Physics in Medicine and Biology,00319155,29203,13616560,Journal,66,4,045016,,,,8,0,,,,,
2-s2.0-85108927142,,,,Gluten-free cheese bread enriched with essential fatty acids: Characterization and acceptance,ch,Book Chapter,Kalschne D.L.,,Universidade Tecnológica Federal do Paraná,Curitiba,Brazil,,,,,2021-02-19,19 February 2021,Gluten Free Diets and Health,,21101050249,,Book,,,,89-130,,,1,0,,,,,
2-s2.0-85103753243,10.47197/RETOS.V41I0.85978,,,The development of swimming in Brazil and its structural intervening factors,ar,Article,Ordonhes M.T.,,Universidade Federal do Parana,Curitiba,Brazil,,,,,2021-02-09,9 February 2021,Retos,15791726,21100468901,19882041,Journal,41,,,664-673,,,6,1,all publisherfullgold,All Open Access Gold,,,
2-s2.0-85101600982,10.1298/ijtr.2020.0027,,,Influence of inspiratory muscle strength on exercise capacity before and after cardiac rehabilitation,ar,Article,Dos Santos T.D.,,Universidade Federal de Santa Maria,Santa Maria,Brazil,,,,,2021-02-02,2 February 2021,International Journal of Therapy and Rehabilitation,17411645,21100219304,1759779X,Journal,28,2,,,,,3,0,,,,,
2-s2.0-85110644103,10.26582/k.53.1.4,,,Basketball small-sided games: Effects of varying formats and using successive bouts,ar,Article,Clemente F.M.,,Instituto de Telecomunicações;Instituto Politécnico de Viana do Castelo,Aveiro;Viana do Castelo,Portugal;Portugal,,,,,2021-02-01,February 2021,Kinesiology,,19400158604,1848638X,Journal,53,1,,28-36,,,11,1,all publisherfullgold repository repositoryvor,All Open Access Gold Green,,,
2-s2.0-85110469680,10.26582/k.53.1.3,,,Talk test: A simple alternative to identify lactate thresholds during progressive cycling exercise,ar,Article,De Lucca L.,,Universidade do Sul de Santa Catarina,Tubarao,Brazil,,,,,2021-02-01,February 2021,Kinesiology,,19400158604,1848638X,Journal,53,1,,20-27,,,0,1,all publisherfullgold,All Open Access Gold,,,
2-s2.0-85104073147,10.3390/sports9020031,,,Choose Where You Live Carefully: Built Environment Differences in Children’s Cardiorespiratory Fitness and Cardiometabolic Risk,ar,Article,Nevill A.M.,,University of Wolverhampton,Wolverhampton,United Kingdom,,,,,2021-02-01,February 2021,Sports,,21101042146,20754663,Journal,9,2,164,,,,4,1,all publisherfullgold repository repositoryvor,All Open Access Gold Green,,,
2-s2.0-85102996341,10.3390/foods10020374,,,How are school menus evaluated in different countries? A systematic review,re,Review,Cupertino A.F.,,Universidade de Brasília,Brasília,Brazil,,,,,2021-02-01,February 2021,Foods,,21100898636,23048158,Journal,10,2,374,,,,8,1,all publisherfullgold repository repositoryvor,All Open Access Gold Green,,,
2-s2.0-85102463939,10.3390/foods10020455,,,"Combining celery oleoresin, limonene and rhamnolipid as new strategy to control endospore-forming bacillus cereus",ar,Article,Bertuso P.d.C.,,Universidade de São Paulo,Sao Paulo,Brazil,,,,,2021-02-01,February 2021,Foods,,21100898636,23048158,Journal,10,2,455,1-13,,,12,1,all publisherfullgold repository repositoryvor,All Open Access Gold Green,,,
2-s2.0-85102452757,10.3390/foods10020454,,,Effect of soil management and training system on negroamaro wine aroma,ar,Article,Coletta A.,,Research Centre for Viticulture and Enology,Turi (BA),Italy,,,,,2021-02-01,February 2021,Foods,,21100898636,23048158,Journal,10,2,454,1-15,,,21,1,all publisherfullgold repository repositoryvor,All Open Access Gold Green,,,
2-s2.0-85102434279,10.3390/foods10020475,,,Phytochemical characterization and evaluation of bioactive properties of tisanes prepared from promising medicinal and aromatic plants,ar,Article,Paschoalinotto B.H.,,Universidade Tecnológica Federal do Paraná;Instituto Politécnico de Bragança,Curitiba;Braganca,Brazil;Portugal,,,,,2021-02-01,February 2021,Foods,,21100898636,23048158,Journal,10,2,475,1-26,,,8,1,all publisherfullgold repository repositoryvor,All Open Access Gold Green,,,
2-s2.0-85101862398,10.3390/foods10020263,,,Effect of active-edible coating and essential oils on lamb patties oxidation during display,ar,Article,Vital A.C.P.,,Universidad de Zaragoza;Universidade Estadual de Maringá,Zaragoza;Maringa,Spain;Brazil,,,,,2021-02-01,February 2021,Foods,,21100898636,23048158,Journal,10,2,263,,,,27,1,all publisherfullgold repository repositoryvor,All Open Access Gold Green,,,
2-s2.0-85101849931,10.23736/S0022-4707.20.11181-2,,32720782,Obesity does not modulate men's eating behavior after a high intensity interval exercise session: An exercise trial,ar,Article,Terra C.M.,,Universidade Federal de São Paulo,Sao Paulo,Brazil,,,,,2021-02-01,February 2021,Journal of Sports Medicine and Physical Fitness,00224707,19887,18271928,Journal,61,2,,280-286,,,1,0,,,,,
2-s2.0-85101840501,10.23736/S0022-4707.20.11099-5,,32720780,Caffeine improves performance but not duration of the countermovement jump phases,ar,Article,Lago-Rodríguez Á.,,Universidad Isabel I,Burgos,Spain,,,,,2021-02-01,February 2021,Journal of Sports Medicine and Physical Fitness,00224707,19887,18271928,Journal,61,2,,199-204,,,7,2,all repository repositoryvor,All Open Access Green,,,
2-s2.0-85101675050,10.1519/JSC.0000000000003079,,30741869,"Unilateral Isometric Squat: Test Reliability, Interlimb Asymmetries, and Relationships With Limb Dominance",ar,Article,Bishop C.,,Middlesex University,London,United Kingdom,,,,,2021-02-01,1 February 2021,Journal of Strength and Conditioning Research,,19889,15334287,Journal,35,,,S144-S151,,,15,1,all publisherfree2read,All Open Access Bronze,,,
2-s2.0-85101527809,10.23736/S0022-4707.20.11155-1,,32674541,"Multidirectional sprints in soccer: Are there connections between linear, curved, and change-of-direction speed performances?",ar,Article,Freitas T.T.,,Universidade Federal de São Paulo;Universidad Católica de Murcia;NAR,Sao Paulo;Murcia;Sao Paulo,Brazil;Spain;Brazil,,,,,2021-02-01,February 2021,Journal of Sports Medicine and Physical Fitness,00224707,19887,18271928,Journal,61,2,,212-217,,,7,0,,,,,
2-s2.0-85101391687,10.1123/JSR.2019-0469,,32369762,Proprioceptive training on dynamic neuromuscular control in fencers: A clinical trial,ar,Article,De Vasconcelos G.S.,,Universidade Federal do Rio Grande do Sul,Porto Alegre,Brazil,,,,,2021-02-01,February 2021,Journal of Sport Rehabilitation,10566716,19876,15433072,Journal,30,2,,220-225,,,9,1,all publisherfree2read repository repositoryvor,All Open Access Bronze Green,,,
2-s2.0-85101349415,10.26773/SMJ.210208,,,Post-exercise hypotension in brazilian jiu-jitsu,ar,Article,Belo W.R.,,Universidade Federal do Rio de Janeiro,Rio de Janeiro,Brazil,,,,,2021-02-01,February 2021,Sport Mont,14517485,21100855988,23370351,Journal,19,1,,39-43,,,2,1,all publisherfullgold,All Open Access Gold,,,
2-s2.0-85101297995,10.1123/JAPA.2019-0255,,32736345,Effect of dance on postural control in people with Parkinson’s disease: A meta-analysis review,re,Review,De Almeida H.S.,,Universidade Candido Mendes,Rio de Janeiro,Brazil,,,,,2021-02-01,February 2021,Journal of Aging and Physical Activity,10638652,29191,1543267X,Journal,29,1,,130-141,,,11,0,,,,,
2-s2.0-85101295824,10.4155/bio-2020-0324,,33470871,"2020 White Paper on Recent Issues in Bioanalysis: BMV of Hybrid Assays, Acoustic MS, HRMS, Data Integrity, Endogenous Compounds, Microsampling and Microbiome (<underline>Part 1</underline> - Recommendations on Industry/Regulators Consensus on BMV of Biotherapeutics by LCMS, Advanced Application in Hybrid Assays, Regulatory Challenges in Mass Spec, Innovation in Small Molecules, Peptides and Oligos)",ar,Article,Neubert H.,,Pfizer Inc.,New York,United States,,,,,2021-02-01,February 2021,Bioanalysis,17576180,19700188217,17576199,Journal,13,4,,203-238,,,30,0,,,,,
2-s2.0-85101285985,10.1123/JAPA.2019-0182,,32723929,Physical activity measured by accelerometry in mozambican older adult women attending a regular exercise program,ar,Article,Daca T.,,Pedagogical University,Maputo,Mozambique,,,,,2021-02-01,February 2021,Journal of Aging and Physical Activity,10638652,29191,1543267X,Journal,29,1,,116-120,,,2,0,,,,,
2-s2.0-85101263340,10.1123/IJSPP.2020-0628,,33406481,Response to the comment on “a new taxonomy for postactivation potentiation in sport”,no,Note,Boullosa D.,,Universidade Federal de Mato Grosso do Sul,Campo Grande,Brazil,,,,,2021-02-01,February 2021,International Journal of Sports Physiology and Performance,15550265,14000156196,15550273,Journal,16,2,,164,,,3,1,all publisherfree2read repository repositoryam,All Open Access Bronze Green,,,
2-s2.0-85101251156,10.1123/JAPA.2019-0452,,32702664,Effect of an exergaming-based dance training paradigm on autonomic nervous system modulation in healthy older adults: A randomized controlled trial,ar,Article,Varas-Diaz G.,,University of Illinois at Chicago,Chicago,United States,,,,,2021-02-01,February 2021,Journal of Aging and Physical Activity,10638652,29191,1543267X,Journal,29,1,,1-9,,,20,0,,,,,
2-s2.0-85100728191,10.1109/JBHI.2020.2988360,,32324580,Sleeve for Knee Angle Monitoring: An IMU-POF Sensor Fusion System,ar,Article,Vargas-Valencia L.S.,,Universidade Federal do Espírito Santo,Vitoria,Brazil,,,,,2021-02-01,February 2021,IEEE Journal of Biomedical and Health Informatics,21682194,21100256982,21682208,Journal,25,2,9072540,465-474,,,26,0,,,,,
2-s2.0-85100524874,10.1519/JSC.0000000000002543,,29489715,Force-Velocity Relationship in Three Different Variations of Prone Row Exercises,ar,Article,Loturco I.,,NAR—Nucleus of High Performance in Sport,Sao Paulo,Brazil,,,,,2021-02-01,1 February 2021,Journal of Strength and Conditioning Research,10648011,19889,15334287,Journal,35,2,,300-309,,,32,2,all repository repositoryvor,All Open Access Green,,,
2-s2.0-85100518790,10.1136/bmjsem-2020-000960,,,Changes in physical activity and sedentary behaviours from before to during the COVID-19 pandemic lockdown: A systematic review,re,Review,Stockwell S.,,Anglia Ruskin University,Cambridge,United Kingdom,,,,,2021-02-01,1 February 2021,BMJ Open Sport and Exercise Medicine,20557647,21100869188,,Journal,7,1,e000960,,,,923,1,all publisherfullgold repository repositoryvor repositoryam,All Open Access Gold Green,,,
2-s2.0-85100503778,10.1519/JSC.0000000000002365,,29351158,"Physical Performance Measures of Flexibility, Hip Strength, Lower Limb Power, and Trunk Endurance in Healthy Navy Cadets: Normative Data and Differences between Sex and Limb Dominance",ar,Article,Lopes T.J.A.,,The University of Sydney School of Health Sciences,Sydney,Australia,,,,,2021-02-01,1 February 2021,Journal of Strength and Conditioning Research,10648011,19889,15334287,Journal,35,2,,458-464,,,22,0,,,,,
2-s2.0-85100489258,10.1519/JSC.0000000000002702,,29933357,Are There Differences in Elite Youth Soccer Player Work Rate Profiles in Congested vs. Regular Match Schedules?,ar,Article,Zanetti V.,,Universidade de São Paulo;Red Bull Brazil,Sao Paulo;Campinas,Brazil;Brazil,,,,,2021-02-01,1 February 2021,Journal of Strength and Conditioning Research,10648011,19889,15334287,Journal,35,2,,473-480,,,9,2,all repository repositoryam,All Open Access Green,,,
2-s2.0-85100452486,10.1519/JSC.0000000000002690,,29878984,"Physiological Responses to Swimming Repetitive ""ice Miles""",ar,Article,Knechtle B.,,Medbase St. Gallen Am Vadianplatz,St Gallen,Switzerland,,,,,2021-02-01,1 February 2021,Journal of Strength and Conditioning Research,10648011,19889,15334287,Journal,35,2,,487-494,,,14,2,all repository,All Open Access Green,,,
