eid,doi,pii,pubmed_id,title,subtype,subtypeDescription,creator,afid,affilname,affiliation_city,affiliation_country,author_count,author_names,author_ids,author_afids,coverDate,coverDisplayDate,publicationName,issn,source_id,eIssn,aggregationType,volume,issueIdentifier,article_number,pageRange,description,authkeywords,citedby_count,openaccess,freetoread,freetoreadLabel,fund_acr,fund_no,fund_sponsor
2-s2.0-85112664931,10.2478/hukin-2021-0063,,,Anaerobic Capacity is Associated with Metabolic Contribution and Mechanical Output Measured during the Wingate Test,ar,Article,Poli R.A.B.D.,,"Universidade Estadual Paulista ""Júlio de Mesquita Filho""",Sao Paulo,Brazil,,,,,2021-07-28,28 July 2021,Journal of Human Kinetics,16405544,15000154801,18997562,Journal,79,1,,65-75,,,8,1,all publisherfullgold repository repositoryvor,All Open Access Gold Green,,,
2-s2.0-85112661605,10.2478/hukin-2021-0073,,,Within-Match Performance Dynamics - Momentary Strength in Handball,ar,Article,Russomanno T.G.,,Technische Universität München;Universidade de Brasília,Munich;Brasília,Germany;Brazil,,,,,2021-07-28,28 July 2021,Journal of Human Kinetics,16405544,15000154801,18997562,Journal,79,1,,211-219,,,9,1,all publisherfullgold repository repositoryvor,All Open Access Gold Green,,,
2-s2.0-85112654954,10.2478/hukin-2021-0078,,,Burnout and Coping Perceptions of Volleyball Players throughout an Annual Sport Season,ar,Article,Pires D.A.,,Universidade Federal do Pará,Belem,Brazil,,,,,2021-07-28,28 July 2021,Journal of Human Kinetics,16405544,15000154801,18997562,Journal,79,1,,249-257,,,16,1,all publisherfullgold repository repositoryvor,All Open Access Gold Green,,,
2-s2.0-85112646862,10.2478/hukin-2021-0069,,,The Relationship between Performance and Asymmetries in Different Multidirectional Sprint Tests in Soccer Players,ar,Article,Fílter A.,,"Universidad Pablo de Olavide, de Sevilla;FSI Sport Research Lab",Sevilla;Granada,Spain;Spain,,,,,2021-07-28,28 July 2021,Journal of Human Kinetics,16405544,15000154801,18997562,Journal,79,1,,155-164,,,16,1,all publisherfullgold repository repositoryvor repositoryam,All Open Access Gold Green,,,
2-s2.0-85112616862,10.2478/hukin-2021-0060,,,MBboard: Validity and Reliability of a New Tool Developed to Evaluate Specific Strength in Rock Climbers,ar,Article,Marino T.K.,,Universidade de São Paulo,Sao Paulo,Brazil,,,,,2021-07-28,28 July 2021,Journal of Human Kinetics,16405544,15000154801,18997562,Journal,79,1,,5-13,,,3,1,all publisherfullgold repository repositoryvor,All Open Access Gold Green,,,
2-s2.0-85116063952,,,,Noninvasive positive pressure ventilation modes,ch,Book Chapter,Plentz R.D.M.,,Universidade Federal de Ciencias da Saúde de Porto Alegre,Porto Alegre,Brazil,,,,,2021-07-14,14 July 2021,Respiratory Care in Non Invasive Mechanical Ventilatory Support Principles and Practice,,21101060442,,Book,,,,105-109,,,0,0,,,,,
2-s2.0-85116042264,,,,Continuous non-invasive ventilatory support,ch,Book Chapter,Dorça A.,,Universidade Federal de Goiás,Goiania,Brazil,,,,,2021-07-14,14 July 2021,Respiratory Care in Non Invasive Mechanical Ventilatory Support Principles and Practice,,21101060442,,Book,,,,131-144,,,0,0,,,,,
2-s2.0-85116004268,,,,Home non invasive mechanical ventilation in neuromuscular disorders: Implications for respiratory therapist,ch,Book Chapter,da Silva R.M.,,Respiratory Physiotherapist,Jaraguá do Sul (SC),Brazil,,,,,2021-07-14,14 July 2021,Respiratory Care in Non Invasive Mechanical Ventilatory Support Principles and Practice,,21101060442,,Book,,,,459-469,,,0,0,,,,,
2-s2.0-85151102444,10.1007/978-3-030-74096-2,,,Vasoplegic endothelial dysfunction: Circulatory shock and methylene blue,bk,Book,Evora P.R.B.,,Universidade de São Paulo,Sao Paulo,Brazil,,,,,2021-07-02,2 July 2021,Vasoplegic Endothelial Dysfunction Circulatory Shock and Methylene Blue,,21101142886,,Book,,,,1-144,,,2,0,,,,,
2-s2.0-85128436954,,,,Integration of Charles Peirce's philosophy into information science,ar,Article,Puerta-Díaz M.,,"Universidade Estadual Paulista ""Júlio de Mesquita Filho"";Universidad de La Habana",Sao Paulo;Havana,Brazil;Cuba,,,,,2021-07-01,July-September 2021,Revista Cubana De Informacion En Ciencias De La Salud,23072113,21100312401,,Journal,32,3,1794,,,,0,0,,,,,
2-s2.0-85127633031,,,,Mapping of electronic searches for the most popular drugs in the COVID-19 pandemic in Brazil,ar,Article,Do Nascimento V.F.,,Universidade do Estado de Mato Grosso,Caceres,Brazil,,,,,2021-07-01,July-September 2021,Revista Cubana De Informacion En Ciencias De La Salud,23072113,21100312401,,Journal,32,3,e1697,,,,1,0,,,,,
2-s2.0-85127135707,10.2196/31838,,,From the Cochrane Library: Topical Tacrolimus for Atopic Dermatitis,le,Letter,Hamp A.,,Arizona College of Osteopathic Medicine,Glendale,United States,,,,,2021-07-01,1 July 2021,Jmir Dermatology,,21101082412,25620959,Journal,4,2,e31838,,,,1,1,all publisherfullgold repository repositoryvor,All Open Access Gold Green,,,
2-s2.0-85126572690,10.35845/kmuj.2021.21918,,,"CALL FOR EMERGENCY ACTION TO LIMIT GLOBAL TEMPERATURE INCREASES, RESTORE BIODIVERSITY, AND PROTECT HEALTH: Wealthy nations must do much more, much faster",ed,Editorial,Atwoli L.,,East African Medical Journal,Nairobi,Kenya,,,,,2021-07-01,July-September 2021,Khyber Medical University Journal,23052643,21101037321,23052651,Journal,13,3,,127-130,,,1,1,all publisherfullgold,All Open Access Gold,,,
2-s2.0-85122489816,10.1177/02611929211038652,,34399588,Ex Vivo Human Skin: An Alternative Test System for Skin Irritation and Corrosion Assays,ar,Article,Eberlin S.,,Kosmoscience Group,Sao Paulo,Brazil,,,,,2021-07-01,July 2021,ATLA Alternatives to Laboratory Animals,02611929,26766,26323559,Journal,49,4,,137-146,,,7,0,,,,,
2-s2.0-85121097858,10.1055/s-0041-1735252,,34847587,Comparison of Speech Recognition in Cochlear Implant Users with Different Speech Processors,ar,Article,Pinheiro M.M.C.,,Universidade Federal de Santa Catarina,Florianopolis,Brazil,,,,,2021-07-01,1 July 2021,Journal of the American Academy of Audiology,10500545,13601,21573107,Journal,32,7,,469-476,,,4,0,,,,,
2-s2.0-85118662334,10.17151/hpsal.2021.26.2.16,,,Vulnerability situations experienced by adolescent offenders: An integrative review,ar,Article,Santos-Couto P.L.,,Centro de Ensino Superior de Guanambi,Guanambi,Brazil,,,,,2021-07-01,July-December 2021,Hacia La Promocion De La Salud,01217577,21101060641,24628425,Journal,26,2,,235-251,,,0,1,all publisherfullgold,All Open Access Gold,,,
2-s2.0-85114709164,10.1016/j.jmpt.2021.06.004,S0161475421000786,34456044,Validating Surface Topography for the Measurement of the Thoracic Kyphosis Angle in Patients With Scoliosis: A Prospective Study of Accuracy,ar,Article,Navarro I.J.R.L.,,Universidade Federal do Rio Grande do Sul,Porto Alegre,Brazil,,,,,2021-07-01,1 July 2021,Journal of Manipulative and Physiological Therapeutics,01614754,35303,15326586,Journal,44,6,,497-503,,,1,0,,,,,
2-s2.0-85113866029,10.1148/ryai.2021200184,,,A deep learning–based model for detecting abnormalities on brain mr images for triaging: Preliminary results from a multisite experience,ar,Article,Gauriau R.,,Massachusetts General Hospital,Boston,United States,,,,,2021-07-01,July 2021,Radiology Artificial Intelligence,,21101055750,26386100,Journal,3,4,e200184,,,,17,2,all repository repositoryvor,All Open Access Green,,,
2-s2.0-85113786553,10.1148/ryai.2021210035,,,Natural language processing of radiology text reports: Interactive text classification,ar,Article,Wiggins W.F.,,Duke University Hospital,Durham,United States,,,,,2021-07-01,July 2021,Radiology Artificial Intelligence,,21101055750,26386100,Journal,3,4,e210035,,,,13,2,all repository repositoryvor,All Open Access Green,,,
2-s2.0-85113770815,10.1016/j.jmpt.2021.06.003,S0161475421000774,34456043,Acute and Time-Course Effects of Osteopathic Manipulative Treatment on Vascular and Autonomic Function in Patients With Heart Failure: A Randomized Trial,ar,Article,Amatuzzi F.,,Madrid Osteopathic School,Brasilia,Brazil,,,,,2021-07-01,1 July 2021,Journal of Manipulative and Physiological Therapeutics,01614754,35303,15326586,Journal,44,6,,455-466,,,10,0,,,,,
2-s2.0-85113203766,10.1016/j.jvoice.2019.12.016,S0892199719303716,32216976,Videolaryngoscopy Quality with Protective Cover of Intraoral Odontologic Camera Evaluation in Vocal Fold Coverage Lesions,ar,Article,Fonseca V.R.,,Universidade Positivo,Curitiba,Brazil,,,,,2021-07-01,July 2021,Journal of Voice,08921997,13783,18734588,Journal,35,4,,665-665.e12,,,0,0,,,,,
2-s2.0-85112664702,10.7752/jpes.2021.s3282,,,Evidence-based effects of multicomponent exercise training on biomarkers related to frailty in older persons: A systematic review,ar,Article,Caldo-Silva A.,,"Universidade de Coimbra, Centro de Investigação do Desporto e da Actividade Física",Coimbra,Portugal,,,,,2021-07-01,July 2021,Journal of Physical Education and Sport,22478051,19900191849,2247806X,Journal,21,,,2219-2227,,,3,1,all publisherfullgold,All Open Access Gold,,,
2-s2.0-85112659250,10.7752/jpes.2021.s3274,,,Effect of strength training using resistive equipment in hydro gymnastics classes on functional fitness of middle-aged and older women,ar,Article,Franco E.A.,,Pontifícia Universidade Católica do Paraná,Curitiba,Brazil,,,,,2021-07-01,July 2021,Journal of Physical Education and Sport,22478051,19900191849,2247806X,Journal,21,,274,2150-2156,,,5,1,all publisherfullgold,All Open Access Gold,,,
2-s2.0-85112646100,10.7752/jpes.2021.s3286,,,Intermittent or continuous cold water immersion recovery protocols do not affect skin temperature,ar,Article,Sánchez-Ureña B.,,Universidad Nacional,Heredia,Costa Rica,,,,,2021-07-01,1 July 2021,Journal of Physical Education and Sport,22478051,19900191849,2247806X,Journal,21,,286,2251-2257,,,0,1,all publisherfullgold,All Open Access Gold,,,
2-s2.0-85112632951,10.7752/jpes.2021.s3248,,,Practice schedule analysis and pedagogical feedback in swimming classes,ar,Article,Monteiro G.N.,,Faculdade Centro Mato-Grossense,Sorriso,Brazil,,,,,2021-07-01,1 July 2021,Journal of Physical Education and Sport,22478051,19900191849,2247806X,Journal,21,,248,1950-1957,,,8,1,all publisherfullgold,All Open Access Gold,,,
2-s2.0-85112628336,10.7752/jpes.2021.s3284,,,Glycemic variability after high intensity continuous and intermittent exercises in children and adolescents with type 1 diabetes,ar,Article,DE LIMA V.A.,,Universidade Federal do Parana,Curitiba,Brazil,,,,,2021-07-01,July 2021,Journal of Physical Education and Sport,22478051,19900191849,2247806X,Journal,21,,284,2237-2243,,,3,1,all publisherfullgold,All Open Access Gold,,,
2-s2.0-85112624765,10.7752/jpes.2021.s3279,,,Is there a setting distribution pattern in high-level men's volleyball? An ecological approach to the game.,ar,Article,Dutra L.N.,,Universidade Federal de Minas Gerais,Belo Horizonte,Brazil,,,,,2021-07-01,July 2021,Journal of Physical Education and Sport,22478051,19900191849,2247806X,Journal,21,,279,2190-2198,,,4,0,,,,,
2-s2.0-85112558044,10.1016/j.fsidi.2021.301197,S2666281721001050,,Using micro-services and artificial intelligence to analyze images in criminal evidences,ar,Article,Silva I.,,Universidade Federal do Rio Grande do Norte,Natal,Brazil,,,,,2021-07-01,July 2021,Forensic Science International Digital Investigation,26662825,21101032719,26662817,Journal,37,,301197,,,,3,0,,,,,
2-s2.0-85112131667,10.1123/ijspp.2020-0218,,33662923,Sensitivity of the iload® application for monitoring changes in barbell velocity following power- And strength-oriented resistance training programs,ar,Article,Pérez-Castilla A.,,Universidad de Granada,Granada,Spain,,,,,2021-07-01,July 2021,International Journal of Sports Physiology and Performance,15550265,14000156196,15550273,Journal,16,7,,1056-1060,,,2,0,,,,,
2-s2.0-85112125599,10.1093/ptj/pzab092,,33704496,Effects of Exercise Interventions on Aerobic Capacity and Health-Related Quality of Life in People Living With HIV/AIDS: Systematic Review and Network Meta-Analysis,ar,Article,Gomes-Neto M.,,Universidade Federal da Bahia,Salvador,Brazil,,,,,2021-07-01,1 July 2021,Physical Therapy,00319023,16916,15386724,Journal,101,7,,,,,14,1,all publisherfree2read,All Open Access Bronze,,,
2-s2.0-85112017042,10.1123/MC.2020-0094,,33963093,Influence of chronotype on motor behavior in healthy individuals: Analyses of manual dexterity in different times of the day,ar,Article,De Holanda Marinho Nogueira N.G.,,Universidade Federal de Minas Gerais,Belo Horizonte,Brazil,,,,,2021-07-01,July 2021,Motor Control,10871640,16868,15432696,Journal,25,3,,423-463,,,2,0,,,,,
2-s2.0-85111157575,10.4155/bio-2021-0101,,34187201,Determination of cortisol in hair using liquid chromatography-tandem mass spectrometry: A short review,re,Review,Decker Soares D.R.,,Universidade Feevale,Novo Hamburgo,Brazil,,,,,2021-07-01,July 2021,Bioanalysis,17576180,19700188217,17576199,Journal,13,14,,1145-1155,,,2,0,,,,,
2-s2.0-85111147118,10.3390/healthcare9070886,,,Cut-off points of visceral adipose tissue associated with metabolic syndrome in military men,ar,Article,da Rosa S.E.,,Brazilian Army Research Institute of Physical Fitness (IPCFEx),Rio de Janeiro,Brazil,,,,,2021-07-01,July 2021,Healthcare Switzerland,,21101041844,22279032,Journal,9,7,886,,,,10,1,all publisherfullgold repository repositoryvor,All Open Access Gold Green,,,
2-s2.0-85111043932,10.3390/sports9070098,,,Local muscle endurance and strength had strong relationship with CrossFit® open 2020 in amateur athletes,ar,Article,Tibana R.A.,,Universidade Federal de Mato Grosso,Cuiaba,Brazil,,,,,2021-07-01,July 2021,Sports,,21101042146,20754663,Journal,9,7,98,,,,19,1,all publisherfullgold repository repositoryvor repositoryam,All Open Access Gold Green,,,
2-s2.0-85111043133,10.23736/S0022-4707.20.11601-3,,33337109,"Effects of conventional and sugar-free energy drinks intake in runners: A double-blind, randomized, placebo-controlled crossover clinical trial",ar,Article,Reis H.H.,,Universidade Federal de Vicosa,Vicosa,Brazil,,,,,2021-07-01,July 2021,Journal of Sports Medicine and Physical Fitness,00224707,19887,18271928,Journal,61,7,,928-934,,,4,0,,,,,
2-s2.0-85110850632,10.3390/foods10071604,,,Government policy for the procurement of food from local family farming in brazilian public institutions,ar,Article,Soares P.,,Universidade Federal de Santa Catarina,Florianopolis,Brazil,,,,,2021-07-01,July 2021,Foods,,21100898636,23048158,Journal,10,7,1604,,,,11,1,all publisherfullgold repository repositoryvor,All Open Access Gold Green,,,
2-s2.0-85110628149,10.3390/foods10071562,,,"Artisanal brazilian cheeses—history, marketing, technological and microbiological aspects",re,Review,Penna A.L.B.,,"Universidade Estadual Paulista ""Júlio de Mesquita Filho""",Sao Paulo,Brazil,,,,,2021-07-01,July 2021,Foods,,21100898636,23048158,Journal,10,7,1562,,,,24,1,all publisherfullgold repository repositoryvor,All Open Access Gold Green,,,
2-s2.0-85110333653,10.2196/24633,,,Digital medical device companion (MyIUS) for new users of intrauterine systems: App development study,ar,Article,Karakoyun T.,,Bayer AG,Leverkusen,Germany,,,,,2021-07-01,July 2021,Jmir Medical Informatics,,21101030139,22919694,Journal,9,7,e24633,,,,7,1,all publisherfullgold repository repositoryvor,All Open Access Gold Green,,,
2-s2.0-85110153650,10.3390/foods10071525,,,Addition of honey to an apple and passion fruit mixed beverage improves its phenolic compound profile,ar,Article,Leite I.B.,,Universidade Federal do Rio de Janeiro,Rio de Janeiro,Brazil,,,,,2021-07-01,July 2021,Foods,,21100898636,23048158,Journal,10,7,1525,,,,11,1,all publisherfullgold repository repositoryvor,All Open Access Gold Green,,,
2-s2.0-85110050173,10.3390/educsci11070337,,,An environmental education and communication project on migratory fishes and fishing communities,ar,Article,Carvalho S.C.,,Universidade de Aveiro,Aveiro,Portugal,,,,,2021-07-01,July 2021,Education Sciences,,21100897500,22277102,Journal,11,7,337,,,,1,1,all publisherfullgold repository repositoryvor,All Open Access Gold Green,,,
2-s2.0-85109596658,10.3390/healthcare9070829,,,Running pace percentile values for brazilian non-professional road runners,ar,Article,Thuany M.,,Universidade do Porto,Porto,Portugal,,,,,2021-07-01,July 2021,Healthcare Switzerland,,21101041844,22279032,Journal,9,7,829,,,,1,1,all publisherfullgold repository repositoryvor,All Open Access Gold Green,,,
2-s2.0-85109344560,10.3390/foods10071469,,,Fruit and agro-industrial waste extracts as potential antimicrobials in meat products: A brief review,re,Review,Gonçalves L.A.,,Universidade de São Paulo,Sao Paulo,Brazil,,,,,2021-07-01,July 2021,Foods,,21100898636,23048158,Journal,10,7,1469,,,,30,1,all publisherfullgold repository repositoryvor,All Open Access Gold Green,,,
2-s2.0-85109327771,10.23736/S0022-4707.20.11479-8,,33615759,Tracking of cardiometabolic risk in a Brazilian schoolchildren cohort: A 3-year longitudinal study,ar,Article,Silveira J.F.,,Universidade de Santa Cruz do Sul,Santa Cruz do Sul,Brazil,,,,,2021-07-01,July 2021,Journal of Sports Medicine and Physical Fitness,00224707,19887,18271928,Journal,61,7,,997-1006,,,8,2,all repository repositoryam,All Open Access Green,,,
2-s2.0-85109173498,10.1123/JSR.2020-0183,,33373976,"Immediate effect of ankle mobilization on range of motion, dynamic knee valgus, and knee pain in women with patellofemoral pain and ankle dorsiflexion restriction: A randomized controlled trial with 48-hour follow-up",ar,Article,Coelho B.A.L.,,Universidade de São Paulo,Sao Paulo,Brazil,,,,,2021-07-01,July 2021,Journal of Sport Rehabilitation,10566716,19876,15433072,Journal,30,5,,697-706,,,9,0,,,,,
2-s2.0-85109089861,10.1016/j.bjpt.2021.06.003,S1413355521000587,34226134,Pain in COVID-19 patients: A call to action for physical therapists to provide pain management after an episode of COVID-19,ed,Editorial,Bittencourt J.V.,,Centro Universitário Augusto Motta (UNISUAM),Rio de Janeiro,Brazil,,,,,2021-07-01,1 July 2021,Brazilian Journal of Physical Therapy,14133555,10800153305,18099246,Journal,25,4,,367-368,,,6,2,all repository repositoryvor,All Open Access Green,,,
2-s2.0-85108886393,10.1016/j.jphys.2021.06.005,S1836955321000515,34127419,Correspondence: Author response to Godi et al,le,Letter,Nascimento L.R.,,Universidade Federal de Minas Gerais;Universidade Federal do Espírito Santo,Belo Horizonte;Vitoria,Brazil;Brazil,,,,,2021-07-01,July 2021,Journal of Physiotherapy,18369553,19700176802,18369561,Journal,67,3,,233,,,0,1,all publisherhybridgold,All Open Access Hybrid Gold,,,
2-s2.0-85108846160,10.1016/j.jphys.2021.06.017,S183695532100062X,34148814,Correspondence: Re: Scrivener et al,le,Letter,Vaughan-Graham J.,,University of Toronto,Toronto,Canada,,,,,2021-07-01,July 2021,Journal of Physiotherapy,18369553,19700176802,18369561,Journal,67,3,,230,,,1,1,all publisherhybridgold,All Open Access Hybrid Gold,,,
2-s2.0-85108759510,10.1097/PEP.0000000000000804,,34151886,Intensive Bimanual Intervention for Children Who Have Undergone Hemispherectomy: A Pilot Study,ar,Article,Robert M.T.,,"Université Laval, Centre Interdisciplinaire de Recherche en Réadaptation et Intégration Sociale",Quebec,Canada,,,,,2021-07-01,July 2021,Pediatric Physical Therapy,08985669,15746,1538005X,Journal,33,3,,120-127,,,2,0,,,,,
2-s2.0-85108744236,10.1007/s40279-021-01438-5,,33871831,The Impact of Coronavirus (COVID-19) Related Public-Health Measures on Training Behaviours of Individuals Previously Participating in Resistance Training: A Cross-Sectional Survey Study,ar,Article,Steele J.,,Southampton Solent University;Ukactive Research Institute,Southampton;London,United Kingdom;United Kingdom,,,,,2021-07-01,July 2021,Sports Medicine,01121642,20373,11792035,Journal,51,7,,1561-1580,,,24,1,all publisherhybridgold repository repositoryvor repositoryam,All Open Access Hybrid Gold Green,,,
2-s2.0-85108742405,10.1016/j.ptsp.2021.04.004,S1466853X21000754,33932873,Moderate intensity cycling is better than running on recovery of eccentric exercise-induced muscle damage,ar,Article,de Azevedo Franke R.,,Universidade Federal do Rio Grande do Sul,Porto Alegre,Brazil,,,,,2021-07-01,July 2021,Physical Therapy in Sport,1466853X,19912,18731600,Journal,50,,,65-73,,,3,0,,,,,
2-s2.0-85108625418,10.1016/j.jbmt.2021.05.018,S1360859221001194,34391311,Hip abduction with ankle dorsiflexion (HAAD) score and trunk seating control within 72 h after stroke predicts long-term disability: A cohort study,ar,Article,Coelho T.S.,,Universidade Federal do Triangulo Mineiro,Uberaba,Brazil,,,,,2021-07-01,July 2021,Journal of Bodywork and Movement Therapies,13608592,16788,15329283,Journal,27,,,710-716,,,2,0,,,,,
2-s2.0-85108588083,10.1016/j.jphys.2021.06.010,S1836955321000539,34147398,Women report sustained benefits from attending group-based education about pelvic floor muscles: a longitudinal qualitative study,ar,Article,Fernandes A.C.N.L.,,Universidade de São Paulo,Sao Paulo,Brazil,,,,,2021-07-01,July 2021,Journal of Physiotherapy,18369553,19700176802,18369561,Journal,67,3,,210-216,,,13,1,all publisherhybridgold,All Open Access Hybrid Gold,,,
2-s2.0-85108583845,10.1016/j.compmedimag.2021.101934,S0895611121000835,34174544,What is the state of the art of computer vision-assisted cytology? A Systematic Literature Review,re,Review,Victória Matias A.,,Universidade Federal de Santa Catarina,Florianopolis,Brazil,,,,,2021-07-01,July 2021,Computerized Medical Imaging and Graphics,08956111,23607,18790771,Journal,91,,101934,,,,16,2,all repository repositoryam,All Open Access Green,,,
2-s2.0-85108570300,10.1016/j.jphys.2021.06.003,S1836955321000461,34147400,Transcranial direct current stimulation provides no clinically important benefits over walking training for improving walking in Parkinson's disease: a systematic review,ar,Article,Nascimento L.R.,,Universidade Federal de Minas Gerais;Universidade Federal do Espírito Santo,Belo Horizonte;Vitoria,Brazil;Brazil,,,,,2021-07-01,July 2021,Journal of Physiotherapy,18369553,19700176802,18369561,Journal,67,3,,190-196,,,9,1,all publisherhybridgold,All Open Access Hybrid Gold,,,
2-s2.0-85108524289,10.5232/RICYDE2021.06504,,,"The effect of a breakfast's glycaemic index and type of hydration on metabolism and cycling performance: A crossover, randomized, controlled clinical trial",ar,Article,de Melo Cazal M.,,Universidade Federal de Vicosa,Vicosa,Brazil,,,,,2021-07-01,July 2021,Ricyde Revista Internacional De Ciencias Del Deporte,18853137,19700201540,,Journal,17,65,,251-263,,,0,1,all publisherfullgold,All Open Access Gold,,,
2-s2.0-85108258437,10.1016/j.jbmt.2021.04.013,S1360859221000875,34391298,Dual-task intervention based on trail making test: Effects on Parkinson's disease,ar,Article,Silva R.d.N.,,Universidade Federal do Triangulo Mineiro,Uberaba,Brazil,,,,,2021-07-01,July 2021,Journal of Bodywork and Movement Therapies,13608592,16788,15329283,Journal,27,,,628-633,,,13,0,,,,,
2-s2.0-85108215738,10.1249/MSS.0000000000002598,,33449605,Maximal Oxygen Uptake Is Underestimated during Incremental Testing in Hypertensive Older Adults: Findings from the HAEL Study,ar,Article,Schaun G.Z.,,Universidade Federal de Pelotas;Center for Exercise Medicine,Pelotas;Birmingham,Brazil;United States,,,,,2021-07-01,2021,Medicine and Science in Sports and Exercise,01959131,19894,15300315,Journal,53,7,,1452-1459,,,5,2,all repository repositoryam,All Open Access Green,,,
2-s2.0-85108100747,10.1016/j.jbmt.2021.05.005,S1360859221001066,34391306,Visual and haptic verticality misperception and trunk control within 72 h after stroke,ar,Article,Pascucci Sande de Souza L.A.,,Universidade Federal do Triangulo Mineiro,Uberaba,Brazil,,,,,2021-07-01,July 2021,Journal of Bodywork and Movement Therapies,13608592,16788,15329283,Journal,27,,,676-681,,,3,0,,,,,
2-s2.0-85108035948,10.1249/JES.0000000000000253,,34112745,Exercise Is Key to Sustaining Metabolic Gains after Bariatric Surgery,ar,Article,Gualano B.,,Universidade de São Paulo,Sao Paulo,Brazil,,,,,2021-07-01,2021,Exercise and Sport Sciences Reviews,00916331,19842,15383008,Journal,49,3,,197-204,,,12,1,all publisherfree2read repository repositoryam,All Open Access Bronze Green,,,
2-s2.0-85107819792,10.1016/j.jbmt.2021.04.006,S1360859221000802,34391283,Immediate effects of the high-velocity low-amplitude thrust on the heart rate autonomic modulation of judo athletes,ar,Article,Leite V.A.,,Universidade Federal do Rio de Janeiro,Rio de Janeiro,Brazil,,,,,2021-07-01,July 2021,Journal of Bodywork and Movement Therapies,13608592,16788,15329283,Journal,27,,,535-542,,,4,0,,,,,
2-s2.0-85107793606,10.1016/j.jbmt.2021.05.003,S1360859221001042,34391292,Triceps surae muscle-tendon unit mechanical property changes during 10 minutes of streching,ar,Article,Borges M.,,Universidade Federal do Rio Grande do Sul,Porto Alegre,Brazil,,,,,2021-07-01,July 2021,Journal of Bodywork and Movement Therapies,13608592,16788,15329283,Journal,27,,,591-596,,,4,0,,,,,
2-s2.0-85107792022,10.1016/j.jbmt.2021.05.014,S1360859221001157,34391296,"Relationship between upper limb physical performance tests and muscle strength of scapular, shoulder and spine stabilizers: A cross-sectional study",ar,Article,Guirelli A.R.,,Universidade Federal de Uberlândia,Uberlandia,Brazil,,,,,2021-07-01,July 2021,Journal of Bodywork and Movement Therapies,13608592,16788,15329283,Journal,27,,,612-619,,,10,0,,,,,
2-s2.0-85107788676,10.1016/j.jbmt.2021.05.004,S1360859221001054,34391291,Reliability of knee extensor neuromuscular structure and function and functional tests’ performance,ar,Article,Lanferdini F.J.,,Universidade Federal de Santa Catarina,Florianopolis,Brazil,,,,,2021-07-01,July 2021,Journal of Bodywork and Movement Therapies,13608592,16788,15329283,Journal,27,,,584-590,,,4,2,all repository repositoryvor,All Open Access Green,,,
