eid,doi,pii,pubmed_id,title,subtype,subtypeDescription,creator,afid,affilname,affiliation_city,affiliation_country,author_count,author_names,author_ids,author_afids,coverDate,coverDisplayDate,publicationName,issn,source_id,eIssn,aggregationType,volume,issueIdentifier,article_number,pageRange,description,authkeywords,citedby_count,openaccess,freetoread,freetoreadLabel,fund_acr,fund_no,fund_sponsor
2-s2.0-85112599673,10.5624/ISD.20210002,,,Can a spontaneous smile invalidate facial identification by photo-anthropometry?,ar,Article,Pint P.H.V.,,Universidade de São Paulo,Sao Paulo,Brazil,,,,,2021-01-01,2021,Imaging Science in Dentistry,22337822,21100211109,22337830,Journal,51,,,1-12,,,1,1,all publisherfullgold repository repositoryvor,All Open Access Gold Green,,,
2-s2.0-85112476777,10.1590/2526-8910.CTOED292021,,,Thinking/doing as the practice of freedom: Occupational therapy and paulo freire's centenary,re,Review,Farias M.N.,,Universidade Federal de São Carlos,Sao Carlos,Brazil,,,,,2021-01-01,2021,Brazilian Journal of Occupational Therapy,,21100899904,25268910,Journal,29,,e3027,,,,1,1,all publisherfullgold,All Open Access Gold,,,
2-s2.0-85112438670,10.1590/2526-8910.CTORE2201,,,Virtual support group for family caregivers of elderly people with dementia in the COVID-19 scenery,ar,Article,Mattos E.B.T.,,Universidade Federal de São Paulo,Sao Paulo,Brazil,,,,,2021-01-01,2021,Brazilian Journal of Occupational Therapy,,21100899904,25268910,Journal,29,,,,,,6,1,all publisherfullgold,All Open Access Gold,,,
2-s2.0-85112432372,10.1590/2526-8910.CTORE2094,,,"Training for sus: The adhesion trajectory of a course on occupational therapy to the inducing policies of curricular change pró and pet-saúde1,2",re,Review,Do Carmo Alonso C.M.,,Universidade Federal do Rio de Janeiro,Rio de Janeiro,Brazil,,,,,2021-01-01,2021,Brazilian Journal of Occupational Therapy,,21100899904,25268910,Journal,29,,e2771,,,,0,1,all publisherfullgold,All Open Access Gold,,,
2-s2.0-85112417498,10.1155/2021/6649549,,34393681,Effect of Robot-Assisted Therapy on Participation of People with Limited Upper Limb Functioning: A Systematic Review with GRADE Recommendations,re,Review,Ferreira F.M.R.M.,,Universidade Federal de Minas Gerais,Belo Horizonte,Brazil,,,,,2021-01-01,2021,Occupational Therapy International,09667903,29854,15570703,Journal,2021,,6649549,,,,7,1,all publisherfullgold repository repositoryvor,All Open Access Gold Green,,,
2-s2.0-85112395510,10.1590/2317-1782/20202020150,,,"Hearing function, perception of disability (handicap) and cognition in the elderly: a relation to be elucidated",ar,Article,de Souza Borges K.C.,,Universidade Federal de Minas Gerais,Belo Horizonte,Brazil,,,,,2021-01-01,2021,Codas,,21100309828,23171782,Journal,33,5,,1-8,,,1,1,all publisherfullgold,All Open Access Gold,,,
2-s2.0-85112381419,10.1590/2317-1782/20202020011,,34320136,Use of an app as a complementary strategy to speech-language therapy in a case of cognitive-communication disorder,ar,Article,Silva M.C.S.C.,,Universidade Federal Fluminense,Niteroi,Brazil,,,,,2021-01-01,2021,Codas,,21100309828,23171782,Journal,33,5,,,,,1,1,all publisherfullgold,All Open Access Gold,,,
2-s2.0-85112379397,10.1590/2317-1782/20192020203,,34320141,Outcomes of manual therapy on the biomechanics of swallowing in individuals with COPD,ar,Article,Steidl E.M.d.S.,,Universidade Federal de Santa Maria,Santa Maria,Brazil,,,,,2021-01-01,2021,Codas,,21100309828,23171782,Journal,33,5,,1-6,,,2,1,all publisherfullgold,All Open Access Gold,,,
2-s2.0-85112367299,10.1590/2317-1782/20202020174,,34320139,The relationship between vocal fatigue and voice-related quality of life in university professors,ar,Article,Coelho S.C.,,Universidade Federal do Espírito Santo,Vitoria,Brazil,,,,,2021-01-01,2021,Codas,,21100309828,23171782,Journal,33,5,,1-5,,,9,1,all publisherfullgold,All Open Access Gold,,,
2-s2.0-85112356716,10.1590/2317-1782/20202020197,,,Perceptive-auditive and perceptive-visual judgment in the identification of gradient productions in fricatives,ar,Article,de Castro Nunes F.L.,,"Universidade Estadual Paulista ""Júlio de Mesquita Filho""",Sao Paulo,Brazil,,,,,2021-01-01,2021,Codas,,21100309828,23171782,Journal,33,5,,1-8,,,0,1,all publisherfullgold,All Open Access Gold,,,
2-s2.0-85112355729,10.1590/2317-1782/20202020111,,34320137,Professional qualification of Brazilian Speech-Language Pathologists and its impacts on the Blue Dye Test (BDT),ar,Article,da Costa F.P.,,Universidade Estadual de Campinas,Campinas,Brazil,,,,,2021-01-01,2021,Codas,,21100309828,23171782,Journal,33,5,,1-7,,,0,0,,,,,
2-s2.0-85112125730,10.1590/2317-1782/20202020169,,34259778,Do Vocabulary and Narrative Skills Correlate in Preschoolers with Typical Language Development?,ar,Article,Souza M.S.D.L.,,Universidade Federal do Rio Grande do Norte,Natal,Brazil,,,,,2021-01-01,2021,Codas,,21100309828,23171782,Journal,33,6,e20200169,1-7,,,2,1,all publisherfullgold repository repositoryvor,All Open Access Gold Green,,,
2-s2.0-85112049679,10.1080/02640414.2021.1945776,,34180373,Effect of vision impairment on match-related performance and technical variation in attacking moves in Paralympic judo,ar,Article,Kons R.,,Universidade Federal de Santa Catarina,Florianopolis,Brazil,,,,,2021-01-01,2021,Journal of Sports Sciences,02640414,21090,1466447X,Journal,39,sup1,,125-131,,,22,2,all repository repositoryvor,All Open Access Green,,,
2-s2.0-85112023297,10.1080/13573322.2021.1905624,,,Special issue–editorial introduction–physical education teacher education and its complexities: mapping contexts for research and sharing experiences from Brazil,ed,Editorial,Sanches Neto L.,,Universidade Federal do Ceará;Universidade Federal do Rio Grande do Norte,Fortaleza;Natal,Brazil;Brazil,,,,,2021-01-01,2021,Sport Education and Society,13573322,20934,14701243,Journal,26,7,,697-703,,,6,1,all publisherfree2read repository repositoryvor,All Open Access Bronze Green,,,
2-s2.0-85112018571,10.1148/ryai.2021200254,,,The RSNA Pulmonary Embolism CT Dataset,ar,Article,Colak E.,,Unity Health Toronto,Toronto,Canada,,,,,2021-01-01,2021,Radiology Artificial Intelligence,,21101055750,26386100,Journal,3,2,e200254,1-7,,,83,2,all repository repositoryvor,All Open Access Green,,,
2-s2.0-85112010604,10.17267/2238-2704rpf.v11i3.3718,,,"Aquatic physical therapy in a patient with limb-girdle muscular dystrophy, type 2b: A case report",ar,Article,da Luz L.E.S.,,Universidade Federal do Pará,Belem,Brazil,,,,,2021-01-01,2021,Revista Pesquisa Em Fisioterapia,,21101021219,22382704,Journal,11,3,,,,,0,1,all publisherfullgold,All Open Access Gold,,,
2-s2.0-85111979922,10.5688/ajpe8285,,34315701,Factors associated with use of medications for anxiety and depression in pharmacy students in brazil Carolina,ar,Article,Amaral M.M.,,Universidade de São Paulo,Sao Paulo,Brazil,,,,,2021-01-01,2021,American Journal of Pharmaceutical Education,00029459,19444,15536467,Journal,85,6,8285,428-437,,,3,1,all publisherfullgold repository repositoryvor,All Open Access Gold Green,,,
2-s2.0-85111975645,10.17267/2238-2704rpf.v11i3.3798,,,Effect of training with non-imersive virtual reality on the performance of the real motor task in the elderly: Case reports,ar,Article,Rebêlo F.L.,,Centro Universitário CESMAC,Maceio,Brazil,,,,,2021-01-01,2021,Revista Pesquisa Em Fisioterapia,,21101021219,22382704,Journal,11,3,,,,,1,1,all publisherfullgold,All Open Access Gold,,,
2-s2.0-85111975562,10.17267/2238-2704rpf.v11i3.3690,,,Renin angiotensin aldosterone system in women using injectable hormonal contraceptive: Protocol of a comparative observational study of cross-sectional,ar,Article,Dos Santos P.A.,,Escola Bahiana de Medicina e Saúde Pública – EBMSP,Salvador,Brazil,,,,,2021-01-01,2021,Revista Pesquisa Em Fisioterapia,,21101021219,22382704,Journal,11,3,,,,,0,1,all publisherfullgold,All Open Access Gold,,,
2-s2.0-85111972213,10.1590/2317-1782/20202019143,,34287591,"Words database for reading by students from Basic Education I, E-READING I",ar,Article,de Oliveira A.M.,,"Universidade Estadual Paulista ""Júlio de Mesquita Filho""",Sao Paulo,Brazil,,,,,2021-01-01,2021,Codas,,21100309828,23171782,Journal,33,4,,1-10,,,0,1,all publisherfullgold repository repositoryvor,All Open Access Gold Green,,,
2-s2.0-85111936667,10.18002/rama.v16i1.6330,,,Time-motion analysis in elite female wushu sanda athletes according to competitive phases and weight categories,ar,Article,Vasconcelos B.B.,,Universidade Federal de Pelotas,Pelotas,Brazil,,,,,2021-01-01,2021,Revista De Artes Marciales Asiaticas,,21101073716,21740747,Journal,16,1,,1-11,,,5,1,all publisherfullgold repository repositoryvor,All Open Access Gold Green,,,
2-s2.0-85111788886,10.1590/2317-1782/20202020102,S231717822021000600601,34190810,Biomechanics of the tongue during swallowing after total laryngectomy: an integrative review,re,Review,Anjos L.M.D.,,Universidade Federal da Paraíba,Joao Pessoa,Brazil,,,,,2021-01-01,2021,Codas,,21100309828,23171782,Journal,33,6,,e20200102,,,1,1,all publisherfullgold,All Open Access Gold,,,
2-s2.0-85111770360,10.1080/24748668.2021.1958533,,,Judo technical-tactical dynamics: analysis of attack system effectiveness in high-level athletes,ar,Article,Brandão Kashiwagura D.,,Universidade de São Paulo,Sao Paulo,Brazil,,,,,2021-01-01,2021,International Journal of Performance Analysis in Sport,,21100237613,14748185,Journal,21,6,,922-933,,,24,0,,,,,
2-s2.0-85111611008,10.1590/2317-1782/20192020266,,34259779,Factors Related to the Performance of Elderly People in Temporal Ordering Tests,ar,Article,Rabelo M.B.,,Universidade Federal da Bahia,Salvador,Brazil,,,,,2021-01-01,2021,Codas,,21100309828,23171782,Journal,33,4,e20190266,1-8,,,1,1,all publisherfullgold repository repositoryvor,All Open Access Gold Green,,,
2-s2.0-85111603794,10.1519/JSC.0000000000003190,,31136550,"Physiological responses and time-motion analysis of kickboxing: Differences between full contact, light contact, and point fighting contests",ar,Article,Ouergui I.,,Institut Supérieur de Sport et de l´Education Physique du Kef,El Kef,Tunisia,,,,,2021-01-01,2021,Journal of Strength and Conditioning Research,10648011,19889,15334295,Journal,35,9,,2558-2563,,,19,0,,,,,
2-s2.0-85111579238,10.1590/2317-1782/20202020059,,34259753,Fluency and reading comprehension in students with and without stuttering,ar,Article,Pinto J.S.,,"Universidade Estadual Paulista ""Júlio de Mesquita Filho""",Sao Paulo,Brazil,,,,,2021-01-01,2021,Codas,,21100309828,23171782,Journal,33,5,,1-7,,,2,1,all publisherfullgold,All Open Access Gold,,,
2-s2.0-85111574168,10.1590/2317-1782/20202020168,,34259754,Reading speed in Elementary School and Junior High,ar,Article,Alves L.M.,,Universidade Federal de Minas Gerais,Belo Horizonte,Brazil,,,,,2021-01-01,2021,Codas,,21100309828,23171782,Journal,33,5,,1-7,,,6,1,all publisherfullgold repository repositoryvor,All Open Access Gold Green,,,
2-s2.0-85111555043,10.46542/pe.2021.211.178185,,,Case study of mind mapping as an educational tool for a pharmaceutical course on drug formulation design,ar,Article,Martinez R.M.,,Universidade de São Paulo,Sao Paulo,Brazil,,,,,2021-01-01,2021,Pharmacy Education,15602214,21211,14772701,Journal,21,1,,178-185,,,2,1,all publisherfullgold,All Open Access Gold,,,
2-s2.0-85111446403,10.5624/ISD.20200318,,,A rare case of Ewing sarcoma metastasis to the oral cavity,ar,Article,Schulz R.E.,,A.C.Camargo Cancer Center,Sao Paulo,Brazil,,,,,2021-01-01,2021,Imaging Science in Dentistry,22337822,21100211109,22337830,Journal,51,,,1-6,,,6,1,all publisherfullgold repository repositoryvor,All Open Access Gold Green,,,
2-s2.0-85111424166,10.5624/ISD.20200320,,,Cone-beam computed tomography artifacts in the presence of dental implants and associated factors: An integrative review,ar,Article,Terrabuio B.R.,,Universidade de São Paulo,Sao Paulo,Brazil,,,,,2021-01-01,2021,Imaging Science in Dentistry,22337822,21100211109,22337830,Journal,51,,,1-14,,,19,1,all publisherfullgold repository repositoryvor,All Open Access Gold Green,,,
2-s2.0-85111405245,10.26603/001c.21477,,,Concurrent validation and reference values of gluteus medius clinical test,ar,Article,Teixeira A.S.S.,,Universidade Federal de Minas Gerais,Belo Horizonte,Brazil,,,,,2021-01-01,2021,International Journal of Sports Physical Therapy,,21101063700,21592896,Journal,16,2,,335-341,,,5,1,all publisherfullgold repository repositoryvor,All Open Access Gold Green,,,
2-s2.0-85111397117,10.1080/24748668.2021.1957295,,,Practical application of the simplified model to assess the arm stroke efficiency: a tool for swimming coaches,ar,Article,Castro F.A.,,Universidade Federal do Rio Grande do Sul,Porto Alegre,Brazil,,,,,2021-01-01,2021,International Journal of Performance Analysis in Sport,,21100237613,14748185,Journal,21,6,,900-908,,,4,0,,,,,
2-s2.0-85110992035,10.1590/2317-1782/20202020127,,34231668,Coreferential processing in elderly with and without Alzheimer's disease,ar,Article,Alves G.Â.D.S.,,Universidade Federal da Paraíba,Joao Pessoa,Brazil,,,,,2021-01-01,2021,Codas,,21100309828,23171782,Journal,33,5,,1-8,,,1,1,all publisherfullgold repository repositoryvor,All Open Access Gold Green,,,
2-s2.0-85110985855,10.1590/2317-1782/20202020100,,34231667,Accuracy of affordable instruments for hearing screening in adults and the elderly,ar,Article,Balen S.A.,,Universidade Federal do Rio Grande do Norte;Universidade Federal da Paraíba;Universidade Estadual de Ciências da Saúde de Alagoas,Natal;Joao Pessoa;Maceio,Brazil;Brazil;Brazil,,,,,2021-01-01,2021,Codas,,21100309828,23171782,Journal,33,5,,1-8,,,1,1,all publisherfullgold repository repositoryvor,All Open Access Gold Green,,,
2-s2.0-85110984191,10.1590/2317-1782/20202020019,,34231751,What are the barriers to participation in a neuromodulation pilot trial for aphasia after stroke?,ar,Article,Andreoli M.L.,,"Universidade Estadual Paulista ""Júlio de Mesquita Filho""",Sao Paulo,Brazil,,,,,2021-01-01,2021,Codas,,21100309828,23171782,Journal,33,4,,1-4,,,1,1,all publisherfullgold repository repositoryvor,All Open Access Gold Green,,,
2-s2.0-85110932940,10.1590/2317-1782/20202019028,,34231750,Bilingualism and Rapid Automatized Naming: effects of language switching on lexical access and reading speed,ar,Article,Simonato E.,,Universidade Federal de São Paulo,Sao Paulo,Brazil,,,,,2021-01-01,2021,Codas,,21100309828,23171782,Journal,33,4,,1-8,,,0,1,all publisherfullgold,All Open Access Gold,,,
2-s2.0-85110804128,10.5114/biolsport.2021.100147,,,"Caffeine mouth rinse enhances performance, fatigue tolerance and reduces muscle activity during moderate-intensity cycling",ar,Article,de Albuquerque Melo A.,,Universidade Federal de Alagoas,Maceio,Brazil,,,,,2021-01-01,2021,Biology of Sport,0860021X,19816,20831862,Journal,38,4,,517-523,,,10,0,,,,,
2-s2.0-85110773817,10.1590/2317-1782/20202020067,,34231711,"Fatigue, effort and vocal discomfort in teachers after teaching activity",ar,Article,de Almeida Porto V.F.,,Universidade Estadual de Ciências da Saúde de Alagoas,Maceio,Brazil,,,,,2021-01-01,2021,Codas,,21100309828,23171782,Journal,33,4,,1-8,,,15,1,all publisherfullgold,All Open Access Gold,,,
2-s2.0-85110761015,10.1590/2317-1782/20202020130,,34231712,Academic path and professional competencies seen through the perception of speech therapy alumni,ar,Article,Maciel C.A.,,Universidade Federal de Minas Gerais,Belo Horizonte,Brazil,,,,,2021-01-01,2021,Codas,,21100309828,23171782,Journal,33,4,,1-8,,,1,1,all publisherfullgold repository repositoryvor,All Open Access Gold Green,,,
2-s2.0-85110672311,10.1590/2317-1782/20202020069,,34190809,Position of lips and tongue in rest in newborns with and without ankyloglossia,ar,Article,Campanha S.M.A.,,SerVoz - Saúde & Comunicação,Belo Horizonte (MG),Brazil,,,,,2021-01-01,2021,Codas,,21100309828,23171782,Journal,33,6,,1-5,,,4,1,all publisherfullgold,All Open Access Gold,,,
2-s2.0-85110629137,10.1136/bjsports-2021-104669,,34272272,Protecting olympic participants from COVID-19: The trialled and tested process,ed,Editorial,Pigozzi F.,,Università degli Studi di Roma Foro Italico;International Federation of Sports Medicine (FIMS),Rome;Lausanne,Italy;Switzerland,,,,,2021-01-01,2021,British Journal of Sports Medicine,03063674,19817,14730480,Journal,55,23,,1321-1323,,,8,2,all repository repositoryvor repositoryam,All Open Access Green,,,
2-s2.0-85110628474,10.1590/2317-1782/20202020102,,,Biomechanics of the tongue during swallowing after total laryngectomy: An integrative review,ar,Article,dos Anjos L.M.,,Universidade Federal da Paraíba,Joao Pessoa,Brazil,,,,,2021-01-01,2021,Codas,,21100309828,23171782,Journal,33,6,,1-10,,,2,1,all publisherfullgold,All Open Access Gold,,,
2-s2.0-85110624571,10.1080/02640414.2021.1951054,,34252002,Composite vignettes of former Brazilian high-performance volleyball athletes’ perspective on life skills learning and transfer,ar,Article,Nunes E.L.G.,,Universidade Federal de Santa Catarina,Florianopolis,Brazil,,,,,2021-01-01,2021,Journal of Sports Sciences,02640414,21090,1466447X,Journal,39,23,,2674-2682,,,4,0,,,,,
2-s2.0-85110612805,10.1590/2317-1782/20202020209,,34190812,Occurrence of reading and writing cognitive processes and perception visual skills in students with Visual Dyslexia,ar,Article,Mantovani S.,,Faculdade de Medicina de São José do Rio Preto,Sao Jose do Rio Preto,Brazil,,,,,2021-01-01,2021,Codas,,21100309828,23171782,Journal,33,6,,1-11,,,4,1,all publisherfullgold,All Open Access Gold,,,
2-s2.0-85110611500,10.1590/2317-1782/20202020173,,34190811,"Factors associated with the initiation of breastfeeding in a maternity hospital in Lima, Peru",ar,Article,Rech R.S.,,Universidade Federal de Ciencias da Saúde de Porto Alegre,Porto Alegre,Brazil,,,,,2021-01-01,2021,Codas,,21100309828,23171782,Journal,33,6,,1-8,,,2,1,all publisherfullgold repository repositoryvor,All Open Access Gold Green,,,
2-s2.0-85110584127,10.1590/2317-1782/20202020254,,34190813,Risk factors for fine and gross motor development in preterm and term infants,ar,Article,Bortagarai F.M.,,Universidade Federal do Pampa,Bage,Brazil,,,,,2021-01-01,2021,Codas,,21100309828,23171782,Journal,33,6,,1-8,,,11,1,all publisherfullgold,All Open Access Gold,,,
2-s2.0-85110562495,10.1590/2317-1782/20202018260,,34190756,"Vocal profile of 46,XX individuals with congenital adrenal hyperplasia",ar,Article,Neves P.C.R.,,Universidade Federal da Bahia,Salvador,Brazil,,,,,2021-01-01,2021,Codas,,21100309828,23171782,Journal,33,5,,1-6,,,2,1,all publisherfullgold,All Open Access Gold,,,
2-s2.0-85110534593,10.3233/bmr-200207,,33682693,The influence of Kinesio Taping on muscle fatigue in individuals with low back pain: A randomised controlled trial,ar,Article,MacEdo L.B.,,Universidade Federal do Rio Grande do Norte,Natal,Brazil,,,,,2021-01-01,2021,Journal of Back and Musculoskeletal Rehabilitation,10538127,12192,18786324,Journal,34,4,,613-621,,,3,2,all repository repositoryam,All Open Access Green,,,
2-s2.0-85110513081,10.1080/24748668.2021.1952831,,,The impact of match venue on performance indicators and tactical behaviour in youth soccer players,ar,Article,Praça G.M.,,Universidade Federal de Minas Gerais,Belo Horizonte,Brazil,,,,,2021-01-01,2021,International Journal of Performance Analysis in Sport,,21100237613,14748185,Journal,21,6,,889-899,,,15,0,,,,,
2-s2.0-85110494251,10.1590/2526-8910.CTOAR2118,,,The role of the occupational therapist in the Intensive Care Unit: A systematic review,re,Review,Bittencourt E.d.S.,,Universidade Federal do Pará,Belem,Brazil,,,,,2021-01-01,2021,Brazilian Journal of Occupational Therapy,,21100899904,25268910,Journal,29,,e2800,,,,3,1,all publisherfullgold,All Open Access Gold,,,
2-s2.0-85110491149,10.1590/2526-8910.CTOARF1929,,,The concept of urban mobility: Articulating actions in occupational therapy,re,Review,Gonçalves M.V.,,Universidade Federal do Espírito Santo,Vitoria,Brazil,,,,,2021-01-01,2021,Brazilian Journal of Occupational Therapy,,21100899904,25268910,Journal,29,,e2523,,,,3,1,all publisherfullgold,All Open Access Gold,,,
2-s2.0-85110474777,10.12800/CCD.V16I48.1725,,,Pedagogical structure of technical-tactical training in female handball formation categories,ar,Article,Dallegrave E.J.,,Universidade do Estado de Santa Catarina,Florianopolis,Brazil,,,,,2021-01-01,2021,Cultura Ciencia Y Deporte,16965043,19600162207,,Journal,16,48,,257-264,,,0,1,all publisherfullgold,All Open Access Gold,,,
2-s2.0-85110464981,10.1590/2526-8910.CTOAR2123,,,Scoping review about the “Occupational Performance History Interview – II” instrument: Perspectives for use in Brazil,re,Review,Gorla J.A.,,Universidade Federal de São Carlos,Sao Carlos,Brazil,,,,,2021-01-01,2021,Brazilian Journal of Occupational Therapy,,21100899904,25268910,Journal,29,,e2807,,,,1,0,,,,,
2-s2.0-85110214036,10.1590/2526-8910.CTOEN1961,,,Reflections on the idea of Latin America and its contributions to southern occupational therapies,ar,Article,Díaz-Leiva M.M.,,Universidade Federal de São Carlos;Universidad de Santiago de Chile;Universidad Academia de Humanismo Cristiano,Sao Carlos;Santiago;Santiago,Brazil;Chile;Chile,,,,,2021-01-01,2021,Brazilian Journal of Occupational Therapy,,21100899904,25268910,Journal,29,,e2568,,,,7,0,,,,,
2-s2.0-85109921963,10.1080/19424280.2021.1917698,,,Effect of loading carriage during walking with military boots with polyurethane and styrene-butadiene rubber midsoles,ar,Article,Muniz A.M.d.S.,,Army School of Physical Education,Rio de Janeiro,Brazil,,,,,2021-01-01,2021,Footwear Science,19424280,19700188148,19424299,Journal,13,S1,,S91-S93,,,0,0,,,,,
2-s2.0-85109765885,10.1016/j.mex.2021.101449,S2215016121002429,,Sentiment analysis based on a social media customised dictionary,ar,Article,Almeida M.D.,,Universidade Federal do Rio de Janeiro,Rio de Janeiro,Brazil,,,,,2021-01-01,January 2021,Methodsx,,21100317906,22150161,Journal,8,,101449,,,,6,1,all publisherfullgold repository repositoryvor,All Open Access Gold Green,,,
2-s2.0-85109750048,10.18549/PharmPract.2021.2.2290,,,The role of primary care pharmacists in the response to the zika epidemic,ar,Article,Santos-Pinto C.B.,,Universidade Federal de Mato Grosso do Sul,Campo Grande,Brazil,,,,,2021-01-01,2021,Pharmacy Practice,1885642X,4700152701,18863655,Journal,19,2,2290,,,,3,1,all publisherfullgold repository repositoryvor repositoryam,All Open Access Gold Green,,,
2-s2.0-85109746486,10.1590/2526-8910.CTOAO2057,,,Occupational therapy and alternative communication: Collaborative intervention with communication partners of a child with cerebral palsy,ar,Article,Manzini M.G.,,Universidade Federal de São Carlos,Sao Carlos,Brazil,,,,,2021-01-01,2021,Brazilian Journal of Occupational Therapy,,21100899904,25268910,Journal,29,,AO2057,,,,1,1,all publisherfullgold,All Open Access Gold,,,
2-s2.0-85109740603,10.1080/17469899.2021.1945923,,,Current management strategies of congenital nasolacrimal duct obstructions,ar,Article,Schellini S.A.,,"Universidade Estadual Paulista ""Júlio de Mesquita Filho""",Sao Paulo,Brazil,,,,,2021-01-01,2021,Expert Review of Ophthalmology,17469899,11900154333,17469902,Journal,16,5,,377-385,,,4,0,,,,,
2-s2.0-85109728636,10.5114/hm.2021.103288,,,"Effect of pilates exercises on blood glucose, urinary problems, sexual symptoms, pain and anxiety in women with gestational diabetes mellitus",ar,Article,Do Nascimento G.R.S.,,Universidade Federal de Mato Grosso,Cuiaba,Brazil,,,,,2021-01-01,2021,Human Movement,17323991,4800156304,18991955,Journal,22,4,,36-45,,,7,0,,,,,
2-s2.0-85109721760,10.5114/hm.2021.103286,,,Strength training promotes anthropometric and functional benefits in sedentary subjects: Does a personal trainer matter?,ar,Article,MATOS A.R.,,Universidade Católica de Brasília,Brasilia,Brazil,,,,,2021-01-01,2021,Human Movement,17323991,4800156304,18991955,Journal,22,4,,20-27,,,1,1,all publisherfullgold,All Open Access Gold,,,
2-s2.0-85109710368,10.47197/retos.v43i0.88526,,,"Sarcopenia and physical activity predict falls in older adults from Amazonas, Brazil",ar,Article,Miranda K.A.,,Universidade da Madeira,Funchal,Portugal,,,,,2021-01-01,2021,Retos,15791726,21100468901,19882041,Journal,43,,,215-222,,,7,1,all publisherfullgold repository repositoryvor repositoryam,All Open Access Gold Green,,,
2-s2.0-85109708765,10.5114/hm.2021.103290,,,The effects of perceived competence and self-controlled goal setting on motor learning,ar,Article,DE ALMEIDA CARVALHAIS C.K.,,Universidade de São Paulo,Sao Paulo,Brazil,,,,,2021-01-01,2021,Human Movement,17323991,4800156304,18991955,Journal,22,4,,56-67,,,2,1,all publisherfullgold,All Open Access Gold,,,
2-s2.0-85109673802,10.5114/hm.2021.103287,,,Comparison between traditional resistance exercise and variable resistance with elastic bands in acute vertical jump performance,ar,Article,MARIN D.P.,,Universidade Cruzeiro do Sul;Universidade Metodista de Sao Paulo,Sao Paulo;Sao Bernardo do Campo,Brazil;Brazil,,,,,2021-01-01,2021,Human Movement,17323991,4800156304,18991955,Journal,22,4,,28-35,,,12,1,all publisherfullgold,All Open Access Gold,,,
2-s2.0-85109672406,10.1590/2526-8910.CTOAO2039,,,"Aging, work and technology: Application driver as a laboral possibility for the 50+ population",ar,Article,de Barros L.,,Universidade Federal do Parana,Curitiba,Brazil,,,,,2021-01-01,2021,Brazilian Journal of Occupational Therapy,,21100899904,25268910,Journal,29,,AO2039,,,,1,1,all publisherfullgold,All Open Access Gold,,,
2-s2.0-85109616737,10.1016/B978-0-12-819662-5.00010-0,,,Probiotics and Prebiotics in Fish Aquaculture,ch,Book Chapter,de Fátima Marques de Mesquita E.,,Universidade Federal Fluminense,Niteroi,Brazil,,,,,2021-01-01,1 January 2021,Probiotics and Prebiotics in Foods Challenges Innovations and Advances,,21101082466,,Book,,,,263-281,,,5,0,,,,,
