eid,doi,pii,pubmed_id,title,subtype,subtypeDescription,creator,afid,affilname,affiliation_city,affiliation_country,author_count,author_names,author_ids,author_afids,coverDate,coverDisplayDate,publicationName,issn,source_id,eIssn,aggregationType,volume,issueIdentifier,article_number,pageRange,description,authkeywords,citedby_count,openaccess,freetoread,freetoreadLabel,fund_acr,fund_no,fund_sponsor
2-s2.0-85163057208,10.1016/j.ssaho.2023.100581,S2590291123001869,,The strategies of private higher educational institutions during the Covid-19 pandemic. A review of literature,re,Review,do Lago M.M.,,Universidade Federal do Rio de Janeiro;Centro Federal De Educacão Tecnológica Celso Suckow Da Fonseca,Rio de Janeiro;Rio de Janeiro,Brazil;Brazil,,,,,2023-01-01,January 2023,Social Sciences and Humanities Open,,21101142603,25902911,Journal,8,1,100581,,,,3,1,all publisherfullgold repository repositoryvor,All Open Access Gold Green,,,
2-s2.0-85163048860,10.37380/jisib.v13i1.993,,,Narrowing the Marketing Capabilities Gap,ar,Article,Louro A.,,,,,,,,,2023-01-01,2023,Journal of Intelligence Studies in Business,,21100327708,2001015X,Journal,13,1,,76-89,,,0,1,all publisherfullgold,All Open Access Gold,,,
2-s2.0-85162835741,10.1504/IJBIDM.2023.130587,,,Fraud detection with machine learning: model comparison,ar,Article,Pacheco J.,,Fundacao Getulio Vargas,Rio de Janeiro,Brazil,,,,,2023-01-01,2023,International Journal of Business Intelligence and Data Mining,17438187,4100151706,17438195,Journal,22,4,,434-450,,,1,0,,,,,
2-s2.0-85162821269,10.1504/IJLSM.2023.130970,,,Artificial intelligence applied to supply chain operations management: a systematic literature review,ar,Article,Dayrell Mendonça G.,,Universidade Estadual de Campinas,Campinas,Brazil,,,,,2023-01-01,2023,International Journal of Logistics Systems and Management,17427967,4700151504,17427975,Journal,45,1,,1-30,,,4,0,,,,,
2-s2.0-85162797006,10.33168/JLISS.2023.0202,,,A Logistics Management study proposal in a Service Sector through the perspective of the Theory of Constraints,ar,Article,Serrano A.L.M.,,Universidade de Brasília,Brasília,Brazil,,,,,2023-01-01,2023,Journal of Logistics Informatics and Service Science,,21101032143,24092665,Journal,10,2,,15-28,,,1,1,all publisherfullgold,All Open Access Gold,,,
2-s2.0-85162785340,10.33168/JSMS.2023.0335,,,An Applied Study of Data Envelopment Analysis on Brazilian Agriculture Data,ar,Article,Pena C.R.,,Universidade de Brasília,Brasília,Brazil,,,,,2023-01-01,2023,Journal of System and Management Sciences,18166075,21100944442,18180523,Journal,13,3,,517-532,,,0,1,all publisherfree2read,All Open Access Bronze,,,
2-s2.0-85162741089,10.1504/IJLSM.2023.130968,,,Logistics service provider performance evaluation based on different perceptions in the reverse supply chain,ar,Article,de Vasconcelos T.R.S.,,Universidade Federal de Pernambuco,Recife,Brazil,,,,,2023-01-01,2023,International Journal of Logistics Systems and Management,17427967,4700151504,17427975,Journal,45,1,,67-87,,,0,0,,,,,
2-s2.0-85162686653,10.1109/EDUCON54358.2023.10125140,,,Alfaba: A Tangible Solution to Support Brazilian Dyslexic Students in their Literacy Process,cp,Conference Paper,Jurgina L.Q.,,Universidade Federal de Pelotas,Pelotas,Brazil,,,,,2023-01-01,2023,IEEE Global Engineering Education Conference Educon,21659559,21100206205,21659567,Conference Proceeding,2023-May,,,,,,4,0,,,,,
2-s2.0-85161969358,10.1504/IJBIS.2023.131089,,,Ubiquitous computing to accessible way-finding: a systematic mapping study,ar,Article,Werlang W.F.,,Universidade do Vale do Rio dos Sinos,Sao Leopoldo,Brazil,,,,,2023-01-01,2023,International Journal of Business Information Systems,17460972,3900148214,17460980,Journal,43,1,,1-19,,,0,0,,,,,
2-s2.0-85161703647,10.1214/22-AOP1619,,,CONCURRENT DONSKER–VARADHAN AND HYDRODYNAMICAL LARGE DEVIATIONS,ar,Article,Bertini L.,,Sapienza Università di Roma,Rome,Italy,,,,,2023-01-01,2023,Annals of Probability,00911798,24724,2168894X,Journal,51,4,,1298-1341,,,3,2,all repository repositoryam,All Open Access Green,,,
2-s2.0-85161628067,10.1016/j.ssaho.2023.100592,S2590291123001973,,The self-perception of leadership by Brazilian dietitians,ar,Article,Vidigal M.D.,,Universidade de Brasília,Brasília,Brazil,,,,,2023-01-01,January 2023,Social Sciences and Humanities Open,,21101142603,25902911,Journal,8,1,100592,,,,1,1,all publisherfullgold,All Open Access Gold,,,
2-s2.0-85161611405,10.29220/CSAM.2023.30.3.311,,,Simulation studies to compare bayesian wavelet shrinkage methods in aggregated functional data,ar,Article,dos Santos Sousa A.R.,,Universidade Estadual de Campinas,Campinas,Brazil,,,,,2023-01-01,2023,Communications for Statistical Applications and Methods,22877843,21100855735,23834757,Journal,30,3,,311-330,,,0,1,all publisherfullgold repository repositoryam,All Open Access Gold Green,,,
2-s2.0-85161468793,10.1007/978-3-031-31007-2_28,,,Security in Smart Home Using Blockchain,cp,Conference Paper,de Oliveira G.G.,,Universidade Estadual de Campinas,Campinas,Brazil,,,,,2023-01-01,2023,Smart Innovation Systems and Technologies,21903018,21100204111,21903026,Book Series,353 SIST,,,306-313,,,0,0,,,,,
2-s2.0-85161459602,10.1007/978-3-031-31007-2_36,,,Long-Range Network (LoRa) Behavior in the Amazon Region in a Fluvial Environment,cp,Conference Paper,Frazào D.,,Universidade do Estado do Amazonas,Manaus,Brazil,,,,,2023-01-01,2023,Smart Innovation Systems and Technologies,21903018,21100204111,21903026,Book Series,353 SIST,,,391-398,,,0,0,,,,,
2-s2.0-85161457834,10.1007/978-3-031-31007-2_10,,,Analysis of Electrical Neural Data Using MUSE and EEGLAB,cp,Conference Paper,Bonfim M.R.,,Pontificia Universidade Catolica de Campinas,Campinas,Brazil,,,,,2023-01-01,2023,Smart Innovation Systems and Technologies,21903018,21100204111,21903026,Book Series,353 SIST,,,103-117,,,1,0,,,,,
2-s2.0-85161455143,10.1007/978-3-031-31007-2_39,,,Using Thermal Wheels for LAFIQ/Fiocruz Air Conditioning System Heat Recovery,cp,Conference Paper,Rabecchi L.J.P.,,Universidade Presbiteriana Mackenzie,Sao Paulo,Brazil,,,,,2023-01-01,2023,Smart Innovation Systems and Technologies,21903018,21100204111,21903026,Book Series,353 SIST,,,419-427,,,0,0,,,,,
2-s2.0-85161444580,,,,Preface,ed,Editorial,de Oliveira G.G.,,Cidade Universitária,Campinas,Brazil,,,,,2023-01-01,2023,Smart Innovation Systems and Technologies,21903018,21100204111,21903026,Book Series,353 SIST,,,vi,,,0,0,,,,,
2-s2.0-85161442432,10.1007/978-3-031-31007-2_17,,,An Overview of P4-Based Load Balancing Mechanism in SDN,cp,Conference Paper,Ruelas A.M.R.,,Universidade Estadual de Campinas,Campinas,Brazil,,,,,2023-01-01,2023,Smart Innovation Systems and Technologies,21903018,21100204111,21903026,Book Series,353 SIST,,,174-179,,,0,0,,,,,
2-s2.0-85161430702,10.1007/978-3-031-31007-2_9,,,Fault Management in Manufacturing Process: Quality Indicators for Short- and Medium-Term Monitoring and Their Interrelationship,cp,Conference Paper,Homem M.O.,,Ingeteam Ltda,Campinas,Brazil,,,,,2023-01-01,2023,Smart Innovation Systems and Technologies,21903018,21100204111,21903026,Book Series,353 SIST,,,93-102,,,0,0,,,,,
2-s2.0-85161430543,10.1007/978-3-031-31007-2_3,,,Effect Analysis of Service Entrance Box on the Wireless Communication Performance of Home Electric Power Meters,cp,Conference Paper,Minhoto R.J.,,Centro de Tecnologia da Informação Renato Archer,Campinas,Brazil,,,,,2023-01-01,2023,Smart Innovation Systems and Technologies,21903018,21100204111,21903026,Book Series,353 SIST,,,36-44,,,0,0,,,,,
2-s2.0-85161428091,10.1007/978-3-031-31007-2_33,,,Optimal Charging Coordination of Electric Vehicles Using the Teaching-Learning-Based Optimization Algorithm,cp,Conference Paper,Santos E.B.P.,,Pontificia Universidade Catolica de Campinas,Campinas,Brazil,,,,,2023-01-01,2023,Smart Innovation Systems and Technologies,21903018,21100204111,21903026,Book Series,353 SIST,,,361-370,,,0,0,,,,,
2-s2.0-85161427363,10.1007/978-3-031-31007-2_44,,,Footprints’ Effectiveness as Decision-Making Tools for Promoting Sustainability,cp,Conference Paper,Branchi B.A.,,Pontificia Universidade Catolica de Campinas,Campinas,Brazil,,,,,2023-01-01,2023,Smart Innovation Systems and Technologies,21903018,21100204111,21903026,Book Series,353 SIST,,,472-478,,,1,0,,,,,
2-s2.0-85161425960,10.1007/978-3-031-31007-2_23,,,Industry 4.0 and Its Impact on Innovation Projects in Steelworks,cp,Conference Paper,Scopel E.,,Instituto Federal do Espírito Santo,Vitoria,Brazil,,,,,2023-01-01,2023,Smart Innovation Systems and Technologies,21903018,21100204111,21903026,Book Series,353 SIST,,,235-243,,,6,0,,,,,
2-s2.0-85161425395,10.1007/978-3-031-31007-2_35,,,Characterization of the Bones of Different Bovine Breeds Based on the Microarchitecture of the Bone Tissue,cp,Conference Paper,Erbereli R.,,Universidade de São Paulo,Sao Paulo,Brazil,,,,,2023-01-01,2023,Smart Innovation Systems and Technologies,21903018,21100204111,21903026,Book Series,353 SIST,,,382-390,,,0,0,,,,,
2-s2.0-85161419045,10.1007/978-3-031-31007-2_40,,,A Data-Driven Methodology for Analyzing Field Nonconformities in Semiconductor Production Applied to a Brazilian Manufacturer,cp,Conference Paper,de Souza J.M.,,Foundation of Innovation and Technology (FiTec),Campinas,Brazil,,,,,2023-01-01,2023,Smart Innovation Systems and Technologies,21903018,21100204111,21903026,Book Series,353 SIST,,,428-438,,,0,0,,,,,
2-s2.0-85161418948,10.1007/978-3-031-31007-2_29,,,Pregnant Women Diabetic Prediction Using 1D-Convolutional Neural Network and SMOTE Procedure,cp,Conference Paper,Alex S.A.,,St. Xavier's Catholic College of Engineering,Nagercoil,India,,,,,2023-01-01,2023,Smart Innovation Systems and Technologies,21903018,21100204111,21903026,Book Series,353 SIST,,,317-328,,,2,0,,,,,
2-s2.0-85161410867,10.1007/978-3-031-31007-2_30,,,"New Technological Waves Emerging in Digital Transformation: Internet of Things IoT/IoE, 5G/6G Mobile Networks and Industries 4.0/5.0",cp,Conference Paper,Leite J.R.E.,,Universidade Estadual de Campinas,Campinas,Brazil,,,,,2023-01-01,2023,Smart Innovation Systems and Technologies,21903018,21100204111,21903026,Book Series,353 SIST,,,329-339,,,3,0,,,,,
2-s2.0-85161399779,10.1007/978-3-031-31007-2_27,,,Application of Industrial Inspection of Metal Parts by CNN,cp,Conference Paper,de Sousa Silva L.,,Universidade Estadual de Campinas,Campinas,Brazil,,,,,2023-01-01,2023,Smart Innovation Systems and Technologies,21903018,21100204111,21903026,Book Series,353 SIST,,,296-305,,,0,0,,,,,
2-s2.0-85161398486,10.1007/978-3-031-31007-2_4,,,A Digitally Controlled Delay Generator Implemented with Cyclone V FPGA Using Timing Analysis,cp,Conference Paper,Oliveira V.J.S.,,Universidade do Estado de Mato Grosso,Caceres,Brazil,,,,,2023-01-01,2023,Smart Innovation Systems and Technologies,21903018,21100204111,21903026,Book Series,353 SIST,,,45-53,,,0,0,,,,,
2-s2.0-85161394440,10.1007/978-3-031-31007-2_51,,,Management of Family Businesses in the Face of the New Scenario of Global Digital Transformation,cp,Conference Paper,Silva A.L.C.,,FUCAPE Business School,Vitoria,Brazil,,,,,2023-01-01,2023,Smart Innovation Systems and Technologies,21903018,21100204111,21903026,Book Series,353 SIST,,,540-547,,,7,0,,,,,
2-s2.0-85161390396,10.1007/978-3-031-31007-2_52,,,Assessing the Early-Age Drying Shrinkage Cracking in Polyamide and Alkali Resistant Glass Microfibers Reinforced Concrete,cp,Conference Paper,Vianna N.J.,,Pontificia Universidade Catolica de Campinas,Campinas,Brazil,,,,,2023-01-01,2023,Smart Innovation Systems and Technologies,21903018,21100204111,21903026,Book Series,353 SIST,,,548-558,,,1,0,,,,,
2-s2.0-85161382323,10.1007/978-3-031-31007-2_6,,,"Application of Cluster Analysis to Electricity Generation Data from the Santo Antônio Hydroelectric Plant in the State of Rondônia, Brazil",cp,Conference Paper,Ribeiro J.G.,,University of the State of Mato Grosso (UNEMAT),Sinop,Brazil,,,,,2023-01-01,2023,Smart Innovation Systems and Technologies,21903018,21100204111,21903026,Book Series,353 SIST,,,64-74,,,0,0,,,,,
2-s2.0-85161377992,10.1007/978-3-031-31007-2_1,,,Artificial Neural Networks for Prediction of Hot Metal Production in a Blast Furnace,cp,Conference Paper,Cardoso W.,,Università degli Studi di Genova,Genoa,Italy,,,,,2023-01-01,2023,Smart Innovation Systems and Technologies,21903018,21100204111,21903026,Book Series,353 SIST,,,3-10,,,6,0,,,,,
2-s2.0-85161371647,10.1007/978-3-031-31007-2_11,,,Classification of Respiratory Sounds Anomalies Using Digital Audio Signal Processing and Artificial Neural Networks,cp,Conference Paper,Calheiro M.,,Universidade do Estado do Amazonas,Manaus,Brazil,,,,,2023-01-01,2023,Smart Innovation Systems and Technologies,21903018,21100204111,21903026,Book Series,353 SIST,,,118-124,,,1,0,,,,,
2-s2.0-85161371293,10.1007/978-3-031-31007-2_26,,,Petrological Retrospective and Technological Potentials of Magnetite Nanolites in Volcanic Glasses,cp,Conference Paper,Nobre A.G.,,Universidade de São Paulo;Universidade Federal de Santa Maria,Sao Paulo;Santa Maria,Brazil;Brazil,,,,,2023-01-01,2023,Smart Innovation Systems and Technologies,21903018,21100204111,21903026,Book Series,353 SIST,,,288-295,,,2,0,,,,,
2-s2.0-85161361110,10.1007/978-3-031-31007-2_14,,,Batzbot: A Creativity Tool for Disabled Children,cp,Conference Paper,Paulo D.D.,,Pontificia Universidade Catolica de Campinas,Campinas,Brazil,,,,,2023-01-01,2023,Smart Innovation Systems and Technologies,21903018,21100204111,21903026,Book Series,353 SIST,,,146-153,,,0,0,,,,,
2-s2.0-85161324389,10.1108/TQM-09-2022-0279,,,ISO management system standards in the light of corporate sustainability: a bibliometric analysis,ar,Article,Ronalter L.M.,,Universitat de Barcelona,Barcelona,Spain,,,,,2023-01-01,2023,TQM Journal,17542731,11600154157,,Journal,35,9,,256-298,,,11,1,all publisherhybridgold,All Open Access Hybrid Gold,,,
2-s2.0-85161249253,10.1007/978-3-031-33976-9_6,,,An Empirical Study About the Instability and Uncertainty of Non-functional Requirements,cp,Conference Paper,Viviani L.,,Instituto de Pesquisas Tecnologicas,Sao Paulo,Brazil,,,,,2023-01-01,2023,Lecture Notes in Business Information Processing,18651348,17500155101,18651356,Book Series,475 LNBIP,,,77-93,,,7,1,,,,,
2-s2.0-85161217518,10.1007/978-3-031-32534-2_19,,,Behavioral Studies for the Use of Visualization in Holistic Evaluation for Multicriteria Decision Problems Decision,cp,Conference Paper,Ferreira E.B.,,Universidade Federal de Pernambuco,Recife,Brazil,,,,,2023-01-01,2023,Lecture Notes in Business Information Processing,18651348,17500155101,18651356,Book Series,474 LNBIP,,,265-276,,,2,0,,,,,
2-s2.0-85160866866,10.5220/0011841500003467,,,Optimization of SNP Search Based on Masks Using Graphics Processing Unit,cp,Conference Paper,da Cruz Á.M.N.,,"Universidade Estadual Paulista ""Júlio de Mesquita Filho""",Sao Paulo,Brazil,,,,,2023-01-01,2023,International Conference on Enterprise Information Systems Iceis Proceedings,,21101107935,21844992,Conference Proceeding,2,,,134-141,,,0,1,all publisherhybridgold,All Open Access Hybrid Gold,,,
2-s2.0-85160855192,10.5220/0011826600003467,,,Digital Transformation of Public Services from the Perception of ICT Practitioners in a Startup-Based Environment,cp,Conference Paper,Marsicano G.,,Universidade de Brasília,Brasília,Brazil,,,,,2023-01-01,2023,International Conference on Enterprise Information Systems Iceis Proceedings,,21101107935,21844992,Conference Proceeding,2,,,490-497,,,1,1,all publisherhybridgold,All Open Access Hybrid Gold,,,
2-s2.0-85160853182,10.5220/0011966100003467,,,Characterizing Security-Related Commits of JavaScript Engines,cp,Conference Paper,de Oliveira B.G.,,Universidade Federal do Parana,Curitiba,Brazil,,,,,2023-01-01,2023,International Conference on Enterprise Information Systems Iceis Proceedings,,21101107935,21844992,Conference Proceeding,2,,,86-97,,,0,1,all publisherhybridgold,All Open Access Hybrid Gold,,,
2-s2.0-85160849137,10.5220/0011992900003467,,,A Problem Analysis in Game-Based Student Response System from UX Elements Perspective,cp,Conference Paper,Campos B.,,Universidade Federal do Amazonas,Manaus,Brazil,,,,,2023-01-01,2023,International Conference on Enterprise Information Systems Iceis Proceedings,,21101107935,21844992,Conference Proceeding,2,,,328-335,,,0,1,all publisherhybridgold,All Open Access Hybrid Gold,,,
2-s2.0-85160847552,10.5220/0011853800003467,,,Expectation vs Reality: Analyzing the Competencies of Software Testing Teams,cp,Conference Paper,Maia N.,,Universidade Federal do Amazonas;Instituto de Pesquisas Eldorado,Manaus;Campinas,Brazil;Brazil,,,,,2023-01-01,2023,International Conference on Enterprise Information Systems Iceis Proceedings,,21101107935,21844992,Conference Proceeding,2,,,152-159,,,0,1,all publisherhybridgold,All Open Access Hybrid Gold,,,
2-s2.0-85160846791,10.5220/0011991500003467,,,Parallelism in the Generation of Concepts Through the Formal Context Object Partitioning Using the In-Close 4 Algorithm,cp,Conference Paper,Alves A.,,Pontificia Universidade Catolica de Minas Gerais,Belo Horizonte,Brazil,,,,,2023-01-01,2023,International Conference on Enterprise Information Systems Iceis Proceedings,,21101107935,21844992,Conference Proceeding,2,,,195-202,,,0,1,all publisherhybridgold,All Open Access Hybrid Gold,,,
2-s2.0-85160836123,10.5220/0011985300003467,,,People Management Problems and Practices in Software Development Projects: A Systematic Literature Review,cp,Conference Paper,Burkard M.F.,,Universidade Federal de Santa Maria,Santa Maria,Brazil,,,,,2023-01-01,2023,International Conference on Enterprise Information Systems Iceis Proceedings,,21101107935,21844992,Conference Proceeding,2,,,179-186,,,0,1,all publisherhybridgold,All Open Access Hybrid Gold,,,
2-s2.0-85160833411,10.5220/0011988500003467,,,SysIoTML: A Technique for Modeling Applications in the Context of IoT,cp,Conference Paper,Nascimento R.,,Universidade Federal do Maranhão,Sao Luis,Brazil,,,,,2023-01-01,2023,International Conference on Enterprise Information Systems Iceis Proceedings,,21101107935,21844992,Conference Proceeding,2,,,187-194,,,2,1,all publisherhybridgold,All Open Access Hybrid Gold,,,
2-s2.0-85160828404,10.5220/0011812400003467,,,Remote and Collaborative Software Development Projects: A Requirements Elicitation Exploratory Study,cp,Conference Paper,Grotta A.,,"Universidade de São Paulo;Instituto Federal de Educação, Ciência e Tecnologia de São Paulo",Sao Paulo;Sao Paulo,Brazil;Brazil,,,,,2023-01-01,2023,International Conference on Enterprise Information Systems Iceis Proceedings,,21101107935,21844992,Conference Proceeding,2,,,117-125,,,0,1,all publisherhybridgold,All Open Access Hybrid Gold,,,
2-s2.0-85160826933,10.5220/0011849000003467,,,An Experience in the Gather.town: Factors That Promote Immersion in Systems for the Metaverse,cp,Conference Paper,Duarte J.C.,,Universidade Federal do Amazonas;Institute of Computing,Manaus;Manaus,Brazil;Brazil,,,,,2023-01-01,2023,International Conference on Enterprise Information Systems Iceis Proceedings,,21101107935,21844992,Conference Proceeding,2,,,304-311,,,0,1,all publisherhybridgold,All Open Access Hybrid Gold,,,
2-s2.0-85160823794,10.5220/0011852300003467,,,Analyzing Software Architecture Documentation Models According to Agile Characteristics,cp,Conference Paper,Barreto L.,,Universidade Federal do Amazonas,Manaus,Brazil,,,,,2023-01-01,2023,International Conference on Enterprise Information Systems Iceis Proceedings,,21101107935,21844992,Conference Proceeding,2,,,75-85,,,0,1,all publisherhybridgold,All Open Access Hybrid Gold,,,
2-s2.0-85160822631,10.5220/0011843600003467,,,Towards a Transition Matrix-Based Concept Drift Approach: Experiments on the Detection Task,cp,Conference Paper,Meira Neto A.C.,,Universidade de São Paulo,Sao Paulo,Brazil,,,,,2023-01-01,2023,International Conference on Enterprise Information Systems Iceis Proceedings,,21101107935,21844992,Conference Proceeding,2,,,361-372,,,2,1,all publisherhybridgold,All Open Access Hybrid Gold,,,
2-s2.0-85160820251,10.5220/0011848600003467,,,"Engagement, Participation, and Liveness: Understanding Audience Interaction in Technology-Based Events",cp,Conference Paper,Gomes G.,,Universidade Federal do Amazonas,Manaus,Brazil,,,,,2023-01-01,2023,International Conference on Enterprise Information Systems Iceis Proceedings,,21101107935,21844992,Conference Proceeding,2,,,264-275,,,5,1,all publisherhybridgold,All Open Access Hybrid Gold,,,
2-s2.0-85160820169,10.5220/0011847600003467,,,Investigating Bug Report Changes in Bugzilla,cp,Conference Paper,de Oliveira Calixto F.E.,,Universidade Federal de Campina Grande,Campina Grande,Brazil,,,,,2023-01-01,2023,International Conference on Enterprise Information Systems Iceis Proceedings,,21101107935,21844992,Conference Proceeding,2,,,55-64,,,0,1,all publisherhybridgold,All Open Access Hybrid Gold,,,
2-s2.0-85160819232,10.5220/0011994200003467,,,UXNator: A Tool for Recommending UX Evaluation Methods,cp,Conference Paper,Oliveira S.,,Universidade Federal do Amazonas;USES Research Group - Institute of Computing (IComp),Manaus;Manaus,Brazil;Brazil,,,,,2023-01-01,2023,International Conference on Enterprise Information Systems Iceis Proceedings,,21101107935,21844992,Conference Proceeding,2,,,336-343,,,2,1,all publisherhybridgold,All Open Access Hybrid Gold,,,
2-s2.0-85160817651,10.5220/0011781100003467,,,On the Automatic Generation of Knowledge Connections,cp,Conference Paper,Fraga F.P.A.,,Pontifícia Universidade Católica do Rio de Janeiro,Rio de Janeiro,Brazil,,,,,2023-01-01,2023,International Conference on Enterprise Information Systems Iceis Proceedings,,21101107935,21844992,Conference Proceeding,2,,,43-54,,,1,1,all publisherhybridgold,All Open Access Hybrid Gold,,,
2-s2.0-85160808990,10.5220/0011774100003467,,,A User-Centered Approach to Analyze Public Service Apps Based on Reviews,cp,Conference Paper,Pedrosa G.V.,,Universidade de Brasília,Brasília,Brazil,,,,,2023-01-01,2023,International Conference on Enterprise Information Systems Iceis Proceedings,,21101107935,21844992,Conference Proceeding,1,,,453-459,,,0,1,all publisherhybridgold,All Open Access Hybrid Gold,,,
2-s2.0-85160808940,10.5220/0011962000003467,,,GOTE: An Edge Computing Architecture for Mobile Gaming,cp,Conference Paper,Robaina G.,,Universidade do Estado de Santa Catarina,Florianopolis,Brazil,,,,,2023-01-01,2023,International Conference on Enterprise Information Systems Iceis Proceedings,,21101107935,21844992,Conference Proceeding,1,,,721-730,,,1,1,all publisherhybridgold,All Open Access Hybrid Gold,,,
2-s2.0-85160808803,10.5220/0011728400003467,,,Legal Information Retrieval Based on a Concept-Frequency Representation and Thesaurus,cp,Conference Paper,Costa W.M.,,Universidade de Brasília,Brasília,Brazil,,,,,2023-01-01,2023,International Conference on Enterprise Information Systems Iceis Proceedings,,21101107935,21844992,Conference Proceeding,1,,,303-311,,,2,1,all publisherhybridgold,All Open Access Hybrid Gold,,,
2-s2.0-85160808036,10.5220/0011972200003467,,,Towards Autonomous Mobile Inspection Robots Using Edge AI,cp,Conference Paper,Câmara de M Santos R.C.,,Universidade Federal de Ouro Preto,Ouro Preto,Brazil,,,,,2023-01-01,2023,International Conference on Enterprise Information Systems Iceis Proceedings,,21101107935,21844992,Conference Proceeding,1,,,555-562,,,2,1,all publisherhybridgold,All Open Access Hybrid Gold,,,
2-s2.0-85160805353,10.5220/0011852000003467,,,A Computational Model for Predicting Cryptocurrencies Using Exogenous Variables,cp,Conference Paper,Gonçalves E.M.,,Universidade Federal do Rio Grande,Rio Grande,Brazil,,,,,2023-01-01,2023,International Conference on Enterprise Information Systems Iceis Proceedings,,21101107935,21844992,Conference Proceeding,1,,,180-186,,,0,1,all publisherhybridgold,All Open Access Hybrid Gold,,,
2-s2.0-85160803479,10.5220/0011728800003467,,,A Classifier-Based Approach to Predict the Approval of Legislative Propositions,cp,Conference Paper,Cabral I.C.D.,,Universidade de Brasília,Brasília,Brazil,,,,,2023-01-01,2023,International Conference on Enterprise Information Systems Iceis Proceedings,,21101107935,21844992,Conference Proceeding,1,,,436-442,,,0,1,all publisherhybridgold,All Open Access Hybrid Gold,,,
2-s2.0-85160800046,10.5220/0011725300003467,,,Improved ACO Rank-Based Algorithm for Use in Selecting Features for Classification Models,cp,Conference Paper,Delamora R.A.,,Vale S.A.,Rio de Janeiro,Brazil,,,,,2023-01-01,2023,International Conference on Enterprise Information Systems Iceis Proceedings,,21101107935,21844992,Conference Proceeding,1,,,291-302,,,0,1,all publisherhybridgold,All Open Access Hybrid Gold,,,
2-s2.0-85160788086,10.5220/0011995500003467,,,BATMAN: A Big Data Platform for Misinformation Monitoring,cp,Conference Paper,Claudino I.,,Universidade Federal do Ceará,Fortaleza,Brazil,,,,,2023-01-01,2023,International Conference on Enterprise Information Systems Iceis Proceedings,,21101107935,21844992,Conference Proceeding,1,,,237-246,,,2,1,all publisherhybridgold,All Open Access Hybrid Gold,,,
2-s2.0-85160786628,10.5220/0011758900003467,,,Indexing High-Dimensional Vector Streams,cp,Conference Paper,Pinheiro J.P.V.,,Pontifícia Universidade Católica do Rio de Janeiro,Rio de Janeiro,Brazil,,,,,2023-01-01,2023,International Conference on Enterprise Information Systems Iceis Proceedings,,21101107935,21844992,Conference Proceeding,1,,,32-43,,,1,1,all publisherhybridgold,All Open Access Hybrid Gold,,,
2-s2.0-85160778796,10.5220/0011968900003467,,,An Automatic Ant Counting and Distribution Estimation System Using Convolutional Neural Networks,cp,Conference Paper,Silva M.C.,,Universidade Federal de Ouro Preto,Ouro Preto,Brazil,,,,,2023-01-01,2023,International Conference on Enterprise Information Systems Iceis Proceedings,,21101107935,21844992,Conference Proceeding,1,,,547-554,,,1,1,all publisherhybridgold,All Open Access Hybrid Gold,,,
