eid,doi,pii,pubmed_id,title,subtype,subtypeDescription,creator,afid,affilname,affiliation_city,affiliation_country,author_count,author_names,author_ids,author_afids,coverDate,coverDisplayDate,publicationName,issn,source_id,eIssn,aggregationType,volume,issueIdentifier,article_number,pageRange,description,authkeywords,citedby_count,openaccess,freetoread,freetoreadLabel,fund_acr,fund_no,fund_sponsor
2-s2.0-85151747965,10.1016/j.ijpe.2023.108856,S0925527323000889,,Exploratory decision robustness analysis of the theory of constraints focusing process using system dynamics modeling,ar,Article,Machado M.P.,,Universidade do Vale do Rio dos Sinos,Sao Leopoldo,Brazil,,,,,2023-06-01,June 2023,International Journal of Production Economics,09255273,19165,,Journal,260,,108856,,,,5,0,,,,,
2-s2.0-85151655666,10.1016/j.rtbm.2023.100966,S2210539523000226,,A system dynamics model for analyzing modal shift policies towards decarbonization in freight transportation,ar,Article,Nassar R.F.,,"Delft University of Technology;Faculteit Techniek, Bestuur en Management, TU Delft",Delft;Delft,Netherlands;Netherlands,,,,,2023-06-01,June 2023,Research in Transportation Business and Management,22105395,20500195043,,Journal,48,,100966,,,,31,1,all publisherhybridgold repository repositoryvor,All Open Access Hybrid Gold Green,,,
2-s2.0-85151548555,10.1016/j.dajour.2023.100209,S2772662223000498,,A novel approach for complex and subjective variable valuation in the COPPE-Cosenza fuzzy model applied to crude oil trading,re,Review,Andrade G.B.,,Universidade Federal do Rio de Janeiro,Rio de Janeiro,Brazil,,,,,2023-06-01,June 2023,Decision Analytics Journal,,21101098756,27726622,Journal,7,,100209,,,,0,1,all publisherfullgold,All Open Access Gold,,,
2-s2.0-85151514098,10.1016/j.dajour.2023.100217,S2772662223000577,,A Delphi fuzzy analytic hierarchy process framework for criteria classification and prioritization in food supply chains under uncertainty,ar,Article,Gupta S.,,"Jaipuria Institute of Management, Jaipur",Jaipur,India,,,,,2023-06-01,June 2023,Decision Analytics Journal,,21101098756,27726622,Journal,7,,100217,,,,31,1,all publisherfullgold,All Open Access Gold,,,
2-s2.0-85151282744,10.1016/j.ijpe.2023.108858,S0925527323000907,,When technologies become Industry 4.0 platforms: Defining the role of digital technologies through a boundary-spanning perspective,ar,Article,Benitez G.B.,,Universidade Federal do Rio Grande do Sul;Pontifícia Universidade Católica do Paraná,Porto Alegre;Curitiba,Brazil;Brazil,,,,,2023-06-01,June 2023,International Journal of Production Economics,09255273,19165,,Journal,260,,108858,,,,49,2,all repository repositoryvor,All Open Access Green,,,
2-s2.0-85151011335,10.1016/j.ijpe.2023.108846,S0925527323000786,,Modeling production disorder: Procedures for digital twins of flexibility-driven manufacturing systems,ar,Article,Neto A.A.,,Pontifícia Universidade Católica do Paraná,Curitiba,Brazil,,,,,2023-06-01,June 2023,International Journal of Production Economics,09255273,19165,,Journal,260,,108846,,,,12,0,,,,,
2-s2.0-85150381993,10.1016/j.seps.2023.101537,S003801212300037X,,The impact of regulation on the Brazilian water and sewerage companies’ efficiency,ar,Article,Carvalho A.E.C.,,Universidade Federal do Rio Grande do Norte,Natal,Brazil,,,,,2023-06-01,June 2023,Socio Economic Planning Sciences,00380121,18291,,Journal,87,,101537,,,,4,0,,,,,
2-s2.0-85150214820,10.1016/j.dajour.2023.100196,S277266222300036X,,"Erratum to “Robust stochastic frontier analysis applied to the Brazilian electricity distribution benchmarking method” [Decis. Anal. J. 3 (2022) 100051] (Decision Analytics Journal (2022) 3, (S2772662222000169), (10.1016/j.dajour.2022.100051))",er,Erratum,Campos M.S.,,Universidade Federal de Ouro Preto,Ouro Preto,Brazil,,,,,2023-06-01,June 2023,Decision Analytics Journal,,21101098756,27726622,Journal,7,,100196,,,,0,1,all publisherfullgold,All Open Access Gold,,,
2-s2.0-85149877995,10.1016/j.seps.2023.101544,S0038012123000447,,Impact of R&D and innovation in Chinese road transportation sustainability performance: A novel trigonometric envelopment analysis for ideal solutions (TEA-IS),ar,Article,Antunes J.,,Universidade Federal do Rio de Janeiro,Rio de Janeiro,Brazil,,,,,2023-06-01,June 2023,Socio Economic Planning Sciences,00380121,18291,,Journal,87,,101544,,,,19,0,,,,,
2-s2.0-85149722950,10.1016/j.accinf.2023.100618,S1467089523000106,,Machine learning-based automation of accounting services: An exploratory case study,ar,Article,Bavaresco R.S.,,Universidade do Vale do Rio dos Sinos,Sao Leopoldo,Brazil,,,,,2023-06-01,June 2023,International Journal of Accounting Information Systems,14670895,29806,,Journal,49,,100618,,,,12,0,,,,,
2-s2.0-85149440496,10.1016/j.ins.2023.02.087,S0020025523002827,,Public bicycle sharing systems control and performance evaluation: A Petri net-based approach,ar,Article,Igreja de Freitas B.,,Universidade Federal do Rio de Janeiro,Rio de Janeiro,Brazil,,,,,2023-06-01,June 2023,Information Sciences,00200255,15134,,Journal,632,,,19-50,,,4,0,,,,,
2-s2.0-85148885148,10.1007/s11749-023-00849-y,,,Non-linear INAR(1) processes under an alternative geometric thinning operator,ar,Article,Barreto-Souza W.,,University College Dublin;King Abdullah University of Science and Technology,Dublin;Thuwal,Ireland;Saudi Arabia,,,,,2023-06-01,June 2023,Test,11330686,14882,18638260,Journal,32,2,,695-725,,,0,1,all publisherhybridgold,All Open Access Hybrid Gold,,,
2-s2.0-85148373659,10.1016/j.seps.2023.101536,S0038012123000368,,Sensitivity of market performance to social risk index: Evidence from global listed companies in logistics and transportation industry,ar,Article,Marashdeh H.,,Abu Dhabi University,Abu Dhabi,United Arab Emirates,,,,,2023-06-01,June 2023,Socio Economic Planning Sciences,00380121,18291,,Journal,87,,101536,,,,4,0,,,,,
2-s2.0-85148330208,10.1016/j.ins.2023.02.027,S0020025523002165,,Interval incremental learning of interval data streams and application to vehicle tracking,ar,Article,Leite D.,,Universidad Adolfo Ibáñez,Santiago,Chile,,,,,2023-06-01,June 2023,Information Sciences,00200255,15134,,Journal,630,,,1-22,,,13,0,,,,,
2-s2.0-85148324707,10.1016/j.ins.2023.01.149,S0020025523001652,,A deep multiple kernel learning-based higher-order fuzzy inference system for identifying DNA N4-methylcytosine sites,ar,Article,Wang L.,,Tianjin University,Tianjin,China,,,,,2023-06-01,June 2023,Information Sciences,00200255,15134,,Journal,630,,,40-52,,,31,0,,,,,
2-s2.0-85146538844,10.1016/j.seps.2023.101511,S0038012123000046,,How risk perception regarding the COVID-19 pandemic affected household food waste: Evidence from Brazil,ar,Article,Deliberador L.R.,,Universidade Federal de São Carlos,Sao Carlos,Brazil,,,,,2023-06-01,June 2023,Socio Economic Planning Sciences,00380121,18291,,Journal,87,,101511,,,,11,1,all publisherfree2read repository repositoryvor,All Open Access Bronze Green,,,
2-s2.0-85144651166,10.1007/s40808-022-01626-w,,,Recurrent neural networks for rainfall-runoff modeling of small Amazon catchments,ar,Article,de Mendonça L.M.,,Universidade Federal do Pará,Belem,Brazil,,,,,2023-06-01,June 2023,Modeling Earth Systems and Environment,23636203,21100981415,23636211,Journal,9,2,,2517-2531,,,7,0,,,,,
2-s2.0-85142459581,10.1007/s12063-022-00333-0,,,Exploring outsourcing service productivity from the buyer and supplier perspective: A case analysis in the fleet maintenance industry,ar,Article,Marques R.,,Sodexo Inc,Barueri,Brazil,,,,,2023-06-01,June 2023,Operations Management Research,19369735,15700154705,19369743,Journal,16,2,,853-867,,,1,0,,,,,
2-s2.0-85142271918,10.1007/s40863-022-00345-5,,,Counting square-free monomial Cremona maps,ar,Article,Costa B.,,Universidade Federal Rural de Pernambuco,Recife,Brazil,,,,,2023-06-01,June 2023,Sao Paulo Journal of Mathematical Sciences,19826907,21100901061,23169028,Journal,17,1,,76-101,,,0,2,all repository repositoryam,All Open Access Green,,,
2-s2.0-85142219674,10.1007/s10100-022-00826-0,,,The cutting stock problem applied to the hardening process in an automotive spring factory,ar,Article,de Lara Andrade P.R.,,"Universidade Estadual Paulista ""Júlio de Mesquita Filho"";Federal University of Technology - Paraná (UTFPR-AP)",Sao Paulo;Londrina,Brazil;Brazil,,,,,2023-06-01,June 2023,Central European Journal of Operations Research,1435246X,5000158106,16139178,Journal,31,2,,637-664,,,1,0,,,,,
2-s2.0-85140798071,10.1016/j.ejor.2022.10.001,S0377221722007706,,New pricing strategies and an effective exact solution framework for profit-oriented ring arborescence problems,ar,Article,Baldacci R.,,"Hamad Bin Khalifa University, College of Science and Engineering",Doha,Qatar,,,,,2023-06-01,1 June 2023,European Journal of Operational Research,03772217,22489,,Journal,307,2,,538-553,,,0,0,,,,,
2-s2.0-85140442934,10.1007/s10260-022-00669-8,,,Dual frame design in agricultural surveys: reviewing roots and methodological perspectives,ar,Article,Ferraz C.,,Universidade Federal de Pernambuco,Recife,Brazil,,,,,2023-06-01,June 2023,Statistical Methods and Applications,16182510,145729,1613981X,Journal,32,2,,593-617,,,0,0,,,,,
2-s2.0-85139498785,10.1007/s10959-022-01202-z,,,A Version of the Random Directed Forest and its Convergence to the Brownian Web,ar,Article,Valle G.,,Universidade Federal do Rio de Janeiro,Rio de Janeiro,Brazil,,,,,2023-06-01,June 2023,Journal of Theoretical Probability,08949840,23978,15729230,Journal,36,2,,948-1002,,,1,0,,,,,
2-s2.0-85139397097,10.1111/sjos.12611,,,On the robustness to outliers of the Student-t process,ar,Article,Andrade J.A.A.,,Universidade Federal do Ceará,Fortaleza,Brazil,,,,,2023-06-01,June 2023,Scandinavian Journal of Statistics,03036898,14072,14679469,Journal,50,2,,725-749,,,8,0,,,,,
2-s2.0-85138034504,10.1007/s40863-022-00328-6,,,"Tight and adjusted equigenerated sequences, and the special fiber",ar,Article,Ramos Z.,,Université Fédérale de Sergipe,Sao Cristovao,Brazil,,,,,2023-06-01,June 2023,Sao Paulo Journal of Mathematical Sciences,19826907,21100901061,23169028,Journal,17,1,,320-344,,,1,0,,,,,
2-s2.0-85135710942,10.1007/s10959-022-01187-9,,,Reaction–Diffusion Models for a Class of Infinite-Dimensional Nonlinear Stochastic Differential Equations,ar,Article,da Costa C.,,Durham University,Durham,United Kingdom,,,,,2023-06-01,June 2023,Journal of Theoretical Probability,08949840,23978,15729230,Journal,36,2,,1059-1087,,,0,1,all publisherhybridgold,All Open Access Hybrid Gold,,,
2-s2.0-85133877498,10.1007/s13385-022-00319-z,,,A public micro pension programme in Brazil: heterogeneity among states and setting up of a benefit age adjustment,ar,Article,Alcoforado R.G.,,Universidade Federal de Pernambuco;ISEG Lisbon School of Economics and Management,Recife;Lisbon,Brazil;Portugal,,,,,2023-06-01,June 2023,European Actuarial Journal,21909733,21100446929,21909741,Journal,13,1,,427-467,,,0,2,all repository repositoryam,All Open Access Green,,,
2-s2.0-85133078756,10.1007/s40863-022-00312-0,,,LCD codes arising from wavelets,ar,Article,de Melo-Hernández F.D.,,Universidade Estadual de Maringá,Maringa,Brazil,,,,,2023-06-01,June 2023,Sao Paulo Journal of Mathematical Sciences,19826907,21100901061,23169028,Journal,17,1,,300-305,,,0,0,,,,,
2-s2.0-85131520115,10.1007/s40863-022-00308-w,,,A family of codes with variable locality and availability,ar,Article,Carvalho C.,,Universidade Federal de Uberlândia,Uberlandia,Brazil,,,,,2023-06-01,June 2023,Sao Paulo Journal of Mathematical Sciences,19826907,21100901061,23169028,Journal,17,1,,55-63,,,1,2,all repository repositoryam,All Open Access Green,,,
2-s2.0-85131404093,10.1007/s00180-022-01235-2,,,Bayesian spatial quantile modeling applied to the incidence of extreme poverty in Lima–Peru,ar,Article,García C.,,Pontificia Universidad Catolica del Peru,Lima,Peru,,,,,2023-06-01,June 2023,Computational Statistics,09434062,28930,16139658,Journal,38,2,,603-621,,,3,0,,,,,
2-s2.0-85127259106,10.1002/asi.24650,,,Information organization and representation in digital cultural heritage in Brazil: Systematic mapping of information infrastructure in digital collections for data science applications,ar,Article,Martins D.L.,,Universidade de Brasília,Brasília,Brazil,,,,,2023-06-01,June 2023,Journal of the Association for Information Science and Technology,23301635,21100307484,23301643,Journal,74,6,,707-726,,,7,0,,,,,
2-s2.0-85126090035,10.1057/s41270-022-00162-x,,,Does demand forecasting matter to retailing?,ar,Article,de Almeida W.M.,,Pontifícia Universidade Católica do Paraná,Curitiba,Brazil,,,,,2023-06-01,June 2023,Journal of Marketing Analytics,20503318,21100834347,20503326,Journal,11,2,,219-232,,,3,0,,,,,
2-s2.0-85107501683,10.1007/s40745-021-00347-8,,,The Logit Exponentiated Power Exponential Regression with Applications,ar,Article,Prataviera F.,,Universidade de São Paulo,Sao Paulo,Brazil,,,,,2023-06-01,June 2023,Annals of Data Science,21985804,21101023806,21985812,Journal,10,3,,713-735,,,2,0,,,,,
2-s2.0-85162236053,10.1108/JM2-07-2023-326,,,Guest editorial: Modelling the business and societal decisions under the impact of COVID-19,ed,Editorial,Shah B.,,Indian Institute of Management Sirmaur,Paonta Sahib,India,,,,,2023-05-29,29 May 2023,Journal of Modelling in Management,17465664,21100438074,17465672,Journal,18,4,,1017-1021,,,1,1,all publisherfree2read,All Open Access Bronze,,,
2-s2.0-85140302941,10.1108/JM2-03-2022-0072,,,Investigating the impact of COVID-19 on sustainable food supply chains,ar,Article,Kumar V.,,Graphic Era Deemed to be University;Bristol Business School,Dehradun;Bristol,India;United Kingdom,,,,,2023-05-29,29 May 2023,Journal of Modelling in Management,17465664,21100438074,17465672,Journal,18,4,,1250-1273,,,14,2,all repository repositoryam,All Open Access Green,,,
2-s2.0-85151449355,10.1016/j.jmapro.2023.03.060,S1526612523002736,,On the mechanical behavior of the sintered Nd-Fe-B permanent magnet during diamond scratching,ar,Article,Costa E.C.,,Universidade Federal de Santa Catarina,Florianopolis,Brazil,,,,,2023-05-26,26 May 2023,Journal of Manufacturing Processes,15266125,27677,,Journal,94,,,79-93,,,8,0,,,,,
2-s2.0-85153752515,10.1108/MD-03-2022-0271,,,"Shop floor performance feedback, employee's motivation and engagement: study of a beverage distribution company",ar,Article,Marodin G.A.,,Universidade Federal do Rio Grande do Sul;Darla Moore School of Business,Porto Alegre;Columbia,Brazil;United States,,,,,2023-05-22,22 May 2023,Management Decision,00251747,144656,,Journal,61,6,,1535-1553,,,3,0,,,,,
2-s2.0-85152789496,10.1108/ICS-10-2021-0159,,,Online security in e-government as an antecedent of cost-effectiveness and quality in business operations,ar,Article,Tegethoff T.,,Colegio de Estudios Superiores de Administración - CESA,Bogota,Colombia,,,,,2023-05-19,19 May 2023,Information and Computer Security,20564961,21100421900,2056497X,Journal,31,2,,125-144,,,5,0,,,,,
2-s2.0-85138064000,10.1016/j.ejor.2022.08.036,S0377221722006816,,A multi-start local search heuristic for the multi-period auto-carrier loading and transportation problem in Brazil,ar,Article,Bonassa A.C.,,Universidade de São Paulo,Sao Paulo,Brazil,,,,,2023-05-16,16 May 2023,European Journal of Operational Research,03772217,22489,,Journal,307,1,,193-211,,,3,0,,,,,
2-s2.0-85144172934,10.1108/JOCM-03-2022-0061,,,Fit for functional differentiation: new directions for personnel management and organizational change bridging the fit theory and social systems theory,ar,Article,Sales A.,,"Fundacao Getulio Vargas;Instituto Brasileiro de Mercado de Capitais, Rio de Janeiro",Rio de Janeiro;Rio de Janeiro,Brazil;Brazil,,,,,2023-05-10,10 May 2023,Journal of Organizational Change Management,09534814,20670,,Journal,36,2,,273-289,,,16,0,,,,,
2-s2.0-85146388600,10.1108/IJOPM-01-2022-0047,,,Bridging sustainability knowledge management and supply chain learning: evidence through buyer selection,ar,Article,Silva M.E.,,Excelia Business School,La Rochelle,France,,,,,2023-05-08,8 May 2023,International Journal of Operations and Production Management,01443577,20039,17586593,Journal,43,6,,947-983,,,15,2,all repository repositoryam,All Open Access Green,,,
2-s2.0-85169819422,10.1590/1982-7849rac2023220045.en,,,The Case of the Case: The Writing and Application of the Method,ar,Article,Dos Passos A.P.P.,,Universidade do Vale do Itajai,Itajai,Brazil,,,,,2023-05-01,May-June 2023,Revista De Administracao Contemporanea,14156555,21101089574,19827849,Journal,27,3,e220045,,,,0,1,all publisherfullgold,All Open Access Gold,,,
2-s2.0-85168096947,10.1590/1982-7849rac2023220199.por,,,The Distinguished Guest: Notes on Participation and Teaching Practice in Examining Boards,ar,Article,Vieira F.G.D.,,Universidade Estadual de Maringá,Maringa,Brazil,,,,,2023-05-01,May-June 2023,Revista De Administracao Contemporanea,14156555,21101089574,19827849,Journal,27,3,e220199,,,,0,1,all publisherfullgold,All Open Access Gold,,,
2-s2.0-85164169679,10.1051/ro/2023081,,,A biased random-key genetic algorithm for the chordal completion problem,ar,Article,Silva S.E.,,Universidade Federal Fluminense,Niteroi,Brazil,,,,,2023-05-01,1 May 2023,RAIRO Operations Research,,12991,28047303,Journal,57,3,,1559-1578,,,5,1,all publisherhybridgold,All Open Access Hybrid Gold,,,
2-s2.0-85163278555,10.1287/ijoc.2023.1288,,,Decomposition Strategies for Vehicle Routing Heuristics,ar,Article,Santini A.,,ESSEC Business School;Barcelona School of Economics;Facultat d'Economia i Empresa;CY Advanced Studies,Cergy-Pontoise;Barcelona;Barcelona;Neuville-sur-Oise,France;Spain;Spain;France,,,,,2023-05-01,May 2023,Informs Journal on Computing,10919856,25040,15265528,Journal,35,3,,543-559,,,14,0,,,,,
2-s2.0-85161043854,10.1287/moor.2022.1285,,,Strong Convexity of Feasible Sets in Off-line and Online Optimization,ar,Article,Molinaro M.,,Pontifícia Universidade Católica do Rio de Janeiro,Rio de Janeiro,Brazil,,,,,2023-05-01,May 2023,Mathematics of Operations Research,0364765X,22140,15265471,Journal,48,2,,865-884,,,3,0,,,,,
2-s2.0-85160425360,10.1051/ro/2023047,,,Computing role assignments of Cartesian product of graphs,ar,Article,Castonguay D.,,Universidade Federal de Goiás,Goiania,Brazil,,,,,2023-05-01,1 May 2023,RAIRO Operations Research,,12991,28047303,Journal,57,3,,1075-1086,,,2,1,all publisherhybridgold repository repositoryvor,All Open Access Hybrid Gold Green,,,
2-s2.0-85160326043,10.1051/ro/2023055,,,Branch-and-cut algorithms for the covering salesman problem,ar,Article,Maziero L.P.,,Universidade Estadual de Campinas,Campinas,Brazil,,,,,2023-05-01,1 May 2023,RAIRO Operations Research,,12991,28047303,Journal,57,3,,1149-1166,,,2,1,all publisherhybridgold repository repositoryvor repositoryam,All Open Access Hybrid Gold Green,,,
2-s2.0-85160311865,10.1051/ro/2023052,,,Algorithms for the genome median under a restricted measure of rearrangement,ar,Article,Neto M.B.C.,,,,,,,,,2023-05-01,1 May 2023,RAIRO Operations Research,,12991,28047303,Journal,57,3,,1045-1058,,,1,1,all publisherhybridgold repository repositoryvor,All Open Access Hybrid Gold Green,,,
2-s2.0-85159939027,10.1590/1982-7849rac2023230077,,,Impact Research: Theory and Practice in the Corporate World,ed,Editorial,Martins O.S.,,Universidade Federal da Paraíba;Revista de Administração Contemporânea,Joao Pessoa;,Brazil;Brazil,,,,,2023-05-01,May-June 2023,Revista De Administracao Contemporanea,14156555,21101089574,19827849,Journal,27,3,e230077,,,,1,0,,,,,
2-s2.0-85159197035,10.1590/1982-7849rac2023230021.en,,,Using Deep Learning Language Models as Scaffolding Tools in Interpretive Research,ar,Article,Fonseca A.L.A.d.,,Universidade Federal do Rio de Janeiro,Rio de Janeiro,Brazil,,,,,2023-05-01,May-June 2023,Revista De Administracao Contemporanea,14156555,21101089574,19827849,Journal,27,3,e230021,,,,3,1,all publisherfullgold,All Open Access Gold,,,
2-s2.0-85159161852,10.1590/1982-7849rac2023220063.por,,,Nuveo: Digital Ethics and Artificial Intelligence for Real World Challenges,ar,Article,Biondi G.M.C.B.,,Fundacao Getulio Vargas,Rio de Janeiro,Brazil,,,,,2023-05-01,May-June 2023,Revista De Administracao Contemporanea,14156555,21101089574,19827849,Journal,27,3,e220063,,,,2,1,all publisherfullgold,All Open Access Gold,,,
2-s2.0-85159159046,10.1590/1982-7849rac2023220089.en,,,Organic Cosmetics and the Use of Emotional Appeals,ar,Article,de Souza L.L.F.,,Universidade de Fortaleza,Fortaleza,Brazil,,,,,2023-05-01,May-June 2023,Revista De Administracao Contemporanea,14156555,21101089574,19827849,Journal,27,3,e220089,,,,2,1,all publisherfullgold,All Open Access Gold,,,
2-s2.0-85159156994,10.1590/1982-7849rac2023220097.en,,,BRK Ambiental Sumaré: Operational Excellence And Continuous Improvement,ar,Article,Santos J.B.,,Fundacao Getulio Vargas,Rio de Janeiro,Brazil,,,,,2023-05-01,May-June 2023,Revista De Administracao Contemporanea,14156555,21101089574,19827849,Journal,27,3,e220097,,,,0,1,all publisherfullgold,All Open Access Gold,,,
2-s2.0-85159156192,10.1590/1982-7849rac2023220068.en,,,(Non)Monetary Behaviors: How Morality and Status Shape Consumers’ Perceptions about Sustainable Actions,ar,Article,Maior C.S.,,Universidade Federal do Parana,Curitiba,Brazil,,,,,2023-05-01,May-June 2023,Revista De Administracao Contemporanea,14156555,21101089574,19827849,Journal,27,3,e220068,,,,1,1,all publisherfullgold,All Open Access Gold,,,
2-s2.0-85156106568,10.1016/j.datak.2023.102177,S0169023X2300037X,,Preface,ed,Editorial,Ghose A.,,University of Wollongong,Wollongong,Australia,,,,,2023-05-01,May 2023,Data and Knowledge Engineering,0169023X,24437,,Journal,145,,102177,,,,0,1,all publisherfree2read,All Open Access Bronze,,,
2-s2.0-85153685070,10.1016/j.orl.2023.04.001,S0167637723000603,,Dual SDDP for risk-averse multistage stochastic programs,ar,Article,Freitas Paulo da Costa B.,,Fundacao Getulio Vargas,Rio de Janeiro,Brazil,,,,,2023-05-01,May 2023,Operations Research Letters,01676377,22202,,Journal,51,3,,332-337,,,6,2,all repository repositoryam,All Open Access Green,,,
2-s2.0-85152136537,10.1016/j.datak.2023.102180,S0169023X2300040X,,Towards automatic Privacy-Preserving Record Linkage: A Transfer Learning based classification step,ar,Article,Nóbrega T.,,Universidade Federal de Campina Grande,Campina Grande,Brazil,,,,,2023-05-01,May 2023,Data and Knowledge Engineering,0169023X,24437,,Journal,145,,102180,,,,2,0,,,,,
2-s2.0-85152027725,10.1002/asmb.2757,,,Deep learning models for inflation forecasting,ar,Article,Theoharidis A.F.,,"Insper, Sao Paulo",Sao Paulo,Brazil,,,,,2023-05-01,May/June 2023,Applied Stochastic Models in Business and Industry,15241904,25195,15264025,Journal,39,3,,447-470,,,9,0,,,,,
2-s2.0-85151992877,10.1002/asmb.2756,,,A review of Bayesian dynamic forecasting models: Applications in marketing,ar,Article,Migon H.S.,,Universidade Federal do Rio de Janeiro,Rio de Janeiro,Brazil,,,,,2023-05-01,May/June 2023,Applied Stochastic Models in Business and Industry,15241904,25195,15264025,Journal,39,3,,471-493,,,1,0,,,,,
2-s2.0-85151375514,10.1016/j.ecolind.2023.110186,S1470160X2300328X,,"Corrigendum to “RGB vs. Multispectral imagery: Mapping aapa mire plant communities with UAVs” [Ecol. Indic. 148 (2023) 110140] (Ecological Indicators (2023) 148, (S1470160X23002820), (10.1016/j.ecolind.2023.110140))",er,Erratum,Wolff F.,,Itä-Suomen yliopisto,Kuopio,Finland,,,,,2023-05-01,May 2023,Ecological Indicators,1470160X,20292,,Journal,149,,110186,,,,0,1,all publisherfullgold,All Open Access Gold,,,
2-s2.0-85150262956,10.1016/j.datak.2023.102174,S0169023X23000344,,AStar: A modeling language for document-oriented geospatial data warehouses,ar,Article,Ferro M.,,Universidade Federal de Pernambuco;Instituto Federal de Alagoas,Recife;Maceio,Brazil;Brazil,,,,,2023-05-01,May 2023,Data and Knowledge Engineering,0169023X,24437,,Journal,145,,102174,,,,3,0,,,,,
2-s2.0-85150178699,10.1016/j.mathsocsci.2023.02.007,S0165489623000203,,Confirmation bias in social networks,ar,Article,Fernandes M.R.,,Universidade de São Paulo,Sao Paulo,Brazil,,,,,2023-05-01,May 2023,Mathematical Social Sciences,01654896,25057,,Journal,123,,,59-76,,,6,2,all repository repositoryam,All Open Access Green,,,
2-s2.0-85149940781,10.1007/s10957-023-02189-1,,,On the Fulfillment of the Complementary Approximate Karush–Kuhn–Tucker Conditions and Algorithmic Applications,ar,Article,Prado R.W.,,Universidade Estadual de Campinas,Campinas,Brazil,,,,,2023-05-01,May 2023,Journal of Optimization Theory and Applications,00223239,23966,15732878,Journal,197,2,,705-736,,,2,0,,,,,
2-s2.0-85149768078,10.1287/moor.2022.1301,,,Iteration Complexity of a Proximal Augmented Lagrangian Method for Solving Nonconvex Composite Optimization Problems with Nonlinear Convex Constraints,ar,Article,Kong W.,,Oak Ridge National Laboratory,Oak Ridge,United States,,,,,2023-05-01,May 2023,Mathematics of Operations Research,0364765X,22140,15265471,Journal,48,2,,1066-1094,,,9,2,all repository repositoryam,All Open Access Green,,,
2-s2.0-85149740445,10.1016/j.cor.2023.106159,S0305054823000230,,Formulations and an adaptive large neighborhood search for just-in-time scheduling of unrelated parallel machines with a common due window,ar,Article,Rolim G.A.,,Universidade de São Paulo,Sao Paulo,Brazil,,,,,2023-05-01,May 2023,Computers and Operations Research,03050548,24355,,Journal,153,,106159,,,,14,0,,,,,
2-s2.0-85149695514,10.1016/j.mathsocsci.2023.02.004,S0165489623000173,,Cryptocurrency is accounting coordination: Selfish mining and double spending in a simple mining game,ar,Article,Barros F.,,FEARP/USP;LEMC-FEARP/USP,;,Brazil;Brazil,,,,,2023-05-01,May 2023,Mathematical Social Sciences,01654896,25057,,Journal,123,,,25-50,,,1,0,,,,,
