eid,doi,pii,pubmed_id,title,subtype,subtypeDescription,creator,afid,affilname,affiliation_city,affiliation_country,author_count,author_names,author_ids,author_afids,coverDate,coverDisplayDate,publicationName,issn,source_id,eIssn,aggregationType,volume,issueIdentifier,article_number,pageRange,description,authkeywords,citedby_count,openaccess,freetoread,freetoreadLabel,fund_acr,fund_no,fund_sponsor
2-s2.0-85150612383,10.1177/08862605231155141,,36825734,Panorama of Intimate Partner Violence Against Women in Brazil and its Association With Self-Perception of Health: Findings From a National Representative Survey,ar,Article,Signorelli M.C.,,Universidade Federal do Parana,Curitiba,Brazil,,,,,2023-07-01,July 2023,Journal of Interpersonal Violence,08862605,20374,15526518,Journal,38,13-14,,8453-8475,,,5,2,all repository repositoryam,All Open Access Green,,,
2-s2.0-85149573867,10.1007/s10071-023-01758-1,,36884107,"Use of anvils by the Great Kiskadee (Aves, Tyrannidae): a description based on citizen science data",ar,Article,da Silva L.B.,,Universidade Federal Rural de Pernambuco,Recife,Brazil,,,,,2023-07-01,July 2023,Animal Cognition,14359448,29520,14359456,Journal,26,4,,1141-1145,,,3,0,,,,,
2-s2.0-85149218217,10.1016/j.psychsport.2023.102406,S1469029223000304,,Effect of a motor skill-based intervention in the relationship of individual and contextual factors in children with and without Developmental Coordination Disorder from low-income families,ar,Article,Santayana de Souza M.,,Universidade Federal do Rio Grande do Sul,Porto Alegre,Brazil,,,,,2023-07-01,July 2023,Psychology of Sport and Exercise,14690292,14033,,Journal,67,,102406,,,,7,0,,,,,
2-s2.0-85148046471,10.1002/bin.1932,,,Equivalence-based instruction to teaching reading by families and teachers students with autism and/or intellectual disabilities,ar,Article,Benitez P.,,Universidade Federal do ABC,Santo Andre,Brazil,,,,,2023-07-01,July 2023,Behavioral Interventions,10720847,14282,1099078X,Journal,38,3,,861-880,,,2,0,,,,,
2-s2.0-85147660943,10.1007/s41105-023-00445-5,,,Metabolomic approach for obstructive sleep apnea in adults: a systematic review,re,Review,Salles C.,,Escola Bahiana de Medicina e Saúde Pública – EBMSP,Salvador,Brazil,,,,,2023-07-01,July 2023,Sleep and Biological Rhythms,14469235,130153,14798425,Journal,21,3,,265-277,,,1,0,,,,,
2-s2.0-85147413777,10.1177/13591053231151483,,36721948,"Disordered eating during COVID-19 pandemic is associated with nutritional status, negative mood changes, and body image in university students",ar,Article,Gottardi N.R.d.M.,,Universidade Federal do Espírito Santo,Vitoria,Brazil,,,,,2023-07-01,July 2023,Journal of Health Psychology,13591053,15536,14617277,Journal,28,8,,774-786,,,4,2,all repository repositoryvor,All Open Access Green,,,
2-s2.0-85146071660,10.1002/bsl.2606,,36602124,"Cessation of dangerousness status in Brasília, Brazil: An analysis of 144 reports from Federal District Medical Examiner's Office in the last 10 years",ar,Article,de Oliveira G.C.,,Universidade Federal do Rio de Janeiro;Universidade de Brasília;Centro Universitário de Brasília – UniCEUB;Government of Brasília in Emergency Service – SAMU,Rio de Janeiro;Brasília;Brasilia;Brasilia,Brazil;Brazil;Brazil;Brazil,,,,,2023-07-01,July/August 2023,Behavioral Sciences and the Law,07353936,12123,10990798,Journal,41,4,,172-185,,,0,0,,,,,
2-s2.0-85144178602,10.1177/03057356221137928,,,The mediating role of music preference in the relationship between personality and pro-sociability,ar,Article,Santos I.L.S.,,Universidade Federal da Paraíba,Joao Pessoa,Brazil,,,,,2023-07-01,July 2023,Psychology of Music,03057356,16300154722,17413087,Journal,51,4,,1302-1313,,,5,0,,,,,
2-s2.0-85144036668,10.1111/cch.13085,,36444144,"Translation, cross-cultural adaptation, validity and reliability of the Brazilian Portuguese version of Activity Scale for Kids questionnaire",ar,Article,de Oliveira V.G.C.,,Universidade Federal de São Paulo;Instituto de Assistencia Medica ao Servidor Publico Estadual,Sao Paulo;Sao Paulo,Brazil;Brazil,,,,,2023-07-01,July 2023,Child Care Health and Development,03051862,14561,13652214,Journal,49,4,,725-731,,,1,0,,,,,
2-s2.0-85143964012,10.1002/bdm.2308,,,Looking up or down on the social ladder: How socioeconomic comparisons shape judgments about monetary and time donations,ar,Article,Demczuk R.,,UCP - Católica Lisbon School of Business & Economics,Lisbon,Portugal,,,,,2023-07-01,July 2023,Journal of Behavioral Decision Making,08943257,20537,10990771,Journal,36,3,e2308,,,,4,1,all publisherhybridgold repository repositoryvor,All Open Access Hybrid Gold Green,,,
2-s2.0-85141589029,10.1007/s00426-022-01765-w,,36346479,The pleasantness and unpleasantness of an object distinctively drives its grasping prediction: behavioral evidence,ar,Article,Saunier G.,,Universidade Federal do Pará,Belem,Brazil,,,,,2023-07-01,July 2023,Psychological Research,03400727,13466,14302772,Journal,87,5,,1491-1500,,,1,0,,,,,
2-s2.0-85141024712,10.1177/17470218221128557,,36114609,Individual differences in musical ability among adults with no music training,ar,Article,Correia A.I.,,Iscte – Instituto Universitário de Lisboa,Lisbon,Portugal,,,,,2023-07-01,July 2023,Quarterly Journal of Experimental Psychology,17470218,4000149409,17470226,Journal,76,7,,1585-1598,,,14,1,all publisherhybridgold repository repositoryvor repositoryam,All Open Access Hybrid Gold Green,,,
2-s2.0-85141014195,10.1177/17456916221109609,,36301830,Media-Induced War Trauma Amid Conflicts in Ukraine,ar,Article,Su Z.,,"Southeast University, Dhaka",Dhaka,Bangladesh,,,,,2023-07-01,July 2023,Perspectives on Psychological Science,17456916,19700182323,17456924,Journal,18,4,,908-911,,,24,2,all repository repositoryam,All Open Access Green,,,
2-s2.0-85139060283,10.1177/17470218221125216,,36062351,Attentional load effects on emotional content in face working memory,ar,Article,Valenti L.,,Universidade de São Paulo,Sao Paulo,Brazil,,,,,2023-07-01,July 2023,Quarterly Journal of Experimental Psychology,17470218,4000149409,17470226,Journal,76,7,,1696-1709,,,1,2,all repository repositoryam,All Open Access Green,,,
2-s2.0-85126329698,10.1007/s12144-022-02992-5,,,Do people see the way things are as they should be? Measuring the individual differences in system justification,ar,Article,Silva W.A.D.,,Universidade Federal da Paraíba,Joao Pessoa,Brazil,,,,,2023-07-01,July 2023,Current Psychology,10461310,13479,19364733,Journal,42,21,,17805-17824,,,6,0,,,,,
2-s2.0-85126140517,10.1007/s12144-022-02957-8,,,The Self-perception of Text message Dependence Scale (STDS): A Brazilian-Portuguese validation and expansion of its psychometric properties,ar,Article,Spritzer D.T.,,Universidade Federal do Rio Grande do Sul,Porto Alegre,Brazil,,,,,2023-07-01,July 2023,Current Psychology,10461310,13479,19364733,Journal,42,21,,17670-17681,,,10,1,all publisherfree2read repository repositoryvor,All Open Access Bronze Green,,,
2-s2.0-85122309689,10.1177/15248380211061771,,34978481,Healthcare Professionals’ Own Experiences of Domestic Violence and Abuse: A Meta-Analysis of Prevalence and Systematic Review of Risk Markers and Consequences,re,Review,Dheensa S.,,Bristol Medical School,Bristol,United Kingdom,,,,,2023-07-01,July 2023,Trauma Violence and Abuse,15248380,13124,15528324,Journal,24,3,,1282-1299,,,22,2,all repository repositoryvor,All Open Access Green,,,
2-s2.0-85118544354,10.1007/s12144-021-02429-5,,,Partner responsiveness moderates the relation between COVID-19-related stressors and changes in mood during the pandemic,ar,Article,Soares L.S.,,Universidade Federal de Minas Gerais,Belo Horizonte,Brazil,,,,,2023-07-01,July 2023,Current Psychology,10461310,13479,19364733,Journal,42,20,,17340-17347,,,3,2,all repository repositoryvor,All Open Access Green,,,
2-s2.0-85076199480,10.1007/s12144-019-00552-y,,,Humor styles across 28 countries,ar,Article,Schermer J.A.,,Western University,London,Canada,,,,,2023-07-01,July 2023,Current Psychology,10461310,13479,19364733,Journal,42,19,,16304-16319,,,33,2,all,All Open Access,,,
2-s2.0-85074509967,10.1017/S1041610219001467,,31647053,"Modelling the impact of functionality, cognition, and mood state on awareness in people with Alzheimer’s disease",ar,Article,Fischer A.,,Pontifícia Universidade Católica do Rio de Janeiro,Rio de Janeiro,Brazil,,,,,2023-07-01,July 2023,International Psychogeriatrics,10416102,16200,1741203X,Journal,35,7,,361-371,,,8,1,all publisherhybridgold,All Open Access Hybrid Gold,,,
2-s2.0-105010524677,10.26707/1984-7270/2023v24n0212,,,Work Engagement in Private Higher Education: A Case Study,ar,Article,Andric J.T.,,ATITUS Educação,Passo Fundo,Brazil,,,,,2023-07-01,July 2023,Revista Brasileira De Orientacao Profissional,16793390,21100202508,19847270,Journal,24,2,,253-263,,,0,0,,,,,
2-s2.0-105010461430,10.26707/1984-7270/2023v24n0214,,,Competencies for career and vocational guidance in Brazil: self-assessment and relevance,ar,Article,Melo-Silva L.L.,,Universidade de São Paulo,Sao Paulo,Brazil,,,,,2023-07-01,July 2023,Revista Brasileira De Orientacao Profissional,16793390,21100202508,19847270,Journal,24,2,,279-293,,,0,0,,,,,
2-s2.0-85164581434,10.1556/2006.2023.00028,,,Compulsive sexual behavior disorder in 42 countries: Insights from the International Sex Survey and introduction of standardized assessment tools,ar,Article,Bothe B.,,University of Montreal;Université du Québec à Trois-Rivières,Montreal;Trois-Rivieres,Canada;Canada,,,,,2023-06-29,June 2023,Journal of Behavioral Addictions,20625871,21100373947,20635303,Journal,12,2,,393-407,,,51,1,all publisherfullgold repository repositoryvor repositoryam,All Open Access Gold Green,,,
2-s2.0-85161427943,10.1556/2006.2023.00013,,37159337,"A scoping review of the association between loot boxes, esports, skin betting, and token wagering with gambling and video gaming behaviors",re,Review,Kim H.S.,,University of Ottawa;Toronto Metropolitan University,Ottawa;Toronto,Canada;Canada,,,,,2023-06-29,June 2023,Journal of Behavioral Addictions,20625871,21100373947,20635303,Journal,12,2,,309-351,,,9,1,all publisherfullgold repository repositoryvor repositoryam,All Open Access Gold Green,,,
2-s2.0-85169168004,10.1007/978-3-031-29882-0_13,,,Emergence of hybrid escherichia coli strains,ch,Book Chapter,Gomes T.A.T.,,Universidade Federal de São Paulo,Sao Paulo,Brazil,,,,,2023-06-28,28 June 2023,Trending Topics in Escherichia Coli Research the Latin American Perspective,,21101174289,,Book,,,,295-315,,,1,0,,,,,
2-s2.0-85169167261,10.1007/978-3-031-29882-0_5,,,Bovine reservoir of STEC and EPEC: Advances and new contributions,ch,Book Chapter,Padola N.L.,,Universidad Nacional del Centro de la Provincia de Buenos Aires,Tandil,Argentina,,,,,2023-06-28,28 June 2023,Trending Topics in Escherichia Coli Research the Latin American Perspective,,21101174289,,Book,,,,107-127,,,0,0,,,,,
2-s2.0-85169164242,10.1007/978-3-031-29882-0_14,,,Genomic analysis of pathogenic escherichia coli strains in Latin America,ch,Book Chapter,Chinen I.,,Instituto Nacional de Enfermedades Infecciosas,Buenos Aires,Argentina,,,,,2023-06-28,28 June 2023,Trending Topics in Escherichia Coli Research the Latin American Perspective,,21101174289,,Book,,,,317-337,,,0,0,,,,,
2-s2.0-85169164160,10.1007/978-3-031-29882-0_15,,,Therapeutic options for diarrheagenic escherichia coli,ch,Book Chapter,Balestracci A.,,Hospital General de Niños Pedro de Elizalde,Buenos Aires,Argentina,,,,,2023-06-28,28 June 2023,Trending Topics in Escherichia Coli Research the Latin American Perspective,,21101174289,,Book,,,,339-360,,,2,0,,,,,
2-s2.0-85169164125,10.1007/978-3-031-29882-0_1,,,Who critical priority escherichia coli in Latin America: A one health challenge for a post-pandemic world,ch,Book Chapter,Lincopan N.,,Universidade de São Paulo,Sao Paulo,Brazil,,,,,2023-06-28,28 June 2023,Trending Topics in Escherichia Coli Research the Latin American Perspective,,21101174289,,Book,,,,1-32,,,4,0,,,,,
2-s2.0-85169160522,10.1007/978-3-031-29882-0_7,,,Insights into animal carriage and pathogen surveillance in Latin America: The case of STEC and APEC,ch,Book Chapter,Galarce N.,,Facultad de Ciencias de la Vida,Santiago,Chile,,,,,2023-06-28,28 June 2023,Trending Topics in Escherichia Coli Research the Latin American Perspective,,21101174289,,Book,,,,149-175,,,1,0,,,,,
2-s2.0-85112263215,10.1108/IJHRH-04-2021-0084,,,The influence of sports policies on the right to fair competition for women,ar,Article,Hissa M.R.N.,,Unichristus,Fortaleza,Brazil,,,,,2023-06-28,28 June 2023,International Journal of Human Rights in Healthcare,20564902,21100834354,20564910,Journal,16,2,,120-127,,,0,0,,,,,
2-s2.0-85169532719,10.1007/978-3-031-30788-1_4,,,Covid-19 detection based on chest x-ray images using multiple transfer learning CNN models,ch,Book Chapter,dos Santos Silva B.R.,,Universidade Federal do Ceará,Fortaleza,Brazil,,,,,2023-06-26,26 June 2023,Computerized Systems for Diagnosis and Treatment of Covid 19,,21101175330,,Book,,,,45-63,,,0,0,,,,,
2-s2.0-85169532635,10.1007/978-3-031-30788-1_9,,,Evaluation of ECG non-linear features in time-frequency domain for the discrimination of COVID-19 severity stages,ch,Book Chapter,Ribeiro P.,,Escola Superior de Biotecnologia da Universidade Católica Portuguesa,Porto,Portugal,,,,,2023-06-26,26 June 2023,Computerized Systems for Diagnosis and Treatment of Covid 19,,21101175330,,Book,,,,137-154,,,0,0,,,,,
2-s2.0-85169531920,10.1007/978-3-031-30788-1_2,,,Lung segmentation of chest x-rays using unet convolutional networks,ch,Book Chapter,dos Santos Silva B.R.,,Universidade Federal do Ceará,Fortaleza,Brazil,,,,,2023-06-26,26 June 2023,Computerized Systems for Diagnosis and Treatment of Covid 19,,21101175330,,Book,,,,15-28,,,0,0,,,,,
2-s2.0-85169528038,10.1007/978-3-031-30788-1_11,,,Exploratory data analysis on clinical and emotional parameters of pregnant women with COVID-19 symptoms,ch,Book Chapter,Lobo Marques J.A.,,University of Saint Joseph,Macau,Macao,,,,,2023-06-26,26 June 2023,Computerized Systems for Diagnosis and Treatment of Covid 19,,21101175330,,Book,,,,179-209,,,0,0,,,,,
2-s2.0-85169518613,10.1007/978-3-031-30788-1_7,,,COVID-19 classification using CT scans with convolutional neural networks,ch,Book Chapter,Motta P.C.,,Universidade Federal do Ceará,Fortaleza,Brazil,,,,,2023-06-26,26 June 2023,Computerized Systems for Diagnosis and Treatment of Covid 19,,21101175330,,Book,,,,99-116,,,1,0,,,,,
2-s2.0-85169516443,10.1007/978-3-031-30788-1_10,,,Classification of severity of COVID-19 patients based on the heart rate variability,ch,Book Chapter,Pordeus D.,,Universidade Federal do Ceará,Fortaleza,Brazil,,,,,2023-06-26,26 June 2023,Computerized Systems for Diagnosis and Treatment of Covid 19,,21101175330,,Book,,,,155-177,,,1,0,,,,,
2-s2.0-85169515075,10.1007/978-3-031-30788-1_5,,,X-ray machine learning classification with VGG-16 for feature extraction,ch,Book Chapter,dos Santos Silva B.R.,,Universidade Federal do Ceará,Fortaleza,Brazil,,,,,2023-06-26,26 June 2023,Computerized Systems for Diagnosis and Treatment of Covid 19,,21101175330,,Book,,,,65-78,,,1,0,,,,,
2-s2.0-85170194015,10.1007/978-3-031-33034-6,,,Behavioral Insights for Policy Design: A New Framework for Understanding Wicked Social Problems and Designing Policies for Real Citizens,bk,Book,Lichand G.,,Stanford Graduate School of Education,Stanford,United States,,,,,2023-06-25,25 June 2023,Behavioral Insights for Policy Design A New Framework for Understanding Wicked Social Problems and Designing Policies for Real Citizens,,21101176560,,Book,,,,1-158,,,3,0,,,,,
2-s2.0-85163694073,10.30849/ripijp.v57i1.1838,,,Estudo Longitudinal sobre Saúde Mental de Estudantes Universitários e a Pandemia de COVID-19: Comparações e Perspectivas,ar,Article,Alvarenga M.A.S.,,Universidade Federal de São João del-Rey,São João del-Rey,Brazil,,,,,2023-06-22,22 June 2023,Interamerican Journal of Psychology,00349690,5700164134,,Journal,57,1,e1838,,,,2,1,all publisherfullgold,All Open Access Gold,,,
2-s2.0-85163665087,10.30849/ripijp.v57i1.1674,,,Recantation After Disclosure of Child Sexual Abuse: The Perspective of Professionals,ar,Article,Baía P.A.D.,,Tribunal de Justiça do Estado do Pará,Belem,Brazil,,,,,2023-06-22,22 June 2023,Interamerican Journal of Psychology,00349690,5700164134,,Journal,57,1,e1674,,,,0,1,all publisherfullgold,All Open Access Gold,,,
2-s2.0-85163630466,10.30849/ripijp.v57i1.1732,,,Psychological Aspects in Children and Adolescents with Dyslexia: A Systematic Review,ar,Article,Pereira M.D.,,Université Fédérale de Sergipe,Sao Cristovao,Brazil,,,,,2023-06-22,22 June 2023,Interamerican Journal of Psychology,00349690,5700164134,,Journal,57,1,e1732,,,,1,1,all publisherfullgold,All Open Access Gold,,,
2-s2.0-85163597795,10.30849/ripijp.v57i1.1748,,,Conceptual and Methodological Aspects of Emotional Labor: An Integrative Review,ar,Article,Simões A.C.A.,,Universidade Federal da Bahia,Salvador,Brazil,,,,,2023-06-22,22 June 2023,Interamerican Journal of Psychology,00349690,5700164134,,Journal,57,1,e1748,,,,1,1,all publisherfullgold,All Open Access Gold,,,
2-s2.0-85168505133,10.3233/ADR-220084,,,Confirmed Synergy between the ϵ4 Allele of Apolipoprotein e and the Variant K of Butyrylcholinesterase as a Risk Factor for Alzheimer's Disease: A Systematic Review and Meta-Analysis,re,Review,Ratis R.C.,,State University of the Midwest,Paraná,Brazil,,,,,2023-06-19,19 June 2023,Journal of Alzheimer S Disease Reports,,21101039875,25424823,Journal,7,1,,613-625,,,5,1,all publisherfullgold repository repositoryvor,All Open Access Gold Green,,,
2-s2.0-85150867581,10.1016/j.jad.2023.03.031,S0165032723003592,36933666,DNA methylation in regulatory elements of the FKBP5 and NR3C1 gene in mother-child binomials with depression,ar,Article,Mendonça M.S.,,Universidade Estadual do Norte Fluminense,Campos dos Goitacazes,Brazil,,,,,2023-06-15,15 June 2023,Journal of Affective Disorders,01650327,16245,15732517,Journal,331,,,287-299,,,7,0,,,,,
2-s2.0-85163921949,10.3233/JAD-220820,,37182864,The Potential Role of Selection Bias in the Association between Coronary Atherosclerosis and Cognitive Impairment,ar,Article,Yahagi-Estevam M.,,Universidade de São Paulo,Sao Paulo,Brazil,,,,,2023-06-13,13 June 2023,Journal of Alzheimer S Disease,13872877,16246,18758908,Journal,93,4,,1307-1316,,,1,0,,,,,
2-s2.0-85168834428,10.1037/apl0001093,,37289533,"Humane Orientation, Work–Family Conflict, and Positive Spillover Across Cultures",ar,Article,Beham B.,,Hochschule für Wirtschaft und Recht Berlin,Berlin,Germany,,,,,2023-06-08,8 June 2023,Journal of Applied Psychology,00219010,15388,19391854,Journal,108,10,,1573-1597,,,3,2,all repository repositoryvor repositoryam,All Open Access Green,,,
2-s2.0-85163913561,10.1017/S0033291722000034,S0033291722000034,35513912,"Mortality, survival, and causes of death in mental disorders: Comprehensive prospective analyses of the UK Biobank cohort",ar,Article,Boschesi Barros V.,,Universidade de São Paulo,Sao Paulo,Brazil,,,,,2023-06-06,6 June 2023,Psychological Medicine,00332917,18742,14698978,Journal,53,8,,3480-3489,,,3,0,,,,,
2-s2.0-85111996571,10.1017/S0144686X2100115X,S0144686X2100115X,,Reassessing the CASP-19 adapted for Brazilian Portuguese: insights from a population-based study,ar,Article,Marques L.P.,,Universidade Federal de Santa Catarina,Florianopolis,Brazil,,,,,2023-06-04,4 June 2023,Ageing and Society,0144686X,28471,14691779,Journal,43,6,,1351-1366,,,1,0,,,,,
2-s2.0-85216985049,10.3390/obesities3020013,,,Respiratory Muscle Strength in Brazilian Adolescents: Impact of Body Composition,ar,Article,de Lima V.C.,,Universidade Cidade de São Paulo,Sao Paulo,Brazil,,,,,2023-06-01,June 2023,Obesities,,21101272840,26734168,Journal,3,2,,155-164,,,0,1,all publisherfullgold,All Open Access Gold,,,
2-s2.0-85204511092,10.3390/obesities3020012,,,Trend in Hypertension Prevalence and Health Behaviors among the Brazilian Adult Population: 2006–2019,ar,Article,Caldeira T.C.M.,,Universidade Federal de Minas Gerais,Belo Horizonte,Brazil,,,,,2023-06-01,June 2023,Obesities,,21101272840,26734168,Journal,3,2,,145-154,,,2,1,all publisherfullgold,All Open Access Gold,,,
2-s2.0-85199372266,10.3390/obesities3020010,,,Temporal Trend of Severe Obesity in Brazilian State Capitals (2006–2021),ar,Article,Dias F.S.B.,,Universidade Federal do Acre,Rio Branco,Brazil,,,,,2023-06-01,June 2023,Obesities,,21101272840,26734168,Journal,3,2,,119-131,,,2,1,all publisherfullgold,All Open Access Gold,,,
2-s2.0-85179329655,10.28987/ijrld.6.1.44,,,Developmental Dyslexia: An Exploratory Study Using Thematic Analysis of the Self-Reported Reading Difficulties of Monolingual and Bilingual Adults,ar,Article,Tomitch L.M.B.,,The University of Auckland;Universidade Federal de Santa Catarina,Auckland;Florianopolis,New Zealand;Brazil,,,,,2023-06-01,1 June 2023,International Journal for Research in Learning Disabilities,2325565X,21101190210,23293764,Journal,6,1,,44-57,,,0,0,,,,,
2-s2.0-85164970194,10.5093/psed2023a13,,,"Effects of Teasing in Physical Education Classes, Self-efficacy, and Physical Activity on Adolescents’ Self-esteem",ar,Article,De Marco J.C.P.,,Universidade do Estado de Santa Catarina,Florianopolis,Brazil,,,,,2023-06-01,June 2023,Psicologia Educativa,1135755X,21100378341,21740526,Journal,29,2,,185-191,,,6,1,all publisherfullgold,All Open Access Gold,,,
2-s2.0-85164199898,10.22320/07190700.2023.13.01.02,,,SUSTAINABILITY IN THE BRAZILIAN TIMBER HOUSING VIRTUAL MARKET,ar,Article,de Araujo V.A.,,Universidade Federal de São Carlos,Sao Carlos,Brazil,,,,,2023-06-01,June 2023,Habitat Sustentable,,21101018933,07190700,Journal,13,1,,20-29,,,1,0,,,,,
2-s2.0-85164112624,10.22320/07190700.2023.13.01.06,,,CLIMATE CHANGE AND THERMAL COMFORT IN COLOMBIAN SOCIAL HOUSING,ar,Article,Callejas-Ochoa L.F.,,"Universidad de san Buenaventura, Bogota",Bogota,Colombia,,,,,2023-06-01,June 2023,Habitat Sustentable,,21101018933,07190700,Journal,13,1,,68-83,,,4,1,all publisherfullgold repository repositoryam,All Open Access Gold Green,,,
2-s2.0-85163790405,10.3390/bs13060443,,,"Physical Activity and Sedentary Behavior in Adults from Penafiel, Portugal: A Cross-Sectional Study",ar,Article,Batista A.,,Instituto Superior de Ciencias Educativas;CI-ISCE/ISCE Douro,Ramada;Penafiel,Portugal;Portugal,,,,,2023-06-01,June 2023,Behavioral Sciences,,21100901748,2076328X,Journal,13,6,443,,,,3,1,all publisherfullgold repository repositoryvor,All Open Access Gold Green,,,
2-s2.0-85163774084,10.3390/bs13060492,,,Aspects of Sexuality in Quilombola Communities’ Young Adults in Eastern Brazilian Amazon,ar,Article,Ramos Costa L.G.,,Universidade Federal do Pará,Belem,Brazil,,,,,2023-06-01,June 2023,Behavioral Sciences,,21100901748,2076328X,Journal,13,6,492,,,,2,1,all publisherfullgold repository repositoryvor,All Open Access Gold Green,,,
2-s2.0-85163766423,10.3390/bs13060488,,,"Dual-Task Performance, Balance and Aerobic Capacity as Predictors of Falls in Older Adults with Cardiovascular Disease: A Comparative Study",ar,Article,Silveira H.,,Universidade Federal do Rio de Janeiro,Rio de Janeiro,Brazil,,,,,2023-06-01,June 2023,Behavioral Sciences,,21100901748,2076328X,Journal,13,6,488,,,,4,1,all publisherfullgold repository repositoryvor,All Open Access Gold Green,,,
2-s2.0-85163743229,10.3390/bs13060440,,,Embedding Play to Enrich Physical Therapy,ar,Article,Fiss A.L.F.,,Texas Woman’s University,Dallas,United States,,,,,2023-06-01,June 2023,Behavioral Sciences,,21100901748,2076328X,Journal,13,6,440,,,,8,1,all publisherfullgold repository repositoryvor,All Open Access Gold Green,,,
2-s2.0-85163740371,10.3390/bs13060510,,,The Role of Emergent Literacy Assessment in Brazilian Portuguese Literacy Acquisition during COVID-19,ar,Article,Borges É.P.K.,,Universidade Federal do Rio Grande do Sul,Porto Alegre,Brazil,,,,,2023-06-01,June 2023,Behavioral Sciences,,21100901748,2076328X,Journal,13,6,510,,,,3,1,all publisherfullgold repository repositoryvor,All Open Access Gold Green,,,
2-s2.0-85163720978,10.3390/educsci13060619,,,How E-learning Is Correlated with Competitiveness and Innovation and Critical Success Factors,ar,Article,Lopes G.A.,,Universidade de Santa Cruz do Sul,Santa Cruz do Sul,Brazil,,,,,2023-06-01,June 2023,Education Sciences,,21100897500,22277102,Journal,13,6,619,,,,5,1,all publisherfullgold,All Open Access Gold,,,
2-s2.0-85163716948,10.3390/bs13060476,,,Effectiveness of the 5A Counseling Model-Based Interventions on Physical Activity Indicators in Adults: A Systematic Review,re,Review,Guerra P.H.,,Universidade Federal da Fronteira Sul,Chapeco,Brazil,,,,,2023-06-01,June 2023,Behavioral Sciences,,21100901748,2076328X,Journal,13,6,476,,,,0,1,all publisherfullgold repository repositoryvor repositoryam,All Open Access Gold Green,,,
2-s2.0-85163701485,10.3390/ejihpe13060082,,,Physical Exercise Decreases Endoplasmic Reticulum Stress in Central and Peripheral Tissues of Rodents: A Systematic Review,re,Review,de Sousa Fernandes M.S.,,Universidade Federal de Pernambuco,Recife,Brazil,,,,,2023-06-01,June 2023,European Journal of Investigation in Health Psychology and Education,21748144,21101042487,22549625,Journal,13,6,,1082-1096,,,4,1,all publisherfullgold repository repositoryvor,All Open Access Gold Green,,,
2-s2.0-85163027120,10.1002/jcv2.12144,,,Delineating early developmental pathways to ADHD: Setting an international research agenda,re,Review,Miller M.,,UC Davis MIND Institute,Sacramento,United States,,,,,2023-06-01,June 2023,Jcpp Advances,,21101229222,26929384,Journal,3,2,e12144,,,,19,1,all repository repositoryvor repositoryam,All Open Access Green,,,
2-s2.0-85162629763,10.53765/20512201.30.5.137,,,"The Mapuche People Cultural Beliefs Related to Consciousness, Mind, and Body",ar,Article,Pérez C.,,Università degli Studi di Salerno,Salerno,Italy,,,,,2023-06-01,June 2023,Journal of Consciousness Studies,13558250,15435,,Journal,30,5-6,,137-150,,,5,0,,,,,
