eid,doi,pii,pubmed_id,title,subtype,subtypeDescription,creator,afid,affilname,affiliation_city,affiliation_country,author_count,author_names,author_ids,author_afids,coverDate,coverDisplayDate,publicationName,issn,source_id,eIssn,aggregationType,volume,issueIdentifier,article_number,pageRange,description,authkeywords,citedby_count,openaccess,freetoread,freetoreadLabel,fund_acr,fund_no,fund_sponsor
2-s2.0-85166508555,10.14746/eip.2023.1.9,,,A Social Network Approach to the Dual Aspect of Moral Competence,ar,Article,Higgins S.S.,,Universidade Federal de Minas Gerais,Belo Horizonte,Brazil,,,,,2023-01-01,2023,Ethics in Progress,,21101039065,20849257,Journal,14,1,,144-168,,,0,1,all publisherfullgold,All Open Access Gold,,,
2-s2.0-85166406752,10.3389/fnhum.2023.1243226,,,Editorial: Sensorimotor decoding: characterization and modeling for rehabilitation and assistive technologies,ed,Editorial,Pais-Vieira M.,,Universidade de Aveiro,Aveiro,Portugal,,,,,2023-01-01,2023,Frontiers in Human Neuroscience,,19700175164,16625161,Journal,17,,1243226,,,,1,1,all publisherfullgold repository repositoryvor,All Open Access Gold Green,,,
2-s2.0-85166398070,10.1590/1982-4327e3307,,,Academic Adaptation to Remote Higher Education Questionnaire: Adaptation and Psychometric Study with Universities,ar,Article,Ferraz A.S.,,Universidade de Brasília,Brasília,Brazil,,,,,2023-01-01,2023,Paideia,0103863X,20000195050,19824327,Journal,33,,e3307,,,,0,1,all publisherfullgold,All Open Access Gold,,,
2-s2.0-85166304764,10.17759/chp.2023190212,,,The Genesis of the ‘Animation Complex’ Concept in the Historical-Cultural Psychology,ar,Article,Artemis P.P.,,Instituto Santos Dumont,Santos,Brazil,,,,,2023-01-01,2023,Cultural Historical Psychology,18165435,21100860383,22248935,Journal,19,2,,88-98,,,0,1,all publisherfullgold,All Open Access Gold,,,
2-s2.0-85166278578,10.17759/chp.2023190207,,,Talented Children who Develop Digital Artifacts and Derive Strength from them: an Example from the Brazilian Metropolis Talent Project,ar,Article,Hazin I.,,Universidade Federal do Rio Grande do Norte,Natal,Brazil,,,,,2023-01-01,2023,Cultural Historical Psychology,18165435,21100860383,22248935,Journal,19,2,,55-60,,,0,1,all publisherfullgold,All Open Access Gold,,,
2-s2.0-85166204560,10.46743/2160-3715/2023.6196,,,Patient's Perspective of Shared Decision-Making in Rheumatoid Arthritis Treatment: A Grounded Theory Exploration,ar,Article,Oliveira I.V.,,Universidade Federal de Minas Gerais,Belo Horizonte,Brazil,,,,,2023-01-01,2023,Qualitative Report,,5700165306,21603715,Journal,28,7,,1902-1926,,,0,1,all publisherfullgold,All Open Access Gold,,,
2-s2.0-85166132204,10.24972/ijts.2023.42.1.27,,,The Varieties of Afterlife Experience: Epistemological and Cultural Implications,ar,Article,de Oliveira Maraldi E.,,Pontifícia Universidade Católica de São Paulo,Sao Paulo,Brazil,,,,,2023-01-01,2023,International Journal of Transpersonal Studies,13210122,21100200606,19423241,Journal,42,1,,27-31,,,2,1,all publisherhybridgold,All Open Access Hybrid Gold,,,
2-s2.0-85166022770,10.1590/1982-0275202340e200213,,,Symptoms of post-traumatic stress disorder and affects in healthcare workers during the COVID-19 pandemic,ar,Article,Pereira J.L.,,Pontifícia Universidade Católica de São Paulo,Sao Paulo,Brazil,,,,,2023-01-01,2023,Estudos De Psicologia Campinas,0103166X,21100416194,19820275,Journal,40,,e200213,,,,0,1,all publisherfullgold,All Open Access Gold,,,
2-s2.0-85166002078,10.3389/fpsyg.2023.1215174,,,Editorial: The interconnectedness of personality and language,ed,Editorial,Čolović P.,,University of Novi Sad,Novi Sad,Serbia,,,,,2023-01-01,2023,Frontiers in Psychology,,21100216571,16641078,Journal,14,,1215174,,,,0,1,all publisherfullgold repository repositoryvor,All Open Access Gold Green,,,
2-s2.0-85165998954,10.1590/1982-0275202340e210072en,,,Survey of cognitive behavioral therapy clinical supervisors profile in Brazil,ar,Article,Barletta J.B.,,Universidade de São Paulo,Sao Paulo,Brazil,,,,,2023-01-01,2023,Estudos De Psicologia Campinas,0103166X,21100416194,19820275,Journal,40,,e210072,,,,1,1,all publisherfullgold,All Open Access Gold,,,
2-s2.0-85165987739,10.21134/haaj.v23i1.721,,,THE BODY AND THE LAW: A GENERAL VIEW OF A PLACE FOR HEALTH IN THE CURRENT PROHIBITIONIST APPROACH TO DRUG DEPENDENCE IN BRAZIL,ar,Article,Kurihara A.C.Z.S.,,Centro Universitário Municipal de Franca,Franca,Brazil,,,,,2023-01-01,2023,Health and Addictions Salud Y Drogas,15785319,21100205744,1988205X,Journal,23,1,,131-151,,,1,1,all publisherhybridgold,All Open Access Hybrid Gold,,,
2-s2.0-85165979310,10.5093/rpadef2023a5,,,Which variables predict the tactical knowledge of volleyball players?,ar,Article,Suárez M.C.,,Universidad Francisco de Vitoria,Pozuelo de Alarcon,Spain,,,,,2023-01-01,2023,Revista De Psicologia Aplicada Al Deporte Y Al Ejercicio Fisico,,21101156976,25303910,Journal,8,1,e4,,,,0,1,all publisherfullgold repository repositoryvor,All Open Access Gold Green,,,
2-s2.0-85165978376,10.3389/fnhum.2023.1116890,,,Would frontal midline theta indicate cognitive changes induced by non-invasive brain stimulation? A mini review,sh,Short Survey,Nakamura-Palacios E.M.,,Universidade Federal do Espírito Santo,Vitoria,Brazil,,,,,2023-01-01,2023,Frontiers in Human Neuroscience,,19700175164,16625161,Journal,17,,1116890,,,,5,1,all publisherfullgold repository repositoryvor,All Open Access Gold Green,,,
2-s2.0-85165977259,10.1590/1982-0275202340e200161en,,,Mapping the social representations of Psychology: a study in a Portuguese context,ar,Article,Gonçalves S.P.,,"Instituto Superior de Ciências Sociais e Políticas, Universidade de Lisboa",Lisbon,Portugal,,,,,2023-01-01,2023,Estudos De Psicologia Campinas,0103166X,21100416194,19820275,Journal,40,,e200161,,,,0,1,all publisherfullgold,All Open Access Gold,,,
2-s2.0-85165971712,10.3389/fpsyg.2023.1052897,,,"Transcultural adaptation, content, and internal structure validity evidence of the perceived efficacy and goal setting system – 2 edition for Brazilian children",ar,Article,Nobre G.C.,,Universidade Federal do Rio Grande do Sul;Federal Institute of Education,Porto Alegre;Canindé,Brazil;Brazil,,,,,2023-01-01,2023,Frontiers in Psychology,,21100216571,16641078,Journal,14,,1052897,,,,1,1,all publisherfullgold repository repositoryvor,All Open Access Gold Green,,,
2-s2.0-85165952941,10.1590/1982-0275202340e200103,,,"Mediation of the meaning of work on the relationship between leadership and performance, controlling the response bias",ar,Article,Leonardo M.d.G.L.,,Universidade Salgado de Oliveira,Sao Goncalo,Brazil,,,,,2023-01-01,2023,Estudos De Psicologia Campinas,0103166X,21100416194,19820275,Journal,40,,e200103,,,,1,1,all publisherfullgold,All Open Access Gold,,,
2-s2.0-85165926865,,,,Foreword,ed,Editorial,Costin C.,,Fundacao Getulio Vargas;The World Bank Group,"Rio de Janeiro;Washington, D.C.",Brazil;United States,,,,,2023-01-01,2023,International Perspectives on Early Childhood Education and Development,24688746,21100981041,24688754,Book Series,39,,,vii-viii,,,0,0,,,,,
2-s2.0-85165575931,10.1080/10749039.2023.2238733,,,Foregrounding learners’ voices: Enabling zones of audacity,ar,Article,Underwood C.,,University of California,Augusta,United States,,,,,2023-01-01,2023,Mind Culture and Activity,10749039,5700152857,15327884,Journal,,,,,,,0,1,all publisherhybridgold,All Open Access Hybrid Gold,,,
2-s2.0-85165551245,10.3389/fpsyg.2023.1135471,,,The birthplace and relative age effects in Brazilian olympic athletes: a cross-national comparison,ar,Article,Thuany M.,,Universidade do Porto,Porto,Portugal,,,,,2023-01-01,2023,Frontiers in Psychology,,21100216571,16641078,Journal,14,,1135471,,,,3,1,all publisherfullgold repository repositoryvor,All Open Access Gold Green,,,
2-s2.0-85165546282,10.3233/JAD-230561,,37393510,Looking behind the Curtain: Patient Stratification According to Genetic or Demographic Factors May Yield Unexpected Results in Studies of Neurodegenerative Diseases,re,Review,Oliveira F.F.D.,,Universidade Federal de São Paulo,Sao Paulo,Brazil,,,,,2023-01-01,2023,Journal of Alzheimer S Disease,13872877,16246,18758908,Journal,94,2,,777-780,,,9,0,,,,,
2-s2.0-85165493543,10.17711/SM.0185-3325.2023.022,,,Team sports as a protective factor against mental health problems and suicidal ideation in adolescents,ar,Article,Machado-Oliveira L.,,Universidade Federal de Pernambuco,Recife,Brazil,,,,,2023-01-01,2023,Salud Mental,01853325,19332,,Journal,46,4,,177-184,,,5,1,all publisherfullgold,All Open Access Gold,,,
2-s2.0-85165457457,10.17711/SM.0185-3325.2023.026,,,The COVID-19 pandemic’s risk factors for depression among postgraduate healthcare students,ar,Article,de Oliveira Souza F.R.A.,,Universidade Federal de Mato Grosso,Cuiaba,Brazil,,,,,2023-01-01,2023,Salud Mental,01853325,19332,,Journal,46,4,,211-220,,,0,1,all publisherfullgold,All Open Access Gold,,,
2-s2.0-85165452863,10.1080/15332276.2023.2238798,,,Supporting and guiding families of gifted children: The role of a psychoeducational program,ar,Article,de Souza Fleith D.,,Universidade de Brasília,Brasília,Brazil,,,,,2023-01-01,2023,Gifted and Talented International,15332276,21100972436,24709565,Journal,38,1,,12-20,,,4,0,,,,,
2-s2.0-85165434051,10.1016/j.chiabu.2023.106347,S0145213423003356,37479549,The global impact of COVID-19 on child protection professionals: A scoping review and thematic analysis,ar,Article,Katz C.,,Tel Aviv University,Tel Aviv-Yafo,Israel,,,,,2023-01-01,2023,Child Abuse and Neglect,01452134,24451,18737757,Journal,,,106347,,,,4,0,,,,,
2-s2.0-85165352111,10.14417/ap.1985,,,The mediating role of burnout syndrome between regulatory focus/motivation and intention to leave in teachers,ar,Article,Carlotto M.S.,,Universidade de Brasília,Brasília,Brazil,,,,,2023-01-01,2023,Analise Psicologica,08708231,21100228079,16466020,Journal,41,1,,15-27,,,1,1,all publisherfullgold repository repositoryam,All Open Access Gold Green,,,
2-s2.0-85165235879,10.3389/fpsyg.2023.1212036,,,The Toronto Mindfulness Scale and the State Mindfulness Scale: psychometric properties of the Spanish versions,ar,Article,Navarrete J.,,Centro de Investigación Biomédica en Red de Epidemiología y Salud Pública;Parc Sanitari Sant Joan de Déu;Institut de Recerca Sant Joan de Déu,Madrid;Sant Boi de Llobregat;Esplugues de Llobregat,Spain;Spain;Spain,,,,,2023-01-01,2023,Frontiers in Psychology,,21100216571,16641078,Journal,14,,1212036,,,,2,1,all publisherfullgold repository repositoryvor,All Open Access Gold Green,,,
2-s2.0-85165215920,10.22235/cp.v17i1.3051,,,Psychometric properties and measurement invariance of an academic self-efficacy scale in college students from five Latin American countries,ar,Article,Dominguez-Lara S.,,Universidad de San Martín de Porres,Lima,Peru,,,,,2023-01-01,2023,Ciencias Psicologicas,16884094,21101065161,16884221,Journal,17,1,e-3051,,,,5,1,all publisherfullgold,All Open Access Gold,,,
2-s2.0-85165204810,10.1109/CHASE58964.2023.00010,,,On the perceived relevance of critical internal quality attributes when evolving software features,cp,Conference Paper,Fernandes E.,,Universidade Federal de Minas Gerais,Belo Horizonte,Brazil,,,,,2023-01-01,2023,Proceedings 2023 IEEE ACM 16th International Conference on Cooperative and Human Aspects of Software Engineering Chase 2023,,21101165520,,Conference Proceeding,,,,13-24,,,1,2,all repository repositoryam,All Open Access Green,,,
2-s2.0-85165184039,10.1109/CHASE58964.2023.00023,,,Investigating the Perceived Impact of Maternity on Software Engineering: A Women's Perspective,cp,Conference Paper,Rocha L.,,Universidade Estadual de Feira de Santana,Feira de Santana,Brazil,,,,,2023-01-01,2023,Proceedings 2023 IEEE ACM 16th International Conference on Cooperative and Human Aspects of Software Engineering Chase 2023,,21101165520,,Conference Proceeding,,,,138-149,,,8,2,all repository repositoryam,All Open Access Green,,,
2-s2.0-85165180940,10.1109/CHASE58964.2023.00025,,,Diversity in Software Engineering: A Survey about Scientists from Underrepresented Groups,cp,Conference Paper,De Souza Santos R.,,Cape Breton University,Sydney,Canada,,,,,2023-01-01,2023,Proceedings 2023 IEEE ACM 16th International Conference on Cooperative and Human Aspects of Software Engineering Chase 2023,,21101165520,,Conference Proceeding,,,,161-166,,,10,2,all repository repositoryam,All Open Access Green,,,
2-s2.0-85165176420,10.1007/s43076-023-00317-4,,,Life Stories of Community Leaders: the Ethical–Political Approach to Social Exclusion,ar,Article,de Castro-Silva C.R.,,Universidade Federal de São Paulo,Sao Paulo,Brazil,,,,,2023-01-01,2023,Trends in Psychology,23581883,21100860733,,Journal,,,,,,,0,0,,,,,
2-s2.0-85165161358,10.1109/CHASE58964.2023.00017,,,Hearing the voice of experts: Unveiling Stack Exchange communities' knowledge of test smells,cp,Conference Paper,Martins L.,,Universidade Federal da Bahia,Salvador,Brazil,,,,,2023-01-01,2023,Proceedings 2023 IEEE ACM 16th International Conference on Cooperative and Human Aspects of Software Engineering Chase 2023,,21101165520,,Conference Proceeding,,,,80-91,,,5,2,all repository repositoryam,All Open Access Green,,,
2-s2.0-85165157920,10.1109/CHASE58964.2023.00014,,,An Exploratory Study of the Benefits of Time-bounded Collaborative Events for Startup Founders,cp,Conference Paper,Miranda A.,,Universidade Federal do Pará,Belem,Brazil,,,,,2023-01-01,2023,Proceedings 2023 IEEE ACM 16th International Conference on Cooperative and Human Aspects of Software Engineering Chase 2023,,21101165520,,Conference Proceeding,,,,43-55,,,1,0,,,,,
2-s2.0-85165155973,10.1109/CHASE58964.2023.00011,,,What's behind tight deadlines? Business causes of technical debt,cp,Conference Paper,De Almeida R.R.,,Universidade Federal da Paraíba,Joao Pessoa,Brazil,,,,,2023-01-01,2023,Proceedings 2023 IEEE ACM 16th International Conference on Cooperative and Human Aspects of Software Engineering Chase 2023,,21101165520,,Conference Proceeding,,,,25-30,,,3,2,all repository repositoryam,All Open Access Green,,,
2-s2.0-85165153862,10.1109/CHASE58964.2023.00026,,,LGBTQIA+ (In) Visibility in Computer Science and Software Engineering Education,cp,Conference Paper,Souza Santos R.D.,,Cape Breton University,Sydney,Canada,,,,,2023-01-01,2023,Proceedings 2023 IEEE ACM 16th International Conference on Cooperative and Human Aspects of Software Engineering Chase 2023,,21101165520,,Conference Proceeding,,,,167-172,,,5,2,all repository repositoryam,All Open Access Green,,,
2-s2.0-85165143916,10.1109/CHASE58964.2023.00022,,,Perceptions of Task Interdependence in Software Development: An Industrial Case Study,cp,Conference Paper,De Barros Souza M.B.,,Universidade Federal de Pernambuco,Recife,Brazil,,,,,2023-01-01,2023,Proceedings 2023 IEEE ACM 16th International Conference on Cooperative and Human Aspects of Software Engineering Chase 2023,,21101165520,,Conference Proceeding,,,,127-137,,,0,2,all repository repositoryam,All Open Access Green,,,
2-s2.0-85165088212,10.3389/fpsyg.2023.1214014,,,Hope for brain health: impacting the life course and society,ar,Article,Dasgupta J.,,Trinity College Dublin;Samvedna Care,Dublin;Gurugram,Ireland;India,,,,,2023-01-01,2023,Frontiers in Psychology,,21100216571,16641078,Journal,14,,1214014,,,,2,1,all publisherfullgold repository repositoryvor,All Open Access Gold Green,,,
2-s2.0-85165055852,10.4324/9781003216360-9,,,Psychoanalytic intimacy as an alternative to psychic suffering for children on the edge,ch,Book Chapter,de Almeida M.M.,,Brazilian Society of Psychoanalysis of São Paulo,Sao Paulo,Brazil,,,,,2023-01-01,1 January 2023,Child and Adolescent Psychoanalysis in A Changing World Children on the Edge,,21101164905,,Book,,,,99-105,,,0,0,,,,,
2-s2.0-85164995282,10.3389/fpsyg.2023.1242809,,,Editorial: Highlights in psychology: cognitive bias,ed,Editorial,Da Silva S.,,Universidade Federal de Santa Catarina,Florianopolis,Brazil,,,,,2023-01-01,2023,Frontiers in Psychology,,21100216571,16641078,Journal,14,,1242809,,,,5,1,all publisherfullgold repository repositoryvor,All Open Access Gold Green,,,
2-s2.0-85164940974,10.14201/scero202354230264,,,Universal Design and Physical Disability: Perceptions on the Use of Support Designs for Smartphone by Adults with Cerebral Palsy,ar,Article,Curioso-Vílchez I.C.,,Universidad Científica del Sur,Lima,Peru,,,,,2023-01-01,2023,Siglo Cero,02101696,21100217604,25300350,Journal,54,2,,73-91,,,1,1,all publisherfullgold,All Open Access Gold,,,
2-s2.0-85164875488,10.4324/9781003336754-11,,,Melancholia as a clinical and metapsychological agent: A look over the ego/superego,ch,Book Chapter,Paim Filho I.A.,,Psychoanalysis Brazilian Society of Porto Alegre,Porto,Brazil,,,,,2023-01-01,1 January 2023,Ego and the Id 100 Years Later,,21101163537,,Book,,,,118-129,,,0,0,,,,,
2-s2.0-85164807420,10.4018/IJGBL.323447,,,The Mystery of Pandora: A Serious Games Approach With 360-Degree Videos on Domestic Violence Against Women,ar,Article,Felix Z.C.,,Universidade Federal Rural de Pernambuco,Recife,Brazil,,,,,2023-01-01,2023,International Journal of Game Based Learning,21556849,21100267903,21556857,Journal,13,1,,,,,3,1,all publisherhybridgold,All Open Access Hybrid Gold,,,
2-s2.0-85164739329,10.46743/2160-3715/2023.5951,,,Home-Office During COVID-19 Pandemic in Brazil: Perceived Influences on Performance and Competency Management,ar,Article,de Souza Odaguiri Enes Y.,,Universidade de Brasília,Brasília,Brazil,,,,,2023-01-01,2023,Qualitative Report,,5700165306,21603715,Journal,28,6,8,1718-1740,,,1,1,all publisherfullgold,All Open Access Gold,,,
2-s2.0-85164623434,10.1590/0102.3772e39nspe02.en,,,Predictive Potential of Motivation to Learn in the use of Learning Strategies,ar,Article,Inácio A.L.M.,,"Universidade Estadual Paulista ""Júlio de Mesquita Filho""",Sao Paulo,Brazil,,,,,2023-01-01,2023,Psicologia Teoria E Pesquisa,01023772,4700152605,18063446,Journal,39,Special Issue,e39nspe02,,,,0,1,all publisherfullgold,All Open Access Gold,,,
2-s2.0-85164622839,10.4025/psicolestud.v28i0.53629,,,TOTAL PAIN IN CANCER PATIENTS: THE INTEGRATIVE LITERATURE REVIEW,ar,Article,Gomes A.M.L.,,Centro Universitário Estácio de Sá,Fortaleza,Brazil,,,,,2023-01-01,2023,Psicologia Em Estudo,14137372,4700152863,18070329,Journal,28,,e53629,,,,2,1,all publisherfullgold,All Open Access Gold,,,
2-s2.0-85164622764,10.4025/psicolestud.v28i0.53056,,,CLINICAL ASSESSMENT OF SUICIDAL BEHAVIOR: FROM BINSWANGER TO NOWADAY’S DASEINSANALYSIS,ar,Article,Silva V.P.,,Universidade do Estado do Rio de Janeiro,Rio de Janeiro,Brazil,,,,,2023-01-01,2023,Psicologia Em Estudo,14137372,4700152863,18070329,Journal,28,,e53056,,,,0,1,,,,,
2-s2.0-85164621832,10.1590/0102.3772e39nspe09.en,,,Psychometric Properties of the Hewitt and Flett Multidimensional Perfectionism Scale in Brazilian Adults,ar,Article,Mansur-Alves M.,,Universidade Federal de Minas Gerais,Belo Horizonte,Brazil,,,,,2023-01-01,2023,Psicologia Teoria E Pesquisa,01023772,4700152605,18063446,Journal,39,Special Issue,e39nspe09,,,,1,1,all publisherfullgold,All Open Access Gold,,,
2-s2.0-85164619485,10.1590/0102.3772e39nspe01.en,,,Cognitive Reserve in Older Adults: A Cluster Analysis,ar,Article,Moret-Tatay C.,,Universidad Católica de Valencia San Vicente Mártir,Valencia,Spain,,,,,2023-01-01,2023,Psicologia Teoria E Pesquisa,01023772,4700152605,18063446,Journal,39,Special Issue,e39nspe01,,,,0,1,all publisherfullgold,All Open Access Gold,,,
2-s2.0-85164618454,10.1590/0102.3772e39404.en,,,Is There a Cure in Psychoanalysis? A Clinic for the Untreatable,ar,Article,Tavares J.M.W.,,Universidade de Brasília,Brasília,Brazil,,,,,2023-01-01,2023,Psicologia Teoria E Pesquisa,01023772,4700152605,18063446,Journal,39,,e39404,,,,0,1,all publisherfullgold,All Open Access Gold,,,
2-s2.0-85164616370,10.1590/1982-4327e3304,,,Temporal Stability of the Zulliger Test in Brazilian Adults,ar,Article,Di Domenico Grazziotin J.B.,,Universidade de Passo Fundo,Passo Fundo,Brazil,,,,,2023-01-01,2023,Paideia,0103863X,20000195050,19824327,Journal,3,,e3304,,,,2,1,all publisherfullgold,All Open Access Gold,,,
2-s2.0-85164616246,10.4025/psicolestud.v28i0.53739,,,THE NEW CORONAVIRUS PANDEMIC: PSYCHOPOLITICS AND BIOVIGILANCE,ar,Article,de Freitas F.S.,,Universidade Federal do Pará,Belem,Brazil,,,,,2023-01-01,2023,Psicologia Em Estudo,14137372,4700152863,18070329,Journal,28,,e53739,,,,0,1,all publisherfullgold,All Open Access Gold,,,
2-s2.0-85164612670,10.1590/0102.3772e39nspe08.en,,,The Data Generation Mechanism: Relationship Between Constructs and Their Indicators,ar,Article,Cunha R.D.,,Universidade de Brasília,Brasília,Brazil,,,,,2023-01-01,2023,Psicologia Teoria E Pesquisa,01023772,4700152605,18063446,Journal,39,Special Issue,e39nspe08,,,,2,1,all publisherfullgold,All Open Access Gold,,,
2-s2.0-85164610573,10.1590/0102.3772e39nspe10.en,,,The Development of Psychological Assessment in Brazil and Current and Future Challenges,ar,Article,Noronha A.P.P.,,Universidade Sao Francisco,Itatiba,Brazil,,,,,2023-01-01,2023,Psicologia Teoria E Pesquisa,01023772,4700152605,18063446,Journal,39,Special Issue,e39nspe10,,,,0,1,all publisherfullgold,All Open Access Gold,,,
2-s2.0-85164610036,10.1590/0102.3772e39nspe03.en,,,Forensic Psychological Assessment of Parental Alienation: The Jurist’s View,ar,Article,Kirchesch S.A.,,Tribunal Judicial de Mato Grosso,Chapada dos Guimarães,Brazil,,,,,2023-01-01,2023,Psicologia Teoria E Pesquisa,01023772,4700152605,18063446,Journal,39,Special Issue,e39nspe03,,,,1,1,all publisherfullgold,All Open Access Gold,,,
2-s2.0-85164609604,10.1590/0102.3772e39402.en,,,Bullying on Adolescence: Psychological Assessment with Projective Methods (Paris School),ar,Article,Neves R.C.,,Universidade de Brasília,Brasília,Brazil,,,,,2023-01-01,2023,Psicologia Teoria E Pesquisa,01023772,4700152605,18063446,Journal,39,,e39402,,,,1,0,,,,,
2-s2.0-85164608344,10.1590/0102.3772e39nspe06.en,,,Mental Health Profiles of University Students and Associated Life Habits,ar,Article,Barroso S.M.,,Universidade Federal do Triangulo Mineiro,Uberaba,Brazil,,,,,2023-01-01,2023,Psicologia Teoria E Pesquisa,01023772,4700152605,18063446,Journal,39,Special Issue,e39nspe06,,,,1,1,all publisherfullgold,All Open Access Gold,,,
2-s2.0-85164604873,10.1590/1807-0310/2023v35263464,,,WOMEN FARMERS FROM RIO GRANDE DO SUL: THEIR TRAJECTORIES IN THE CONTEXT OF AGROECOLOGICAL PRODUCTION,ar,Article,Ibarra A.C.R.,,Pontifícia Universidade Católica do Rio Grande do Sul,Porto Alegre,Brazil,,,,,2023-01-01,2023,Psicologia E Sociedade,01027182,4700152865,18070310,Journal,35,,e263464,,,,0,1,all publisherfullgold repository repositoryam,All Open Access Gold Green,,,
2-s2.0-85164603076,10.1590/1807-0310/2023v35220326,,,FROM A SCHIZO JOURNEY TO SCHIZOANALYSIS: WALKING THROUGH THE HISTORY OF PSICOLOGIA & SOCIEDADE JOURNAL,ar,Article,Donhauser L.J.,,Universidade Comunitária da Região de Chapecó,Chapeco,Brazil,,,,,2023-01-01,2023,Psicologia E Sociedade,01027182,4700152865,18070310,Journal,35,,e220326,,,,0,1,all publisherfullgold,All Open Access Gold,,,
2-s2.0-85164602908,10.1590/1807-0310/2023v35261821,,,GAGGED SEXUALITIES: THE TOPICALITY OF STELLA DO PATROCÍNIO’S SPEECHES,ar,Article,de Carvalho L.F.,,Universidade Federal de Santa Catarina,Florianopolis,Brazil,,,,,2023-01-01,2023,Psicologia E Sociedade,01027182,4700152865,18070310,Journal,35,,e261821,,,,0,1,all publisherfullgold,All Open Access Gold,,,
2-s2.0-85164602720,10.1590/0102.3772e39501.en,,,Bridging the Gaps in Social Life Cycle Assessment: Theoretical and Practical Contributions,ar,Article,Chabrawi A.M.R.O.,,Universidade de Brasília,Brasília,Brazil,,,,,2023-01-01,2023,Psicologia Teoria E Pesquisa,01023772,4700152605,18063446,Journal,39,,e39501,,,,3,1,all publisherfullgold,All Open Access Gold,,,
2-s2.0-85164599481,10.1590/0102.3772e39nspe05.en,,,Brazilian Version of the Level of Personality Functioning Scale-Brief Form 2.0: Evidence of Reliability and Validity,ar,Article,de Oliveira S.E.S.,,Universidade de Brasília,Brasília,Brazil,,,,,2023-01-01,2023,Psicologia Teoria E Pesquisa,01023772,4700152605,18063446,Journal,39,Special Issue,e39nspe05,,,,4,1,all publisherfullgold repository repositoryam,All Open Access Gold Green,,,
2-s2.0-85164596793,10.1590/0102.3772e39nspe04.en,,,The Pfister Test in Psychological Assessment for Firearm Handling,ar,Article,Resende A.C.,,Universidade Catolica de Goias,Goiania,Brazil,,,,,2023-01-01,2023,Psicologia Teoria E Pesquisa,01023772,4700152605,18063446,Journal,39,Special Issue,e39nspe04,,,,0,1,all publisherfullgold,All Open Access Gold,,,
2-s2.0-85164593728,10.4025/psicolestud.v28i0.53702,,,THE ONE AND THE FUNCTION OF SEX ACCORDING TO PSYCHOANALYSIS,ar,Article,Almeida L.F.,,Universidade de São Paulo,Sao Paulo,Brazil,,,,,2023-01-01,2023,Psicologia Em Estudo,14137372,4700152863,18070329,Journal,28,,e53702,,,,0,1,all publisherfullgold,All Open Access Gold,,,
2-s2.0-85164590161,10.1590/1807-0310/2023v35239120,,,"BRAINWASHING: SCIENCE, MYTH, AND PSEUDOSCIENCE OF PSYCHOLOGICAL CONTROL",ar,Article,Ferreira L.B.,,Universidade de Brasília,Brasília,Brazil,,,,,2023-01-01,2023,Psicologia E Sociedade,01027182,4700152865,18070310,Journal,35,,e239120,,,,0,1,all publisherfullgold,All Open Access Gold,,,
2-s2.0-85164578953,10.1590/1807-0310/2023v35262117,,,BECOMING VAGABOND AS RESISTANCE TO WORK IN THE CAPITALIST SYSTEM,ar,Article,de Oliveira e Souza O.A.,,Universidade Estadual de Londrina,Londrina,Brazil,,,,,2023-01-01,2023,Psicologia E Sociedade,01027182,4700152865,18070310,Journal,35,,e262117,,,,0,1,all publisherfullgold,All Open Access Gold,,,
2-s2.0-85164576115,10.4025/psicolestud.v28i0.53458,,,BETWEEN THE EXPECTATIONS AND PRACTICE OF A PSYCHOLOGY PROFESSIONAL AT SCHOOL,ar,Article,Tessaro M.,,Universidade do Oeste de Santa Catarina,Joacaba,Brazil,,,,,2023-01-01,2023,Psicologia Em Estudo,14137372,4700152863,18070329,Journal,28,,e53458,,,,0,1,all publisherfullgold,All Open Access Gold,,,
