eid,doi,pii,pubmed_id,title,subtype,subtypeDescription,creator,afid,affilname,affiliation_city,affiliation_country,author_count,author_names,author_ids,author_afids,coverDate,coverDisplayDate,publicationName,issn,source_id,eIssn,aggregationType,volume,issueIdentifier,article_number,pageRange,description,authkeywords,citedby_count,openaccess,freetoread,freetoreadLabel,fund_acr,fund_no,fund_sponsor
2-s2.0-85202567062,10.15689/ap.2023.2202.22680.08,,,Can careless responding interfere with the psychometric properties of self-report instruments?,ar,Article,Bonfá-Araujo B.,,Western University,London,Canada,,,,,2023-01-01,2023,Avaliacao Psicologica,16770471,21100403825,21753431,Journal,22,2,,185-195,,,0,0,,,,,
2-s2.0-85202564469,10.15689/ap.2023.2202.23319.11,,,Cross-cultural adaptation and psychometric properties of the Life Skills Transfer Survey (LSTS),ar,Article,Romano A.R.,,Universidade Sao Francisco,Itatiba,Brazil,,,,,2023-01-01,2023,Avaliacao Psicologica,16770471,21100403825,21753431,Journal,22,2,,216-225,,,1,0,,,,,
2-s2.0-85202563999,10.15689/ap.2023.2202.19668.01,,,Evidence of validity based on the internal structure of the IESS-UP-Student,ar,Article,Vieira-Santos J.,,Centro Universitário Adventista de São Paulo,Engenheiro Coelho,Brazil,,,,,2023-01-01,2023,Avaliacao Psicologica,16770471,21100403825,21753431,Journal,22,2,,111-124,,,0,0,,,,,
2-s2.0-85202562536,10.15689/ap.2023.2202.21873.07,,,Validity Evidence for the Humor Styles Questionnaire (HSQ) in Brazil,ar,Article,de Aquino S.D.,,Pontifícia Universidade Católica do Rio de Janeiro,Rio de Janeiro,Brazil,,,,,2023-01-01,2023,Avaliacao Psicologica,16770471,21100403825,21753431,Journal,22,2,,174-184,,,0,0,,,,,
2-s2.0-85202541891,10.15689/ap.2023.2202.23647.12,,,Short Scale of Creative Self: Validity Evidence for the Brazilian Version,ar,Article,de Oliveira Jorge G.,,Universidade de Brasília,Brasília,Brazil,,,,,2023-01-01,2023,Avaliacao Psicologica,16770471,21100403825,21753431,Journal,22,2,,226-235,,,0,0,,,,,
2-s2.0-85202531088,10.15689/ap.2023.2202.22885.09,,,Psychometric Properties of the Agility in the Face of Organizational Changes Scale,ar,Article,de Oliveira A.S.,,Universidade Salgado de Oliveira,Sao Goncalo,Brazil,,,,,2023-01-01,2023,Avaliacao Psicologica,16770471,21100403825,21753431,Journal,22,2,,196-205,,,0,0,,,,,
2-s2.0-85202530653,10.15689/ap.2023.2202.21080.05,,,Associations between self-statements and social skills in public speaking by university students,ar,Article,Bauth M.F.,,Centro Universitário de Lavras,Lavras,Brazil,,,,,2023-01-01,2023,Avaliacao Psicologica,16770471,21100403825,21753431,Journal,22,2,,154-162,,,0,0,,,,,
2-s2.0-85202529045,10.15689/ap.2023.2202.20915.03,,,Operationalized Portage Inventory for children with low vision: an expert analysis,ar,Article,Quintão C.S.,,Universidade Federal de São Carlos,Sao Carlos,Brazil,,,,,2023-01-01,2023,Avaliacao Psicologica,16770471,21100403825,21753431,Journal,22,2,,134-142,,,0,0,,,,,
2-s2.0-85202525418,10.15689/ap.2023.2202.20659.02,,,Scale of Creative Potential at Work: evidence of validity through internal structure and reliability,ar,Article,Spadari G.F.,,Pontificia Universidade Catolica de Campinas,Campinas,Brazil,,,,,2023-01-01,2023,Avaliacao Psicologica,16770471,21100403825,21753431,Journal,22,2,,125-133,,,0,0,,,,,
2-s2.0-85201294293,10.30578/nomadas.n57a2,,,Grey Zone: Imagination and Fabulatory Epistemology in Vilém Flusser,ar,Article,Felinto E.,,Universidad Estatal de Río de Janeiro,Rio de Janeiro,Brazil,,,,,2023-01-01,January 2023,Nomadas,01217550,21100899925,25394762,Journal,57,,n57a2,,,,0,1,all publisherfullgold,All Open Access Gold,,,
2-s2.0-85196475768,10.1007/978-3-031-40868-7_12,,,Teaching Reading with Comprehension to Public School Students,ch,Book Chapter,Domeniconi C.,,Universidade Federal de São Carlos,Sao Carlos,Brazil,,,,,2023-01-01,1 January 2023,Contributions of Behavior Analysis to Reading and Writing Comprehension,,21101229619,,Book,,,,271-289,,,0,0,,,,,
2-s2.0-85196472829,10.1007/978-3-031-40868-7_13,,,"Differential Diagnosis of Specific Reading and Writing Disorders: Speech, Language and Hearing Sciences Contributions",ch,Book Chapter,Giacheti C.M.,,"Universidade Estadual Paulista ""Júlio de Mesquita Filho""",Sao Paulo,Brazil,,,,,2023-01-01,1 January 2023,Contributions of Behavior Analysis to Reading and Writing Comprehension,,21101229619,,Book,,,,293-309,,,0,0,,,,,
2-s2.0-85196472557,10.1007/978-3-031-40868-7_10,,,Effect of Teaching Phonemes from Pseudo-Alphabets on the Emergence of Recombinative Reading in Adults,ch,Book Chapter,Inhauser L.Z.,,Núcleo de Intervenção Comportamental,Sao Paulo,Brazil,,,,,2023-01-01,1 January 2023,Contributions of Behavior Analysis to Reading and Writing Comprehension,,21101229619,,Book,,,,237-252,,,0,0,,,,,
2-s2.0-85196472223,10.1007/978-3-031-40868-7_14,,,A Dialogue on Reading: The Perspectives of Bloomfield’s Linguistics and Behavior Analysis,ch,Book Chapter,da Conceição D.B.,,Universidade Federal do Reconcavo da Bahia,Cruz das Almas,Brazil,,,,,2023-01-01,1 January 2023,Contributions of Behavior Analysis to Reading and Writing Comprehension,,21101229619,,Book,,,,311-338,,,0,0,,,,,
2-s2.0-85196472201,10.1007/978-3-031-40868-7_1,,,Behavioral Analysis of Learning to Read and Write,ch,Book Chapter,De Rose J.C.,,Universidade Federal de São Carlos,Sao Carlos,Brazil,,,,,2023-01-01,1 January 2023,Contributions of Behavior Analysis to Reading and Writing Comprehension,,21101229619,,Book,,,,3-31,,,0,0,,,,,
2-s2.0-85196467650,10.1007/978-3-031-40868-7_15,,,The Paulo Freire “Method” in a Behavioral Reading of the Alphabetization,ch,Book Chapter,Bachega D.,,Universidade Federal de São Carlos,Sao Carlos,Brazil,,,,,2023-01-01,1 January 2023,Contributions of Behavior Analysis to Reading and Writing Comprehension,,21101229619,,Book,,,,339-359,,,0,0,,,,,
2-s2.0-85196459996,10.1007/978-3-031-40868-7_3,,,The Stimulus Equivalence Paradigm and the Notion of Relational Networks in Teaching Reading and Writing: Contributions from Laboratories at UEL,ch,Book Chapter,Haydu V.B.,,Universidade Estadual de Londrina,Londrina,Brazil,,,,,2023-01-01,1 January 2023,Contributions of Behavior Analysis to Reading and Writing Comprehension,,21101229619,,Book,,,,71-92,,,0,0,,,,,
2-s2.0-85196459904,10.1007/978-3-031-40868-7_4,,,Teaching Irregular Words Through the Teaching Program Learning to Read and Write in Small Steps,ch,Book Chapter,Golfeto R.M.,,Universidade Federal de São Carlos,Sao Carlos,Brazil,,,,,2023-01-01,1 January 2023,Contributions of Behavior Analysis to Reading and Writing Comprehension,,21101229619,,Book,,,,95-119,,,0,0,,,,,
2-s2.0-85196458349,10.1007/978-3-031-40868-7_2,,,Mapping of Brazilian Studies on Reading and Writing Based on the Equivalence Paradigm,ch,Book Chapter,De Albuquerque A.R.,,Universidade Católica de Brasília,Brasilia,Brazil,,,,,2023-01-01,1 January 2023,Contributions of Behavior Analysis to Reading and Writing Comprehension,,21101229619,,Book,,,,33-69,,,0,0,,,,,
2-s2.0-85196456110,,,,Preface,ed,Editorial,De Albuquerque A.R.,,Universidade Católica de Brasília;Brazilian National Institute of Science and Technology,Brasilia;,Brazil;Brazil,,,,,2023-01-01,1 January 2023,Contributions of Behavior Analysis to Reading and Writing Comprehension,,21101229619,,Book,,,,v-vii,,,0,0,,,,,
2-s2.0-85196455752,10.1007/978-3-031-40868-7_8,,,Teaching Reading and Writing to People with Intellectual Disabilities and the ALEPP Teaching Program,ch,Book Chapter,Postalli L.M.M.,,Universidade Federal de São Carlos,Sao Carlos,Brazil,,,,,2023-01-01,1 January 2023,Contributions of Behavior Analysis to Reading and Writing Comprehension,,21101229619,,Book,,,,191-209,,,0,0,,,,,
2-s2.0-85196455663,10.1007/978-3-031-40868-7_9,,,People with Hearing Loss: Effects of Reading Instruction on Vocal Verbal Repertoire,ch,Book Chapter,Almeida-Verdu A.C.M.,,"Universidade Estadual Paulista ""Júlio de Mesquita Filho""",Sao Paulo,Brazil,,,,,2023-01-01,1 January 2023,Contributions of Behavior Analysis to Reading and Writing Comprehension,,21101229619,,Book,,,,211-235,,,0,0,,,,,
2-s2.0-85196455591,10.1007/978-3-031-40868-7,,,Contributions of Behavior Analysis to Reading and Writing Comprehension,bk,Book,De Albuquerque A.R.,,Universidade Católica de Brasília;Brazilian National Institute of Science and Technology,Brasilia;,Brazil;Brazil,,,,,2023-01-01,1 January 2023,Contributions of Behavior Analysis to Reading and Writing Comprehension,,21101229619,,Book,,,,1-359,,,0,0,,,,,
2-s2.0-85196443764,10.1007/978-3-031-40868-7_6,,,Resources Needed to Expand the Program for Teaching Verbal Repertoires Toward Sentences,ch,Book Chapter,Almeida-Verdu A.C.M.,,"Universidade Estadual Paulista ""Júlio de Mesquita Filho""",Sao Paulo,Brazil,,,,,2023-01-01,1 January 2023,Contributions of Behavior Analysis to Reading and Writing Comprehension,,21101229619,,Book,,,,139-164,,,0,0,,,,,
2-s2.0-85196442920,10.1007/978-3-031-40868-7_11,,,Learning to Read and Write in Adults: Contributions of Behavior Analysis,ch,Book Chapter,De Albuquerque A.R.,,Universidade Católica de Brasília,Brasilia,Brazil,,,,,2023-01-01,1 January 2023,Contributions of Behavior Analysis to Reading and Writing Comprehension,,21101229619,,Book,,,,253-270,,,0,0,,,,,
2-s2.0-85196439733,10.1007/978-3-031-40868-7_7,,,Teaching Relevant Prerequisites for Learning to Read and Write and Expanding the ALEPP Teaching Program,ch,Book Chapter,De Melo R.M.,,Universidade de Brasília,Brasília,Brazil,,,,,2023-01-01,1 January 2023,Contributions of Behavior Analysis to Reading and Writing Comprehension,,21101229619,,Book,,,,165-187,,,0,0,,,,,
2-s2.0-85196437930,10.1007/978-3-031-40868-7_5,,,Teaching to Read Storybooks,ch,Book Chapter,Hanna E.S.,,Universidade de Brasília,Brasília,Brazil,,,,,2023-01-01,1 January 2023,Contributions of Behavior Analysis to Reading and Writing Comprehension,,21101229619,,Book,,,,121-137,,,0,0,,,,,
2-s2.0-85193019860,10.1007/978-3-031-11760-2_6,,,"Creativity, Self-Development and Human Values: A Dialogical Perspective on Promoting a Democratic World",ch,Book Chapter,Branco A.U.,,Universidade de Brasília,Brasília,Brazil,,,,,2023-01-01,2023,Palgrave Studies in Creativity and Culture,27554503,21101264426,27554511,Book Series,Part F3857,,,109-133,,,2,0,,,,,
2-s2.0-85192938724,10.1590/1413-82712023280406,,,Human Values and Belief in Misleading Information about COVID-19,ar,Article,Daudt R.S.,,Universidade Feevale,Novo Hamburgo,Brazil,,,,,2023-01-01,2023,Psico Usf,,5800208171,21753563,Journal,28,4,,727-739,,,0,1,all publisherfullgold,All Open Access Gold,,,
2-s2.0-85192927352,10.1590/1413-82712023280413,,,Factors Influencing Life Satisfaction in Basic Education Teachers,ar,Article,de Souza L.K.,,Universidade Federal do Rio Grande do Sul,Porto Alegre,Brazil,,,,,2023-01-01,2023,Psico Usf,,5800208171,21753563,Journal,28,4,,825-836,,,1,1,all publisherfullgold,All Open Access Gold,,,
2-s2.0-85192394356,10.15689/ap.2023.2201.22223.05,,,General and Organizational Cynicism Scale: Evidence of Validity for Brazil,ar,Article,de Medeiros Silva A.C.A.,,Universidade de Brasília,Brasília,Brazil,,,,,2023-01-01,January 2023,Avaliacao Psicologica,16770471,21100403825,21753431,Journal,22,1,,42-51,,,0,0,,,,,
2-s2.0-85192384330,10.15689/ap.2023.2201.20925.03,,,"Effects of meditation on attention, executive functions and school performance",ar,Article,Vidal E.R.S.,,Universidade Federal da Bahia,Salvador,Brazil,,,,,2023-01-01,January 2023,Avaliacao Psicologica,16770471,21100403825,21753431,Journal,22,1,,22-32,,,0,0,,,,,
2-s2.0-85192382275,10.15689/ap.2023.2201.21503.04,,,The Brazilian CBCL/6-18 inventory: review of evidence of validity and reliability,ar,Article,Roama-Alves R.J.,,Universidade Federal de Mato Grosso,Cuiaba,Brazil,,,,,2023-01-01,January 2023,Avaliacao Psicologica,16770471,21100403825,21753431,Journal,22,1,,33-41,,,0,0,,,,,
2-s2.0-85192382174,10.15689/ap.2023.2201.22930.08,,,Adaptation and validation of the Comprehensive assessment of Acceptance and Commitment Therapy processes (CompACT),ar,Article,Machado A.B.C.,,Universidade Federal do Rio Grande do Sul,Porto Alegre,Brazil,,,,,2023-01-01,January 2023,Avaliacao Psicologica,16770471,21100403825,21753431,Journal,22,1,,73-81,,,0,0,,,,,
2-s2.0-85192379534,10.15689/ap.2023.2201.23399.11,,,Evidence of the Male Sexual Function Index (MSFI) for the Brazilian Context,ar,Article,Silva M.D.,,Universidade de Brasília,Brasília,Brazil,,,,,2023-01-01,January 2023,Avaliacao Psicologica,16770471,21100403825,21753431,Journal,22,1,,103-110,,,1,0,,,,,
2-s2.0-85192377117,10.15689/ap.2023.2201.22707.07,,,Instruments for the Assessment of Schizophrenia in Brazil: Literature Review,ar,Article,da Silva A.G.L.,,Professora da Faculdade Princesa do Oeste,Crateus,Brazil,,,,,2023-01-01,January 2023,Avaliacao Psicologica,16770471,21100403825,21753431,Journal,22,1,,63-72,,,0,0,,,,,
2-s2.0-85192373186,10.15689/ap.2023.2201.23187.10,,,Construction of the Courtesy Stigma among Family Members of Drug Users Scale (ECOFAD),ar,Article,Maldonado D.A.C.,,Universidade Federal de Juiz de Fora,Juiz de Fora,Brazil,,,,,2023-01-01,January 2023,Avaliacao Psicologica,16770471,21100403825,21753431,Journal,22,1,,92-102,,,0,0,,,,,
2-s2.0-85192371297,10.32601/ejal.902022,,,A Study of Consistency in English-Arabic Subtitling of Military Ranks: Black Hawk Down Film as a Case Study,ar,Article,Ibrahim I.T.,,Al-Iraqia University,Baghdad,Iraq,,,,,2023-01-01,2023,Eurasian Journal of Applied Linguistics,,21100896854,21491135,Journal,9,2,,258-266,,,1,0,,,,,
2-s2.0-85192366742,10.15689/ap.2023.2201.19619.02,,,Psychometric Properties of the Dyslexia Signs Screening Scale for Teachers,ar,Article,dos Santos Peres Cardoso H.,,Universidade Estadual do Sudoeste da Bahia,Vitoria da Conquista,Brazil,,,,,2023-01-01,January 2023,Avaliacao Psicologica,16770471,21100403825,21753431,Journal,22,1,,10-21,,,0,0,,,,,
2-s2.0-85192362506,10.15689/ap.2023.2201.18944.01,,,The cognitive interview in the adaptation and validation of a psychometric instrument,ar,Article,Pereira G.U.,,Pontifícia Universidade Católica do Rio Grande do Sul,Porto Alegre,Brazil,,,,,2023-01-01,January 2023,Avaliacao Psicologica,16770471,21100403825,21753431,Journal,22,1,,1-9,,,0,0,,,,,
2-s2.0-85192357513,10.15689/ap.2023.2201.22943.09,,,Construction of the Multidimensional Empathy Scale for Adults and evaluation of its psychometric properties,ar,Article,Sampaio L.R.,,Universidade Federal de Campina Grande,Campina Grande,Brazil,,,,,2023-01-01,January 2023,Avaliacao Psicologica,16770471,21100403825,21753431,Journal,22,1,,82-91,,,0,0,,,,,
2-s2.0-85192347883,10.15689/ap.2023.2201.22413.06,,,Scale of Conjugal Conflict: Internal validity and relation to other variables,ar,Article,Mosmann C.P.,,Universidade do Vale do Rio dos Sinos,Sao Leopoldo,Brazil,,,,,2023-01-01,January 2023,Avaliacao Psicologica,16770471,21100403825,21753431,Journal,22,1,,52-62,,,0,0,,,,,
2-s2.0-85191170065,10.2989/17280583.2023.2293904,,38638062,"Gender differences in the pathway of childhood trauma, impulsivity and adult eating behaviour: a cross-sectional study",ar,Article,Bonfada Collares Machado A.,,Universidade Federal do Rio Grande do Sul,Porto Alegre,Brazil,,,,,2023-01-01,2023,Journal of Child and Adolescent Mental Health,17280583,200147135,17280591,Journal,35,1-3,,42-54,,,0,0,,,,,
2-s2.0-85190680254,10.1037/sah0000465,,,Evidence of Validity of the Adapted Version of the Attribution Questionnaire for Drug Dependence (AQ-D),ar,Article,Ronzani T.M.,,Universidade Federal de Juiz de Fora,Juiz de Fora,Brazil,,,,,2023-01-01,2023,Stigma and Health,23766972,21101042149,23766964,Journal,,,,,,,1,0,,,,,
2-s2.0-85189299681,10.14349/sumapsi.2023.v30.n2.2,,,Utrecht Work Engagement Scale (UWES): Psychometric parameters in Brazil,ar,Article,de Holanda Coelho G.L.,,University College Cork,Cork,Ireland,,,,,2023-01-01,2023,Suma Psicologica,01214381,19700188499,21459797,Journal,30,2,,11-20,,,1,0,,,,,
2-s2.0-85189165763,10.1037/qup0000277,,,The Methodology of Narrative Productions in Bachelor’s Degree in Rural Education: Enhancing the Construction of a New Ethical Paradigm,ar,Article,dos Santos M.L.,,Universidade Federal de Ouro Preto,Ouro Preto,Brazil,,,,,2023-01-01,2023,Qualitative Psychology,23263601,21100840179,23263598,Journal,10,3,,543-551,,,0,0,,,,,
2-s2.0-85188469047,10.22235/cp.v17i2.3092,,,Updates to the validity evidence based on the internal structure of the ASRS-18,ar,Article,Porto T.I.,,Universidade do Oeste Paulista,Presidente Prudente,Brazil,,,,,2023-01-01,2023,Ciencias Psicologicas,16884094,21101065161,16884221,Journal,17,2,e3092,,,,0,1,all publisherfullgold repository repositoryam,All Open Access Gold Green,,,
2-s2.0-85188468741,10.3389/fpsyg.2023.1260814,,,Empathy and the art of Leonardo da Vinci,re,Review,Mansur S.S.,,Universidade Federal de Santa Catarina,Florianopolis,Brazil,,,,,2023-01-01,2023,Frontiers in Psychology,,21100216571,16641078,Journal,14,,1260814,,,,1,1,all publisherfullgold repository repositoryvor,All Open Access Gold Green,,,
2-s2.0-85188460733,10.22235/cp.v17i2.2867,,,The mediation of work engagement in resource relations with job crafting,ar,Article,Louro E.S.,,Universidade Salgado de Oliveira,Sao Goncalo,Brazil,,,,,2023-01-01,2023,Ciencias Psicologicas,16884094,21101065161,16884221,Journal,17,2,e2867,,,,0,1,all publisherfullgold,All Open Access Gold,,,
2-s2.0-85188448849,10.22235/cp.v17i2.2952,,,Perpetration of bullying and depression in children and adolescents: a scoping review,ar,Article,de Araújo G.R.,,Universidade Federal do Delta do Parnaíba,Parnaiba,Brazil,,,,,2023-01-01,2023,Ciencias Psicologicas,16884094,21101065161,16884221,Journal,17,2,e2952,,,,1,1,all publisherfullgold repository repositoryam,All Open Access Gold Green,,,
2-s2.0-85188445413,10.22235/cp.v17i2.2844,,,Family conflict and parental engagement: perceptions of teenage children,ar,Article,Mosmann C.P.,,Universidade do Vale do Rio dos Sinos,Sao Leopoldo,Brazil,,,,,2023-01-01,2023,Ciencias Psicologicas,16884094,21101065161,16884221,Journal,17,2,e2844,,,,0,1,all publisherfullgold repository repositoryam,All Open Access Gold Green,,,
2-s2.0-85188440312,10.22235/cp.v17i2.2805,,,Promotion of executive functions in adolescents with typical development: Systematic review,ar,Article,Nunes L.G.,,Universidade Presbiteriana Mackenzie,Sao Paulo,Brazil,,,,,2023-01-01,2023,Ciencias Psicologicas,16884094,21101065161,16884221,Journal,17,2,e-2805,,,,0,1,all publisherfullgold,All Open Access Gold,,,
2-s2.0-85188437890,10.22235/cp.v17i2.2823,,,"Promotion of empathy, self-concept and basic values: an intervention in a female prison",ar,Article,Pereira E.F.M.,,Fundacao Universidade Federal do Vale do Sao Francisco,Petrolina,Brazil,,,,,2023-01-01,2023,Ciencias Psicologicas,16884094,21101065161,16884221,Journal,17,2,e2823,,,,0,1,all publisherfullgold,All Open Access Gold,,,
2-s2.0-85188425969,10.22235/cp.v17i2.2891,,,The core of the dark triad predict environmentalism through social dominance orientation,ar,Article,Monteiro R.P.,,Universidade Federal da Paraíba,Joao Pessoa,Brazil,,,,,2023-01-01,2023,Ciencias Psicologicas,16884094,21101065161,16884221,Journal,17,2,e2891,,,,1,1,all publisherfullgold,All Open Access Gold,,,
2-s2.0-85188425641,10.22235/cp.v17i2.2861,,,Do optimism and subjective well-being help in coping with COVID-19?,ar,Article,Cavallaro A.P.O.,,Universidade Sao Francisco,Itatiba,Brazil,,,,,2023-01-01,2023,Ciencias Psicologicas,16884094,21101065161,16884221,Journal,17,2,e-2861,,,,0,1,all publisherfullgold,All Open Access Gold,,,
2-s2.0-85188424024,10.22235/cp.v17i2.2892,,,Proposal of standards for Reading Comprehension Multidimensional Battery,ar,Article,Ferraz A.S.,,Universidade de Brasília,Brasília,Brazil,,,,,2023-01-01,2023,Ciencias Psicologicas,16884094,21101065161,16884221,Journal,17,2,e-2892,,,,1,0,,,,,
2-s2.0-85188422547,10.22235/cp.v17i2.3053,,,Adaptation and validity evidence of LGBT Microaggression Experiences at Work Scale in Brazil,ar,Article,de Sousa Zarife P.,,Universidade Federal de Uberlândia,Uberlandia,Brazil,,,,,2023-01-01,2023,Ciencias Psicologicas,16884094,21101065161,16884221,Journal,17,2,e3053,,,,1,1,all publisherfullgold,All Open Access Gold,,,
2-s2.0-85188419590,10.22235/cp.v17i2.2845,,,Time management in the routine of university students: results of an intervention,ar,Article,Soares A.B.,,Universidade do Estado do Rio de Janeiro,Rio de Janeiro,Brazil,,,,,2023-01-01,2023,Ciencias Psicologicas,16884094,21101065161,16884221,Journal,17,2,e-2845,,,,1,1,all publisherfullgold repository repositoryam,All Open Access Gold Green,,,
2-s2.0-85188416344,10.22235/cp.v17i2.2835,,,"Translation, validity evidence and reliability of the Brazilian Version of the Fear of Missing Out Scale",ar,Article,Siquara G.M.,,Universidade Estadual de Feria de Santana,Santana,Brazil,,,,,2023-01-01,2023,Ciencias Psicologicas,16884094,21101065161,16884221,Journal,17,2,e2835,,,,0,1,all publisherfullgold,All Open Access Gold,,,
2-s2.0-85187712778,10.22235/cp.v17i2.2881,,,Adaptation and validation of the Psychologist and Counsellor Self-Efficacy Scale (PCES) among Brazilian psychologists and psychology students,ar,Article,Preuhs S.A.,,Pontificia Universidade Catolica de Campinas,Campinas,Brazil,,,,,2023-01-01,2023,Ciencias Psicologicas,16884094,21101065161,16884221,Journal,17,2,e2881,,,,2,1,all publisherfullgold repository repositoryam,All Open Access Gold Green,,,
2-s2.0-85186997639,10.4324/9781032153346_2,,,"Valuational (Ethical) Inquiry, Animals, and Us: Contemporary Framings and Future Imaginaries",ch,Book Chapter,Anthony R.,,University of Alaska Anchorage,Anchorage,United States,,,,,2023-01-01,1 January 2023,Routledge International Handbook of Human Animal Interactions and Anthrozoology,,21101205826,,Book,,,,17-36,,,0,0,,,,,
2-s2.0-85186925747,10.1080/13674676.2023.2270942,,,Social support and religiosity in bipolar disorder individuals in euthymic phase,ar,Article,Studart-Bottó P.,,Universidade Federal da Bahia,Salvador,Brazil,,,,,2023-01-01,2023,Mental Health Religion and Culture,13674676,12671,14699737,Journal,26,10,,993-1006,,,0,0,,,,,
2-s2.0-85186677492,,,,"Lacan, the Feminine, and Feminisms",ch,Book Chapter,Sota Fuentes M.J.,,Escola Brasileira de Psicanálise (EBP);World Association of Psychoanalysis (WAP),;,Brazil;Argentina,,,,,2023-01-01,1 January 2023,Bloomsbury Handbook to Literature and Psychoanalysis,,21101204673,,Book,,,,353-366,,,0,0,,,,,
2-s2.0-85186561679,10.3389/fnbeh.2023.1351704,,,Editorial: On the destabilization of maladaptive memory: updates and future perspectives,ed,Editorial,Radiske A.,,Universidade Federal do Rio Grande do Norte;Edmond and Lily Safra International Institute of Neuroscience,Natal;Macaiba,Brazil;Brazil,,,,,2023-01-01,2023,Frontiers in Behavioral Neuroscience,16625153,19700175166,,Journal,17,,1351704,,,,0,1,all publisherfullgold repository repositoryvor,All Open Access Gold Green,,,
2-s2.0-85185903770,10.1590/1415-4714.e220425,,,The issue of analytical neutrality: A clinical-political trajectory,ar,Article,De Souza T.R.,,Universidade Federal do Rio de Janeiro,Rio de Janeiro,Brazil,,,,,2023-01-01,2023,Revista Latinoamericana De Psicopatologia Fundamental,14154714,19200157024,19840381,Journal,26,,e220425,,,,0,1,all publisherfullgold,All Open Access Gold,,,
2-s2.0-85185508194,10.1590/1413-82712023280402,,,Family Conflict Resolution Strategies Scale: Adaptation and Psychometric Evidence,ar,Article,Costa L.B.d.S.,,Universidade Federal da Paraíba,Joao Pessoa,Brazil,,,,,2023-01-01,2023,Psico Usf,,5800208171,21753563,Journal,28,4,,669-683,,,1,1,all publisherfullgold,All Open Access Gold,,,
2-s2.0-85185505116,10.1590/1413-82712023280414,,,Creative Self-Beliefs of Civilian and Military School Students,ar,Article,Jorge G.d.O.,,Universidade de Brasília,Brasília,Brazil,,,,,2023-01-01,2023,Psico Usf,,5800208171,21753563,Journal,28,4,,837-848,,,1,1,all publisherfullgold repository repositoryam,All Open Access Gold Green,,,
2-s2.0-85185498986,10.1590/1413-82712023280412,,,"Social Skills, Behavioral Problems, and Academic Competence of Students with Intellectual Disabilities",ar,Article,Silva E.F.e.,,Universidade de São Paulo,Sao Paulo,Brazil,,,,,2023-01-01,2023,Psico Usf,,5800208171,21753563,Journal,28,4,,811-824,,,0,1,all publisherfullgold,All Open Access Gold,,,
2-s2.0-85185494032,10.1590/1413-82712023280403,,,Nonparametric Item Response Models: A Comparison on Recovering True Scores,ar,Article,Franco V.R.,,Universidade Sao Francisco,Itatiba,Brazil,,,,,2023-01-01,2023,Psico Usf,,5800208171,21753563,Journal,28,4,,685-696,,,2,1,all publisherfullgold repository repositoryam,All Open Access Gold Green,,,
2-s2.0-85185492916,10.1590/1413-82712023280411,,,Medidas Abrangente e Reduzida de Comportamento de Suporte do Supervisor à Família,ar,Article,Vieira B.A.,,Universidade Salgado de Oliveira,Sao Goncalo,Brazil,,,,,2023-01-01,2023,Psico Usf,,5800208171,21753563,Journal,28,4,,799-810,,,1,1,all publisherfullgold,All Open Access Gold,,,
2-s2.0-85185477886,10.1590/1413-82712023280410,,,Coping Strategies Scale for Cancer Patients: Development of a Measurement,ar,Article,Pereira F.R.S.,,Secretaria do Estado da Saúde do Maranhão,Sao Luis,Brazil,,,,,2023-01-01,2023,Psico Usf,,5800208171,21753563,Journal,28,4,,783-797,,,1,1,all publisherfullgold,All Open Access Gold,,,
2-s2.0-85185455570,10.1590/1413-82712023280407,,,"Evidenced of Validity of the RASH Scale — Relation, Autonomy, Separation and Heteronomy in a Sample of Brazilians and North Americans",ar,Article,Palhares F.,,Universidade Federal do Rio Grande do Sul,Porto Alegre,Brazil,,,,,2023-01-01,2023,Psico Usf,,5800208171,21753563,Journal,28,4,,741-751,,,0,1,all publisherfullgold,All Open Access Gold,,,
