eid,doi,pii,pubmed_id,title,subtype,subtypeDescription,creator,afid,affilname,affiliation_city,affiliation_country,author_count,author_names,author_ids,author_afids,coverDate,coverDisplayDate,publicationName,issn,source_id,eIssn,aggregationType,volume,issueIdentifier,article_number,pageRange,description,authkeywords,citedby_count,openaccess,freetoread,freetoreadLabel,fund_acr,fund_no,fund_sponsor
2-s2.0-85055629959,10.20396/BJOS.V17I0.8651897,,,Fracture toughness of three heat pressed ceramic systems,ar,Article,Fiorin L.,,Universidade de São Paulo,Sao Paulo,Brazil,,,,,2018-01-01,2018,Brazilian Journal of Oral Sciences,16773217,7400153104,16773225,Journal,17,,e18017,,,,0,1,all publisherfullgold repository repositoryam,All Open Access Gold Green,,,
2-s2.0-85055628354,10.20396/BJOS.V17I0.8652654,,,Effect of colorant solutions on the color stability of provisional prosthetic materials,ar,Article,Costa í.A.d.F.,,Escola Bahiana de Medicina e Saúde Pública – EBMSP,Salvador,Brazil,,,,,2018-01-01,2018,Brazilian Journal of Oral Sciences,16773217,7400153104,16773225,Journal,17,,e18153,,,,13,1,all publisherfullgold repository repositoryam,All Open Access Gold Green,,,
2-s2.0-85055625785,10.1590/1807-3107BOR-2018.VOL32.0097,,30379234,Influence of preheating and post-curing on a novel fiber-reinforced composite post material,ar,Article,de Almeida L.N.,,Universidade Federal de Goiás,Goiania,Brazil,,,,,2018-01-01,2018,Brazilian Oral Research,18068324,52142,18073107,Journal,32,,e097,,,,10,1,all publisherfullgold repository repositoryvor repositoryam,All Open Access Gold Green,,,
2-s2.0-85055625561,10.20396/BJOS.V17I0.8651900,,,Craniometric variation among Brazilian and Scottish populations: A physical anthropology approach,ar,Article,Lopez-Capp T.,,Universidade de São Paulo,Sao Paulo,Brazil,,,,,2018-01-01,2018,Brazilian Journal of Oral Sciences,16773217,7400153104,16773225,Journal,17,,e18019,,,,2,1,all publisherfullgold repository repositoryam,All Open Access Gold Green,,,
2-s2.0-85055625197,10.20396/BJOS.V17I0.8652645,,,"Changes in head posture, hyoid bone position and airway dimensions after orthognatic surgery",ar,Article,Azevedo W.R.d.S.,,United Colleges of North of Minas - FUNORTE,Maceio,Brazil,,,,,2018-01-01,2018,Brazilian Journal of Oral Sciences,16773217,7400153104,16773225,Journal,17,,e18030,,,,3,1,all publisherfullgold repository repositoryam,All Open Access Gold Green,,,
2-s2.0-85055624016,10.5005/JP-JOURNALS-10024-2355,,30150487,Antimicrobial potential of laser diode in infected dentin,ar,Article,Estrela C.R.A.,,Universidade de Cuiaba,Cuiaba,Brazil,,,,,2018-01-01,2018,Journal of Contemporary Dental Practice,,25682,15263711,Journal,19,8,,904-909,,,2,1,all publisherfree2read,All Open Access Bronze,,,
2-s2.0-85055622876,10.20396/BJOS.V17I0.8652906,,,Relationship between oral candidiasis and users of dental prostheses,ar,Article,de Lira A.,,Universidade Estadual do Piaui,Teresina,Brazil,,,,,2018-01-01,2018,Brazilian Journal of Oral Sciences,16773217,7400153104,16773225,Journal,17,,e18150,,,,1,1,all publisherfullgold repository repositoryam,All Open Access Gold Green,,,
2-s2.0-85055621949,10.20396/BJOS.V17I0.8652655,,,Fluoride concentration in Peruvian salts and the standardization of analysis with specific electrode by the direct method,ar,Article,Cury J.,,Universidade Estadual de Campinas,Campinas,Brazil,,,,,2018-01-01,2018,Brazilian Journal of Oral Sciences,16773217,7400153104,16773225,Journal,17,,e18486,,,,2,1,all publisherfullgold repository repositoryam,All Open Access Gold Green,,,
2-s2.0-85055621849,10.20396/BJOS.V17I0.8652637,,,Effect of different methods of hygiene on the color stability of extrinsically pigmented facial silicone,ar,Article,Cabral Y.M.,,Universidade Federal de Alfenas,Alfenas,Brazil,,,,,2018-01-01,2018,Brazilian Journal of Oral Sciences,16773217,7400153104,16773225,Journal,17,,e18027,,,,1,1,all publisherfullgold repository repositoryam,All Open Access Gold Green,,,
2-s2.0-85055620013,10.20396/BJOS.V17I0.8652939,,,Simplified micrometric surface characterization of different implant surfaces available on the Brazilian market,ar,Article,Filho L.,,Universidade Estadual de Campinas,Campinas,Brazil,,,,,2018-01-01,2018,Brazilian Journal of Oral Sciences,16773217,7400153104,16773225,Journal,17,,e18371,,,,1,1,all publisherfullgold,All Open Access Gold,,,
2-s2.0-85055618808,10.1590/1807-3107bor-2018.vol32.0070,,30365611,Tricalcium silicate-based cements: Properties and modifications,ar,Article,Duarte M.A.H.,,Universidade de São Paulo,Sao Paulo,Brazil,,,,,2018-01-01,2018,Brazilian Oral Research,18068324,52142,18073107,Journal,32,,e70,111-118,,,75,1,all publisherfullgold repository repositoryvor repositoryam,All Open Access Gold Green,,,
2-s2.0-85055618807,10.1590/1807-3107BOR-2018.vol32.0071,,30365612,Dendritic cells and their relation to apical peridontitis,re,Review,de Figueiredo J.,,Universidade Federal do Rio Grande do Sul,Porto Alegre,Brazil,,,,,2018-01-01,2018,Brazilian Oral Research,18068324,52142,18073107,Journal,32,,e71,119-125,,,8,1,all publisherfullgold repository repositoryvor repositoryam,All Open Access Gold Green,,,
2-s2.0-85055617356,10.1590/1807-3107bor-2018.vol32.0068,,30365609,"Endodontic medicine: Interrelationships among apical periodontitis, systemic disorders, and tissue responses of dental materials",ar,Article,Cintra L.T.A.,,"Universidade Estadual Paulista ""Júlio de Mesquita Filho""",Sao Paulo,Brazil,,,,,2018-01-01,2018,Brazilian Oral Research,18068324,52142,18073107,Journal,32,,e68,66-81,,,45,1,all publisherfullgold repository repositoryvor repositoryam,All Open Access Gold Green,,,
2-s2.0-85055616870,10.1590/1807-3107bor-2018.vol32.0075,,30365616,Pulp canal obliteration after traumatic injuries in permanent teeth - scientific fact or fiction?,re,Review,Bastos J.,,Universidade Federal de Minas Gerais,Belo Horizonte,Brazil,,,,,2018-01-01,2018,Brazilian Oral Research,18068324,52142,18073107,Journal,32,,e75,159-168,,,44,1,all publisherfullgold repository repositoryvor repositoryam,All Open Access Gold Green,,,
2-s2.0-85055616309,10.1590/1807-3107bor-2018.vol32.0067,,30365608,Nickel-titanium instruments in endodontics: A concise review of the state of the art,re,Review,Gavini G.,,Universidade de São Paulo,Sao Paulo,Brazil,,,,,2018-01-01,2018,Brazilian Oral Research,18068324,52142,18073107,Journal,32,,e67,44-65,,,180,1,all publisherfullgold repository repositoryam,All Open Access Gold Green,,,
2-s2.0-85055616139,10.1590/1807-3107bor-2018.vol32.0065,,30365606,"Unprepared root canal surface areas: Causes, clinical implications, and therapeutic strategies",ar,Article,Siqueira Junior J.F.,,Universidade Estacio de Sa,Rio de Janeiro,Brazil,,,,,2018-01-01,2018,Brazilian Oral Research,18068324,52142,18073107,Journal,32,,e65,1-19,,,182,1,all publisherfullgold repository repositoryvor,All Open Access Gold Green,,,
2-s2.0-85055615688,10.1590/1807-3107bor-2018.vol32.0072,,30365613,Current trends of genetics in apical periodontitis research,re,Review,Küchler E.C.,,Universidade de São Paulo,Sao Paulo,Brazil,,,,,2018-01-01,2018,Brazilian Oral Research,18068324,52142,18073107,Journal,32,,e72,126-132,,,14,1,all publisherfullgold repository repositoryvor,All Open Access Gold Green,,,
2-s2.0-85055614713,10.1590/1807-3107bor-2018.vol32.0066,,30365607,Root canal preparation using micro-computed tomography analysis: A literature review,re,Review,de Sousa-Neto M.D.,,Universidade de São Paulo,Sao Paulo,Brazil,,,,,2018-01-01,2018,Brazilian Oral Research,18068324,52142,18073107,Journal,32,,e66,20-43,,,98,1,all publisherfullgold repository repositoryvor repositoryam,All Open Access Gold Green,,,
2-s2.0-85055614000,10.1590/1807-3107bor-2018.vol32.0076,,30365617,How biomechanics can affect the endodontic treated teeth and their restorative procedures?,re,Review,Soares C.J.,,Universidade Federal de Uberlândia,Uberlandia,Brazil,,,,,2018-01-01,2018,Brazilian Oral Research,18068324,52142,18073107,Journal,32,,e76,169-183,,,73,1,all publisherfullgold repository repositoryvor repositoryam,All Open Access Gold Green,,,
2-s2.0-85055613580,10.1590/1807-3107bor-2018.vol32.0069,,30365610,Etiologic role of root canal infection in apical periodontitis and its relationship with clinical symptomatology,ar,Article,Gomes B.P.F.d.A.,,Universidade Estadual de Campinas,Campinas,Brazil,,,,,2018-01-01,2018,Brazilian Oral Research,18068324,52142,18073107,Journal,32,,e69,82-110,,,155,1,all publisherfullgold repository repositoryvor,All Open Access Gold Green,,,
2-s2.0-85055612618,10.1590/1807-3107bor-2018.vol32.0073,,30365614,"Root perforations: A review of diagnosis, prognosis and materials",re,Review,Estrela C.,,Universidade Federal de Goiás,Goiania,Brazil,,,,,2018-01-01,2018,Brazilian Oral Research,18068324,52142,18073107,Journal,32,,e73,133-146,,,80,1,all publisherfullgold repository repositoryvor repositoryam,All Open Access Gold Green,,,
2-s2.0-85055612381,10.1590/1807-3107bor-2018.vol32.0074,,30365615,Current options concerning the endodontically-treated teeth restoration with the adhesive approach,re,Review,de Carvalho M.A.,,Universidade Federal de Goiás,Goiania,Brazil,,,,,2018-01-01,2018,Brazilian Oral Research,18068324,52142,18073107,Journal,32,,e74,147-158,,,115,1,all publisherfullgold repository repositoryvor repositoryam,All Open Access Gold Green,,,
2-s2.0-85055611035,10.1002/JPER.17-0665,,29846937,Isolation and characterization of progenitor cells from surgically created early healing alveolar defects in humans: A preliminary study,ar,Article,Sant'ana A.C.P.,,Universidade de São Paulo,Sao Paulo,Brazil,,,,,2018-01-01,2018,Journal of Periodontology,00223492,26173,,Journal,89,11,,1326-1333,,,6,0,,,,,
2-s2.0-85055609232,10.1002/JPER.17-0619,,29873085,Long-term evaluation (20 years) of the outcomes of subepithelial connective tissue graft plus coronally advanced flap in the treatment of maxillary single recession-type defects,ar,Article,Prato G.P.P.,,Tuscany Academy of Dental Research (ATRO),Florence,Italy,,,,,2018-01-01,2018,Journal of Periodontology,00223492,26173,,Journal,89,11,,1290-1299,,,81,0,,,,,
2-s2.0-85055602086,10.1002/JPER.17-0687,,29797719,Immunological and microbiological periodontal profiles in isolated growth hormone deficiency,ar,Article,Araújo I.M.P.,,Universidade de São Paulo,Sao Paulo,Brazil,,,,,2018-01-01,2018,Journal of Periodontology,00223492,26173,,Journal,89,11,,1351-1361,,,4,0,,,,,
2-s2.0-85055129805,10.11607/prd.3500,,30304076,A powdering technique for veneering zirconia and its effect on the flexural strength of ceramic bilayers,ar,Article,da Silva P.,,"Universidade Estadual Paulista ""Júlio de Mesquita Filho""",Sao Paulo,Brazil,,,,,2018-01-01,2018,International Journal of Periodontics and Restorative Dentistry,01987569,25636,19453388,Journal,38,6,,865-871,,,1,0,,,,,
2-s2.0-85055080364,10.1590/1807-3107bor-2018.vol32.0086,,30231176,Short implants versus longer implants with maxillary sinus lift. A systematic review and meta-analysis,ar,Article,Cruz R.S.,,Universidade de São Paulo,Sao Paulo,Brazil,,,,,2018-01-01,2018,Brazilian Oral Research,18068324,52142,18073107,Journal,32,,,1-14,,,56,1,all publisherfullgold repository repositoryvor repositoryam,All Open Access Gold Green,,,
2-s2.0-85055079922,10.1590/1807-3107bor-2018.vol32.0102,,30328899,"Influence of ethanol-wet dentin, adhesive mode of application, and aging on bond strength of universal adhesive",ar,Article,de Souza M.Y.,,"Universidade Estadual Paulista ""Júlio de Mesquita Filho""",Sao Paulo,Brazil,,,,,2018-01-01,2018,Brazilian Oral Research,18068324,52142,18073107,Journal,32,,e102,,,,20,1,all publisherfullgold repository repositoryvor,All Open Access Gold Green,,,
2-s2.0-85055079417,10.1590/1807-3107bor-2018.vol32.0093,,30231175,Expression of urokinase-type plasminogen activator and its receptorin squamous cell carcinoma of the oral tongue,ar,Article,Serpa M.S.,,Universidade Federal do Rio Grande do Norte,Natal,Brazil,,,,,2018-01-01,2018,Brazilian Oral Research,18068324,52142,18073107,Journal,32,,e93,,,,10,1,all publisherfullgold repository repositoryvor repositoryam,All Open Access Gold Green,,,
2-s2.0-85055078819,10.1590/1807-3107bor-2018.vol32.0092,,30231172,"A single-center 18-year experience with oral candidiasis in Brazil: a retrospective study of 1,534 cases",ar,Article,Reinhardt L.C.,,Universidade Federal de Pelotas,Pelotas,Brazil,,,,,2018-01-01,2018,Brazilian Oral Research,18068324,52142,18073107,Journal,32,,e92,,,,14,1,all publisherfullgold repository repositoryvor,All Open Access Gold Green,,,
2-s2.0-85055078648,10.1590/1807-3107bor-2018.vol32.0108,,30328896,Influence of a hydrophobic monomer on the physical and mechanical properties of experimental surface sealants,ar,Article,Giorgi M.C.C.,,Universidade Estadual do Amazonas,Manaus,Brazil,,,,,2018-01-01,2018,Brazilian Oral Research,18068324,52142,18073107,Journal,32,,e108,,,,3,1,all publisherfullgold,All Open Access Gold,,,
2-s2.0-85055076760,10.1590/1807-3107bor-2018.vol32.0098,,30328898,Influence of head and linear growth on the development of malocclusion at six years of age: a cohort study,ar,Article,de Morais Santos Campos M.P.,,Universidade Federal de Pernambuco,Recife,Brazil,,,,,2018-01-01,2018,Brazilian Oral Research,18068324,52142,18073107,Journal,32,,e98,,,,7,1,all publisherfullgold repository repositoryvor repositoryam,All Open Access Gold Green,,,
2-s2.0-85055076587,10.1590/1807-3107bor-2018.vol32.0103,,30328900,Experimental furcal perforation treated with mineral trioxide aggregate plus selenium: immune response,ar,Article,Espaladori M.C.,,Universidade Federal de Minas Gerais,Belo Horizonte,Brazil,,,,,2018-01-01,2018,Brazilian Oral Research,18068324,52142,18073107,Journal,32,,e103,,,,2,1,all publisherfullgold repository repositoryvor,All Open Access Gold Green,,,
2-s2.0-85055076491,10.1590/1807-3107bor-2018.vol32.0105,,30328895,Nuclear Metallothionein In Oral Squamous Cell Carcinoma: Clinicopathological Parameters And Patient Survival,ar,Article,do Rego Bezerra G.M.,,João de Barros Barreto University Hospital,Belem,Brazil,,,,,2018-01-01,2018,Brazilian Oral Research,18068324,52142,18073107,Journal,32,,e105,,,,2,1,all publisherfullgold repository repositoryvor,All Open Access Gold Green,,,
2-s2.0-85055076244,10.1590/1807-3107bor-2018.vol32.0104,,30328894,Long term bonding efficacy of adhesives containing benzodioxioles as alternative co initiators,ar,Article,Lima G.D.S.,,Universidade Federal de Pelotas,Pelotas,Brazil,,,,,2018-01-01,2018,Brazilian Oral Research,18068324,52142,18073107,Journal,32,,e104,,,,3,1,all publisherfullgold repository repositoryvor repositoryam,All Open Access Gold Green,,,
2-s2.0-85055075807,10.1590/1807-3107bor-2018.vol32.0109,,30328901,The role of human milk and sucrose on cariogenicity of microcosm biofilms,ar,Article,Signori C.,,Universidade Federal de Pelotas,Pelotas,Brazil,,,,,2018-01-01,2018,Brazilian Oral Research,18068324,52142,18073107,Journal,32,,e109,,,,16,1,all publisherfullgold repository repositoryvor repositoryam,All Open Access Gold Green,,,
2-s2.0-85055075484,10.1590/1807-3107bor-2018.vol32.0091,,30231171,Caries in children with lactose intolerance and cow’s milk protein allergy,ar,Article,Moimaz S.A.S.,,"Universidade Estadual Paulista ""Júlio de Mesquita Filho""",Sao Paulo,Brazil,,,,,2018-01-01,2018,Brazilian Oral Research,18068324,52142,18073107,Journal,32,,e91,,,,10,1,all publisherfullgold repository repositoryvor repositoryam,All Open Access Gold Green,,,
2-s2.0-85055075221,10.1590/1807-3107bor-2018.vol32.0094,,30231174,Evaluation of the efficacy of filling material removal and re-filling after different retreatment procedures,ar,Article,de Castro R.F.,,Universidade Federal do Pará,Belem,Brazil,,,,,2018-01-01,2018,Brazilian Oral Research,18068324,52142,18073107,Journal,32,,e94,,,,10,1,all publisherfullgold repository repositoryvor repositoryam,All Open Access Gold Green,,,
2-s2.0-85055075112,10.1590/1807-3107bor-2018.vol32.0095,,30231170,Impact Of Malocclusion On Oral Health-Related Quality Of Life Among Schoolchildren,ar,Article,de Araújo Guimarães S.P.,,Universidade Federal dos Vales do Jequitinhonha e Mucuri,Diamantina,Brazil,,,,,2018-01-01,2018,Brazilian Oral Research,18068324,52142,18073107,Journal,32,,e95,,,,32,1,all publisherfullgold repository repositoryvor repositoryam,All Open Access Gold Green,,,
2-s2.0-85055072517,10.1590/1807-3107bor-2018.vol32.0096,,30328897,Effect Of Acute Administration Of Nicotine And Ethanol On Tooth Movement In Rats,ar,Article,de Araujo C.M.,,Pontifícia Universidade Católica do Paraná,Curitiba,Brazil,,,,,2018-01-01,2018,Brazilian Oral Research,18068324,52142,18073107,Journal,32,,e96,,,,11,1,all publisherfullgold repository repositoryvor repositoryam,All Open Access Gold Green,,,
2-s2.0-85055072118,10.1590/1807-3107bor-2018.vol32.0084,,30231173,Hyaluronic acid accelerates bone repair in human dental sockets: a randomized triple-blind clinical trial,ar,Article,Alcântara C.E.P.,,Universidade Federal de Juiz de Fora,Juiz de Fora,Brazil,,,,,2018-01-01,2018,Brazilian Oral Research,18068324,52142,18073107,Journal,32,,e84,,,,43,1,all publisherfullgold repository repositoryvor repositoryam,All Open Access Gold Green,,,
2-s2.0-85055071670,10.1590/1807-3107bor-2018.vol32.0101,,30328893,Pacifier use modifies the association between breastfeeding and malocclusion: a cross-sectional study,ar,Article,da Costa C.T.,,Universidade Federal de Pelotas,Pelotas,Brazil,,,,,2018-01-01,2018,Brazilian Oral Research,18068324,52142,18073107,Journal,32,,,1-7,,,18,1,all publisherfullgold repository repositoryvor,All Open Access Gold Green,,,
2-s2.0-85054778681,10.1177/1055665618757635,,29489417,Compensations in bone morphology and the dentition in patients with untreated unilateral cleft lip and palate: A cone- beam computed tomographic analysis,ar,Article,Woods M.E.,,University of Kentucky,Lexington,United States,,,,,2018-01-01,1 January 2018,Cleft Palate Craniofacial Journal,10556656,21036,15451569,Journal,55,10,,1358-1366,,,4,0,,,,,
2-s2.0-85054774349,10.1177/1055665618766999,,29613837,Lingual frenulum phenotypes in Brazilian infants with congenital zika syndrome,ar,Article,Fonteles C.S.R.,,Universidade Federal do Ceará,Fortaleza,Brazil,,,,,2018-01-01,1 January 2018,Cleft Palate Craniofacial Journal,10556656,21036,15451569,Journal,55,10,,1391-1398,,,10,2,all repository repositoryvor,All Open Access Green,,,
2-s2.0-85054696693,10.11607/jomi.6320,,30231088,Evaluation of vertical misfit of CAD/CAM implant-supported titanium and zirconia frameworks,ar,Article,Fontoura D.,,Faculdade de Estudos Administrativos de Minas Gerais,Belo Horizonte,Brazil,,,,,2018-01-01,2018,International Journal of Oral and Maxillofacial Implants,08822786,25615,,Journal,33,5,,1027-1032,,,11,0,,,,,
2-s2.0-85054641451,10.11607/jomi.6548,,30231103,Rehabilitation of a severely resorbed posterior mandible with 4-mm extra-short implants and guided bone regeneration: Case report with 3-year follow-up,ar,Article,Fabris V.,,ATITUS Educação,Passo Fundo,Brazil,,,,,2018-01-01,2018,International Journal of Oral and Maxillofacial Implants,08822786,25615,,Journal,33,5,,e147-e150,,,7,0,,,,,
2-s2.0-85054638426,10.11607/ijp.5876,,29772031,Stresses in implant-supported fixed complete dentures with different screw-tightening sequences and torque application modes,ar,Article,de Barcellos L.,,Pontifícia Universidade Católica do Rio Grande do Sul,Porto Alegre,Brazil,,,,,2018-01-01,2018,International Journal of Prosthodontics,08932174,25637,,Journal,31,5,,492-493,,,0,0,,,,,
2-s2.0-85054592124,10.1002/JPER.17-0356,,29693260,American academy of periodontology best evidence consensus statement on the efficacy of laser therapy used alone or as an adjunct to non-surgical and surgical treatment of periodontitis and peri-implant diseases,no,Note,Mills M.P.,,The University of Texas Health Science Center at San Antonio,San Antonio,United States,,,,,2018-01-01,2018,Journal of Periodontology,00223492,26173,,Journal,89,7,,737-742,,,79,1,all publisherfree2read repository repositoryvor,All Open Access Bronze Green,,,
2-s2.0-85054587683,10.5005/JP-JOURNALS-10024-2208,,29358532,Effect of dental prophylaxis techniques on the surface roughness of resin composites,ar,Article,Gomes I.A.,,Universidade Ceuma (UNICEUMA),Sao Luis,Brazil,,,,,2018-01-01,January 2018,Journal of Contemporary Dental Practice,,25682,15263711,Journal,19,1,,37-41,,,6,1,all publisherfree2read,All Open Access Bronze,,,
2-s2.0-85054581324,10.1002/JPER.17-0630,,29717484,Microbiologic effect of two topical anti-infective treatments on ligature-induced peri-implantitis: A pilot study in dogs,ar,Article,Ramos U.D.,,Universidade de São Paulo,Sao Paulo,Brazil,,,,,2018-01-01,2018,Journal of Periodontology,00223492,26173,,Journal,89,8,,995-1002,,,15,0,,,,,
2-s2.0-85054578805,10.5005/JP-JOURNALS-10024-2207,,29358531,Children's menu diversity: Influence on fluoride absorption and excretion,ar,Article,Cavalli A.,,Faculdade São Leopoldo Mandic,Campinas,Brazil,,,,,2018-01-01,January 2018,Journal of Contemporary Dental Practice,,25682,15263711,Journal,19,1,,30-36,,,2,1,all publisherfree2read,All Open Access Bronze,,,
2-s2.0-85054569712,10.1002/JPER.17-0541,,29520950,Early intervention of peri-implantitis and periodontitis using a mouse model,ar,Article,Wong R.L.,,"University of California, Los Angeles",Los Angeles,United States,,,,,2018-01-01,2018,Journal of Periodontology,00223492,26173,,Journal,89,6,,669-679,,,27,2,all repository repositoryam,All Open Access Green,,,
2-s2.0-85054568623,10.1002/JPER.17-0599,,29761866,Occurrence of peri-implant diseases and risk indicators at the patient and implant levels: A multilevel cross-sectional study,ar,Article,Pimentel S.P.,,Universidade Paulista,Sao Paulo,Brazil,,,,,2018-01-01,2018,Journal of Periodontology,00223492,26173,,Journal,89,9,,1091-1100,,,50,0,,,,,
2-s2.0-85054567288,10.5005/JP-JOURNALS-10024-2204,,29358528,Effect of the curing temperature of dental composites evaluated with a fluorescent dye,ar,Article,da Silva-Júnior M.,,"Universidade Estadual Paulista ""Júlio de Mesquita Filho""",Sao Paulo,Brazil,,,,,2018-01-01,January 2018,Journal of Contemporary Dental Practice,,25682,15263711,Journal,19,1,,3-12,,,2,2,all repository repositoryvor,All Open Access Green,,,
2-s2.0-85054540952,10.5005/JP-JOURNALS-10024-2252,,29603698,Does Erbium: Yttrium-aluminum-garnet laser to enamel improve the performance of etch-and-rinse and universal adhesives?,ar,Article,Tavarez R.R.D.J.,,CEUMA University São Luis,,Brazil,,,,,2018-01-01,2018,Journal of Contemporary Dental Practice,,25682,15263711,Journal,19,3,,272-282,,,4,0,,,,,
2-s2.0-85054467086,10.1590/1807-3107bor-2018.vol32.0047,,30281682,Using Uv Light For Adhesive Remnant Removal After Debonding Of Orthodontic Accessories,ar,Article,Kaneshima E.N.,,Universidade Norte do Parana,Londrina,Brazil,,,,,2018-01-01,2018,Brazilian Oral Research,18068324,52142,18073107,Journal,32,,e47,,,,8,1,all publisherfullgold repository repositoryvor repositoryam,All Open Access Gold Green,,,
2-s2.0-85054418880,10.1259/dmfr.20170437,,29718686,The assessment of adherence to infection control in oral radiology using newly developed and validated questionnaire (QicOR),ar,Article,Da Costa E.D.,,Universidade Estadual de Campinas,Campinas,Brazil,,,,,2018-01-01,2018,Dentomaxillofacial Radiology,0250832X,16649,1476542X,Journal,47,7,20170437,,,,7,2,all repository repositoryvor,All Open Access Green,,,
2-s2.0-85054412465,10.5005/JP-JOURNALS-10024-2265,,29603711,Management of a severe cervicofacial odontogenic infection,ar,Article,Tormes A.K.M.,,Universidade de Pernambuco,Recife,Brazil,,,,,2018-01-01,2018,Journal of Contemporary Dental Practice,,25682,15263711,Journal,19,3,,352-355,,,8,1,all publisherfree2read,All Open Access Bronze,,,
2-s2.0-85054399590,10.1155/2018/9169208,,,Cheilitis Glandularis of Both Lips: Successful Treatment with a Combination of an Intralesional Steroid Injection and Tacrolimus Ointment,ar,Article,Sugaya N.,,Universidade de São Paulo,Sao Paulo,Brazil,,,,,2018-01-01,2018,Case Reports in Dentistry,20906447,21100398002,20906455,Journal,2018,,9169208,,,,8,1,all publisherfullgold repository repositoryvor repositoryam,All Open Access Gold Green,,,
2-s2.0-85054398338,10.5005/JP-JOURNALS-10024-2246,,29603692,Effect of at-home and in-office bleaching on marginal microleakage in composite resin restorations using two adhesive systems,ar,Article,Klein C.A.,,Universidade Luterana do Brasil,Canoas,Brazil,,,,,2018-01-01,2018,Journal of Contemporary Dental Practice,,25682,15263711,Journal,19,3,,248-252,,,11,1,all publisherfree2read,All Open Access Bronze,,,
2-s2.0-85054153895,10.1002/JPER.17-0379,,29528502,Long-term evaluation (20 years) of the outcomes of coronally advanced flap in the treatment of single recession-type defects,ar,Article,Pini Prato G.P.,,Tuscany Academy of Dental Research (ATRO),Florence,Italy,,,,,2018-01-01,2018,Journal of Periodontology,00223492,26173,,Journal,89,3,,265-274,,,59,0,,,,,
2-s2.0-85053891386,10.1155/2018/5481383,,,Association between the anatomy of the mandibular canal and facial types: A cone-beam computed tomography analysis,ar,Article,Dos Santos Oliveira R.,,Faculdade São Leopoldo Mandic,Campinas,Brazil,,,,,2018-01-01,2018,International Journal of Dentistry,16878728,19900192030,16878736,Journal,2018,,5481383,,,,17,1,all publisherfullgold repository repositoryvor,All Open Access Gold Green,,,
2-s2.0-85053736474,10.1111/jcpe.12907,,29681059,Treatment of single maxillary gingival recession associated with non-carious cervical lesion: Randomized clinical trial comparing connective tissue graft alone to graft plus partial restoration,ar,Article,Santamaria M.P.,,"Universidade Estadual Paulista ""Júlio de Mesquita Filho""",Sao Paulo,Brazil,,,,,2018-01-01,2018,Journal of Clinical Periodontology,03036979,25669,1600051X,Journal,45,8,,968-976,,,49,0,,,,,
