eid,doi,pii,pubmed_id,title,subtype,subtypeDescription,creator,afid,affilname,affiliation_city,affiliation_country,author_count,author_names,author_ids,author_afids,coverDate,coverDisplayDate,publicationName,issn,source_id,eIssn,aggregationType,volume,issueIdentifier,article_number,pageRange,description,authkeywords,citedby_count,openaccess,freetoread,freetoreadLabel,fund_acr,fund_no,fund_sponsor
2-s2.0-85042216171,10.1007/s10973-018-7080-7,,,"Correction to: Thermal, spectroscopic and antimicrobial activity characterization of some norfloxacin complexes (Journal of Thermal Analysis and Calorimetry, (2018), 132, 2, (1077-1088), 10.1007/s10973-018-7019-z)",er,Erratum,Nunes W.D.G.,,"Universidade Estadual Paulista ""Júlio de Mesquita Filho""",Sao Paulo,Brazil,,,,,2018-09-01,1 September 2018,Journal of Thermal Analysis and Calorimetry,13886150,26983,15882926,Journal,133,3,,1673,,,0,1,all publisherfree2read repository repositoryvor,All Open Access Bronze Green,,,
2-s2.0-85042137490,10.1016/j.ijom.2018.01.021,S0901502718300390,29459128,Clinical viability of single implant-retained mandibular overdentures: a systematic review and meta-analysis,re,Review,de Souza Batista V.E.,,"Universidade Estadual Paulista ""Júlio de Mesquita Filho""",Sao Paulo,Brazil,,,,,2018-09-01,September 2018,International Journal of Oral and Maxillofacial Surgery,09015027,25629,13990020,Journal,47,9,,1166-1177,,,29,0,,,,,
2-s2.0-85042074669,10.1007/s00784-018-2358-5,,29450737,Correlation between plaque control and gingival health using short and extended oral hygiene intervals,ar,Article,De David S.C.,,Universidade Federal de Santa Maria,Santa Maria,Brazil,,,,,2018-09-01,1 September 2018,Clinical Oral Investigations,14326981,24409,14363771,Journal,22,7,,2593-2597,,,19,0,,,,,
2-s2.0-85040923799,10.1007/s00784-018-2347-8,,29372447,Lactobacillus rhamnosus intake can prevent the development of Candidiasis,ar,Article,Leão M.,,Universidade de Taubate,Taubate,Brazil,,,,,2018-09-01,1 September 2018,Clinical Oral Investigations,14326981,24409,14363771,Journal,22,7,,2511-2518,,,25,0,,,,,
2-s2.0-85040721725,10.1007/s00784-018-2344-y,,29354883,Prevalence of technical errors and periapical lesions in a sample of endodontically treated teeth: a CBCT analysis,ar,Article,Nascimento E.,,Universidade Estadual de Campinas,Campinas,Brazil,,,,,2018-09-01,1 September 2018,Clinical Oral Investigations,14326981,24409,14363771,Journal,22,7,,2495-2503,,,50,0,,,,,
2-s2.0-85035122422,10.1007/s11282-017-0306-8,,30484035,A case of sublingual adenoid cystic carcinoma involving the mandible presenting as a “skip lesion”,ar,Article,Fujita M.,,Okayama University Hospital,Okayama,Japan,,,,,2018-09-01,1 September 2018,Oral Radiology,09116028,100968,16139674,Journal,34,3,,281-287,,,2,0,,,,,
2-s2.0-85032208754,10.1007/s11282-017-0305-9,,30484033,Case–control study of mandibular canal branching and tooth-related inflammatory lesions,ar,Article,Castro M.A.A.,,Universidade Federal de Juiz de Fora,Juiz de Fora,Brazil,,,,,2018-09-01,1 September 2018,Oral Radiology,09116028,100968,16139674,Journal,34,3,,229-236,,,3,0,,,,,
2-s2.0-85052583121,10.1186/s12903-018-0612-5,,30157818,The knowledge and use of population-based methods for caries detection,ar,Article,Castro A.,,Universidade Estadual de Feira de Santana,Feira de Santana,Brazil,,,,,2018-08-29,29 August 2018,BMC Oral Health,,24341,14726831,Journal,18,1,153,,,,12,1,all publisherfullgold repository repositoryvor,All Open Access Gold Green,,,
2-s2.0-85052579887,10.1186/s12903-018-0605-4,,30157834,Oral health and health-related quality of life in HIV patients,ar,Article,da Costa Vieira V.,,Universidade Federal da Bahia,Salvador,Brazil,,,,,2018-08-29,29 August 2018,BMC Oral Health,,24341,14726831,Journal,18,1,151,,,,25,1,all publisherfullgold repository repositoryvor,All Open Access Gold Green,,,
2-s2.0-85062583643,10.1186/s12903-018-0597-0,,30086753,"Fully digital workflow, integrating dental scan, smile design and CAD-CAM: Case report",ar,Article,Stanley M.,,Private Practice,Alges,Portugal,,,,,2018-08-07,7 August 2018,BMC Oral Health,,24341,14726831,Journal,18,1,134,,,,91,1,all publisherfullgold repository repositoryvor,All Open Access Gold Green,,,
2-s2.0-85057613932,10.1563/aaid-joi-D-16-00162,,29608404,Apicoectomy and scanning electron microscopy analysis of an implant infected by apical (retrograde) peri-implantitis: A case letter,ar,Article,Manfro R.,,SOEBRAS,Florianopolis,Brazil,,,,,2018-08-01,August 2018,Journal of Oral Implantology,01606972,26153,15481336,Journal,44,4,,287-291,,,4,0,,,,,
2-s2.0-85057606241,10.1563/aaid-joi-D-17-00264,,29517410,Optimizing anterior implant esthetics with a vascularized interpositional periosteal connective tissue graft for ridge augmentation: A case report,ar,Article,Ferreira C.,,University of Tennessee Health Science Center,Memphis,United States,,,,,2018-08-01,August 2018,Journal of Oral Implantology,01606972,26153,15481336,Journal,44,4,,267-274,,,2,1,all publisherfree2read,All Open Access Bronze,,,
2-s2.0-85053622151,,,30106536,Surface treatments to improve the repair of acrylic and bis-Acryl provisional materials,ar,Article,Gonçalves T.,,Universidade Federal de Santa Catarina,Florianopolis,Brazil,,,,,2018-08-01,August 2018,American Journal of Dentistry,08948275,23805,,Journal,31,4,,199-204,,,10,0,,,,,
2-s2.0-85053597041,,,30106532,Effect of desensitizing toothpastes on dentin erosive wear and tubule occlusion. An in situ study,ar,Article,Lopes R.,,Universidade de São Paulo,Sao Paulo,Brazil,,,,,2018-08-01,August 2018,American Journal of Dentistry,08948275,23805,,Journal,31,4,,177-183,,,10,0,,,,,
2-s2.0-85052236077,10.1111/clr.13308,,29952033,Profilometric changes of peri-implant tissues over 5 years: A randomized controlled trial comparing a one- and two-piece implant system,ar,Article,Sapata V.,,Universidade de São Paulo;Universität Zürich,Sao Paulo;Zurich,Brazil;Switzerland,,,,,2018-08-01,August 2018,Clinical Oral Implants Research,09057161,24408,16000501,Journal,29,8,,864-872,,,20,2,all repository repositoryvor,All Open Access Green,,,
2-s2.0-85052192482,10.1007/s40368-018-0355-7,,29995181,Evaluation of a new method of oral health education in children with cleft lip and palate,ar,Article,Franco A.,,Universidade de São Paulo,Sao Paulo,Brazil,,,,,2018-08-01,1 August 2018,European Archives of Paediatric Dentistry,18186300,5800179585,19969805,Journal,19,4,,267-271,,,4,0,,,,,
2-s2.0-85051800460,10.1111/clr.13292,,29876969,Reposition of the bone plate over the antrostomy in maxillary sinus augmentation: A histomorphometric study in rabbits,ar,Article,Omori Y.,,Osaka Dental University;ARDEC Academy,Hirakata;Rimini,Japan;Italy,,,,,2018-08-01,August 2018,Clinical Oral Implants Research,09057161,24408,16000501,Journal,29,8,,821-834,,,29,0,,,,,
2-s2.0-85051683558,10.21815/JDE.018.084,,30068778,Dental students' perceptions and performance in use of conventional and virtual microscopy in oral pathology,ar,Article,Fernandes C.,,Universidade Estadual de Campinas,Campinas,Brazil,,,,,2018-08-01,1 August 2018,Journal of Dental Education,00220337,19466,19307837,Journal,82,8,,883-890,,,16,0,,,,,
2-s2.0-85051445294,10.1111/jopr.12727,,29235205,The Effect of Surface Treatment on Shear Bond Strength between Y-TZP and Veneer Ceramic: A Systematic Review and Meta-Analysis,re,Review,de Mello C.,,"Universidade Estadual Paulista ""Júlio de Mesquita Filho""",Sao Paulo,Brazil,,,,,2018-08-01,August 2018,Journal of Prosthodontics,1059941X,26177,1532849X,Journal,27,7,,624-635,,,28,0,,,,,
2-s2.0-85051330347,10.1016/j.prosdent.2018.05.011,S0022391318304219,30097264,Wear resistance and abrasiveness of CAD-CAM monolithic materials,ar,Article,Ludovichetti F.S.,,"Universidade Estadual Paulista ""Júlio de Mesquita Filho""",Sao Paulo,Brazil,,,,,2018-08-01,August 2018,Journal of Prosthetic Dentistry,00223913,26175,,Journal,120,2,,318-318.e8,,,106,2,all repository repositoryvor,All Open Access Green,,,
2-s2.0-85051208328,10.1111/cid.12605,,29577575,One-year clinical outcomes of locking taper Equator attachments retaining mandibular overdentures to narrow diameter implants,ar,Article,Marcello-Machado R.,,Universidade Estadual de Campinas,Campinas,Brazil,,,,,2018-08-01,August 2018,Clinical Implant Dentistry and Related Research,15230899,24403,17088208,Journal,20,4,,483-492,,,27,0,,,,,
2-s2.0-85051192969,10.1111/jop.12726,,29738071,Prevalence of oral potentially malignant disorders: A systematic review and meta-analysis,re,Review,Mello F.W.,,Universidade Federal de Santa Catarina,Florianopolis,Brazil,,,,,2018-08-01,August 2018,Journal of Oral Pathology and Medicine,09042512,26155,16000714,Journal,47,7,,633-640,,,297,0,,,,,
2-s2.0-85051178301,10.1111/jop.12741,,29863801,Androgen receptor in salivary gland carcinoma: A review of an old marker as a possible new target,ar,Article,Yeoh C.C.,,Queen Alexandra Hospital,Portsmouth,United Kingdom,,,,,2018-08-01,August 2018,Journal of Oral Pathology and Medicine,09042512,26155,16000714,Journal,47,7,,691-695,,,23,0,,,,,
2-s2.0-85051080580,10.1016/j.prosdent.2018.05.009,S0022391318304190,30097263,Effect of photodynamic therapy on the mechanical properties and bond strength of glass-fiber posts to endodontically treated intraradicular dentin,ar,Article,Strazzi Sahyon H.B.,,"Universidade Estadual Paulista ""Júlio de Mesquita Filho""",Sao Paulo,Brazil,,,,,2018-08-01,August 2018,Journal of Prosthetic Dentistry,00223913,26175,,Journal,120,2,,317-317.e7,,,69,2,all repository repositoryvor,All Open Access Green,,,
2-s2.0-85051079181,10.4317/jced.54926,,,Nonsyndromic cleft lip and/or palate: A multicenter study of the dental anomalies involved,ar,Article,Menezes C.,,Hospital Sirio-Libanês,Sao Paulo,Brazil,,,,,2018-08-01,1 August 2018,Journal of Clinical and Experimental Dentistry,,21100207619,19895488,Journal,10,8,,e746-e750,,,18,1,all publisherfree2read repository repositoryvor repositoryam,All Open Access Bronze Green,,,
2-s2.0-85051076987,10.4317/jced.54994,,,Anti-erosive effect of calcium carbonate suspensions,ar,Article,Scandiffio P.,,Faculdade São Leopoldo Mandic,Campinas,Brazil,,,,,2018-08-01,1 August 2018,Journal of Clinical and Experimental Dentistry,,21100207619,19895488,Journal,10,8,,e776-e780,,,7,1,all publisherfree2read repository repositoryvor repositoryam,All Open Access Bronze Green,,,
2-s2.0-85051071178,10.4317/jced.54967,,,Effect of different bleaching protocols on whitening efficiency and enamel superficial microhardness,ar,Article,Mushashe A.,,Universidade Positivo,Curitiba,Brazil,,,,,2018-08-01,1 August 2018,Journal of Clinical and Experimental Dentistry,,21100207619,19895488,Journal,10,8,,e772-e775,,,25,1,all publisherfree2read repository repositoryvor repositoryam,All Open Access Bronze Green,,,
2-s2.0-85051069141,10.4317/jced.54881,,,Correlation between alteration of enamel roughness and tooth color,ar,Article,Vieira-Junior W.,,Faculdade São Leopoldo Mandic,Campinas,Brazil,,,,,2018-08-01,1 August 2018,Journal of Clinical and Experimental Dentistry,,21100207619,19895488,Journal,10,8,,e815-e820,,,28,1,all publisherfree2read repository repositoryvor repositoryam,All Open Access Bronze Green,,,
2-s2.0-85050698687,10.1016/j.ajodo.2017.03.030,S088954061830266X,30075931,Extreme maxillomandibular discrepancy in unilateral cleft lip and palate: Longitudinal follow-up in a patient with mandibular prognathism,ar,Article,Turri de Castro Ribeiro T.,,Universidade de São Paulo,Sao Paulo,Brazil,,,,,2018-08-01,August 2018,American Journal of Orthodontics and Dentofacial Orthopedics,08895406,23807,,Journal,154,2,,294-304,,,6,0,,,,,
2-s2.0-85050693760,10.1016/j.ajodo.2017.10.028,S0889540618302555,30075921,Maturational changes of the normal occlusion: A 40-year follow-up,ar,Article,Massaro C.,,Universidade de São Paulo,Sao Paulo,Brazil,,,,,2018-08-01,August 2018,American Journal of Orthodontics and Dentofacial Orthopedics,08895406,23807,,Journal,154,2,,188-200,,,55,2,all repository repositoryvor,All Open Access Green,,,
2-s2.0-85050669486,10.1016/j.ajodo.2018.04.012,S088954061830369X,30075918,Authors’ response,le,Letter,Thaís Teixeira de P.,,University of Rio de Janeiro,Rio de Janeiro,Brazil,,,,,2018-08-01,August 2018,American Journal of Orthodontics and Dentofacial Orthopedics,08895406,23807,,Journal,154,2,,161-162,,,0,1,all publisherfree2read,All Open Access Bronze,,,
2-s2.0-85050666763,10.1016/j.ajodo.2017.10.030,S0889540618302634,30075924,Three-dimensional quantitative assessment of surgical stability and condylar displacement changes after counterclockwise maxillomandibular advancement surgery: Effect of simultaneous articular disc repositioning,ar,Article,Gomes L.R.,,"Universidade Estadual Paulista ""Júlio de Mesquita Filho""",Sao Paulo,Brazil,,,,,2018-08-01,August 2018,American Journal of Orthodontics and Dentofacial Orthopedics,08895406,23807,,Journal,154,2,,221-233,,,14,2,all repository repositoryvor repositoryam,All Open Access Green,,,
2-s2.0-85050454471,10.1111/clr.13340,,30043456,Implant survival rates and biologic complications with implant-supported fixed complete dental prostheses: A retrospective study with up to 12-year follow-up,ar,Article,Papaspyridakos P.,,Tufts University School of Dental Medicine;Eastman Institute for Oral Health,Boston;Rochester,United States;United States,,,,,2018-08-01,August 2018,Clinical Oral Implants Research,09057161,24408,16000501,Journal,29,8,,881-893,,,74,0,,,,,
2-s2.0-85050284001,10.1111/edt.12404,,,Effect of ethylenediaminetetraacetic acid and hyaluronic acid on the viability and cytokine expression of periodontal ligament fibroblasts,ar,Article,França M.C.M.,,"Universidade Estadual Paulista ""Júlio de Mesquita Filho""",Sao Paulo,Brazil,,,,,2018-08-01,August 2018,Dental Traumatology,16004469,24958,16009657,Journal,34,4,,271-277,,,5,0,,,,,
2-s2.0-85050268566,10.1016/j.joen.2018.05.009,S0099239918303467,30053937,Large Bacterial Floc Causing an Independent Extraradicular Infection and Posttreatment Apical Periodontitis: A Case Report,ar,Article,Ricucci D.,,Private Practice,Piacenza,Italy,,,,,2018-08-01,August 2018,Journal of Endodontics,00992399,25688,,Journal,44,8,,1308-1316,,,22,0,,,,,
2-s2.0-85049861885,10.1111/eos.12539,,29961994,In vivo biocompatibility and biomineralization of calcium silicate cements,ar,Article,Benetti F.,,"Universidade Estadual Paulista ""Júlio de Mesquita Filho""",Sao Paulo,Brazil,,,,,2018-08-01,August 2018,European Journal of Oral Sciences,09098836,25025,16000722,Journal,126,4,,326-333,,,23,0,,,,,
2-s2.0-85049805354,10.1111/joor.12651,,29761853,Splinted and unsplinted overdenture attachment systems: A systematic review and meta-analysis,re,Review,Leão R.S.,,Universidade de Pernambuco,Recife,Brazil,,,,,2018-08-01,August 2018,Journal of Oral Rehabilitation,0305182X,26156,13652842,Journal,45,8,,647-656,,,45,0,,,,,
2-s2.0-85049789233,10.23736/S0026-4970.18.04025-6,,29943947,Evaluation of stress biomarkers and electrolytes in saliva of patients undergoing fixed orthodontic treatment,ar,Article,Silva Andrade A.,,Universidade Federal do Rio Grande do Sul,Porto Alegre,Brazil,,,,,2018-08-01,August 2018,Minerva Stomatologica,00264970,26236,1827174X,Journal,67,4,,172-178,,,17,0,,,,,
2-s2.0-85049781490,10.1111/joor.12653,,29782038,Tongue pressure measurement in children with mouth-breathing behaviour,ar,Article,Azevedo N.,,Universidade Federal de Minas Gerais,Belo Horizonte,Brazil,,,,,2018-08-01,August 2018,Journal of Oral Rehabilitation,0305182X,26156,13652842,Journal,45,8,,612-617,,,24,0,,,,,
2-s2.0-85048721624,10.1016/j.jdent.2018.06.002,S0300571218301556,29894764,Evaluation of dentin desensitization protocols on the dentinal surface and their effects on the dentin bond interface,ar,Article,Escalante-Otárola W.G.,,"Universidade Estadual Paulista ""Júlio de Mesquita Filho""",Sao Paulo,Brazil,,,,,2018-08-01,August 2018,Journal of Dentistry,03005712,25686,,Journal,75,,,98-104,,,17,2,all repository repositoryvor,All Open Access Green,,,
2-s2.0-85048718425,10.1016/j.joen.2018.04.011,S0099239918302851,29908692,Apically Extruded Debris in Curved Root Canals Using the WaveOne Gold Reciprocating and Twisted File Adaptive Systems,ar,Article,Boijink D.,,Universidade Federal do Rio Grande do Sul,Porto Alegre,Brazil,,,,,2018-08-01,August 2018,Journal of Endodontics,00992399,25688,,Journal,44,8,,1289-1292,,,36,0,,,,,
2-s2.0-85048713340,10.1016/j.dental.2018.05.002,S0109564118301593,29801683,Effect of light curing units on the polymerization of bulk fill resin-based composites,ar,Article,Shimokawa C.A.K.,,Universidade de São Paulo,Sao Paulo,Brazil,,,,,2018-08-01,August 2018,Dental Materials,01095641,24936,,Journal,34,8,,1211-1221,,,70,0,,,,,
2-s2.0-85048585341,10.1016/j.oooo.2018.04.005,S2212440318309039,29880286,Presence and associated factors of carotid artery calcification detected by digital panoramic radiography in patients with chronic kidney disease undergoing hemodialysis,ar,Article,Maia P.,,Universidade Federal do Rio Grande do Norte,Natal,Brazil,,,,,2018-08-01,August 2018,Oral Surgery Oral Medicine Oral Pathology and Oral Radiology,22124403,21100204102,,Journal,126,2,,198-204,,,14,0,,,,,
2-s2.0-85048578111,10.1016/j.jcms.2018.05.041,S101051821830307X,29887197,Corrigendum to “Automatic repositioning of jaw segments for three-dimensional virtual treatment planning of orthognathic surgery” [Journal of Cranio-Maxillofacial Surgery 45 (9) (2017) 1399–1407] (S1010518217302172) (10.1016/j.jcms.2017.06.017)),er,Erratum,dos Santos R.,,Universidade Estadual de Campinas,Campinas,Brazil,,,,,2018-08-01,August 2018,Journal of Cranio Maxillofacial Surgery,10105182,21658,18784119,Journal,46,8,,1395,,,0,0,,,,,
2-s2.0-85048574033,10.1016/j.oraloncology.2018.06.010,S1368837518302288,30098783,Oncogenic drivers in 11q13 associated with prognosis and response to therapy in advanced oropharyngeal carcinomas,ar,Article,Barros-Filho M.C.,,A.C.Camargo Cancer Center,Sao Paulo,Brazil,,,,,2018-08-01,August 2018,Oral Oncology,13688375,12628,18790593,Journal,83,,,81-90,,,22,2,all repository repositoryvor repositoryam,All Open Access Green,,,
2-s2.0-85048510449,10.1016/j.jcms.2018.05.031,S1010518218302798,29866436,Three-dimensional stability analysis of maxillomandibular advancement surgery with and without articular disc repositioning,ar,Article,Bianchi J.,,"Universidade Estadual Paulista ""Júlio de Mesquita Filho""",Sao Paulo,Brazil,,,,,2018-08-01,August 2018,Journal of Cranio Maxillofacial Surgery,10105182,21658,18784119,Journal,46,8,,1348-1354,,,6,2,all repository repositoryvor,All Open Access Green,,,
2-s2.0-85048482443,10.1016/j.jcms.2018.05.030,S1010518218302786,29861406,The effect of mandibular distraction osteogenesis on airway obstruction and polysomnographic parameters in children with Robin sequence,ar,Article,da Costa A.L.,,Universidade Federal do Rio Grande do Sul;Hospital de Clinicas de Porto Alegre,Porto Alegre;Porto Alegre,Brazil;Brazil,,,,,2018-08-01,August 2018,Journal of Cranio Maxillofacial Surgery,10105182,21658,18784119,Journal,46,8,,1343-1347,,,21,0,,,,,
2-s2.0-85047809644,10.1016/j.joen.2018.03.002,S009923991830164X,29866405,Incidence of Root Resorption after the Replantation of Avulsed Teeth: A Meta-analysis,re,Review,Souza B.D.M.,,Universidade Federal de Santa Catarina,Florianopolis,Brazil,,,,,2018-08-01,August 2018,Journal of Endodontics,00992399,25688,,Journal,44,8,,1216-1227,,,77,0,,,,,
2-s2.0-85047782009,10.1111/joor.12644,,29745983,Muscle hardness and masticatory myofascial pain: Assessment and clinical relevance,re,Review,Costa Y.M.,,Universidade de São Paulo,Sao Paulo,Brazil,,,,,2018-08-01,August 2018,Journal of Oral Rehabilitation,0305182X,26156,13652842,Journal,45,8,,640-646,,,27,0,,,,,
2-s2.0-85047771859,10.1016/j.jdent.2018.05.018,S0300571218301350,29857074,Clinical relevance of studies on the visual and radiographic methods for detecting secondary caries lesions – A systematic review,re,Review,Signori C.,,Universidade Federal de Pelotas,Pelotas,Brazil,,,,,2018-08-01,August 2018,Journal of Dentistry,03005712,25686,,Journal,75,,,22-33,,,27,1,all publisherhybridgold,All Open Access Hybrid Gold,,,
2-s2.0-85047630419,10.1111/jop.12724,,29729040,Demographic and clinicopathologic distribution of head and neck malignant tumors in pediatric patients from a Brazilian population: A retrospective study,ar,Article,Arboleda L.P.A.,,Universidade Estadual de Campinas,Campinas,Brazil,,,,,2018-08-01,August 2018,Journal of Oral Pathology and Medicine,09042512,26155,16000714,Journal,47,7,,696-705,,,23,0,,,,,
2-s2.0-85047546865,10.1111/edt.12402,,,Histological evaluation of the repair process of replanted rat teeth after storage in resveratrol dissolved in dimethyl sulphoxide,ar,Article,Poi W.R.,,"Universidade Estadual Paulista ""Júlio de Mesquita Filho""",Sao Paulo,Brazil,,,,,2018-08-01,August 2018,Dental Traumatology,16004469,24958,16009657,Journal,34,4,,254-263,,,4,0,,,,,
2-s2.0-85047196958,10.1016/j.dental.2018.05.001,S0109564118300307,29764698,Translucency thresholds for dental materials,ar,Article,Salas M.,,Universidad de Granada,Granada,Spain,,,,,2018-08-01,August 2018,Dental Materials,01095641,24936,,Journal,34,8,,1168-1174,,,212,0,,,,,
2-s2.0-85047179728,10.1016/j.dental.2018.04.012,S0109564118301271,29789162,Fatigue failure load of an adhesively-cemented lithium disilicate glass-ceramic: Conventional ceramic etching vs etch & prime one-step primer,ar,Article,Scherer M.M.,,Universidade Federal de Santa Maria,Santa Maria,Brazil,,,,,2018-08-01,August 2018,Dental Materials,01095641,24936,,Journal,34,8,,1134-1143,,,45,0,,,,,
2-s2.0-85047101366,10.1016/j.archoralbio.2018.04.017,S0003996918301389,29775861,Screening methylation of DNA repair genes in the oral mucosa of chronic smokers,ar,Article,Carta C.F.L.,,"Universidade Estadual Paulista ""Júlio de Mesquita Filho"";University Center Braz Cubas",Sao Paulo;Mogi das Cruzes,Brazil;Brazil,,,,,2018-08-01,August 2018,Archives of Oral Biology,00039969,24634,18791506,Journal,92,,,83-87,,,7,2,all repository repositoryvor,All Open Access Green,,,
2-s2.0-85047094734,10.1016/j.dental.2018.05.011,S0109564117307716,29789161,Synthesis of silver-containing calcium aluminate particles and their effects on a MTA-based endodontic sealer,ar,Article,Almeida L.H.S.,,Universidade Federal de Pelotas,Pelotas,Brazil,,,,,2018-08-01,August 2018,Dental Materials,01095641,24936,,Journal,34,8,,e214-e223,,,25,0,,,,,
2-s2.0-85046829769,10.1016/j.archoralbio.2018.04.010,S0003996918301195,29727722,Association between genetic polymorphisms in DEFB1 and microRNA202 with caries in two groups of Brazilian children,ar,Article,Oliveira D.S.B.d.,,Universidade de São Paulo;Universidade Federal de Alfenas,Sao Paulo;Alfenas,Brazil;Brazil,,,,,2018-08-01,August 2018,Archives of Oral Biology,00039969,24634,18791506,Journal,92,,,1-7,,,10,0,,,,,
2-s2.0-85046769915,10.1016/j.dental.2018.04.005,S0109564117306395,29739624,Fracture loads and failure modes of customized and non-customized zirconia abutments,ar,Article,Moris I.C.M.,,Universidade de São Paulo,Sao Paulo,Brazil,,,,,2018-08-01,August 2018,Dental Materials,01095641,24936,,Journal,34,8,,e197-e204,,,9,0,,,,,
2-s2.0-85046698975,10.1016/j.dental.2018.04.011,S0109564118300952,29752162,Synthesis and characterization of a new methacrylate monomer derived from the cashew nut shell liquid (CNSL) and its effect on dentinal tubular occlusion,ar,Article,Moreira M.,,Universidade Federal do Ceará;Paulo Picanço School of Dentistry,Fortaleza;Fortaleza,Brazil;Brazil,,,,,2018-08-01,August 2018,Dental Materials,01095641,24936,,Journal,34,8,,1144-1153,,,16,2,all repository repositoryvor,All Open Access Green,,,
2-s2.0-85046632804,10.1016/j.archoralbio.2018.04.014,S0003996918301353,29751148,Salivary immunoglobulin levels in juvenile autoimmune hepatitis,ar,Article,Damasceno J.X.,,Unichristus,Fortaleza,Brazil,,,,,2018-08-01,August 2018,Archives of Oral Biology,00039969,24634,18791506,Journal,92,,,51-56,,,4,0,,,,,
2-s2.0-85046357185,10.1016/j.prosdent.2017.12.026,S0022391318300763,29724548,Risk of bias assessment of systematic reviews regarding dental implant placement in smokers: An umbrella systematic review,re,Review,de Oliveira-Neto O.B.,,Universidade Federal de Alagoas,Maceio,Brazil,,,,,2018-08-01,August 2018,Journal of Prosthetic Dentistry,00223913,26175,,Journal,120,2,,198-203,,,8,0,,,,,
2-s2.0-85046118237,10.1016/j.ijom.2018.04.011,S0901502718301425,29709324,The clinical outcome of skeletal anchorage in interceptive treatment (in growing patients) for class III malocclusion,re,Review,Meyns J.,,Departement Beeldvorming & Pathologie;General Hospital St. Jan,Leuven;Brugge,Belgium;Belgium,,,,,2018-08-01,August 2018,International Journal of Oral and Maxillofacial Surgery,09015027,25629,13990020,Journal,47,8,,1003-1010,,,16,1,all repository repositoryvor,All Open Access Green,,,
2-s2.0-85045719661,10.1016/j.joms.2018.02.013,S0278239118301769,29551518,Embolization as the Primary Treatment for Mandibular Arteriovenous Malformations: An Analysis of 50 Literature Reports and of an Illustrative Case,re,Review,Monteiro J.L.G.C.,,Universidade de Pernambuco,Recife,Brazil,,,,,2018-08-01,August 2018,Journal of Oral and Maxillofacial Surgery,02782391,26152,15315053,Journal,76,8,,1695-1707,,,8,0,,,,,
2-s2.0-85045580027,10.1016/j.joms.2018.01.031,S0278239118301113,29544755,Maxillary Interdental Osteotomies Have Low Morbidity for Alveolar Crestal Bone and Adjacent Teeth: A Cone Beam Computed Tomography-Based Study,ar,Article,Rodrigues D.B.,,Universidade Federal da Bahia,Salvador,Brazil,,,,,2018-08-01,August 2018,Journal of Oral and Maxillofacial Surgery,02782391,26152,15315053,Journal,76,8,,1763-1771,,,7,2,all repository repositoryvor,All Open Access Green,,,
