eid,doi,pii,pubmed_id,title,subtype,subtypeDescription,creator,afid,affilname,affiliation_city,affiliation_country,author_count,author_names,author_ids,author_afids,coverDate,coverDisplayDate,publicationName,issn,source_id,eIssn,aggregationType,volume,issueIdentifier,article_number,pageRange,description,authkeywords,citedby_count,openaccess,freetoread,freetoreadLabel,fund_acr,fund_no,fund_sponsor
2-s2.0-85048701960,10.26882/histagrar.075e05m,,,The Indian zebu in Brazilian lands,re,Review,Medrado J.,,Universidade Federal do Recôncavo of Bahia,Cruz das Almas,Brazil,,,,,2018-08-01,August 2018,Historia Agraria,11391472,83082,,Journal,,75,,115-138,,,3,1,all publisherfullgold,All Open Access Gold,,,
2-s2.0-85048537264,10.1016/j.dib.2018.05.142,S2352340918306486,,Data on elemental composition of the medicinal plant Hymenaea martiana Hayne (Jatobá),dp,Data Paper,Rocha L.S.,,Universidade Federal de Mato Grosso do Sul,Campo Grande,Brazil,,,,,2018-08-01,August 2018,Data in Brief,,21100372856,23523409,Journal,19,,,959-964,,,10,1,all publisherfullgold repository repositoryvor,All Open Access Gold Green,,,
2-s2.0-85047397012,10.1016/j.dib.2018.05.025,S2352340918305286,,Bacillus subtilis promoter sequences data set for promoter prediction in Gram-positive bacteria,dp,Data Paper,Coelho R.V.,,"Instituto Federal de Educação, Ciȇncia e Tecnologia do Rio Grande do Sul",Bento Goncalves,Brazil,,,,,2018-08-01,August 2018,Data in Brief,,21100372856,23523409,Journal,19,,,264-270,,,13,1,all publisherfullgold repository repositoryvor,All Open Access Gold Green,,,
2-s2.0-85047382283,10.1016/j.dib.2018.05.049,S2352340918305559,,Data on the volumes of water stored in the reservoirs supplying the Metropolitan Area of Sao Paulo (2003–2015),dp,Data Paper,Lima G.N.d.,,Universidad Nacional Autónoma de México,Mexico,Mexico,,,,,2018-08-01,August 2018,Data in Brief,,21100372856,23523409,Journal,19,,,409-412,,,1,1,all publisherfullgold repository repositoryvor,All Open Access Gold Green,,,
2-s2.0-85047118402,10.1016/j.dib.2018.04.145,S2352340918304980,,Data on tensile tests and NMR measurements of poly(vinilidene fluoride) before and after stress relaxation,dp,Data Paper,Contreras M.M.,,Universidade Federal do Rio de Janeiro,Rio de Janeiro,Brazil,,,,,2018-08-01,August 2018,Data in Brief,,21100372856,23523409,Journal,19,,,55-58,,,3,1,all publisherfullgold repository repositoryvor,All Open Access Gold Green,,,
2-s2.0-85050909774,10.1126/science.aau5930,,30049868,Brazilian killifishes risk extinction,le,Letter,Sills J.,,,,,,,,,2018-07-27,27 July 2018,Science,00368075,23571,10959203,Journal,361,6400,,340-341,,,30,0,,,,,
2-s2.0-85050671052,10.1038/s41586-018-0301-1,,30046075,The future of hyperdiverse tropical ecosystems,re,Review,Barlow J.,,Lancaster Environment Centre,Lancaster,United Kingdom,,,,,2018-07-26,26 July 2018,Nature,00280836,21206,14764687,Journal,559,7715,,517-526,,,506,2,all,All Open Access,,,
2-s2.0-85050545476,10.1126/science.aar5452,,30026200,"Modeling the ecology and evolution of biodiversity: Biogeographical cradles, museums, and graves",ar,Article,Rangel T.F.,,Universidade Federal de Goiás,Goiania,Brazil,,,,,2018-07-20,20 July 2018,Science,00368075,23571,10959203,Journal,361,6399,Y,,,,293,2,all repository repositoryam,All Open Access Green,,,
2-s2.0-85049993610,10.1073/pnas.1721728115,,29967148,Plant height and hydraulic vulnerability to drought and cold,ar,Article,Olson M.E.,,Universidad Nacional Autónoma de México,Mexico,Mexico,,,,,2018-07-17,17 July 2018,Proceedings of the National Academy of Sciences of the United States of America,00278424,21121,10916490,Journal,115,29,,7551-7556,,,321,1,all publisherfree2read repository repositoryvor,All Open Access Bronze Green,,,
2-s2.0-85054390295,10.1038/s41598-018-28052-2,,30006618,Retraction Note: New molecular tools in Neospora caninum for studying apicomplexan parasite proteins,er,Erratum,Mota C.M.,,Universidade Federal de Uberlândia,Uberlandia,Brazil,,,,,2018-07-13,13 July 2018,Scientific Reports,,21100200805,20452322,Journal,8,1,10964,10964,,,0,1,all publisherfullgold repository repositoryvor,All Open Access Gold Green,,,
2-s2.0-85050435529,10.1126/science.aau3368,,30002245,Brazil naturalizes non-native species,le,Letter,Brito M.F.G.,,Université Fédérale de Sergipe,Sao Cristovao,Brazil,,,,,2018-07-13,13 July 2018,Science,00368075,23571,10959203,Journal,361,6398,,139,,,16,0,,,,,
2-s2.0-85050281902,10.1126/science.aat1378,,30002226,Multimessenger observations of a flaring blazar coincident with high-energy neutrino IceCube-170922A,ar,Article,Aartsen M.G.,,University of Canterbury,Christchurch,New Zealand,,,,,2018-07-13,13 July 2018,Science,00368075,23571,10959203,Journal,361,6398,eaat1378,,,,1086,2,all repository repositoryam,All Open Access Green,,,
2-s2.0-85049849892,10.1126/science.aat2890,,30002248,Neutrino emission from the direction of the blazar TXS 0506+056 prior to the IceCube-170922A alert,ar,Article,Aartsen M.G.,,University of Canterbury,Christchurch,New Zealand,,,,,2018-07-13,13 July 2018,Science,00368075,23571,10959203,Journal,361,6398,,147-151,,,914,2,all repository repositoryam,All Open Access Green,,,
2-s2.0-85050366067,10.1098/rsos.180567,,,Reintroducing apex predators: The perils of muddling guilds and taxocenoses,no,Note,Miranda E.B.P.,,Universidade do Estado de Mato Grosso;ONF Brasil Gestão Florestal,Caceres;Cotriguaçu,Brazil;Brazil,,,,,2018-07-11,11 July 2018,Royal Society Open Science,,21100446014,20545703,Journal,5,7,180567,,,,3,1,all publisherfullgold repository repositoryvor,All Open Access Gold Green,,,
2-s2.0-85049612491,10.1073/pnas.1720798115,,29946025,"Evolutionary genomic dynamics of Peruvians before, during, and after the Inca Empire",ar,Article,Harris D.N.,,University of Maryland School of Medicine,Baltimore,United States,,,,,2018-07-10,10 July 2018,Proceedings of the National Academy of Sciences of the United States of America,00278424,21121,10916490,Journal,115,28,,E6526-E6535,,,113,1,all publisherhybridgold repository repositoryvor repositoryam,All Open Access Hybrid Gold Green,,,
2-s2.0-85050105437,10.1126/sciadv.aar4313,,29978040,A strategy for the conservation of biodiversity on mid-ocean ridges from deep-sea mining,re,Review,Dunn D.C.,,Duke University,Durham,United States,,,,,2018-07-04,4 July 2018,Science Advances,,21100457028,23752548,Journal,4,7,eaar4313,,,,102,1,all publisherfullgold repository repositoryvor,All Open Access Gold Green,,,
2-s2.0-85055915382,10.5123/S1679-49742018000200007,S223796222018000200900,29972471,Can Brazil achieve the new World Health Organization global targets for tuberculosis control?,ar,Article,Maciel E.L.N.,,Universidade Federal do Espírito Santo,Vitoria,Brazil,,,,,2018-07-02,2 July 2018,Epidemiologia E Servicos De Saude Revista do Sistema Unico De Saude do Brasil,,21100872043,22379622,Journal,27,2,,e0200007,,,3,1,all publisherfullgold,All Open Access Gold,,,
2-s2.0-85055912550,10.5123/S1679-49742018000200015,S223796222018000200314,29972473,Health communication: a study of the profile and structure of municipal communication advisory services in 2014-2015,ar,Article,Nardi A.C.F.,,Universidade de Brasília,Brasília,Brazil,,,,,2018-07-02,2 July 2018,Epidemiologia E Servicos De Saude Revista do Sistema Unico De Saude do Brasil,,21100872043,22379622,Journal,27,2,,e2017409,,,2,1,all publisherfullgold repository repositoryvor,All Open Access Gold Green,,,
2-s2.0-85055909733,10.5123/S1679-49742018000200013,S223796222018000200313,29972472,"Recreational soccer practice among adults, in Brazilian capitals, 2011-2015",ar,Article,Lima D.F.d.,,Universidade Estadual do Oeste do Paraná,Cascavel,Brazil,,,,,2018-07-02,2 July 2018,Epidemiologia E Servicos De Saude Revista do Sistema Unico De Saude do Brasil,,21100872043,22379622,Journal,27,2,,e2017284,,,7,1,all publisherfullgold repository repositoryvor,All Open Access Gold Green,,,
2-s2.0-85055906632,10.5123/S1679-49742018000200014,S223796222018000200315,29972474,Congenital syndrome associated with Zika virus infection among live births in Brazil: a description of the distribution of reported and confirmed cases in 2015-2016,ar,Article,França G.V.A.d.,,Ministério da Saúde,Brasilia,Brazil,,,,,2018-07-02,2 July 2018,Epidemiologia E Servicos De Saude Revista do Sistema Unico De Saude do Brasil,,21100872043,22379622,Journal,27,2,,e2017473,,,38,1,all publisherfullgold repository repositoryvor,All Open Access Gold Green,,,
2-s2.0-85063887617,10.17648/acta.scientiae.v20iss4id4620,,,The milieu and the didactic contract – Analysis of a demonstrative class of the circle of mathematics of Brazil,ar,Article,Figueroa T.,,Universidade de São Paulo;Universidade Tecnológica Federal do Paraná,Sao Paulo;Curitiba,Brazil;Brazil,,,,,2018-07-01,July-August 2018,Acta Scientiae,15174492,21100902661,21787727,Journal,20,4,,687-706,,,0,1,all publisherfullgold,All Open Access Gold,,,
2-s2.0-85063815374,10.17648/acta.scientiae.v20iss4id4670,,,Investigating the drivers and mental representations of the private interpretations of students of quantum mechanics,ar,Article,Trevisan R.,,Universidade Luterana do Brasil,Canoas,Brazil,,,,,2018-07-01,July-August 2018,Acta Scientiae,15174492,21100902661,21787727,Journal,20,4,,725-745,,,1,1,all publisherfullgold,All Open Access Gold,,,
2-s2.0-85063806823,10.17648/acta.scientiae.v20iss4id4199,,,Contributions to teacher development in the context of a teacher training program,ar,Article,Santos M.,,Program in Education in Science and Mathematics;Escola Luterana Martinho Lutero,;Porto Alegre,United States;Brazil,,,,,2018-07-01,July-August 2018,Acta Scientiae,15174492,21100902661,21787727,Journal,20,4,,670-686,,,0,1,all publisherfullgold repository repositoryam,All Open Access Gold Green,,,
2-s2.0-85063800538,10.17648/acta.scientiae.v20iss4id3913,,,Approach to phylogenetic systematics with emphasis on biodiversity in textbooks,ar,Article,Cordeiro R.S.,,Universidade de Mogi das Cruzes,Mogi das Cruzes,Brazil,,,,,2018-07-01,July-August 2018,Acta Scientiae,15174492,21100902661,21787727,Journal,20,4,,610-625,,,2,1,all publisherfullgold,All Open Access Gold,,,
2-s2.0-85063789322,10.17648/acta.scientiae.v20iss4id3716,,,A brief history of molecular geometry from the epistemological perspective of Guy Brousseau,re,Review,Da Silva K.S.,,Universidade de São Paulo;Université Fédérale de Sergipe,Sao Paulo;Sao Cristovao,Brazil;Brazil,,,,,2018-07-01,July-August 2018,Acta Scientiae,15174492,21100902661,21787727,Journal,20,4,,626-647,,,1,1,all publisherfullgold,All Open Access Gold,,,
2-s2.0-85063768792,10.17648/acta.scientiae.v20iss4id4228,,,The scientific divulgation of the theme ‘water’: An analysis of the science textbooks,ar,Article,Miceli B.S.,,Centro Federal De Educacão Tecnológica Celso Suckow Da Fonseca,Rio de Janeiro,Brazil,,,,,2018-07-01,July-August 2018,Acta Scientiae,15174492,21100902661,21787727,Journal,20,4,,707-724,,,1,1,all publisherfullgold,All Open Access Gold,,,
2-s2.0-85063766014,10.17648/acta.scientiae.v20iss4id4096,,,Recurring history and the provisional character of science in the nature of light teaching,re,Review,De Souza P.F.,,Universidade Federal de Goiás,Goiania,Brazil,,,,,2018-07-01,July-August 2018,Acta Scientiae,15174492,21100902661,21787727,Journal,20,4,,648-669,,,1,1,all publisherfullgold,All Open Access Gold,,,
2-s2.0-85063739639,10.17648/acta.scientiae.v20iss4id4038,,,Perceptions about the nature of science in popular science texts from Ciência Hoje online Journal,re,Review,de Paiva Diniz N.,,Universidade Federal de Santa Catarina,Florianopolis,Brazil,,,,,2018-07-01,July-August 2018,Acta Scientiae,15174492,21100902661,21787727,Journal,20,4,,571-592,,,1,1,all publisherfullgold,All Open Access Gold,,,
2-s2.0-85063738279,10.17648/acta.scientiae.v20iss4id4095,,,Inherited human characters used in teaching genetics in textbooks,re,Review,Baiotto C.R.,,Universidade de Cruz Alta,Cruz Alta,Brazil,,,,,2018-07-01,July-August 2018,Acta Scientiae,15174492,21100902661,21787727,Journal,20,4,,593-609,,,1,1,all publisherfullgold,All Open Access Gold,,,
2-s2.0-85063724526,10.17648/acta.scientiae.v20iss4id3647,,,The manuscripts of Manoel de azevedo fortes (1660-1749) and the scientific discourse in the Portuguese kingdom in the passage from the XVII century to the XVIII century,re,Review,Ribeiro D.,,Universidade Estadual do Oeste do Paraná,Cascavel,Brazil,,,,,2018-07-01,July-August 2018,Acta Scientiae,15174492,21100902661,21787727,Journal,20,4,,536-551,,,0,1,all publisherfullgold,All Open Access Gold,,,
2-s2.0-85063723375,10.17648/acta.scientiae.v20iss4id3788,,,Films used in the teaching of sciences and the possibilities of discussions about science,ar,Article,Berk A.,,Centro Federal De Educacão Tecnológica Celso Suckow Da Fonseca,Rio de Janeiro,Brazil,,,,,2018-07-01,July-August 2018,Acta Scientiae,15174492,21100902661,21787727,Journal,20,4,,520-535,,,1,1,all publisherfullgold,All Open Access Gold,,,
2-s2.0-85058441678,10.1371/journal.pone.0199868,,30044799,Direct archaeological evidence for Southwestern Amazonia as an early plant domestication and food production centre,ar,Article,Watling J.,,Universidade de São Paulo,Sao Paulo,Brazil,,,,,2018-07-01,July 2018,Plos One,,10600153309,19326203,Journal,13,7,e0199868,,,,121,1,all publisherfullgold repository repositoryvor repositoryam,All Open Access Gold Green,,,
2-s2.0-85054780542,10.1590/0001-3765201820170930,,29947678,Nanoencapsulated Melaleuca alternifolia essential oil exerts anesthetic effects in the brachyuran crab using Neohelice granulata,ar,Article,Souza C.F.,,Universidade Federal de Santa Maria,Santa Maria,Brazil,,,,,2018-07-01,July-September 2018,Anais Da Academia Brasileira De Ciencias,00013765,18659,16782690,Journal,90,3,,2855-2864,,,11,1,all publisherfullgold repository repositoryam,All Open Access Gold Green,,,
2-s2.0-85054772709,10.1590/0001-3765201820170809,,30043909,A comparative study of phytoconstituents and antibacterial activity of in vitro derived materials of four passiflora species,ar,Article,Simão M.J.,,Universidade do Estado do Rio de Janeiro,Rio de Janeiro,Brazil,,,,,2018-07-01,July-September 2018,Anais Da Academia Brasileira De Ciencias,00013765,18659,16782690,Journal,90,3,,2805-2813,,,8,1,all publisherfullgold repository repositoryam,All Open Access Gold Green,,,
2-s2.0-85054600912,10.1590/0001-3765201820170728,,,Study of barium sulfate dissolution by scale dissolver based on solutions of dtpa,ar,Article,Abib� G.A.P.,,Universidade Estadual do Norte Fluminense,Campos dos Goitacazes,Brazil,,,,,2018-07-01,July-September 2018,Anais Da Academia Brasileira De Ciencias,00013765,18659,16782690,Journal,90,3,,3185-3196,,,13,1,all publisherfullgold repository repositoryvor repositoryam,All Open Access Gold Green,,,
2-s2.0-85054600395,10.1590/0001-3765201820170594,,30043905,"Medicinal plants: Versatility and concordance of use in the caatinga area, northeastern brazil",ar,Article,Santos M.O.,,Universidade Regional do Cariri,Crato,Brazil,,,,,2018-07-01,July-September 2018,Anais Da Academia Brasileira De Ciencias,00013765,18659,16782690,Journal,90,3,,2767-2779,,,14,1,all publisherfullgold repository repositoryvor repositoryam,All Open Access Gold Green,,,
2-s2.0-85054598943,10.1590/0001-3765201820170352,,,L-carnitine supplementation in the recovery of plasma l-carnitine in patients with heart failure submitted to coronary artery bypass grafting,ar,Article,Souza Cruz W.M.,,Universidade Federal do Rio de Janeiro,Rio de Janeiro,Brazil,,,,,2018-07-01,July-September 2018,Anais Da Academia Brasileira De Ciencias,00013765,18659,16782690,Journal,90,3,,3099-3104,,,2,1,all publisherfullgold repository repositoryvor repositoryam,All Open Access Gold Green,,,
2-s2.0-85054598683,10.1590/0001-3765201820170522,,,"Occurrence and characterization of entomogenic galls in an area of cerrado sensu stricto and gallery forest of the state of bahia, brazil",ar,Article,DA SILVA A.,,Universidade do Estado da Bahia,Salvador,Brazil,,,,,2018-07-01,July-September 2018,Anais Da Academia Brasileira De Ciencias,00013765,18659,16782690,Journal,90,3,,2903-2919,,,12,1,all publisherfullgold repository repositoryvor repositoryam,All Open Access Gold Green,,,
2-s2.0-85054597097,10.1590/0001-3765201820180199,,,New technique of intragastric sleeve: Viability and survival in a pig model,ar,Article,Ribeiro M.,,Universidade do Estado do Rio de Janeiro,Rio de Janeiro,Brazil,,,,,2018-07-01,July-September 2018,Anais Da Academia Brasileira De Ciencias,00013765,18659,16782690,Journal,90,3,,3075-3080,,,1,1,all publisherfullgold repository repositoryvor repositoryam,All Open Access Gold Green,,,
2-s2.0-85054596846,10.1590/0001-3765201820180364,,,Glucocorticoid susceptibility and in vivo abcb1 activity differ in murine b cell subset,ar,Article,DA COSTA K.M.,,Universidade Federal do Rio de Janeiro,Rio de Janeiro,Brazil,,,,,2018-07-01,July-September 2018,Anais Da Academia Brasileira De Ciencias,00013765,18659,16782690,Journal,90,3,,3081-3097,,,5,1,all publisherfullgold repository repositoryvor,All Open Access Gold Green,,,
2-s2.0-85054596170,10.1590/0001-3765201820170972,,30043910,Physicochemical quality profiles of commercial oral tablets and capsulecontaining lutein – impact of insufficient specific sanitary regulations,ar,Article,Anselmo C.D.S.,,Universidade Federal do Rio de Janeiro,Rio de Janeiro,Brazil,,,,,2018-07-01,July-September 2018,Anais Da Academia Brasileira De Ciencias,00013765,18659,16782690,Journal,90,3,,3063-3073,,,7,1,all publisherfullgold repository repositoryvor repositoryam,All Open Access Gold Green,,,
2-s2.0-85054596042,10.1590/0001-3765201820170905,,,Tracking atmospheric dispersion of metals in rio de janeiro metropolitan region (Brazil) with epiphytes as bioindicators,ar,Article,Marques A.N.,,Universidade Federal Fluminense,Niteroi,Brazil,,,,,2018-07-01,July-September 2018,Anais Da Academia Brasileira De Ciencias,00013765,18659,16782690,Journal,90,3,,2991-3005,,,8,1,all publisherfullgold repository repositoryvor repositoryam,All Open Access Gold Green,,,
2-s2.0-85054595210,10.1590/0001-3765201820170838,,30304229,Immunophenotyping lymphocyte and acute phase proteins in canine x-linked muscular dystrophy,ar,Article,DE ABREU D.K.,,Universidade de São Paulo,Sao Paulo,Brazil,,,,,2018-07-01,July-September 2018,Anais Da Academia Brasileira De Ciencias,00013765,18659,16782690,Journal,90,3,,2977-2990,,,1,1,all publisherfullgold repository repositoryvor repositoryam,All Open Access Gold Green,,,
2-s2.0-85054594058,10.1590/0001-3765201820170749,,29947673,"First record of the invasive tapeworm, schyzocotyle acheilognathi (Pseudophyllidea; bothriocephalidae) in native freshwater fish, brazil",ar,Article,DE SOUZA G.A.,,Universidade Federal do Rio de Janeiro,Rio de Janeiro,Brazil,,,,,2018-07-01,July-September 2018,Anais Da Academia Brasileira De Ciencias,00013765,18659,16782690,Journal,90,3,,2845-2849,,,7,1,all publisherfullgold repository repositoryvor repositoryam,All Open Access Gold Green,,,
2-s2.0-85054593639,10.1590/0001-3765201820170977,,,"Ongoing quiescence in the borborema plateau plague focus (Paraiba, brazil)",ar,Article,Zeppelini C.G.,,Universidade Federal da Paraíba,Joao Pessoa,Brazil,,,,,2018-07-01,July-September 2018,Anais Da Academia Brasileira De Ciencias,00013765,18659,16782690,Journal,90,3,,3007-3015,,,6,1,all publisherfullgold repository repositoryvor,All Open Access Gold Green,,,
2-s2.0-85054589368,10.1590/0001-3765201820171003,,,Mutations in the melanocortin-1 receptor (Mc1r) gene have no influence on the distinct patterns of melanic plumage found in the manakins of the genus antilophia (aves: Pipridae),ar,Article,Luna L.,,Universidade Federal do Pará;Museu Paraense Emilio Goeldi,Belem;Belem,Brazil;Brazil,,,,,2018-07-01,July-September 2018,Anais Da Academia Brasileira De Ciencias,00013765,18659,16782690,Journal,90,3,,2873-2879,,,2,1,all publisherfullgold repository repositoryvor,All Open Access Gold Green,,,
2-s2.0-85054587276,10.1590/0001-3765201820180095,,,"Brazilian fruit processing, wastes as a source of lipase and other biotechnological products: A review",ar,Article,Okino-Delgado C.H.,,"Universidade Estadual Paulista ""Júlio de Mesquita Filho""",Sao Paulo,Brazil,,,,,2018-07-01,July-September 2018,Anais Da Academia Brasileira De Ciencias,00013765,18659,16782690,Journal,90,3,,2927-2943,,,18,1,all publisherfullgold repository repositoryam,All Open Access Gold Green,,,
2-s2.0-85054587263,10.1590/0001-3765201820170946,,,Dextran sulphate of sodium-induced colitis in mice: antihyperalgesic effects of ethanoliextract of citrus reticulata and potential damage to the central nervous system,ar,Article,Hilel A.S.,,Universidade do Sul de Santa Catarina,Tubarao,Brazil,,,,,2018-07-01,July-September 2018,Anais Da Academia Brasileira De Ciencias,00013765,18659,16782690,Journal,90,3,,3139-3145,,,7,1,all publisherfullgold repository repositoryvor,All Open Access Gold Green,,,
2-s2.0-85054587175,10.1590/0001-3765201820170955,,,Satellite telemetry and image reception with software defineradio applied to space outreach projects in brazil,ar,Article,Peralta D.J.M.,,Instituto Nacional de Pesquisas Espaciais,Sao Jose dos Campos,Brazil,,,,,2018-07-01,July-September 2018,Anais Da Academia Brasileira De Ciencias,00013765,18659,16782690,Journal,90,3,,3175-3184,,,2,1,all publisherfullgold repository repositoryvor repositoryam,All Open Access Gold Green,,,
2-s2.0-85054586774,10.1590/0001-3765201820170261,,30043902,"Solaropsis brasiliana, anatomy, range extension and its phylogenetic position within pleurodontidae (Mollusca, gastropoda, stylommatophora)",ar,Article,Cuezzo M.G.,,Consejo Nacional de Investigaciones Científicas y Técnicas,Buenos Aires,Argentina,,,,,2018-07-01,July-September 2018,Anais Da Academia Brasileira De Ciencias,00013765,18659,16782690,Journal,90,3,,2753-2765,,,5,1,all publisherfullgold repository repositoryvor repositoryam,All Open Access Gold Green,,,
2-s2.0-85054583581,10.1590/0001-3765201820170268,,,"Simulation of a surface spill of different diesel/biodiesel mixtures in an ultisol, using natural attenuation and bioaugmentation/biostimulation",ar,Article,Meyer D.D.,,Universidade Federal do Rio Grande do Sul,Porto Alegre,Brazil,,,,,2018-07-01,July-September 2018,Anais Da Academia Brasileira De Ciencias,00013765,18659,16782690,Journal,90,3,,2741-2752,,,8,1,all publisherfullgold repository repositoryvor repositoryam,All Open Access Gold Green,,,
2-s2.0-85054581294,10.1590/0001-3765201820170606,,,Structural characterization of vegetative organs of the endangered brazilian native species hesperozygis ringens (Benth.) epling,ar,Article,Pinheiro C.G.,,Universidade Federal de Santa Maria,Santa Maria,Brazil,,,,,2018-07-01,July-September 2018,Anais Da Academia Brasileira De Ciencias,00013765,18659,16782690,Journal,90,3,,2887-2901,,,2,1,all publisherfullgold repository repositoryvor,All Open Access Gold Green,,,
2-s2.0-85054580915,10.1590/0001-3765201820180144,,,Hibiscus acetosella extract protects against alkylating agent-induced dna damage in mice,ar,Article,Vilela T.C.,,Universidade do Sul de Santa Catarina,Tubarao,Brazil,,,,,2018-07-01,July-September 2018,Anais Da Academia Brasileira De Ciencias,00013765,18659,16782690,Journal,90,3,,3165-3174,,,5,1,all publisherfullgold repository repositoryvor repositoryam,All Open Access Gold Green,,,
2-s2.0-85054579193,10.1590/0001-3765201820180033,,30304214,Essential oils from piper aduncum inflorescences and leaves: Chemicacomposition and antifungal activity against sclerotinia sclerotiorum,ar,Article,Valadares A.C.F.,,"Instituto Federal de Educação, Ciência e Tecnologia Goiano Campus Rio Verde",Rio Verde,Brazil,,,,,2018-07-01,July-September 2018,Anais Da Academia Brasileira De Ciencias,00013765,18659,16782690,Journal,90,3,,2691-2699,,,32,1,all publisherfullgold repository repositoryvor,All Open Access Gold Green,,,
2-s2.0-85054578687,10.1590/0001-3765201820170420,,30304215,"Seasonal variations, metal distribution and water quality in the todos os santos river, southeastern brazil: A multivariate analysis",ar,Article,Pereira C.A.F.,,Universidade Federal dos Vales do Jequitinhonha e Mucuri,Diamantina,Brazil,,,,,2018-07-01,July-September 2018,Anais Da Academia Brasileira De Ciencias,00013765,18659,16782690,Journal,90,3,,2701-2710,,,4,1,all publisherfullgold repository repositoryvor,All Open Access Gold Green,,,
2-s2.0-85054577121,10.1590/0001-3765201820170332,,,Chemical composition and evaluation of antileishmanial and cytotoxic activities of the essential oil from leaves of cryptocarya aschersoniana mez. (lauraceae juss.),ar,Article,DE ANDRADE P.M.,,"Instituto Federal de Educação, Ciência e Tecnologia do Sul de Minas Gerais - IFSULDEMINAS",Pouso Alegre,Brazil,,,,,2018-07-01,July-September 2018,Anais Da Academia Brasileira De Ciencias,00013765,18659,16782690,Journal,90,3,,2671-2678,,,37,1,all publisherfullgold repository repositoryvor repositoryam,All Open Access Gold Green,,,
2-s2.0-85054573104,10.1590/0001-3765201820180052,,30304240,Cohort study of cardiovascular risk in asymptomatic young adults: Subclinical atherosclerosis and coronary calcium score,ar,Article,Poletto S.,,Universidade do Vale do Rio dos Sinos,Sao Leopoldo,Brazil,,,,,2018-07-01,July-September 2018,Anais Da Academia Brasileira De Ciencias,00013765,18659,16782690,Journal,90,3,,3129-3137,,,5,1,all publisherfullgold repository repositoryam,All Open Access Gold Green,,,
2-s2.0-85054569691,10.1590/0001-3765201820170598,,30043906,"Silver and gold nanoparticles from tannic acid: Synthesis, characterization and evaluation of antileishmanial and cytotoxic activities",ar,Article,Lopes L.C.S.,,Universidade Federal do Piauí,Teresina,Brazil,,,,,2018-07-01,July-September 2018,Anais Da Academia Brasileira De Ciencias,00013765,18659,16782690,Journal,90,3,,2679-2689,,,57,1,all publisherfullgold repository repositoryvor repositoryam,All Open Access Gold Green,,,
