eid,doi,pii,pubmed_id,title,subtype,subtypeDescription,creator,afid,affilname,affiliation_city,affiliation_country,author_count,author_names,author_ids,author_afids,coverDate,coverDisplayDate,publicationName,issn,source_id,eIssn,aggregationType,volume,issueIdentifier,article_number,pageRange,description,authkeywords,citedby_count,openaccess,freetoread,freetoreadLabel,fund_acr,fund_no,fund_sponsor
2-s2.0-85041583220,10.1038/s41598-017-18573-7,,29343691,Use of nanoparticle concentration as a tool to understand the structural properties of colloids,ar,Article,Ribeiro L.N.D.M.,,Universidade Estadual de Campinas,Campinas,Brazil,,,,,2018-12-01,1 December 2018,Scientific Reports,,21100200805,20452322,Journal,8,1,982,,,,94,1,all publisherfullgold repository repositoryvor,All Open Access Gold Green,,,
2-s2.0-85041582614,10.1038/s41598-018-20732-3,,29396524,Identifying musical pieces from fMRI data using encoding and decoding models,ar,Article,Hoefle S.,,Universidade Federal do Rio de Janeiro;Instituto D'Or de Pesquisa e Ensino,Rio de Janeiro;Rio de Janeiro,Brazil;Brazil,,,,,2018-12-01,1 December 2018,Scientific Reports,,21100200805,20452322,Journal,8,1,2266,,,,24,1,all publisherfullgold repository repositoryvor,All Open Access Gold Green,,,
2-s2.0-85041576907,10.1038/s41598-017-17463-2,,29343757,The early conversion of deep-sea wood falls into chemosynthetic hotspots revealed by in situ monitoring,ar,Article,Kalenitchenko D.,,Sorbonne Université;Université Laval,Paris;Quebec,France;Canada,,,,,2018-12-01,1 December 2018,Scientific Reports,,21100200805,20452322,Journal,8,1,907,,,,19,1,all publisherfullgold repository repositoryvor,All Open Access Gold Green,,,
2-s2.0-85041576604,10.1038/s41598-018-19990-y,,29396521,Haloperidol-induced catalepsy is ameliorated by deep brain stimulation of the inferior colliculus,ar,Article,Engelhardt K.A.,,Philipps-Universität Marburg,Marburg,Germany,,,,,2018-12-01,1 December 2018,Scientific Reports,,21100200805,20452322,Journal,8,1,2216,,,,15,1,all publisherfullgold repository repositoryvor,All Open Access Gold Green,,,
2-s2.0-85041573158,10.1038/s41598-018-20685-7,,29396498,Oscillatory interlayer coupling in spin Hall systems,ar,Article,Gonçalves A.M.,,Centro Brasileiro de Pesquisas Físicas,Rio de Janeiro,Brazil,,,,,2018-12-01,1 December 2018,Scientific Reports,,21100200805,20452322,Journal,8,1,2318,,,,17,1,all publisherfullgold repository repositoryvor repositoryam,All Open Access Gold Green,,,
2-s2.0-85041569671,10.1038/s41598-018-20273-9,,29391426,Prevalence and Risk Factors of self-reported dry eye in Brazil using a short symptom questionnaire,ar,Article,Castro J.S.D.,,Universidade Estadual de Campinas;Faculty of Medical Sciences of Santos,Campinas;Sao Paulo,Brazil;Brazil,,,,,2018-12-01,1 December 2018,Scientific Reports,,21100200805,20452322,Journal,8,1,2076,,,,51,1,all publisherfullgold repository repositoryvor,All Open Access Gold Green,,,
2-s2.0-85041569218,10.1038/s41598-018-20653-1,,29396510,Nitrogen supply influences photosynthesis establishment along the sugarcane leaf,ar,Article,Bassi D.,,Universidade Estadual de Campinas,Campinas,Brazil,,,,,2018-12-01,1 December 2018,Scientific Reports,,21100200805,20452322,Journal,8,1,2327,,,,220,1,all publisherfullgold repository repositoryvor,All Open Access Gold Green,,,
2-s2.0-85041379841,10.1038/s41598-017-18927-1,,29343741,Species Distribution Modelling: Contrasting presence-only models with plot abundance data,ar,Article,Gomes V.H.F.,,Universidade Federal do Pará;Museu Paraense Emilio Goeldi,Belem;Belem,Brazil;Brazil,,,,,2018-12-01,1 December 2018,Scientific Reports,,21100200805,20452322,Journal,8,1,1003,,,,149,1,all publisherfullgold repository repositoryvor repositoryam,All Open Access Gold Green,,,
2-s2.0-85041373119,10.1038/s41598-018-20194-7,,29382897,Integrative genomic analysis of methylphenidate response in attention-deficit/hyperactivity disorder,ar,Article,Pagerols M.,,Universitat Autònoma de Barcelona;Hospital Universitari Vall d'Hebron,Cerdanyola del Valles;Barcelona,Spain;Spain,,,,,2018-12-01,1 December 2018,Scientific Reports,,21100200805,20452322,Journal,8,1,1881,,,,17,1,all publisherfullgold repository repositoryvor,All Open Access Gold Green,,,
2-s2.0-85041367878,10.1038/s41598-018-20133-6,,29382865,Frequency of EBV associated classical Hodgkin lymphoma decreases over a 54-year period in a Brazilian population,ar,Article,Campos A.H.J.F.M.,,A.C.Camargo Cancer Center,Sao Paulo,Brazil,,,,,2018-12-01,1 December 2018,Scientific Reports,,21100200805,20452322,Journal,8,1,1849,,,,12,1,all publisherfullgold repository repositoryvor,All Open Access Gold Green,,,
2-s2.0-85041361938,10.1038/s41598-018-19270-9,,29382839,Towards the scale-up of the formation of nanoparticles on α-Ag2WO4 with bactericidal properties by femtosecond laser irradiation,ar,Article,Assis M.,,Universidade Federal de São Carlos,Sao Carlos,Brazil,,,,,2018-12-01,1 December 2018,Scientific Reports,,21100200805,20452322,Journal,8,1,1884,,,,54,1,all publisherfullgold repository repositoryvor,All Open Access Gold Green,,,
2-s2.0-85041350996,10.1038/s41598-018-19554-0,,29386521,Human migration and the spread of malaria parasites to the New World,ar,Article,Rodrigues P.T.,,Universidade de São Paulo,Sao Paulo,Brazil,,,,,2018-12-01,1 December 2018,Scientific Reports,,21100200805,20452322,Journal,8,1,1993,,,,88,1,all publisherfullgold repository repositoryvor repositoryam,All Open Access Gold Green,,,
2-s2.0-85041345533,10.1038/s41598-018-19328-8,,29379026,Adhesive Leaf Created by a Corona Discharge,ar,Article,Lee W.,,Yonsei University Mirae Campus,Wonju,South Korea,,,,,2018-12-01,1 December 2018,Scientific Reports,,21100200805,20452322,Journal,8,1,1737,,,,3,1,all publisherfullgold repository repositoryvor,All Open Access Gold Green,,,
2-s2.0-85041342699,10.1038/s41598-018-19893-y,,29382862,Spin-Orbit Effects on the Dynamical Properties of Polarons in Graphene Nanoribbons,ar,Article,Ribeiro L.A.,,Linköpings Universitet;Universidade de Brasília,Linkoping;Brasília,Sweden;Brazil,,,,,2018-12-01,1 December 2018,Scientific Reports,,21100200805,20452322,Journal,8,1,1914,,,,8,1,all publisherfullgold repository repositoryvor,All Open Access Gold Green,,,
2-s2.0-85041312220,10.1038/s41598-018-19918-6,,29386654,Body size is more important than diet in determining stable-isotope estimates of trophic position in crocodilians,ar,Article,Villamarín F.,,Instituto Nacional de Pesquisas Da Amazonia;Universidad Regional Amazónica Ikiam,Manaus;Tena,Brazil;Ecuador,,,,,2018-12-01,1 December 2018,Scientific Reports,,21100200805,20452322,Journal,8,1,2020,,,,28,1,all publisherfullgold repository repositoryvor,All Open Access Gold Green,,,
2-s2.0-85041299324,10.1038/s41598-017-19010-5,,29386520,Angiogenesis and evading immune destruction are the main related transcriptomic characteristics to the invasive process of oral tongue cancer,ar,Article,Pérez-Valencia J.A.,,Universidade Federal do Rio de Janeiro,Rio de Janeiro,Brazil,,,,,2018-12-01,1 December 2018,Scientific Reports,,21100200805,20452322,Journal,8,1,2007,,,,10,1,all publisherfullgold repository repositoryvor,All Open Access Gold Green,,,
2-s2.0-85041284306,10.1038/s41598-018-20325-0,,29382901,Inhibition of the checkpoint protein PD-1 by the therapeutic antibody pembrolizumab outlined by quantum chemistry,ar,Article,Tavares A.,,Universidade Federal do Rio Grande do Norte,Natal,Brazil,,,,,2018-12-01,1 December 2018,Scientific Reports,,21100200805,20452322,Journal,8,1,1840,,,,24,1,all publisherfullgold repository repositoryvor,All Open Access Gold Green,,,
2-s2.0-85041242400,10.1038/s41598-018-20211-9,,29379090,GO FEAT: A rapid web-based functional annotation tool for genomic and transcriptomic data,ar,Article,Araujo F.A.,,Universidade Federal do Pará,Belem,Brazil,,,,,2018-12-01,1 December 2018,Scientific Reports,,21100200805,20452322,Journal,8,1,1794,,,,85,1,all publisherfullgold repository repositoryvor,All Open Access Gold Green,,,
2-s2.0-85041133818,10.1038/s41598-018-19985-9,,29374216,Warning signals of biodiversity collapse across gradients of tropical forest loss,ar,Article,Roque F.D.O.,,James Cook University;Universidade Federal de Mato Grosso do Sul,Townsville;Campo Grande,Australia;Brazil,,,,,2018-12-01,1 December 2018,Scientific Reports,,21100200805,20452322,Journal,8,1,1622,,,,62,1,all publisherfullgold repository repositoryvor,All Open Access Gold Green,,,
2-s2.0-85041126574,10.1038/s41598-018-19735-x,,29374264,Oxidative stress induced by Cu nutritional disorders in Citrus depends on nitrogen and calcium availability,ar,Article,Hippler F.,,Instituto Agronomico de Campinas,Campinas,Brazil,,,,,2018-12-01,1 December 2018,Scientific Reports,,21100200805,20452322,Journal,8,1,1641,,,,43,1,all publisherfullgold repository repositoryvor,All Open Access Gold Green,,,
2-s2.0-85041081119,10.1038/s41598-018-19782-4,,29362391,Widespread modulation of gene expression by copy number variation in skeletal muscle,ar,Article,Geistlinger L.,,Universidade de São Paulo;Ludwig-Maximilians-Universität München;The City University of New York;Empresa Brasileira de Pesquisa Agropecuária - Embrapa,Sao Paulo;Munich;New York;Brasilia,Brazil;Germany;United States;Brazil,,,,,2018-12-01,1 December 2018,Scientific Reports,,21100200805,20452322,Journal,8,1,1399,,,,20,1,all publisherfullgold repository repositoryvor,All Open Access Gold Green,,,
2-s2.0-85041073560,10.1038/s41598-018-19840-x,,29367729,Ethanolic extract of the fungus Trichoderma stromaticum decreases inflammation and ameliorates experimental cerebral malaria in C57BL/6 mice,ar,Article,Cariaco Y.,,Universidade Federal de Uberlândia,Uberlandia,Brazil,,,,,2018-12-01,1 December 2018,Scientific Reports,,21100200805,20452322,Journal,8,1,1547,,,,26,1,all publisherfullgold repository repositoryvor,All Open Access Gold Green,,,
2-s2.0-85041070385,10.1038/s41598-018-19358-2,,29371623,Pervasive Rise of Small-scale Deforestation in Amazonia,ar,Article,Kalamandeen M.,,University of Leeds,Leeds,United Kingdom,,,,,2018-12-01,1 December 2018,Scientific Reports,,21100200805,20452322,Journal,8,1,1600,,,,145,1,all publisherfullgold repository repositoryvor,All Open Access Gold Green,,,
2-s2.0-85041052928,10.1038/s41598-018-19566-w,,29352252,Towards an experimental classification system for membrane active peptides,ar,Article,Brand G.D.,,Universidade de Brasília;Embrapa Recursos Geneticos e Biotecnologia,Brasília;Brasilia,Brazil;Brazil,,,,,2018-12-01,1 December 2018,Scientific Reports,,21100200805,20452322,Journal,8,1,1194,,,,19,1,all publisherfullgold repository repositoryvor,All Open Access Gold Green,,,
2-s2.0-85041023545,10.1038/s41598-018-19746-8,,29367684,Perovskite Thin Film Synthesised from Sputtered Lead Sulphide,ar,Article,Da Silva Filho J.M.C.,,Universidade Estadual de Campinas,Campinas,Brazil,,,,,2018-12-01,1 December 2018,Scientific Reports,,21100200805,20452322,Journal,8,1,1563,,,,73,1,all publisherfullgold repository repositoryvor,All Open Access Gold Green,,,
2-s2.0-85041003779,10.1038/s41598-018-19359-1,,29358738,Kinin-B1 Receptor Stimulation Promotes Invasion and is Involved in Cell-Cell Interaction of Co-Cultured Glioblastoma and Mesenchymal Stem Cells,ar,Article,Oliveira M.,,"Universidade de São Paulo;Institut ""Jožef Stefan"";National Institute of Biology Ljubljana",Sao Paulo;Ljubljana;Ljubljana,Brazil;Slovenia;Slovenia,,,,,2018-12-01,1 December 2018,Scientific Reports,,21100200805,20452322,Journal,8,1,1299,,,,41,1,all publisherfullgold repository repositoryvor,All Open Access Gold Green,,,
2-s2.0-85040997609,10.1038/s41598-018-19453-4,,29358719,Investigation of Candida parapsilosis virulence regulatory factors during host-pathogen interaction,ar,Article,Tóth R.,,University of Szeged Faculty of Science and Informatics,Szeged,Hungary,,,,,2018-12-01,1 December 2018,Scientific Reports,,21100200805,20452322,Journal,8,1,1346,,,,23,1,all publisherfullgold repository repositoryvor,All Open Access Gold Green,,,
2-s2.0-85040991455,10.1038/s41598-017-18865-y,,29358582,"Evolutionary analyses of myosin genes in trypanosomatids show a history of expansion, secondary losses and neofunctionalization",ar,Article,De Souza D.A.S.,,"Fundacao Oswaldo Cruz;Instituto Carlos Chagas, Curitiba",Rio de Janeiro;Curitiba,Brazil;Brazil,,,,,2018-12-01,1 December 2018,Scientific Reports,,21100200805,20452322,Journal,8,1,1376,,,,15,1,all publisherfullgold repository repositoryvor,All Open Access Gold Green,,,
2-s2.0-85040987223,10.1038/s41598-018-19540-6,,29358657,Interaction between hippocampal-prefrontal plasticity and thalamic-prefrontal activity,ar,Article,Bueno-Junior L.S.,,Universidade de São Paulo,Sao Paulo,Brazil,,,,,2018-12-01,1 December 2018,Scientific Reports,,21100200805,20452322,Journal,8,1,1382,,,,11,1,all publisherfullgold repository repositoryvor,All Open Access Gold Green,,,
2-s2.0-85040982022,10.1038/s41598-018-19403-0,,29358584,"Nitrogen cycling during secondary succession in Atlantic Forest of Bahia, Brazil",ar,Article,Winbourne J.B.,,Brown University,Providence,United States,,,,,2018-12-01,1 December 2018,Scientific Reports,,21100200805,20452322,Journal,8,1,1377,,,,45,1,all publisherfullgold repository repositoryvor,All Open Access Gold Green,,,
2-s2.0-85040977801,10.1038/s41598-017-18797-7,,29362410,New live screening of plant-nematode interactions in the rhizosphere,ar,Article,O'Callaghan F.E.,,The James Hutton Institute,Aberdeen,United Kingdom,,,,,2018-12-01,1 December 2018,Scientific Reports,,21100200805,20452322,Journal,8,1,1440,,,,33,1,all publisherfullgold repository repositoryvor,All Open Access Gold Green,,,
2-s2.0-85040953233,10.1038/s41598-018-19549-x,,29348637,Plasmodium dihydrofolate reductase is a second enzyme target for the antimalarial action of triclosan,ar,Article,Bilsland E.,,Universidade Estadual de Campinas;Cambridge Systems Biology Centre,Campinas;Cambridge,Brazil;United Kingdom,,,,,2018-12-01,1 December 2018,Scientific Reports,,21100200805,20452322,Journal,8,1,1038,,,,38,1,all publisherfullgold repository repositoryvor,All Open Access Gold Green,,,
2-s2.0-85040950653,10.1038/s41598-018-19543-3,,29348607,"Evaluation of mitochondrial bioenergetics, dynamics, endoplasmic reticulum-mitochondria crosstalk, and reactive oxygen species in fibroblasts from patients with complex i deficiency",ar,Article,Leipnitz G.,,University of Pittsburgh School of Medicine;Universidade Federal do Rio Grande do Sul,Pittsburgh;Porto Alegre,United States;Brazil,,,,,2018-12-01,1 December 2018,Scientific Reports,,21100200805,20452322,Journal,8,1,1165,,,,51,1,all publisherfullgold repository repositoryvor,All Open Access Gold Green,,,
2-s2.0-85040930532,10.1038/s41598-018-19583-9,,29348592,Stingless Bee Larvae Require Fungal Steroid to Pupate,ar,Article,Paludo C.R.,,Universidade de São Paulo,Sao Paulo,Brazil,,,,,2018-12-01,1 December 2018,Scientific Reports,,21100200805,20452322,Journal,8,1,1122,,,,95,1,all publisherfullgold repository repositoryvor,All Open Access Gold Green,,,
2-s2.0-85040907412,10.1038/s41598-018-19671-w,,29358662,"Network of proteins, enzymes and genes linked to biomass degradation shared by Trichoderma species",ar,Article,Horta M.A.C.,,Universidade Estadual de Campinas,Campinas,Brazil,,,,,2018-12-01,1 December 2018,Scientific Reports,,21100200805,20452322,Journal,8,1,1341,,,,35,1,all publisherfullgold repository repositoryvor,All Open Access Gold Green,,,
2-s2.0-85040843101,10.1038/s41598-018-19779-z,,29352160,The 'forma specialis' issue in Fusarium: A case study in Fusarium solani f. sp. pisi,ar,Article,Šišić A.,,Universität Kassel,Kassel,Germany,,,,,2018-12-01,1 December 2018,Scientific Reports,,21100200805,20452322,Journal,8,1,1252,,,,64,1,all publisherfullgold repository repositoryvor,All Open Access Gold Green,,,
2-s2.0-85040842492,10.1038/s41598-018-19483-y,,29352253,Tracking the Evolution of Transiently Transfected Individual Cells in a Microfluidic Platform,ar,Article,Vitor M.,,Universidade Estadual de Campinas;Laboratoire d'Hydrodynamique de l'Ecole Polytechnique,Campinas;Palaiseau,Brazil;France,,,,,2018-12-01,1 December 2018,Scientific Reports,,21100200805,20452322,Journal,8,1,1225,,,,16,1,all publisherfullgold repository repositoryvor,All Open Access Gold Green,,,
2-s2.0-85040830565,10.1038/s41598-018-19276-3,,29339805,First description of behavior and immune system relationship in fish,ar,Article,Kirsten K.,,Universidade Federal de Santa Maria,Santa Maria,Brazil,,,,,2018-12-01,1 December 2018,Scientific Reports,,21100200805,20452322,Journal,8,1,846,,,,39,1,all publisherfullgold repository repositoryvor,All Open Access Gold Green,,,
2-s2.0-85040826508,10.1038/s41598-018-19338-6,,29343840,Vision Status in Older Adults: The Brazilian Amazon Region Eye Survey,re,Review,Salomão S.R.,,Universidade Federal de São Paulo,Sao Paulo,Brazil,,,,,2018-12-01,1 December 2018,Scientific Reports,,21100200805,20452322,Journal,8,1,886,,,,10,1,all publisherfullgold repository repositoryvor,All Open Access Gold Green,,,
2-s2.0-85040822514,10.1038/s41598-018-19240-1,,29343823,Methods and extractants to evaluate silicon availability for sugarcane,ar,Article,Crusciol C.A.C.,,"Universidade Estadual Paulista ""Júlio de Mesquita Filho""",Sao Paulo,Brazil,,,,,2018-12-01,1 December 2018,Scientific Reports,,21100200805,20452322,Journal,8,1,916,,,,36,1,all publisherfullgold repository repositoryvor,All Open Access Gold Green,,,
2-s2.0-85040820674,10.1038/s41598-018-19526-4,,29352135,Blocking Zika virus vertical transmission,ar,Article,Mesci P.,,Rady Children's Hospital,San Diego,United States,,,,,2018-12-01,1 December 2018,Scientific Reports,,21100200805,20452322,Journal,8,1,1218,,,,56,1,all publisherfullgold repository repositoryvor,All Open Access Gold Green,,,
2-s2.0-85040820641,10.1038/s41598-018-19324-y,,29343858,"Developmental pathways inferred from modularity, morphological integration and fluctuating asymmetry patterns in the human face",ar,Article,Quinto-Sánchez M.,,"Universidad Nacional Autónoma de México, Facultad de Medicina;Instituto Patagónico de Ciencias Sociales y Humanas",Mexico;Puerto Madryn,Mexico;Argentina,,,,,2018-12-01,1 December 2018,Scientific Reports,,21100200805,20452322,Journal,8,1,963,,,,10,1,all publisherfullgold repository repositoryvor,All Open Access Gold Green,,,
2-s2.0-85040819120,10.1038/s41598-018-19339-5,,29339789,Exosome-mediated breast cancer chemoresistance via miR-155 transfer,ar,Article,Santos J.C.,,Universidade Estadual de Campinas,Campinas,Brazil,,,,,2018-12-01,1 December 2018,Scientific Reports,,21100200805,20452322,Journal,8,1,829,,,,282,1,all publisherfullgold repository repositoryvor,All Open Access Gold Green,,,
2-s2.0-85040798949,10.1038/s41598-018-19418-7,,29343839,Musical auditory stimulus acutely influences heart rate dynamic responses to medication in subjects with well-controlled hypertension,ar,Article,Martiniano E.C.,,Centro Universitário FMABC;Faculdade de Juazeiro do Norte,Santo Andre;Ceara,Brazil;Brazil,,,,,2018-12-01,1 December 2018,Scientific Reports,,21100200805,20452322,Journal,8,1,958,,,,14,1,all publisherfullgold repository repositoryvor,All Open Access Gold Green,,,
2-s2.0-85040798261,10.1038/s41598-017-19055-6,,29335646,"Dipeptidyl peptidase-4 inhibitors, pancreatic cancer and acute pancreatitis: A meta-analysis with trial sequential analysis",ar,Article,Pinto L.C.,,Hospital de Clinicas de Porto Alegre,Porto Alegre,Brazil,,,,,2018-12-01,1 December 2018,Scientific Reports,,21100200805,20452322,Journal,8,1,782,,,,76,1,all publisherfullgold repository repositoryvor,All Open Access Gold Green,,,
2-s2.0-85040795718,10.1038/s41598-018-19233-0,,29348595,On the Angular Distribution of the H+Li2 Cross Sections: A Converged Time-Independent Quantum Scattering Study,ar,Article,Vila H.V.R.,,Universidade de Brasília,Brasília,Brazil,,,,,2018-12-01,1 December 2018,Scientific Reports,,21100200805,20452322,Journal,8,1,1044,,,,3,1,all publisherfullgold repository repositoryvor,All Open Access Gold Green,,,
2-s2.0-85040785075,10.1038/s41598-017-19096-x,,29335588,Peripheral iron levels in children with attention-deficit hyperactivity disorder: A systematic review and meta-analysis,re,Review,Tseng P.T.,,Tsyr-Huey Mental Hospital;WinShine Clinics in Specialty of Psychiatry,Kaohsiung;Kaohsiung,Taiwan;Taiwan,,,,,2018-12-01,1 December 2018,Scientific Reports,,21100200805,20452322,Journal,8,1,788,,,,96,1,all publisherfullgold repository repositoryvor,All Open Access Gold Green,,,
2-s2.0-85040774209,10.1038/s41598-017-17563-z,,29335438,Grey and white matter volumes either in treatment-naïve or hormone-treated transgender women: A voxel-based morphometry study,ar,Article,Spizzirri G.,,Universidade de São Paulo,Sao Paulo,Brazil,,,,,2018-12-01,1 December 2018,Scientific Reports,,21100200805,20452322,Journal,8,1,736,,,,39,1,all publisherfullgold repository repositoryvor,All Open Access Gold Green,,,
2-s2.0-85040772185,10.1038/s41598-018-19589-3,,29343733,"Serum Vitamin D levels and risk of prevalent tuberculosis, incident tuberculosis and tuberculin skin test conversion among prisoners",ar,Article,MacEda E.,,Universidade Federal da Grande Dourados,Dourados,Brazil,,,,,2018-12-01,1 December 2018,Scientific Reports,,21100200805,20452322,Journal,8,1,997,,,,32,1,all publisherfullgold repository repositoryvor,All Open Access Gold Green,,,
2-s2.0-85040766696,10.1038/s41598-017-19063-6,,29348479,Prime-boost vaccination with recombinant protein and adenovirus-vector expressing Plasmodium vivax circumsporozoite protein (CSP) partially protects mice against Pb/Pv sporozoite challenge,ar,Article,De Camargo T.M.,,Universidade de São Paulo,Sao Paulo,Brazil,,,,,2018-12-01,1 December 2018,Scientific Reports,,21100200805,20452322,Journal,8,1,1118,,,,24,1,all publisherfullgold repository repositoryvor,All Open Access Gold Green,,,
2-s2.0-85040764330,10.1038/s41598-017-19066-3,,29335482,Engineered nonlinear materials using gold nanoantenna array,ar,Article,Drachev V.P.,,Skolkovo Institute of Science and Technology;UNT College of Engineering,Moscow;Denton,Russian Federation;United States,,,,,2018-12-01,1 December 2018,Scientific Reports,,21100200805,20452322,Journal,8,1,780,,,,14,1,all publisherfullgold repository repositoryvor,All Open Access Gold Green,,,
2-s2.0-85040619991,10.1038/s41598-017-17500-0,,29317657,Blood plasma/IgG N-glycome biosignatures associated with major depressive disorder symptom severity and the antidepressant response,ar,Article,Park D.I.,,Max Planck Institute of Psychiatry,Munich,Germany,,,,,2018-12-01,1 December 2018,Scientific Reports,,21100200805,20452322,Journal,8,1,179,,,,33,1,all publisherfullgold repository repositoryvor,All Open Access Gold Green,,,
2-s2.0-85040599251,10.1038/s41598-017-19018-x,,29330511,Testing density-functional approximations on a lattice and the applicability of the related Hohenberg-Kohn-like theorem,ar,Article,França V.,,"Universidade Estadual Paulista ""Júlio de Mesquita Filho""",Sao Paulo,Brazil,,,,,2018-12-01,1 December 2018,Scientific Reports,,21100200805,20452322,Journal,8,1,664,,,,7,1,all publisherfullgold repository repositoryvor repositoryam,All Open Access Gold Green,,,
2-s2.0-85040517614,10.1038/s41598-017-18629-8,,29317730,Large-scale sill emplacement in Brazil as a trigger for the end-Triassic crisis,ar,Article,Heimdal T.H.,,Universitetet i Oslo,Oslo,Norway,,,,,2018-12-01,1 December 2018,Scientific Reports,,21100200805,20452322,Journal,8,1,141,,,,78,1,all publisherfullgold repository repositoryvor,All Open Access Gold Green,,,
2-s2.0-85040514075,10.1038/s41598-017-18532-2,,29317702,Surveillance of vector-borne pathogens under imperfect detection: Lessons from Chagas disease risk (mis)measurement,ar,Article,Minuzzi-Souza T.T.C.,,Universidade de Brasília,Brasília,Brazil,,,,,2018-12-01,1 December 2018,Scientific Reports,,21100200805,20452322,Journal,8,1,151,,,,27,1,all publisherfullgold repository repositoryvor,All Open Access Gold Green,,,
2-s2.0-85040466923,10.1038/s41598-017-18470-z,,29321597,Microbial habitability of Europa sustained by radioactive sources,ar,Article,Altair T.,,Universidade de São Paulo;Laboratorio Nacional de Luz Sincrotron,Sao Paulo;Campinas,Brazil;Brazil,,,,,2018-12-01,1 December 2018,Scientific Reports,,21100200805,20452322,Journal,8,1,260,,,,36,1,all publisherfullgold repository repositoryvor,All Open Access Gold Green,,,
2-s2.0-85040462586,10.1038/s41598-017-18986-4,,29323263,"Putative sex pheromone of the Asian citrus psyllid, Diaphorina citri, breaks down into an attractant",ar,Article,Zanardi O.Z.,,Research and Development Department,Araraquara,Brazil,,,,,2018-12-01,1 December 2018,Scientific Reports,,21100200805,20452322,Journal,8,1,455,,,,41,1,all publisherfullgold repository repositoryvor,All Open Access Gold Green,,,
2-s2.0-85040462314,10.1038/s41598-017-18083-6,,29323132,Assembly of an atypical α-macroglobulin complex from Pseudomonas aeruginosa,ar,Article,Zouhir S.,,Laboratório Nacional de Biociências,Campinas,Brazil,,,,,2018-12-01,1 December 2018,Scientific Reports,,21100200805,20452322,Journal,8,1,527,,,,1,1,all publisherfullgold repository repositoryvor,All Open Access Gold Green,,,
2-s2.0-85040460436,10.1038/s41598-017-18700-4,,29323239,Specific Phospholipids Regulate the Acquisition of Neuronal and Astroglial Identities in Post-Mitotic Cells,ar,Article,Montaner A.,,Universidad Nacional de Rosario,Rosario,Argentina,,,,,2018-12-01,1 December 2018,Scientific Reports,,21100200805,20452322,Journal,8,1,460,,,,16,1,all publisherfullgold repository repositoryvor,All Open Access Gold Green,,,
2-s2.0-85040457465,10.1038/s41598-017-18639-6,,29321581,A ruthenium-based 5-fluorouracil complex with enhanced cytotoxicity and apoptosis induction action in HCT116 cells,ar,Article,Silva V.R.,,Fundacao Oswaldo Cruz,Rio de Janeiro,Brazil,,,,,2018-12-01,1 December 2018,Scientific Reports,,21100200805,20452322,Journal,8,1,288,,,,67,1,all publisherfullgold repository repositoryvor,All Open Access Gold Green,,,
