eid,doi,pii,pubmed_id,title,subtype,subtypeDescription,creator,afid,affilname,affiliation_city,affiliation_country,author_count,author_names,author_ids,author_afids,coverDate,coverDisplayDate,publicationName,issn,source_id,eIssn,aggregationType,volume,issueIdentifier,article_number,pageRange,description,authkeywords,citedby_count,openaccess,freetoread,freetoreadLabel,fund_acr,fund_no,fund_sponsor
2-s2.0-85059221821,10.1073/pnas.1812505115,,30509982,Resource extraction and infrastructure threaten forest cover and community rights,ar,Article,Bebbington A.J.,,University of Melbourne;The University of Manchester;Clark University,Melbourne;Manchester;Worcester,Australia;United Kingdom;United States,,,,,2018-12-26,26 December 2018,Proceedings of the National Academy of Sciences of the United States of America,00278424,21121,10916490,Journal,115,52,,13164-13173,,,167,1,all publisherhybridgold repository repositoryvor repositoryam,All Open Access Hybrid Gold Green,,,
2-s2.0-85059071693,10.1073/pnas.1809197115,,30530675,Speleothem record of geomagnetic South Atlantic Anomaly recurrence,ar,Article,Trindade R.I.F.,,Universidade de São Paulo,Sao Paulo,Brazil,,,,,2018-12-26,26 December 2018,Proceedings of the National Academy of Sciences of the United States of America,00278424,21121,10916490,Journal,115,52,,13198-13203,,,35,1,all publisherfree2read repository repositoryvor,All Open Access Bronze Green,,,
2-s2.0-85062599019,10.1016/j.isci.2018.11.029,S2589004218302190,,CellMinerCDB for Integrative Cross-Database Genomics and Pharmacogenomics Analyses of Cancer Cell Lines,ar,Article,Rajapakse V.N.,,National Cancer Institute (NCI),Rockville,United States,,,,,2018-12-21,21 December 2018,Iscience,,21100907125,25890042,Journal,10,,,247-264,,,121,1,all publisherfullgold repository repositoryvor,All Open Access Gold Green,,,
2-s2.0-85058678859,10.1073/pnas.1810598115,,30498031,"DPYSL3 modulates mitosis, migration, and epithelial-to-mesenchymal transition in claudin-low breast cancer",ar,Article,Matsunuma R.,,Baylor College of Medicine;Hamamatsu University School of Medicine;Hamamatsu Oncology Center,Houston;Hamamatsu;Hamamatsu,United States;Japan;Japan,,,,,2018-12-18,18 December 2018,Proceedings of the National Academy of Sciences of the United States of America,00278424,21121,10916490,Journal,115,51,,E11978-E11987,,,40,1,all publisherhybridgold repository repositoryvor,All Open Access Hybrid Gold Green,,,
2-s2.0-85058642281,10.1073/pnas.1812028115,,30487220,Emergent sustainability in open property regimes,re,Review,Moritz M.,,The Ohio State University,Columbus,United States,,,,,2018-12-18,18 December 2018,Proceedings of the National Academy of Sciences of the United States of America,00278424,21121,10916490,Journal,115,51,,12859-12867,,,45,1,all publisherhybridgold repository repositoryvor repositoryam,All Open Access Hybrid Gold Green,,,
2-s2.0-85058620964,10.1073/pnas.1818161115,,30568027,Increasing exercise’s effect on mental health: Exercise intensity does matter,le,Letter,Gronwald T.,,MSH Medical School Hamburg,Hamburg,Germany,,,,,2018-12-18,18 December 2018,Proceedings of the National Academy of Sciences of the United States of America,00278424,21121,10916490,Journal,115,51,,E11890-E11891,,,29,1,all publisherfree2read repository repositoryvor,All Open Access Bronze Green,,,
2-s2.0-85058367006,10.1126/science.aav0207,,30545889,Multiproxy evidence highlights a complex evolutionary legacy of maize in South America,ar,Article,Kistler L.,,University of Warwick;Smithsonian National Museum of Natural History,"Coventry;Washington, D.C.",United Kingdom;United States,,,,,2018-12-14,14 December 2018,Science,00368075,23571,10959203,Journal,362,6420,,1309-1313,,,184,2,all repository repositoryam,All Open Access Green,,,
2-s2.0-85058903836,10.5123/S1679-49742018000400018,S223796222018000400100,30570035,Revisiting the trajectory of Epidemiology and Health Services: the virtuous circle from 2011 to 2018,ar,Article,Duarte E.,,Ministério da Saúde,Brasilia,Brazil,,,,,2018-12-13,13 December 2018,Epidemiologia E Servicos De Saude Revista do Sistema Unico De Saude do Brasil,,21100872043,22379622,Journal,27,4,,e2018418,,,2,1,all publisherfullgold,All Open Access Gold,,,
2-s2.0-85058902959,10.5123/S1679-49742018000400017,S223796222018000400315,30570034,"Factors associated with need for dental treatment: a cross-sectional study at Fluminense Federal University, Rio de Janeiro, Brazil, 2013",ar,Article,Novaes L.C.M.,,Universidade Federal Fluminense,Niteroi,Brazil,,,,,2018-12-13,13 December 2018,Epidemiologia E Servicos De Saude Revista do Sistema Unico De Saude do Brasil,,21100872043,22379622,Journal,27,4,,e2018102,,,1,1,all publisherfullgold repository repositoryvor,All Open Access Gold Green,,,
2-s2.0-85058895395,10.5123/S1679-49742018000400016,S223796222018000401100,30570033,Geolocation of hospitalizations registered on the Brazilian National Health System's Hospital Information System: a solution based on the R Statistical Software,ar,Article,Rocha T.A.H.,,Universidade Federal de Minas Gerais,Belo Horizonte,Brazil,,,,,2018-12-13,13 December 2018,Epidemiologia E Servicos De Saude Revista do Sistema Unico De Saude do Brasil,,21100872043,22379622,Journal,27,4,,e2017444,,,12,1,all publisherfullgold repository repositoryvor,All Open Access Gold Green,,,
2-s2.0-85058893604,10.5123/S1679-49742018000400015,S223796222018000400314,30570032,"Trends in mortality due to road traffic accidents in the municipality of Goiânia, Brazil, 2006-2014",ar,Article,Aquino É.C.d.,,Universidade Federal de Goiás,Goiania,Brazil,,,,,2018-12-13,13 December 2018,Epidemiologia E Servicos De Saude Revista do Sistema Unico De Saude do Brasil,,21100872043,22379622,Journal,27,4,,e2017268,,,3,1,all publisherfullgold repository repositoryvor,All Open Access Gold Green,,,
2-s2.0-85058347948,10.1073/pnas.1803615115,,30478037,Genetically encodable bioluminescent system from fungi,ar,Article,Kotlobay A.A.,,Shemyakin-Ovchinnikov Institute of Bioorganic Chemistry of the Russian Academy of Sciences,Moscow,Russian Federation,,,,,2018-12-11,11 December 2018,Proceedings of the National Academy of Sciences of the United States of America,00278424,21121,10916490,Journal,115,50,,12728-12732,,,154,1,all publisherhybridgold repository repositoryvor,All Open Access Hybrid Gold Green,,,
2-s2.0-85058604407,10.1126/science.aav2621,,30409807,Early human dispersals within the Americas,ar,Article,Moreno-Mayar J.V.,,Statens Naturhistoriske Museum,Copenhagen,Denmark,,,,,2018-12-07,7 December 2018,Science,00368075,23571,10959203,Journal,362,6419,eaav2621,,,,239,2,all repository repositoryam,All Open Access Green,,,
2-s2.0-85057945365,10.1126/science.aar3213,,30523083,Animals and the zoogeochemistry of the carbon cycle,re,Review,Schmitz O.J.,,Yale School of the Environment,New Haven,United States,,,,,2018-12-07,7 December 2018,Science,00368075,23571,10959203,Journal,362,6419,eaar3213,,,,275,0,,,,,
2-s2.0-85057731923,10.1038/s41586-018-0739-1,,30518890,An experiment to search for dark-matter interactions using sodium iodide detectors,ar,Article,Adhikari G.,,Sejong University,Seoul,South Korea,,,,,2018-12-06,6 December 2018,Nature,00280836,21206,14764687,Journal,564,7734,,83-86,,,100,2,all repository repositoryam,All Open Access Green,,,
2-s2.0-85088112039,10.28991/esj-2018-01160,,,"Chemical composition, antimicrobial and antioxidant activities of eugenia dysenterica dc essential oil",ar,Article,de Oliveira D.C.S.,,Universidade de São Paulo,Sao Paulo,Brazil,,,,,2018-12-01,December 2018,Emerging Science Journal,,21101017598,26109182,Journal,2,6,,410-416,,,7,1,all publisherfullgold repository repositoryam,All Open Access Gold Green,,,
2-s2.0-85067601698,10.1038/s41598-018-27831-1,,29934570,Nintedanib inhibits growth of human prostate carcinoma cells by modulating both cell cycle and angiogenesis regulators,ar,Article,da Silva R.F.,,Universidade Estadual de Campinas;University of Colorado Anschutz Medical Campus,Campinas;Aurora,Brazil;United States,,,,,2018-12-01,1 December 2018,Scientific Reports,,21100200805,20452322,Journal,8,1,9540,,,,9,1,all publisherfullgold repository repositoryvor,All Open Access Gold Green,,,
2-s2.0-85061816728,,,,Tree communities on terra firme in the Guaporé Amazon Region,ar,Article,Da Cruz W.J.A.,,Centro de Pesquisa de Limnologia,Caceres,Brazil,,,,,2018-12-01,December 2018,Interciencia,03781844,22962,22447776,Journal,43,12,,841-845,,,0,0,,,,,
2-s2.0-85061770663,,,,Bioethanol production from broken rice grains,re,Review,De Cassia de Souza Schneider R.,,Universidade de Santa Cruz do Sul,Santa Cruz do Sul,Brazil,,,,,2018-12-01,December 2018,Interciencia,03781844,22962,22447776,Journal,43,12,,846-851,,,12,0,,,,,
2-s2.0-85059286168,10.1371/journal.pone.0209934,,30596752,TP53 p.Arg337His germline mutation prevalence in Southern Brazil: Further evidence for mutation testing in young breast cancer patients,ar,Article,Hahn E.C.,,Universidade Federal do Rio Grande do Sul;Hospital de Clinicas de Porto Alegre,Porto Alegre;Porto Alegre,Brazil;Brazil,,,,,2018-12-01,December 2018,Plos One,,10600153309,19326203,Journal,13,12,e0209934,,,,9,1,all publisherfullgold repository repositoryvor repositoryam,All Open Access Gold Green,,,
2-s2.0-85059277830,10.1371/journal.pone.0210174,,30596793,"Resilience, stress and injuries in the context of the Brazilian elite rhythmic gymnastics",ar,Article,Codonhato R.,,Universidade Estadual de Maringá,Maringa,Brazil,,,,,2018-12-01,December 2018,Plos One,,10600153309,19326203,Journal,13,12,e0210174,,,,41,1,all publisherfullgold repository repositoryvor repositoryam,All Open Access Gold Green,,,
2-s2.0-85059275981,10.1371/journal.pone.0209822,,30596724,Predicting the defensive performance of individual players in one vs. One soccer games,ar,Article,Wilson R.S.,,The University of Queensland,Brisbane,Australia,,,,,2018-12-01,December 2018,Plos One,,10600153309,19326203,Journal,13,12,e0209822,,,,12,1,all publisherfullgold repository repositoryvor repositoryam,All Open Access Gold Green,,,
2-s2.0-85059265942,10.1371/journal.pone.0208925,,30596664,Conditional cash transfer programme: Impact on homicide rates and hospitalisations from violence in Brazil,ar,Article,Machado D.B.,,London School of Hygiene & Tropical Medicine;Center of Data and Knowledge Integration for Health (CIDACS),London;Salvador,United Kingdom;Brazil,,,,,2018-12-01,December 2018,Plos One,,10600153309,19326203,Journal,13,12,e0208925,,,,32,1,all publisherfullgold repository repositoryvor repositoryam,All Open Access Gold Green,,,
2-s2.0-85059265538,10.1371/journal.pone.0209921,,30596760,Can stable isotope markers be used to distinguish wild and mass-reared Anastrepha fraterculus flies?,ar,Article,Botteon V.,,Universidade de São Paulo,Sao Paulo,Brazil,,,,,2018-12-01,December 2018,Plos One,,10600153309,19326203,Journal,13,12,e0209921,,,,4,1,all publisherfullgold repository repositoryvor repositoryam,All Open Access Gold Green,,,
2-s2.0-85059262844,10.1371/journal.pone.0209406,,30596693,Impacts of deforestation on plant-pollinator networks assessed using an agent based model,ar,Article,Newton A.C.,,Bournemouth University,Bournemouth,United Kingdom,,,,,2018-12-01,December 2018,Plos One,,10600153309,19326203,Journal,13,12,e0209406,,,,18,1,all publisherfullgold repository repositoryvor repositoryam,All Open Access Gold Green,,,
2-s2.0-85059260045,10.1371/journal.pone.0203340,,30596650,In silico repositioning of approved drugs against Schistosoma mansoni energy metabolism targets,ar,Article,Calixto N.M.,,"Instituto Federal de Educação, Ciência e Tecnologia Goiano Campus Rio Verde",Rio Verde,Brazil,,,,,2018-12-01,December 2018,Plos One,,10600153309,19326203,Journal,13,12,e0203340,,,,5,1,all publisherfullgold repository repositoryvor repositoryam,All Open Access Gold Green,,,
2-s2.0-85059253433,10.1371/journal.pone.0209445,,30596686,Genotype-dependent changes of gene expression during somatic embryogenesis in oil palm hybrids (Elaeis oleifera x E. Guineensis),ar,Article,Santos I.R.,,Universidade de Brasília;Embrapa Recursos Geneticos e Biotecnologia,Brasília;Brasilia,Brazil;Brazil,,,,,2018-12-01,December 2018,Plos One,,10600153309,19326203,Journal,13,12,e0209445,,,,19,1,all publisherfullgold repository repositoryvor repositoryam,All Open Access Gold Green,,,
2-s2.0-85059244811,10.1371/journal.pone.0206716,,30586361,Drought tolerance of sugarcane propagules is improved when origin material faces water deficit,ar,Article,Marcos F.C.C.,,Universidade Estadual de Campinas,Campinas,Brazil,,,,,2018-12-01,December 2018,Plos One,,10600153309,19326203,Journal,13,12,e0206716,,,,33,1,all publisherfullgold repository repositoryvor repositoryam,All Open Access Gold Green,,,
2-s2.0-85059238983,10.1371/journal.pone.0209834,,30589905,Autonomic changes induced by precompetitive stress in cyclists in relation to physical fitness and anxiety,ar,Article,Oliveira-Silva I.,,Evangelical University of Goiás – Unievangelica,Anapolis,Brazil,,,,,2018-12-01,December 2018,Plos One,,10600153309,19326203,Journal,13,12,e0209834,,,,16,1,all publisherfullgold repository repositoryvor repositoryam,All Open Access Gold Green,,,
2-s2.0-85059232544,10.1371/journal.pone.0209367,,30592758,A high mortality rate associated with multidrug-resistant Acinetobacter baumannii ST79 and ST25 carrying OXA-23 in a Brazilian intensive care unit,ar,Article,Da Silva K.E.,,Universidade Federal da Grande Dourados,Dourados,Brazil,,,,,2018-12-01,December 2018,Plos One,,10600153309,19326203,Journal,13,12,e0209367,,,,57,1,all publisherfullgold repository repositoryvor repositoryam,All Open Access Gold Green,,,
2-s2.0-85059231551,10.1371/journal.pone.0208523,,30589896,Restoration of ecosystem services in tropical forests: A global meta-analysis,ar,Article,Shimamoto C.,,Universidade Federal do Parana,Curitiba,Brazil,,,,,2018-12-01,December 2018,Plos One,,10600153309,19326203,Journal,13,12,e0208523,,,,98,1,all publisherfullgold repository repositoryvor repositoryam,All Open Access Gold Green,,,
2-s2.0-85059212605,10.1371/journal.pone.0209513,,30586389,Acute effects of single dose transcranial direct current stimulation on muscle strength: A systematic review and meta-analysis,re,Review,Lattari E.,,Universidade Salgado de Oliveira,Sao Goncalo,Brazil,,,,,2018-12-01,December 2018,Plos One,,10600153309,19326203,Journal,13,12,e0209513,,,,50,1,all publisherfullgold repository repositoryvor repositoryam,All Open Access Gold Green,,,
2-s2.0-85059079209,10.1016/j.heliyon.2018.e01058,S2405844018317146,,Effects of bacterial cellulose gel on the anorectal resting pressures in rats submitted to anal sphincter injury,ar,Article,Cavalcante A.R.T.,,Universidade Federal de Pernambuco,Recife,Brazil,,,,,2018-12-01,December 2018,Heliyon,24058440,21100411756,,Journal,4,12,e01058,,,,7,1,all publisherfullgold repository repositoryvor,All Open Access Gold Green,,,
2-s2.0-85058926202,10.1371/journal.pone.0209102,,30576363,Effects of macroconsumers on benthic communities: Rapid increases in dry-season accrual of calcium in a tropical karst stream,ar,Article,Corrêa E.C.,,Universidade Federal de Mato Grosso do Sul,Campo Grande,Brazil,,,,,2018-12-01,December 2018,Plos One,,10600153309,19326203,Journal,13,12,e0209102,,,,9,1,all publisherfullgold repository repositoryvor repositoryam,All Open Access Gold Green,,,
2-s2.0-85058925045,10.1038/s41598-018-36626-3,,30575787,Toll-Like Receptor-4 Disruption Suppresses Adipose Tissue Remodeling and Increases Survival in Cancer Cachexia Syndrome,ar,Article,Henriques F.,,University of Massachusetts Chan Medical School;Universidade de Mogi das Cruzes,Worcester;Mogi das Cruzes,United States;Brazil,,,,,2018-12-01,1 December 2018,Scientific Reports,,21100200805,20452322,Journal,8,1,18024,,,,38,1,all publisherfullgold repository repositoryvor repositoryam,All Open Access Gold Green,,,
2-s2.0-85058922099,10.1371/journal.pone.0202784,,30576325,The synergism of high-intensity intermittent exercise and every-other-day intermittent fasting regimen on energy metabolism adaptations includes hexokinase activity and mitochondrial efficiency,ar,Article,Real-Hohn A.,,Medizinische Universität Wien,Vienna,Austria,,,,,2018-12-01,December 2018,Plos One,,10600153309,19326203,Journal,13,12,e0202784,,,,35,1,all publisherfullgold repository repositoryvor repositoryam,All Open Access Gold Green,,,
2-s2.0-85058918755,10.1038/s41598-018-36563-1,,30575774,Lactoferrin and lactoferricin endocytosis halt Giardia cell growth and prevent infective cyst production,ar,Article,Frontera L.S.,,Instituto de Investigación Médica Mercedes y Martín Ferreyra,Cordoba,Argentina,,,,,2018-12-01,1 December 2018,Scientific Reports,,21100200805,20452322,Journal,8,1,18020,,,,27,1,all publisherfullgold repository repositoryvor,All Open Access Gold Green,,,
2-s2.0-85058914208,10.1371/journal.pone.0209430,,30576366,DNA barcoding of fish fauna from low order streams of Tapajós River basin,ar,Article,Guimarães K.L.A.,,Universidade Federal do Oeste do Pará,Santarem,Brazil,,,,,2018-12-01,December 2018,Plos One,,10600153309,19326203,Journal,13,12,e0209430,,,,13,1,all publisherfullgold repository repositoryvor repositoryam,All Open Access Gold Green,,,
2-s2.0-85058913255,10.1038/s41598-018-36444-7,,30575786,"Legacies of domestication, trade and herder mobility shape extant male zebu cattle diversity in South Asia and Africa",ar,Article,Pérez-Pardal L.,,CIBIO - Centro de Investigação em Biodiversidade e Recursos Genéticos;SERIDA,Fornelo e Vairao;Villaviciosa,Portugal;Spain,,,,,2018-12-01,1 December 2018,Scientific Reports,,21100200805,20452322,Journal,8,1,18027,,,,31,1,all publisherfullgold repository repositoryvor,All Open Access Gold Green,,,
2-s2.0-85058911042,10.1371/journal.pone.0209470,,30576371,Opportunities for natural infrastructure to improve urban water security in Latin America,ar,Article,Tellman B.,,Arizona State University,Tempe,United States,,,,,2018-12-01,December 2018,Plos One,,10600153309,19326203,Journal,13,12,e0209470,,,,23,1,all publisherfullgold repository repositoryvor repositoryam,All Open Access Gold Green,,,
2-s2.0-85058903468,10.1038/s41598-018-36933-9,,30573754,Intracellular albumin overload elicits endoplasmic reticulum stress and PKC-delta/p38 MAPK pathway activation to induce podocyte apoptosis,ar,Article,Gonçalves G.,,Universidade de São Paulo,Sao Paulo,Brazil,,,,,2018-12-01,1 December 2018,Scientific Reports,,21100200805,20452322,Journal,8,1,18012,,,,34,1,all publisherfullgold repository repositoryvor,All Open Access Gold Green,,,
2-s2.0-85058877146,10.1038/s41598-018-36196-4,,30568246,Exploring the rumen fluid metabolome using liquid chromatography-high-resolution mass spectrometry and Molecular Networking,ar,Article,de Almeida R.T.R.,,Universidade Estadual de Maringá,Maringa,Brazil,,,,,2018-12-01,1 December 2018,Scientific Reports,,21100200805,20452322,Journal,8,1,17971,,,,27,1,all publisherfullgold repository repositoryvor,All Open Access Gold Green,,,
2-s2.0-85058876798,10.1038/s41598-018-36382-4,,30568251,Hybrid Hydrogel Composed of Polymeric Nanocapsules Co-Loading Lidocaine and Prilocaine for Topical Intraoral Anesthesia,ar,Article,Muniz B.V.,,Universidade Estadual de Campinas,Campinas,Brazil,,,,,2018-12-01,1 December 2018,Scientific Reports,,21100200805,20452322,Journal,8,1,17972,,,,46,1,all publisherfullgold repository repositoryvor,All Open Access Gold Green,,,
2-s2.0-85058825841,10.1371/journal.pone.0209599,,30571783,New antigens for the serological diagnosis of human visceral leishmaniasis identified by immunogenomic screening,ar,Article,Carvalho A.M.R.S.,,Universidade Federal de Minas Gerais,Belo Horizonte,Brazil,,,,,2018-12-01,December 2018,Plos One,,10600153309,19326203,Journal,13,12,e0209599,,,,25,1,all publisherfullgold repository repositoryvor repositoryam,All Open Access Gold Green,,,
2-s2.0-85058825168,10.1371/journal.pone.0209776,,30571776,New method for estimating the post-mortem interval using the chemical composition of different generations of empty puparia: Indoor cases,ar,Article,Paula M.C.,,Universidade Federal da Grande Dourados;Universidade Estadual de Mato Grosso do Sul,Dourados;Dourados,Brazil;Brazil,,,,,2018-12-01,December 2018,Plos One,,10600153309,19326203,Journal,13,12,e0209776,,,,20,1,all publisherfullgold repository repositoryvor repositoryam,All Open Access Gold Green,,,
2-s2.0-85058824619,10.1371/journal.pone.0209007,,30562391,Occurrence of tissue cyst forming coccidia in Magellanic penguins (Spheniscus magellanicus) rescued on the coast of Brazil,ar,Article,Lima Acosta I.C.,,Universidade de São Paulo,Sao Paulo,Brazil,,,,,2018-12-01,December 2018,Plos One,,10600153309,19326203,Journal,13,12,e0209007,,,,19,1,all publisherfullgold repository repositoryvor repositoryam,All Open Access Gold Green,,,
2-s2.0-85058818901,10.1371/journal.pone.0209386,,30571704,Understanding the impact of crosslinked PCL/ PEG/GelMA electrospun nanofibers on bactericidal activity,ar,Article,De Paula M.M.M.,,Universidade Estadual de Campinas;College of Engineering,Campinas;Boston,Brazil;United States,,,,,2018-12-01,December 2018,Plos One,,10600153309,19326203,Journal,13,12,e0209386,,,,30,1,all publisherfullgold repository repositoryvor repositoryam,All Open Access Gold Green,,,
2-s2.0-85058818084,10.1371/journal.pone.0209569,,30571792,Effectiveness of citrulline and N-carbamoyl glutamate as arginine precursors on reproductive performance in mammals: A systematic review,ar,Article,Palencia J.Y.P.,,Universidade Federal de Lavras,Lavras,Brazil,,,,,2018-12-01,December 2018,Plos One,,10600153309,19326203,Journal,13,12,e0209569,,,,13,1,all publisherfullgold repository repositoryvor repositoryam,All Open Access Gold Green,,,
2-s2.0-85058811235,10.1371/journal.pone.0208997,,30571687,Genetic structure and diversity in Brazilian populations of Anastrepha obliqua (Diptera: Tephritidae),ar,Article,Passos J.F.,,Universidade Estadual de Santa Cruz,Ilheus,Brazil,,,,,2018-12-01,December 2018,Plos One,,10600153309,19326203,Journal,13,12,e0208997,,,,10,1,all publisherfullgold repository repositoryvor repositoryam,All Open Access Gold Green,,,
2-s2.0-85058810498,10.1371/journal.pone.0208414,,30566494,"Prevalence, incidence and residual risk of transfusion-transmitted HBV infection before and after the implementation of HBV-NAT in northern Brazil",ar,Article,De Miranda Corrêa A.S.,,Universidade Federal do Pará;Foundation Center for Hemotherapy and Hematology of Pará (HEMOPA),Belem;Belem,Brazil;Brazil,,,,,2018-12-01,December 2018,Plos One,,10600153309,19326203,Journal,13,12,e0208414,,,,13,1,all publisherfullgold repository repositoryvor repositoryam,All Open Access Gold Green,,,
2-s2.0-85058808222,10.1371/journal.pone.0209005,,30562373,Rotavirus A in wild and domestic animals from areas with environmental degradation in the Brazilian Amazon,ar,Article,de Cássio Veloso de Barros B.,,Instituto Evandro Chagas,Ananindeua,Brazil,,,,,2018-12-01,December 2018,Plos One,,10600153309,19326203,Journal,13,12,e0209005,,,,24,1,all publisherfullgold repository repositoryvor repositoryam,All Open Access Gold Green,,,
2-s2.0-85058806213,10.1371/journal.pone.0208789,,30562362,Polymorphism analysis of the apxIA gene of Actinobacillus pleuropneumoniae serovar 5 isolated in swine herds from Brazil,ar,Article,dos Santos L.F.,,Universidade Federal de Vicosa;Microvet - Microbiologia Veterinária Especial Ltda.,Vicosa;Vicosa,Brazil;Brazil,,,,,2018-12-01,December 2018,Plos One,,10600153309,19326203,Journal,13,12,e0208789,,,,1,1,all publisherfullgold repository repositoryvor repositoryam,All Open Access Gold Green,,,
2-s2.0-85058805269,10.1371/journal.pone.0208312,,30566453,Human ecological and social determinants of dental caries among the Xavante Indigenous people in Central Brazil,ar,Article,Arantes R.,,Fundacao Oswaldo Cruz,Rio de Janeiro,Brazil,,,,,2018-12-01,December 2018,Plos One,,10600153309,19326203,Journal,13,12,e0208312,,,,13,1,all publisherfullgold repository repositoryvor repositoryam,All Open Access Gold Green,,,
2-s2.0-85058799823,10.1371/journal.pone.0202062,,30566475,"How do Brazilian citizens perceive animal welfare conditions in poultry, beef, and dairy supply chains?",ar,Article,de Queiroz R.G.,,Universidade Federal da Grande Dourados,Dourados,Brazil,,,,,2018-12-01,December 2018,Plos One,,10600153309,19326203,Journal,13,12,e0202062,,,,16,1,all publisherfullgold repository repositoryvor repositoryam,All Open Access Gold Green,,,
2-s2.0-85058799400,10.1371/journal.pone.0208261,,30566449,Exclusive breastfeeding changes in Brazil attributable to pacifier use,ar,Article,Buccini G.,,Universidade de São Paulo;Yale University,Sao Paulo;New Haven,Brazil;United States,,,,,2018-12-01,December 2018,Plos One,,10600153309,19326203,Journal,13,12,e0208261,,,,13,1,all publisherfullgold repository repositoryvor repositoryam,All Open Access Gold Green,,,
2-s2.0-85058795920,10.1371/journal.pone.0209190,,30571725,Lack of scarring is not always a sign of cardiac health: Functional and molecular characterization of the rat heart's following chronic reperfusion,ar,Article,Omoto A.C.M.,,Universidade de São Paulo,Sao Paulo,Brazil,,,,,2018-12-01,December 2018,Plos One,,10600153309,19326203,Journal,13,12,e0209190,,,,3,1,all publisherfullgold repository repositoryvor repositoryam,All Open Access Gold Green,,,
2-s2.0-85058788459,10.1371/journal.pone.0208306,,30571713,Effect of pequi (Caryocar brasiliense) and juçara (Euterpe edulis) waste extract on oxidation process stability in broiler meat treated by UV-C,ar,Article,Frasao B.,,Universidade Federal do Oeste da Bahia,Barreiras,Brazil,,,,,2018-12-01,December 2018,Plos One,,10600153309,19326203,Journal,13,12,e0208306,,,,14,1,all publisherfullgold repository repositoryvor repositoryam,All Open Access Gold Green,,,
