eid,doi,pii,pubmed_id,title,subtype,subtypeDescription,creator,afid,affilname,affiliation_city,affiliation_country,author_count,author_names,author_ids,author_afids,coverDate,coverDisplayDate,publicationName,issn,source_id,eIssn,aggregationType,volume,issueIdentifier,article_number,pageRange,description,authkeywords,citedby_count,openaccess,freetoread,freetoreadLabel,fund_acr,fund_no,fund_sponsor
2-s2.0-85070463755,10.1038/s41598-018-21982-x,,29511268,Erratum: Publisher Correction: TLR4-Mediated Placental Pathology and Pregnancy Outcome in Experimental Malaria (Scientific reports (2017) 7 1 (8623)),er,Erratum,Barboza R.,,Universidade Federal de São Paulo,Sao Paulo,Brazil,,,,,2018-03-06,6 March 2018,Scientific Reports,,21100200805,20452322,Journal,8,1,4275,4275,,,0,1,all publisherfullgold repository repositoryvor,All Open Access Gold Green,,,
2-s2.0-85070443360,10.1038/s41598-018-21748-5,,29511271,Erratum: Publisher Correction: Aspirin metabolite sodium salicylate selectively inhibits transcriptional activity of ATF6α and downstream target genes (Scientific reports (2017) 7 1 (9190)),er,Erratum,Mügge F.L.B.,,Universidade Federal de Minas Gerais,Belo Horizonte,Brazil,,,,,2018-03-06,6 March 2018,Scientific Reports,,21100200805,20452322,Journal,8,1,4281,4281,,,0,1,all publisherfullgold repository repositoryvor,All Open Access Gold Green,,,
2-s2.0-85042941548,10.1073/pnas.1716747115,,29463714,Carbon monoxide protects the kidney through the central circadian clock and CD39,ar,Article,Correa-Costa M.,,Harvard Medical School,Boston,United States,,,,,2018-03-06,6 March 2018,Proceedings of the National Academy of Sciences of the United States of America,00278424,21121,10916490,Journal,115,10,,E2302-E2310,,,75,0,,,,,
2-s2.0-85042921163,10.1073/pnas.1718435115,,29463708,Environmental enrichment and exercise are better than social enrichment to reduce memory deficits in amyloid beta neurotoxicity,ar,Article,Prado Lima M.G.,,Universidade Federal do Pampa,Bage,Brazil,,,,,2018-03-06,6 March 2018,Proceedings of the National Academy of Sciences of the United States of America,00278424,21121,10916490,Journal,115,10,,E2403-E2409,,,87,1,all publisherfree2read repository repositoryvor,All Open Access Bronze Green,,,
2-s2.0-85055077201,10.5123/S1679-49742018000100015,S223796222018000100313,29513857,Trends in the dental surgeon workforce in Brazil 2007-2014: a time series study using data from the National Registry of Health Services,ar,Article,Cascaes A.M.,,Universidade Federal de Pelotas,Pelotas,Brazil,,,,,2018-03-05,5 March 2018,Epidemiologia E Servicos De Saude Revista do Sistema Unico De Saude do Brasil,,21100872043,22379622,Journal,27,1,,e201723615,,,19,1,all publisherfullgold,All Open Access Gold,,,
2-s2.0-85053622015,10.5123/S1679-49742018000100017,S223796222018000101000,29513856,Measurement of social inequalities in health: concepts and methodological approaches in the Brazilian context,ar,Article,Silva I.C.M.d.,,Universidade Federal de Pelotas,Pelotas,Brazil,,,,,2018-03-05,5 March 2018,Epidemiologia E Servicos De Saude Revista do Sistema Unico De Saude do Brasil,,21100872043,22379622,Journal,27,1,,e000100017,,,65,1,all publisherfullgold repository repositoryvor,All Open Access Gold Green,,,
2-s2.0-85068916456,10.1371/journal.pone.0217754,,31242200,The effect of anthropogenic drivers on spatial patterns of mangrove land use on the Amazon coast,ar,Article,Hayashi S.N.,,Universidade Federal do Pará;Universidade Federal Rural da Amazonia,Belem;Belem,Brazil;Brazil,,,,,2018-03-01,1 March 2018,Plos One,,10600153309,19326203,Journal,14,6,e0217754,,,,41,1,all publisherfullgold repository repositoryvor repositoryam,All Open Access Gold Green,,,
2-s2.0-85068914527,10.1371/journal.pone.0217750,,31242198,Influence of silver nanoparticle solution on the mechanical properties of resin cements and intrarradicular dentin,ar,Article,Suzuki T.Y.U.,,Universidade Federal de Minas Gerais,Belo Horizonte,Brazil,,,,,2018-03-01,1 March 2018,Plos One,,10600153309,19326203,Journal,14,6,e0217750,,,,28,1,all publisherfullgold repository repositoryvor repositoryam,All Open Access Gold Green,,,
2-s2.0-85064107176,10.1038/s41598-018-21666-6,,29497055,"Erratum: Author Correction: Well-being, problematic alcohol consumption and acute subjective drug effects in past-year ayahuasca users: a large, international, self-selecting online survey (Scientific reports (2017) 7 1 (15201))",er,Erratum,Lawn W.,,University College London;University of Exeter,London;Exeter,United Kingdom;United Kingdom,,,,,2018-03-01,1 March 2018,Scientific Reports,,21100200805,20452322,Journal,8,1,4059,4059,,,3,1,all publisherfullgold repository repositoryvor,All Open Access Gold Green,,,
2-s2.0-85063747017,,,,Pombaline reform and the rise of mathematics education to a higher level,ar,Article,Mondini F.,,"Universidade Estadual Paulista ""Júlio de Mesquita Filho""",Sao Paulo,Brazil,,,,,2018-03-01,March-April 2018,Acta Scientiae,15174492,21100902661,21787727,Journal,20,2,,172-187,,,0,0,,,,,
2-s2.0-85063744251,,,,The gap between the financial mathematics expressed in textbooks and that practiced in banks,ar,Article,Pinto de Queiroz M.R.P.P.,,Universidade do Estado da Bahia,Salvador,Brazil,,,,,2018-03-01,March-April 2018,Acta Scientiae,15174492,21100902661,21787727,Journal,20,2,,96-116,,,2,0,,,,,
2-s2.0-85063742719,,,,The dimensions of the knowledge of math teachers: The knowledge quartet as instrument of analysis of the teaching practice,ar,Article,Alves K.A.,,Programa de Pós-Graduação em Ensino,,Brazil,,,,,2018-03-01,March-April 2018,Acta Scientiae,15174492,21100902661,21787727,Journal,20,2,,22-42,,,1,0,,,,,
2-s2.0-85063734714,,,,Active learning methodologies: A brief review,ar,Article,Lovato F.L.,,Universidade Federal de Santa Maria (UFSM),,United States,,,,,2018-03-01,March-April 2018,Acta Scientiae,15174492,21100902661,21787727,Journal,20,2,,154-171,,,12,0,,,,,
2-s2.0-85063732581,,,,The representation of Redox Reactions Content in Brazilian Chemistry Textbooks,re,Review,Fernandes de Goes L.,,Universidade de São Paulo,Sao Paulo,Brazil,,,,,2018-03-01,March-April 2018,Acta Scientiae,15174492,21100902661,21787727,Journal,20,2,,135-153,,,1,0,,,,,
2-s2.0-85063730423,10.17648/acta.scientiae.v20iss2id3563,,,Scientific production on early chemistry teacher training disclosed through five Brazilian journals (2012-2016),re,Review,Leão M.F.,,Departamento de Ensino,Porto Velho,Brazil,,,,,2018-03-01,March-April 2018,Acta Scientiae,15174492,21100902661,21787727,Journal,20,2,,56-77,,,0,1,all publisherfullgold repository repositoryam,All Open Access Gold Green,,,
2-s2.0-85063722811,,,,Research practice in the beginning formation of teachers of chemistry: A look at the pedagogical projects,ar,Article,Wenzel J.S.,,Universidade Federal da Fronteira Sul,Chapeco,Brazil,,,,,2018-03-01,March-April 2018,Acta Scientiae,15174492,21100902661,21787727,Journal,20,2,,2-21,,,0,0,,,,,
2-s2.0-85045412551,10.1142/S0218127418300069,,,Nonchaotic Behavior in Quadratic Three-Dimensional Differential Systems with a Symmetric Jacobian Matrix,ar,Article,Messias M.,,"Universidade Estadual Paulista ""Júlio de Mesquita Filho""",Sao Paulo,Brazil,,,,,2018-03-01,1 March 2018,International Journal of Bifurcation and Chaos,02181274,12337,,Journal,28,3,1830006,,,,2,0,,,,,
2-s2.0-85045388235,10.1142/S0218127418500396,,,Algebraic Limit Cycles in Piecewise Linear Differential Systems,ar,Article,Buzzi C.,,"Universidade Estadual Paulista ""Júlio de Mesquita Filho""",Sao Paulo,Brazil,,,,,2018-03-01,1 March 2018,International Journal of Bifurcation and Chaos,02181274,12337,,Journal,28,3,1850039,,,,8,2,all repository repositoryam,All Open Access Green,,,
2-s2.0-85045121626,,,,Effect of methanol extracts of Stryphnodendron adstringens (MART) coville on feeding and breeding of plutella xylostella L. (Lepidoptera: Plutellidae),ar,Article,Fonseca J.,,Universidade Federal da Grande Dourados,Dourados,Brazil,,,,,2018-03-01,March 2018,Interciencia,03781844,22962,,Journal,43,3,,182-187,,,7,0,,,,,
2-s2.0-85045019964,10.1371/journal.pone.0193551,,29596437,Are the unken reflex and the aposematic colouration of red-bellied toads efficient against bird predation?,ar,Article,Bordignon D.W.,,Universidade Federal do Rio Grande do Sul,Porto Alegre,Brazil,,,,,2018-03-01,March 2018,Plos One,,10600153309,19326203,Journal,13,3,e0193551,,,,22,1,all publisherfullgold repository repositoryvor repositoryam,All Open Access Gold Green,,,
2-s2.0-85045012656,10.1371/journal.pone.0194511,,29596503,Empirical radio propagation model for DTV applied to non-homogeneous paths and different climates using machine learning techniques,ar,Article,Gomes I.,,Universidade Federal do Pará,Belem,Brazil,,,,,2018-03-01,March 2018,Plos One,,10600153309,19326203,Journal,13,3,e0194511,,,,18,1,all publisherfullgold repository repositoryvor repositoryam,All Open Access Gold Green,,,
2-s2.0-85045008067,10.1371/journal.pone.0194776,,29596452,Anaerobic metabolism induces greater total energy expenditure during exercise with blood flow restriction,ar,Article,Conceição M.,,Universidade de São Paulo;Universidade Estadual de Campinas,Sao Paulo;Campinas,Brazil;Brazil,,,,,2018-03-01,March 2018,Plos One,,10600153309,19326203,Journal,13,3,e0194776,,,,26,1,all publisherfullgold repository repositoryvor repositoryam,All Open Access Gold Green,,,
2-s2.0-85044998244,10.1371/journal.pone.0193239,,29596449,Sequence analysis of the potato aphid Macrosiphum euphorbiae transcriptome identified two new viruses,ar,Article,Teixeira M.A.,,"University of California, Riverside;Ministry of Agriculture",Riverside;Brasilia,United States;Brazil,,,,,2018-03-01,March 2018,Plos One,,10600153309,19326203,Journal,13,3,e0193239,,,,13,1,all publisherfullgold repository repositoryvor,All Open Access Gold Green,,,
2-s2.0-85044988262,10.1371/journal.pone.0194989,,29596469,Low sox2 expression marks a distinct subset of adenoid cystic carcinoma of the head and neck and is associated with an advanced tumor stage,ar,Article,Thierauf J.,,Universitätsklinikum Heidelberg;Universitätsklinikum Ulm,Heidelberg;Ulm,Germany;Germany,,,,,2018-03-01,March 2018,Plos One,,10600153309,19326203,Journal,13,3,e0194989,,,,8,1,all publisherfullgold repository repositoryvor repositoryam,All Open Access Gold Green,,,
2-s2.0-85044957436,10.1371/journal.pone.0193984,,29601590,Differential resilience of Amazonian otters along the Rio Negro in the aftermath of the 20th century international fur trade,re,Review,Pimenta N.C.,,Instituto Nacional de Pesquisas Da Amazonia;Museu Paraense Emilio Goeldi,Manaus;Belem,Brazil;Brazil,,,,,2018-03-01,March 2018,Plos One,,10600153309,19326203,Journal,13,3,e0193984,,,,12,1,all publisherfullgold repository repositoryvor repositoryam,All Open Access Gold Green,,,
2-s2.0-85044934822,10.1371/journal.pone.0195276,,29596524,"Effects of repetitive transcranial magnetic stimulation and trans-spinal direct current stimulation associated with treadmill exercise in spinal cord and cortical excitability of healthy subjects: A triple-blind, randomized and sham-controlled study",ar,Article,Albuquerque P.,,Universidade Federal de Pernambuco;Centro Universitário Tabosa de Almeida,Recife;Itambe de Pernambuco,Brazil;Brazil,,,,,2018-03-01,March 2018,Plos One,,10600153309,19326203,Journal,13,3,e0195276,,,,26,1,all publisherfullgold repository repositoryvor,All Open Access Gold Green,,,
2-s2.0-85044865514,10.1371/journal.pone.0192067,,29590115,Impaired neuronal maturation of hippocampal neural progenitor cells in mice lacking CRAF,ar,Article,Pfeiffer V.,,Julius-Maximilians-Universität Würzburg,Wurzburg,Germany,,,,,2018-03-01,March 2018,Plos One,,10600153309,19326203,Journal,13,3,e0192067,,,,3,1,all publisherfullgold repository repositoryvor repositoryam,All Open Access Gold Green,,,
2-s2.0-85044861918,10.1371/journal.pone.0193226,,29590122,Association between six-minute walk distance and long-term outcomes in patients with pulmonary arterial hypertension: Data from the randomized SERAPHIN trial,ar,Article,Souza R.,,Universidade de São Paulo,Sao Paulo,Brazil,,,,,2018-03-01,March 2018,Plos One,,10600153309,19326203,Journal,13,3,e0193226,,,,36,1,all publisherfullgold repository repositoryvor repositoryam,All Open Access Gold Green,,,
2-s2.0-85044775522,10.1371/journal.pone.0194884,,29590186,"JMJD1A, H3K9me1, H3K9me2 and ADM expression as prognostic markers in oral and oropharyngeal squamous cell carcinoma",ar,Article,De Lima Maia L.,,Universidade Federal do Espírito Santo,Vitoria,Brazil,,,,,2018-03-01,March 2018,Plos One,,10600153309,19326203,Journal,13,3,e0194884,,,,26,1,all publisherfullgold repository repositoryvor repositoryam,All Open Access Gold Green,,,
2-s2.0-85044770102,10.1371/journal.pone.0194725,,29590174,Extending the paleontology–biogeography reciprocity with SDMs: Exploring models and data in reducing fossil taxonomic uncertainty,ar,Article,Eduardo A.A.,,Université Fédérale de Sergipe,Sao Cristovao,Brazil,,,,,2018-03-01,March 2018,Plos One,,10600153309,19326203,Journal,13,3,e0194725,,,,11,1,all publisherfullgold repository repositoryvor repositoryam,All Open Access Gold Green,,,
2-s2.0-85044627168,10.1007/s12046-018-0838-6,,,Assessment of the toughness of fibre-reinforced concrete using the R-curve approach,ar,Article,Stephen S.J.,,Indian Institute of Technology Madras,Chennai,India,,,,,2018-03-01,1 March 2018,Sadhana Academy Proceedings in Engineering Sciences,02562499,23531,09737677,Journal,43,3,46,,,,8,1,all publisherfree2read,All Open Access Bronze,,,
2-s2.0-85044544956,10.1371/journal.pone.0193703,,29566100,Authorship attribution based on Life-Like Network Automata,ar,Article,Machicao J.,,Universidade de São Paulo,Sao Paulo,Brazil,,,,,2018-03-01,March 2018,Plos One,,10600153309,19326203,Journal,13,3,e0193703,,,,31,1,all publisherfullgold repository repositoryvor repositoryam,All Open Access Gold Green,,,
2-s2.0-85044539351,10.1371/journal.pone.0192542,,29579122,The Monty Hall problem revisited: Autonomic arousal in an inverted version of the game,ar,Article,Massad E.,,Universidade de São Paulo;London School of Hygiene & Tropical Medicine;University of Derby;Fundacao Getulio Vargas,Sao Paulo;London;Derby;Rio de Janeiro,Brazil;United Kingdom;United Kingdom;Brazil,,,,,2018-03-01,March 2018,Plos One,,10600153309,19326203,Journal,13,3,e0192542,,,,2,1,all publisherfullgold repository repositoryvor repositoryam,All Open Access Gold Green,,,
2-s2.0-85044535135,10.1371/journal.pone.0194247,,29579069,Molecular and morphological data of the freshwater fish Glandulocauda melanopleura (Characiformes: Characidae) provide evidences of river captures and local differentiation in the Brazilian Atlantic Forest,ar,Article,Camelier P.,,Universidade de São Paulo,Sao Paulo,Brazil,,,,,2018-03-01,March 2018,Plos One,,10600153309,19326203,Journal,13,3,e0194247,,,,22,1,all publisherfullgold repository repositoryvor repositoryam,All Open Access Gold Green,,,
2-s2.0-85044533285,10.1371/journal.pone.0194990,,29579115,Metabolic syndrome and cognitive decline in the elderly: A systematic review,ar,Article,Assuncao N.,,Universidade Federal do Rio de Janeiro;Instituto D'Or de Pesquisa e Ensino,Rio de Janeiro;Rio de Janeiro,Brazil;Brazil,,,,,2018-03-01,March 2018,Plos One,,10600153309,19326203,Journal,13,3,e0194990,,,,98,1,all publisherfullgold repository repositoryvor repositoryam,All Open Access Gold Green,,,
2-s2.0-85044521861,10.1371/journal.pone.0194392,,29579099,"Severe influenza A(H1N1)pdm09 in pregnant women and neonatal outcomes, State of Sao Paulo, Brazil, 2009",ar,Article,Ribeiro A.F.,,Universidade de São Paulo;Universidade Nove de Julho;Instituto de Infectologia Emilio Ribas;Epidemiological Surveillance Center,Sao Paulo;Sao Paulo;Sao Paulo;Sao Paulo,Brazil;Brazil;Brazil;Brazil,,,,,2018-03-01,March 2018,Plos One,,10600153309,19326203,Journal,13,3,e0194392,,,,10,1,all publisherfullgold repository repositoryvor repositoryam,All Open Access Gold Green,,,
2-s2.0-85044502425,10.1371/journal.pone.0194050,,29584755,Flexibility evaluation of multiechelon supply chains,ar,Article,Almeida J.F.D.F.,,Universidade Federal de Minas Gerais,Belo Horizonte,Brazil,,,,,2018-03-01,March 2018,Plos One,,10600153309,19326203,Journal,13,3,e0194050,,,,9,1,all publisherfullgold repository repositoryvor repositoryam,All Open Access Gold Green,,,
2-s2.0-85044411214,10.1371/journal.pone.0194038,,29570721,Structural and functional analyses of the optic nerve and lateral geniculate nucleus in glaucoma,ar,Article,Furlanetto R.L.,,Universidade Federal de São Paulo,Sao Paulo,Brazil,,,,,2018-03-01,March 2018,Plos One,,10600153309,19326203,Journal,13,3,e0194038,,,,23,1,all publisherfullgold repository repositoryvor repositoryam,All Open Access Gold Green,,,
2-s2.0-85044409771,10.1371/journal.pone.0194039,,29570711,Smoking intensity and bladder cancer aggressiveness at diagnosis,ar,Article,Barbosa A.L.A.,,Radboud University Medical Center;Universidade Federal da Bahia,Nijmegen;Salvador,Netherlands;Brazil,,,,,2018-03-01,March 2018,Plos One,,10600153309,19326203,Journal,13,3,e0194039,,,,29,1,all publisherfullgold repository repositoryvor,All Open Access Gold Green,,,
2-s2.0-85044318167,10.1371/journal.pone.0194689,,29566087,"Life history and chemical ecology of the Warrior wasp Synoeca septentrionalis (Hymenoptera: Vespidae, Epiponini)",ar,Article,Santos E.,,Universidade Federal do Reconcavo da Bahia,Cruz das Almas,Brazil,,,,,2018-03-01,March 2018,Plos One,,10600153309,19326203,Journal,13,3,e0194689,,,,10,1,all publisherfullgold repository repositoryvor repositoryam,All Open Access Gold Green,,,
2-s2.0-85044306205,10.1371/journal.pone.0194432,,29566090,Aerobic fitness in professional soccer players after anterior cruciate ligament reconstruction,ar,Article,De Almeida A.M.,,Universidade de São Paulo;Rua Dr. Ovidio Pires de Campos,Sao Paulo;Cerqueira Cesar,Brazil;Brazil,,,,,2018-03-01,March 2018,Plos One,,10600153309,19326203,Journal,13,3,e0194432,,,,54,1,all publisherfullgold repository repositoryvor repositoryam,All Open Access Gold Green,,,
2-s2.0-85044297229,10.1371/journal.pone.0193739,,29561852,Proteomic endorsed transcriptomic profiles of venom glands from Tityus obscurus and T. serrulatus scorpions,ar,Article,De Oliveira U.C.,,Instituto Butantan,Sao Paulo,Brazil,,,,,2018-03-01,March 2018,Plos One,,10600153309,19326203,Journal,13,3,e0193739,,,,66,1,all publisherfullgold repository repositoryvor repositoryam,All Open Access Gold Green,,,
2-s2.0-85044286125,10.1371/journal.pone.0193660,,29561869,Quantity and quality of seed dispersal by a large arboreal frugivore in small and large Atlantic forest fragments,ar,Article,Chaves Ó.M.,,Pontifícia Universidade Católica do Rio Grande do Sul;Organização Fauna Brasilis,Porto Alegre;Porto Alegre,Brazil;Brazil,,,,,2018-03-01,March 2018,Plos One,,10600153309,19326203,Journal,13,3,e0193660,,,,22,1,all publisherfullgold repository repositoryvor repositoryam,All Open Access Gold Green,,,
2-s2.0-85044275712,10.1371/journal.pone.0194057,,29561907,Pilates training improves 5-km run performance by changing metabolic cost and muscle activity in trained runners,ar,Article,Finatto P.,,Universidade Federal do Rio Grande do Sul,Porto Alegre,Brazil,,,,,2018-03-01,March 2018,Plos One,,10600153309,19326203,Journal,13,3,e0194057,,,,26,1,all publisherfullgold repository repositoryvor repositoryam,All Open Access Gold Green,,,
2-s2.0-85044253721,10.1371/journal.pone.0194492,,29566036,The Brazilian version of Skindex-16 is a valid and reliable instrument to assess the health-related quality of life of patients with skin diseases,ar,Article,Cárcano C.B.M.,,Hospital de Câncer de Barretos;Faculdade de Ciências da Saúde de Barretos Dr. Paulo Prata,Barretos;Barretos,Brazil;Brazil,,,,,2018-03-01,March 2018,Plos One,,10600153309,19326203,Journal,13,3,e0194492,,,,15,1,all publisherfullgold repository repositoryvor repositoryam,All Open Access Gold Green,,,
2-s2.0-85044250284,10.1371/journal.pone.0193509,,29554095,"The mixture of cashew nut shell liquid and castor oil results in an efficient larvicide against Aedes aegypti that does not alter embryo-fetal development, reproductive performance or DNA integrity",ar,Article,Vani J.M.,,Universidade Federal de Mato Grosso do Sul,Campo Grande,Brazil,,,,,2018-03-01,March 2018,Plos One,,10600153309,19326203,Journal,13,3,e0193509,,,,25,1,all publisherfullgold repository repositoryvor repositoryam,All Open Access Gold Green,,,
2-s2.0-85044222875,10.1371/journal.pone.0194509,,29558524,Survival of viral pathogens in animal feed ingredients under transboundary shipping models,ar,Article,Dee S.A.,,"Pipestone, USA",Pipestone,United States,,,,,2018-03-01,March 2018,Plos One,,10600153309,19326203,Journal,13,3,e0194509,,,,164,1,all publisherfullgold repository repositoryvor,All Open Access Gold Green,,,
2-s2.0-85044203270,10.1371/journal.pone.0194184,,29558516,Low genetic diversity of the human T-cell lymphotropic virus (HTLV-1) in an endemic area of the brazilian Amazon basin,ar,Article,Nobre A.F.S.,,Universidade Federal do Pará,Belem,Brazil,,,,,2018-03-01,March 2018,Plos One,,10600153309,19326203,Journal,13,3,e0194184,,,,8,1,all publisherfullgold repository repositoryvor repositoryam,All Open Access Gold Green,,,
2-s2.0-85044198192,10.1371/journal.pone.0194437,,29558476,Scaling mimesis: Morphometric and ecomorphological similarities in three sympatric plant-mimetic fish of the family Carangidae (Teleostei),ar,Article,De Queiroz A.C.,,Universidade Federal do Pará,Belem,Brazil,,,,,2018-03-01,March 2018,Plos One,,10600153309,19326203,Journal,13,3,e0194437,,,,3,1,all publisherfullgold repository repositoryvor repositoryam,All Open Access Gold Green,,,
2-s2.0-85044177786,10.1371/journal.pone.0194654,,29554132,Measuring resilience and assessing vulnerability of terrestrial ecosystems to climate change in South America,ar,Article,Anjos L.J.S.,,Universidade Federal do Pará;Universidade Federal Rural da Amazonia,Belem;Belem,Brazil;Brazil,,,,,2018-03-01,March 2018,Plos One,,10600153309,19326203,Journal,13,3,e0194654,,,,60,1,all publisherfullgold repository repositoryvor repositoryam,All Open Access Gold Green,,,
2-s2.0-85044174843,10.1371/journal.pone.0193135,,29554098,Inequalities in esophageal cancer mortality in Brazil: Temporal trends and projections,ar,Article,dos Santos J.,,Instituto Nacional de Cancer,Rio de Janeiro,Brazil,,,,,2018-03-01,March 2018,Plos One,,10600153309,19326203,Journal,13,3,e0193135,,,,6,1,all publisherfullgold repository repositoryvor repositoryam,All Open Access Gold Green,,,
2-s2.0-85044171369,10.1371/journal.pone.0193752,,29547648,Diversity of terrestrial mammal seed dispersers along a lowland Amazon forest regrowth gradient,ar,Article,Arévalo-Sandi A.,,Instituto Nacional de Pesquisas Da Amazonia,Manaus,Brazil,,,,,2018-03-01,March 2018,Plos One,,10600153309,19326203,Journal,13,3,e0193752,,,,20,1,all publisherfullgold repository repositoryvor repositoryam,All Open Access Gold Green,,,
2-s2.0-85044162343,10.1371/journal.pone.0194035,,29547622,"Dispositional mindfulness, anticipation and abstinence symptoms related to hypnotic dependence among insomniac women who seek treatment: A cross-sectional study",ar,Article,Barros V.V.,,Universidade Federal de São Paulo;Nepsis - Research Center on Health and Substance Use - MBRP Brasil - Brazilian Center for Research and Training in Mindfulness-Based Relapse Prevention,Sao Paulo;Sao Paulo,Brazil;Brazil,,,,,2018-03-01,March 2018,Plos One,,10600153309,19326203,Journal,13,3,e0194035,,,,5,1,all publisherfullgold repository repositoryvor repositoryam,All Open Access Gold Green,,,
2-s2.0-85044070394,10.1371/journal.pone.0194228,,29543857,Is substance use associated with HIV cascade outcomes in Latin America?,ar,Article,De Boni R.B.,,Instituto Nacional de Infectologia Evandro Chagas (INI),Rio de Janeiro,Brazil,,,,,2018-03-01,March 2018,Plos One,,10600153309,19326203,Journal,13,3,e0194228,,,,16,1,all publisherfullgold repository repositoryvor repositoryam,All Open Access Gold Green,,,
2-s2.0-85044068728,10.1371/journal.pone.0194383,,29543867,"Toll-like receptors 2, 4, and 9 expressions over the entire clinical and immunopathological spectrum of American cutaneous leishmaniasis due to Leishmania (V.) braziliensis and Leishmania (L.) amazonensis",ar,Article,Campos M.B.,,Instituto Evandro Chagas,Ananindeua,Brazil,,,,,2018-03-01,March 2018,Plos One,,10600153309,19326203,Journal,13,3,e0194383,,,,30,1,all publisherfullgold repository repositoryvor repositoryam,All Open Access Gold Green,,,
2-s2.0-85044034197,10.1371/journal.pone.0194430,,29543912,"TNF-α blockade impairs in vitro tuberculous granuloma formation and down modulate Th1, Th17 and Treg cytokines",ar,Article,Alves da Silva D.A.,,"Instituto Federal de Educação, Ciência e Tecnologia do Triangulo Mineiro (IFTM)",Uberaba,Brazil,,,,,2018-03-01,March 2018,Plos One,,10600153309,19326203,Journal,13,3,e0194430,,,,42,1,all publisherfullgold repository repositoryvor repositoryam,All Open Access Gold Green,,,
2-s2.0-85043987554,10.1016/j.heliyon.2018.e00571,S2405844017333996,,The preparation of benzyl esters using stoichiometric niobium (V) chloride versus niobium grafted SiO2 catalyst: A comparison study,ar,Article,Barbosa S.L.,,Universidade Federal dos Vales do Jequitinhonha e Mucuri,Diamantina,Brazil,,,,,2018-03-01,March 2018,Heliyon,24058440,21100411756,,Journal,4,3,e00571,,,,1,1,all repository repositoryvor,All Open Access Green,,,
