eid,doi,pii,pubmed_id,title,subtype,subtypeDescription,creator,afid,affilname,affiliation_city,affiliation_country,author_count,author_names,author_ids,author_afids,coverDate,coverDisplayDate,publicationName,issn,source_id,eIssn,aggregationType,volume,issueIdentifier,article_number,pageRange,description,authkeywords,citedby_count,openaccess,freetoread,freetoreadLabel,fund_acr,fund_no,fund_sponsor
2-s2.0-85023208370,10.1016/j.vetpar.2017.07.002,S0304401717303011,28807293,Sarcocystis neurona and Neospora caninum in Brazilian opossums (Didelphis spp.): Molecular investigation and in vitro isolation of Sarcocystis spp.,ar,Article,Gondim L.S.Q.,,Universidade Federal da Bahia,Salvador,Brazil,,,,,2017-08-30,30 August 2017,Veterinary Parasitology,03044017,19537,18732550,Journal,243,,,192-198,,,21,0,,,,,
2-s2.0-85021805296,10.1016/j.vetpar.2017.06.023,S0304401717302911,28807284,First description of Cryptosporidium parvum in carrier pigeons (Columba livia),ar,Article,Oliveira B.C.M.,,"Universidade Estadual Paulista ""Júlio de Mesquita Filho""",Sao Paulo,Brazil,,,,,2017-08-30,30 August 2017,Veterinary Parasitology,03044017,19537,18732550,Journal,243,,,148-150,,,35,2,all repository repositoryvor,All Open Access Green,,,
2-s2.0-85020630250,10.1016/j.vetpar.2017.06.008,S0304401717302649,28807309,Synergistic interaction of ten essential oils against Haemonchus contortus in vitro,ar,Article,Katiki L.M.,,Instituto de Zootecnia,Nova Odessa,Brazil,,,,,2017-08-30,30 August 2017,Veterinary Parasitology,03044017,19537,18732550,Journal,243,,,47-51,,,87,0,,,,,
2-s2.0-85020298023,10.1016/j.vetpar.2017.05.020,S0304401717302212,28807290,Exposure to vector-borne pathogens in privately owned dogs living in different socioeconomic settings in Brazil,ar,Article,Figueredo L.A.,,Fundacao Oswaldo Cruz,Rio de Janeiro,Brazil,,,,,2017-08-30,30 August 2017,Veterinary Parasitology,03044017,19537,18732550,Journal,243,,,18-23,,,35,0,,,,,
2-s2.0-85028551421,10.1186/s13071-017-2333-z,,28851424,"Sand fly (Diptera, Psychodidae, Phlebotominae) abundance and diversity in areas affected by the São Francisco River transposition project in Ceará State, Brazil",ar,Article,Dos Santos Silva J.,,Fundacao Oswaldo Cruz,Rio de Janeiro,Brazil,,,,,2017-08-29,29 August 2017,Parasites and Vectors,,17500154721,17563305,Journal,10,1,403,,,,2,1,all publisherfullgold repository repositoryvor,All Open Access Gold Green,,,
2-s2.0-85044272159,10.3390/vetsci4030042,,,How behavioral changes can indicate serious cerebral pathology: A case report of concomitant olfactory neuroblastoma and distemper virus encephalitis in a Swiss shepherd dog,ar,Article,Candini D.,,Veterinary Practitioner,Torino,Italy,,,,,2017-08-28,28 August 2017,Veterinary Sciences,,21100856030,23067381,Journal,4,3,42,,,,2,1,all publisherfullgold repository repositoryvor repositoryam,All Open Access Gold Green,,,
2-s2.0-85029227744,10.4314/ovj.v7i3.9,,,"Effects of topical flurbiprofen sodium, diclofenac sodium, ketorolac tromethamine and benzalkonium chloride on corneal sensitivity in normal dogs",ar,Article,De Araújo Cantarella R.,,Universidade Federal do Parana,Curitiba,Brazil,,,,,2017-08-24,24 August 2017,Open Veterinary Journal,22264485,21100438194,22186050,Journal,7,3,,254-260,,,11,1,all publisherfullgold repository repositoryvor repositoryam,All Open Access Gold Green,,,
2-s2.0-85026309271,10.1016/j.vaccine.2017.07.045,S0264410X17309532,28757058,Immune correlates of protection for dengue: State of the art and research Agenda,cp,Conference Paper,Katzelnick L.C.,,"University of California, Berkeley;University of Florida",Berkeley;Gainesville,United States;United States,,,,,2017-08-24,24 August 2017,Vaccine,0264410X,21376,18732518,Journal,35,36,,4659-4669,,,80,2,all repository repositoryam,All Open Access Green,,,
2-s2.0-85028747896,10.3390/ani7080064,,,American citizens’ views of an ideal pig farm,ar,Article,Sato P.,,The University of British Columbia,Vancouver,Canada,,,,,2017-08-22,22 August 2017,Animals,,21100244850,20762615,Journal,7,8,64,,,,46,1,all publisherfullgold repository repositoryvor repositoryam,All Open Access Gold Green,,,
2-s2.0-85027685508,10.1186/s12917-017-1174-5,,28821261,Main lesions in the central nervous system of dogs due to Leishmania infantum infection,ar,Article,Macau W.L.,,Universidade Federal do Maranhão,Sao Luis,Brazil,,,,,2017-08-18,18 August 2017,BMC Veterinary Research,,4300151401,17466148,Journal,13,1,255,,,,12,1,all publisherfullgold repository repositoryvor,All Open Access Gold Green,,,
2-s2.0-85027499592,10.1186/s13071-017-2324-0,,28814323,Efficacy of sarolaner (Simparic™) against induced infestations of Amblyomma cajennense on dogs,ar,Article,Scott F.,,Universidade Federal Rural do Rio de Janeiro,Seropedica,Brazil,,,,,2017-08-17,17 August 2017,Parasites and Vectors,,17500154721,17563305,Journal,10,1,390,,,,7,1,all publisherfullgold repository repositoryvor,All Open Access Gold Green,,,
2-s2.0-85027990729,10.1186/s13620-017-0103-z,,,Month-wise variation and prediction of bulk tank somatic cell count in Brazilian dairy herds and its impact on payment based on milk quality,ar,Article,Busanello M.,,Universidade de São Paulo,Sao Paulo,Brazil,,,,,2017-08-15,15 August 2017,Irish Veterinary Journal,03680762,18282,20460481,Journal,70,1,26,,,,12,1,all publisherfullgold repository repositoryvor,All Open Access Gold Green,,,
2-s2.0-85027687245,10.14202/vetworld.2017.924-926,,,Molecular screening for hemotropic mycoplasmas in captive Barbary sheep (Ammotragus lervia) in southern Brazil,ar,Article,Santos L.,,Universidade Federal do Parana;Universidade Estadual do Oeste do Paraná,Curitiba;Cascavel,Brazil;Brazil,,,,,2017-08-15,15 August 2017,Veterinary World,09728988,21100201717,22310916,Journal,10,8,,924-926,,,1,1,all publisherfullgold repository repositoryvor repositoryam,All Open Access Gold Green,,,
2-s2.0-85027533206,10.1186/s12917-017-1170-9,,28810860,Tartrate-resistant acid phosphate as biomarker of bone turnover over the lifespan and different physiologic stages in sheep,ar,Article,Camassa J.A.,,University of Trás-os-Montes and Alto Douro,Vila Real,Portugal,,,,,2017-08-15,15 August 2017,BMC Veterinary Research,,4300151401,17466148,Journal,13,1,239,,,,9,1,all publisherfullgold repository repositoryvor,All Open Access Gold Green,,,
2-s2.0-85020027964,10.1016/j.vetpar.2017.05.012,S0304401717302133,28606326,Evaluation of the transcription of interleukin-12 in the intestinal mucosa of mice subjected to experimental toxocariasis and supplemented with Saccharomyces boulardii,ar,Article,de Moura M.,,Universidade Federal de Pelotas,Pelotas,Brazil,,,,,2017-08-15,15 August 2017,Veterinary Parasitology,03044017,19537,18732550,Journal,242,,,59-62,,,8,1,all publisherhybridgold,All Open Access Hybrid Gold,,,
2-s2.0-85019873944,10.1016/j.vetpar.2017.05.014,S0304401717302157,28606322,"Peripheral and placental immune responses in goats after primoinfection with Neospora caninum at early, mid and late gestation",ar,Article,Porto W.,,Universidade Federal de Alagoas,Maceio,Brazil,,,,,2017-08-15,15 August 2017,Veterinary Parasitology,03044017,19537,18732550,Journal,242,,,38-43,,,4,1,all publisherhybridgold,All Open Access Hybrid Gold,,,
2-s2.0-85019715791,10.1016/j.vetpar.2017.05.011,S0304401717302121,28606318,Integrative taxonomy of Goezia spinulosa (Nematoda: Raphidascarididae) from arapaimas in the northwestern Brazil,ar,Article,Silva M.T.d.,,"Fundacao Oswaldo Cruz;Instituto Federal De Educação, Ciência E Tecnologia Do Acre – IFAC",Rio de Janeiro;Rio Branco,Brazil;Brazil,,,,,2017-08-15,15 August 2017,Veterinary Parasitology,03044017,19537,18732550,Journal,242,,,14-21,,,4,1,all publisherfree2read repository repositoryvor,All Open Access Bronze Green,,,
2-s2.0-85021743799,10.1016/j.vaccine.2017.05.046,S0264410X17306825,28687406,Comparative efficacy and toxicity of two vaccine candidates against Sporothrix schenckii using either Montanide™ Pet Gel A or aluminum hydroxide adjuvants in mice,ar,Article,Portuondo D.L.,,"Universidade Estadual Paulista ""Júlio de Mesquita Filho""",Sao Paulo,Brazil,,,,,2017-08-03,3 August 2017,Vaccine,0264410X,21376,18732518,Journal,35,34,,4430-4436,,,28,2,all repository repositoryvor,All Open Access Green,,,
2-s2.0-85043389575,10.1002/vms3.66,,,Pilot assessment of vascular endothelial growth factor receptors and trafficking pathways in recurrent and metastatic canine subcutaneous mast cell tumours,ar,Article,da Silva L.,,University of Guelph,Guelph,Canada,,,,,2017-08-01,1 August 2017,Veterinary Medicine and Science,,21100869514,20531095,Journal,3,3,,146-155,,,11,1,all publisherfullgold repository repositoryvor,All Open Access Gold Green,,,
2-s2.0-85042719714,10.1139/cjas-2016-0185,,,Characteristics of carcass and meat of heifers finished on pasture amended with different supplement frequency and soybean oil source,ar,Article,Santana M.C.A.,,"Universidade Estadual Paulista ""Júlio de Mesquita Filho""",Sao Paulo,Brazil,,,,,2017-08-01,1 August 2017,Canadian Journal of Animal Science,00083984,37794,19181825,Journal,98,1,,32-43,,,4,2,all repository repositoryvor,All Open Access Green,,,
2-s2.0-85042702357,10.1139/cjas-2017-0019,,,Modelling lactation curves of dairy goats by fitting random regression models using Legendre polynomials or B-splines,ar,Article,Brito L.F.,,Centre for the Genetic Improvement of Livestock,Guelph,Canada,,,,,2017-08-01,1 August 2017,Canadian Journal of Animal Science,00083984,37794,19181825,Journal,98,1,,73-83,,,31,2,all repository repositoryvor repositoryam,All Open Access Green,,,
2-s2.0-85042688490,10.1139/cjas-2016-0184,,,Dynamics of acute phase proteins in dairy cows with subclinical hypocalcemia,ar,Article,Feijó J.,,Universidade Federal de Pelotas,Pelotas,Brazil,,,,,2017-08-01,1 August 2017,Canadian Journal of Animal Science,00083984,37794,19181825,Journal,98,1,,1-8,,,5,0,,,,,
2-s2.0-85042684743,10.1139/cjas-2016-0210,,,By-product of passion fruit seed (Passiflora edulis) in the diet of broilers,ar,Article,Zanetti L.H.,,Universidade Estadual de Maringá,Maringa,Brazil,,,,,2017-08-01,1 August 2017,Canadian Journal of Animal Science,00083984,37794,19181825,Journal,98,1,,109-118,,,7,2,all repository repositoryam,All Open Access Green,,,
2-s2.0-85035151148,10.1590/s0100-736x2017000800008,,,Natural and experimental Leucaena leucocephala poisoning in horses,ar,Article,Porto M.R.,,Universidade de Brasília,Brasília,Brazil,,,,,2017-08-01,1 August 2017,Pesquisa Veterinaria Brasileira,0100736X,18819,16785150,Journal,37,8,,829-834,,,9,1,all publisherfullgold repository repositoryvor,All Open Access Gold Green,,,
2-s2.0-85035149028,10.1590/s0100-736x2017000800014,,,Clinical and epidemiological study in dogs with thoracolumbar vertebrae fractures and luxations,ar,Article,Araújo B.M.,,Universidade Federal Rural de Pernambuco,Recife,Brazil,,,,,2017-08-01,1 August 2017,Pesquisa Veterinaria Brasileira,0100736X,18819,16785150,Journal,37,8,,866-870,,,5,1,all publisherfullgold repository repositoryvor,All Open Access Gold Green,,,
2-s2.0-85035146779,10.1590/s0100-736x2017000800017,,,Uterine vasculature of pregnant mares of donkey and stallion through the Doppler ultrasonography spectral mode,ar,Article,Lemos S.,,Universidade Federal Fluminense,Niteroi,Brazil,,,,,2017-08-01,1 August 2017,Pesquisa Veterinaria Brasileira,0100736X,18819,16785150,Journal,37,8,,877-882,,,3,1,all publisherfullgold repository repositoryvor,All Open Access Gold Green,,,
2-s2.0-85035143620,10.1590/s0100-736x2017000800020,,,Morphology of the trachea and lung lobation of Leopardus pardalis (ocelot),ar,Article,Schuingues C.d.O.,,Universidade do Estado de Mato Grosso,Caceres,Brazil,,,,,2017-08-01,1 August 2017,Pesquisa Veterinaria Brasileira,0100736X,18819,16785150,Journal,37,8,,897-903,,,3,1,all publisherfullgold repository repositoryvor,All Open Access Gold Green,,,
2-s2.0-85035130912,10.1590/s0100-736x2017000800007,,,Suppurative infectious diseases of the central nervous system in domestic ruminants,ar,Article,Konradt G.,,Universidade Federal do Rio Grande do Sul,Porto Alegre,Brazil,,,,,2017-08-01,1 August 2017,Pesquisa Veterinaria Brasileira,0100736X,18819,16785150,Journal,37,8,,820-828,,,20,1,all publisherfullgold repository repositoryvor repositoryam,All Open Access Gold Green,,,
2-s2.0-85035130503,10.1590/s0100-736x2017000800013,,,Efficacy of a Kalanchoe gastonis-bonnieri extract to control bacterial biofilms and dental calculus in dogs,ar,Article,Abdalla S.L.,,Universidade de São Paulo,Sao Paulo,Brazil,,,,,2017-08-01,1 August 2017,Pesquisa Veterinaria Brasileira,0100736X,18819,16785150,Journal,37,8,,859-865,,,4,1,all publisherfullgold repository repositoryvor repositoryam,All Open Access Gold Green,,,
2-s2.0-85035120016,10.1590/s0100-736x2017000800009,,,Clinical evaluation of dogs with intervertebral disc disease (Hansen type I) submitted to surgical decompression: 110 cases,ar,Article,Chaves R.,,Universidade Federal de Santa Maria,Santa Maria,Brazil,,,,,2017-08-01,1 August 2017,Pesquisa Veterinaria Brasileira,0100736X,18819,16785150,Journal,37,8,,835-839,,,1,1,all publisherfullgold repository repositoryvor,All Open Access Gold Green,,,
2-s2.0-85035119423,10.1590/s0100-736x2017000800019,,,"Evaluation of neonatal vitality and blood glucose, lactate and cortisol concentrations in foals of the Paint Horse breed",ar,Article,Cruz R.,,"Universidade Estadual Paulista ""Júlio de Mesquita Filho""",Sao Paulo,Brazil,,,,,2017-08-01,1 August 2017,Pesquisa Veterinaria Brasileira,0100736X,18819,16785150,Journal,37,8,,891-896,,,6,1,all publisherfullgold repository repositoryvor repositoryam,All Open Access Gold Green,,,
2-s2.0-85035111535,10.1590/s0100-736x2017000800004,,,"Detection of coronavirus in diarrhea samples from water buffaloes (Bubalus bubalis) raised in the State of São Paulo, Brazil",ar,Article,Rossi R.,,Universidade de São Paulo,Sao Paulo,Brazil,,,,,2017-08-01,1 August 2017,Pesquisa Veterinaria Brasileira,0100736X,18819,16785150,Journal,37,8,,802-804,,,0,1,all publisherfullgold repository repositoryam,All Open Access Gold Green,,,
2-s2.0-85035108049,10.1590/s0100-736x2017000800003,,,Parasitic diseases of cattle and sheep in southern Brazil: Frequency and economic losses estimate,ar,Article,de Oliveira P.A.,,Universidade Federal de Pelotas,Pelotas,Brazil,,,,,2017-08-01,1 August 2017,Pesquisa Veterinaria Brasileira,0100736X,18819,16785150,Journal,37,8,,797-801,,,24,1,all publisherfullgold repository repositoryvor,All Open Access Gold Green,,,
2-s2.0-85035102330,10.1590/s0100-736x2017000800011,,,Increased nitric oxide plasma concentration in dogs with naturally acquired chronic renal disease,ar,Article,Galvão A.B.,,"Universidade Estadual Paulista ""Júlio de Mesquita Filho""",Sao Paulo,Brazil,,,,,2017-08-01,1 August 2017,Pesquisa Veterinaria Brasileira,0100736X,18819,16785150,Journal,37,8,,847-852,,,0,1,all publisherfullgold repository repositoryvor,All Open Access Gold Green,,,
2-s2.0-85035101133,10.1590/s0100-736x2017000800001,,,Portulaca elatior (Portulacaceae) poisoning in cattle,ar,Article,Neto T.S.d.O.,,Universidade Federal de Campina Grande,Campina Grande,Brazil,,,,,2017-08-01,1 August 2017,Pesquisa Veterinaria Brasileira,0100736X,18819,16785150,Journal,37,8,,785-789,,,5,1,all publisherfullgold repository repositoryvor,All Open Access Gold Green,,,
2-s2.0-85035097817,10.1590/s0100-736x2017000800012,,,Development of spinal walking in paraplegic dogs with thoracolumbar spinal fractures/luxations,ar,Article,Araújo B.M.,,Universidade Federal Rural de Pernambuco,Recife,Brazil,,,,,2017-08-01,1 August 2017,Pesquisa Veterinaria Brasileira,0100736X,18819,16785150,Journal,37,8,,853-858,,,0,1,all publisherfullgold repository repositoryvor,All Open Access Gold Green,,,
2-s2.0-85035095913,10.1590/s0100-736x2017000800018,,,Ruminal parameters and nitrogen balance in fed cattle feeding with cassava root silage,ar,Article,Vieira P.,,Universidade Estadual do Sudoeste da Bahia,Vitoria da Conquista,Brazil,,,,,2017-08-01,1 August 2017,Pesquisa Veterinaria Brasileira,0100736X,18819,16785150,Journal,37,8,,883-890,,,7,1,all publisherfullgold repository repositoryvor,All Open Access Gold Green,,,
2-s2.0-85035095795,10.1590/s0100-736x2017000800002,,,"Clinical, blood gas and biochemical profile of diarrheic dairy calves fed starter concentrate containing citrus pulp as a replacement for corn",ar,Article,Soares M.,,Universidade de São Paulo,Sao Paulo,Brazil,,,,,2017-08-01,1 August 2017,Pesquisa Veterinaria Brasileira,0100736X,18819,16785150,Journal,37,8,,790-796,,,1,1,all publisherfullgold repository repositoryvor repositoryam,All Open Access Gold Green,,,
2-s2.0-85035095530,10.1590/s0100-736x2017000800005,,,Transmissibility of small ruminants lentivirus in kids by experimentally infected semen,ar,Article,Hasegawa M.Y.,,Universidade de São Paulo,Sao Paulo,Brazil,,,,,2017-08-01,1 August 2017,Pesquisa Veterinaria Brasileira,0100736X,18819,16785150,Journal,37,8,,805-812,,,4,1,all publisherfullgold repository repositoryvor,All Open Access Gold Green,,,
2-s2.0-85035094036,10.1590/s0100-736x2017000800010,,,Acute and chronic toxicity and antimicrobial activity of the extract of Stryphnodendron adstringens (Mart.) Coville,ar,Article,Almeida A.C.,,Universidade Federal de Minas Gerais,Belo Horizonte,Brazil,,,,,2017-08-01,1 August 2017,Pesquisa Veterinaria Brasileira,0100736X,18819,16785150,Journal,37,8,,840-846,,,14,1,all publisherfullgold repository repositoryvor,All Open Access Gold Green,,,
2-s2.0-85035090908,10.1590/s0100-736x2017000800015,,,Modified Schirmer tear test and rebound tonometry in bluefronted Amazon parrot (Amazona aestiva),ar,Article,Falcão M.S.A.,,Universidade de Brasília,Brasília,Brazil,,,,,2017-08-01,1 August 2017,Pesquisa Veterinaria Brasileira,0100736X,18819,16785150,Journal,37,8,,871-873,,,9,1,all publisherfullgold repository repositoryvor repositoryam,All Open Access Gold Green,,,
2-s2.0-85035082040,10.1590/s0100-736x2017000800006,,,"Neospora caninum IgG antibody research and evaluation of the risk factors associated to the infection in ovine, State of Sergipe, Brazil",ar,Article,Rizzo H.,,Universidade Federal Rural de Pernambuco,Recife,Brazil,,,,,2017-08-01,1 August 2017,Pesquisa Veterinaria Brasileira,0100736X,18819,16785150,Journal,37,8,,813-819,,,7,1,all publisherfullgold repository repositoryvor,All Open Access Gold Green,,,
2-s2.0-85031818751,,,,Lipids: Classification and main physiological functions,ar,Article,Santana M.,,Pós Doutora em Zootecnia,Goiania,Brazil,,,,,2017-08-01,August 2017,Revista Electronica De Veterinaria,,19900193646,16957504,Journal,18,8,,,,,0,0,,,,,
2-s2.0-85031817221,,,,Ingestive behavior in dairy goats supplemented with multinutritional blocks associated with concentrate levels,ar,Article,Ramos J.,,Empresa Estadual de Pesquisa Agropecuária da Paraíba,Joao Pessoa,Brazil,,,,,2017-08-01,August 2017,Revista Electronica De Veterinaria,,19900193646,16957504,Journal,18,8,,,,,0,0,,,,,
2-s2.0-85031798927,,,,Growth and Productivity of Nopalea Cochenillifera in function of different planting densities in cultivation with and without weeding,ar,Article,Ramos J.,,Empresa Estadual de Pesquisa Agropecuária da Paraíba,Joao Pessoa,Brazil,,,,,2017-08-01,August 2017,Revista Electronica De Veterinaria,,19900193646,16957504,Journal,18,8,,,,,9,0,,,,,
2-s2.0-85031792734,,,,Biomedical performance of grass fed goats with multinutritional blocks,ar,Article,Ezequiel F.,,Universidade Estadual da Paraiba,Campina Grande,Brazil,,,,,2017-08-01,August 2017,Revista Electronica De Veterinaria,,19900193646,16957504,Journal,18,8,,,,,0,0,,,,,
2-s2.0-85031768957,,,,Substrate and level of the water column in the reproduction of Betta splendens,ar,Article,De Lima B.,,Universidade Federal do Piauí,Teresina,Brazil,,,,,2017-08-01,August 2017,Revista Electronica De Veterinaria,,19900193646,16957504,Journal,18,8,,,,,0,0,,,,,
2-s2.0-85030123873,,,28761186,Blood lactate concentration in diabetic dogs,ar,Article,Claus P.,,Universidade de São Paulo,Sao Paulo,Brazil,,,,,2017-08-01,August 2017,Canadian Veterinary Journal,00085286,17727,,Journal,58,8,,817-822,,,7,0,,,,,
2-s2.0-85029408280,10.1016/j.rvsc.2017.09.001,S0034528816305185,28918235,"Identification of bluetongue virus serotypes 1, 4, and 17 co-infections in sheep flocks during outbreaks in Brazil",ar,Article,Guimarães L.,,Universidade Federal do Rio Grande do Sul,Porto Alegre,Brazil,,,,,2017-08-01,August 2017,Research in Veterinary Science,00345288,18851,15322661,Journal,113,,,87-93,,,18,0,,,,,
2-s2.0-85029171114,10.1136/vetreccr-2017-000492,,,An infectious bronchitis virus Mass-like strain from Brazil causing kidney damage and tropism in a broiler flock,ar,Article,Fernando F.S.,,"Universidade Estadual Paulista ""Júlio de Mesquita Filho""",Sao Paulo,Brazil,,,,,2017-08-01,1 August 2017,Veterinary Record Case Reports,,21100466246,20526121,Journal,5,3,e000492,,,,1,0,,,,,
2-s2.0-85028908799,10.1016/j.jcpa.2017.07.008,S0021997517301457,28942300,Annular Stenotic Oesophageal Squamous Cell Carcinoma in Cattle Exposed Naturally to Bracken Fern (Pteridium arachnoideum),ar,Article,Faccin T.C.,,Universidade Federal de Santa Maria,Santa Maria,Brazil,,,,,2017-08-01,August-October 2017,Journal of Comparative Pathology,00219975,29580,15323129,Journal,157,2-3,,174-180,,,5,0,,,,,
2-s2.0-85026912657,,,,Answering of cultivars from coriander to different spaces as the presence and absence of thinning,ar,Article,Crispim J.F.,,Universidade Federal Rural do Semi-Árido,Mossoro,Brazil,,,,,2017-08-01,August 2017,Bulgarian Journal of Agricultural Science,13100351,19400157213,,Journal,23,4,,567-571,,,0,0,,,,,
2-s2.0-85021827132,10.1016/j.anireprosci.2017.06.005,S0378432016307618,28662881,Sperm membrane proteins associated with the boar semen cryopreservation,ar,Article,Guimarães D.B.,,Universidade Estadual do Ceará,Fortaleza,Brazil,,,,,2017-08-01,August 2017,Animal Reproduction Science,03784320,36360,,Journal,183,,,27-38,,,36,0,,,,,
2-s2.0-85021768362,10.1111/jvp.12393,,28092108,Pharmacokinetics and pharmacodynamics of the injectable formulation of methadone hydrochloride and methadone in lipid nanocarriers administered orally to horses,ar,Article,Crosignani N.,,"Universidade Estadual Paulista ""Júlio de Mesquita Filho""",Sao Paulo,Brazil,,,,,2017-08-01,August 2017,Journal of Veterinary Pharmacology and Therapeutics,01407783,23129,13652885,Journal,40,4,,398-405,,,9,0,,,,,
2-s2.0-85021766708,10.1007/s00436-017-5539-2,,28667520,"Structure of parasites community in Chaetobranchopsis orbicularis (Cichlidae), a host from the Amazon River system in northern Brazil",ar,Article,Tavares-Dias M.,,Empresa Brasileira de Pesquisa Agropecuária - Embrapa,Brasilia,Brazil,,,,,2017-08-01,1 August 2017,Parasitology Research,09320113,20340,14321955,Journal,116,8,,2313-2319,,,10,0,,,,,
2-s2.0-85021736764,10.1016/j.cimid.2017.06.004,S0147957117300450,28750863,Microscopic and molecular identification of hemotropic mycoplasmas in South American coatis (Nasua nasua),ar,Article,Cubilla M.P.,,Universidade Federal do Parana;Bela Vista Biological Sanctuary,Curitiba;Foz do Iguacu,Brazil;Brazil,,,,,2017-08-01,August 2017,Comparative Immunology Microbiology and Infectious Diseases,01479571,19660,18781667,Journal,53,,,19-25,,,14,0,,,,,
2-s2.0-85021287553,10.1016/j.livsci.2017.06.006,S1871141317301889,,"Effects of colostrum, and protein and energy supplementation on survival and performance of low-birth-weight piglets",ar,Article,Moreira L.P.,,Universidade Federal do Rio Grande do Sul,Porto Alegre,Brazil,,,,,2017-08-01,August 2017,Livestock Science,18711413,3300147807,,Journal,202,,,188-193,,,24,0,,,,,
2-s2.0-85021141141,10.1016/j.smallrumres.2017.06.001,S0921448817301608,,Effects of Spigelia anthelmia decoction on sheep gastrointestinal nematodes,ar,Article,Ribeiro W.L.C.,,Universidade Estadual do Ceará,Fortaleza,Brazil,,,,,2017-08-01,August 2017,Small Ruminant Research,09214488,92166,,Journal,153,,,146-152,,,15,0,,,,,
2-s2.0-85021126592,10.1016/j.vetmic.2017.06.008,S0378113517305102,28757016,"Characterization of Corynebacterium diphtheriae, C. confusum and C. amycolatum isolated from sows with genitourinary infection",ar,Article,Poor A.P.,,Universidade de São Paulo,Sao Paulo,Brazil,,,,,2017-08-01,August 2017,Veterinary Microbiology,03781135,20882,18732542,Journal,207,,,149-152,,,14,0,,,,,
2-s2.0-85021112150,10.1016/j.smallrumres.2017.06.015,S0921448817301748,,"Differential diagnosis of infectious reproductive diseases in sheep flocks of Mato Grosso State, Brazil",ar,Article,Eckstein C.,,Universidade Federal de Mato Grosso,Cuiaba,Brazil,,,,,2017-08-01,August 2017,Small Ruminant Research,09214488,92166,,Journal,153,,,158-162,,,3,0,,,,,
2-s2.0-85021111666,10.1016/j.livsci.2017.06.007,S1871141317301890,,"Effect of starch level in supplement with or without oil source on diet and apparent digestibility, rumen fermentation and microbial population of Nellore steers grazing tropical grass",ar,Article,Neto A.J.,,"Universidade Estadual Paulista ""Júlio de Mesquita Filho""",Sao Paulo,Brazil,,,,,2017-08-01,August 2017,Livestock Science,18711413,3300147807,,Journal,202,,,171-179,,,10,2,all repository repositoryvor,All Open Access Green,,,
2-s2.0-85021054998,10.1007/s00436-017-5531-x,,28638980,"First report of typical Brazilian Toxoplasma gondii genotypes from isolates of free-range chickens (Gallus gallus domesticus) circulating in the state of Paraíba, Northeast Brazil",cp,Conference Paper,Feitosa T.F.,,Universidade Federal de Campina Grande;Instituto Federal de Educação Ciência e Tecnologia da Paraíba – IFPB,Campina Grande;Joao Pessoa,Brazil;Brazil,,,,,2017-08-01,1 August 2017,Parasitology Research,09320113,20340,14321955,Journal,116,8,,2265-2270,,,17,0,,,,,
