eid,doi,pii,pubmed_id,title,subtype,subtypeDescription,creator,afid,affilname,affiliation_city,affiliation_country,author_count,author_names,author_ids,author_afids,coverDate,coverDisplayDate,publicationName,issn,source_id,eIssn,aggregationType,volume,issueIdentifier,article_number,pageRange,description,authkeywords,citedby_count,openaccess,freetoread,freetoreadLabel,fund_acr,fund_no,fund_sponsor
2-s2.0-85039417470,10.1186/s13071-017-2563-0,,29282130,What does not kill it makes it weaker: Effects of sub-lethal concentrations of ivermectin on the locomotor activity of Anopheles aquasalis,ar,Article,Sampaio V.D.S.,,Universidade do Estado do Amazonas;Fundação de Medicina Tropical Dr. Heitor Vieira Dourado;Fundação de Vigilância em Saúde do Amazonas,Manaus;Manaus;Manaus,Brazil;Brazil;Brazil,,,,,2017-12-28,28 December 2017,Parasites and Vectors,,17500154721,17563305,Journal,10,1,623,,,,16,1,all publisherfullgold repository repositoryvor,All Open Access Gold Green,,,
2-s2.0-84951872334,10.1080/09712119.2015.1125354,,,"Addition of increasing doses of ricinoleic acid from castor oil (Ricinus communis L.) in horse diets: Intake, digestibility, glucose and insulin dynamic",ar,Article,Gandra J.,,Universidade Federal da Grande Dourados,Dourados,Brazil,,,,,2017-12-23,23 December 2017,Journal of Applied Animal Research,09712119,22533,09741844,Journal,45,1,,71-75,,,5,1,all publisherhybridgold,All Open Access Hybrid Gold,,,
2-s2.0-85039039498,10.1186/s13071-017-2576-8,,29268793,Selection strategy of phage-displayed immunogens based on an in vitro evaluation of the Th1 response of PBMCs and their potential use as a vaccine against Leishmania infantum infection,ar,Article,Ramos F.F.,,Universidade Federal de Minas Gerais,Belo Horizonte,Brazil,,,,,2017-12-21,21 December 2017,Parasites and Vectors,,17500154721,17563305,Journal,10,1,617,,,,16,1,all publisherfullgold repository repositoryvor,All Open Access Gold Green,,,
2-s2.0-85035129076,10.1016/j.vaccine.2017.11.006,S0264410X17315487,29150209,Exploring the relationship between polio type 2 serum neutralizing antibodies and intestinal immunity using data from two randomized controlled trials of new bOPV-IPV immunization schedules,ar,Article,Bandyopadhyay A.S.,,Bill & Melinda Gates Foundation,Seattle,United States,,,,,2017-12-19,19 December 2017,Vaccine,0264410X,21376,18732518,Journal,35,52,,7283-7291,,,12,1,all publisherhybridgold repository repositoryvor,All Open Access Hybrid Gold Green,,,
2-s2.0-85034735995,10.1016/j.vaccine.2017.11.011,S0264410X17315700,29174677,In vivo electroporation enhances vaccine-mediated therapeutic control of human papilloma virus-associated tumors by the activation of multifunctional and effector memory CD8+ T cells,ar,Article,Sales N.S.,,Universidade de São Paulo,Sao Paulo,Brazil,,,,,2017-12-19,19 December 2017,Vaccine,0264410X,21376,18732518,Journal,35,52,,7240-7249,,,15,0,,,,,
2-s2.0-85034581924,10.1016/j.vaccine.2017.11.007,S0264410X17315499,29146379,LT adjuvant modulates epitope specificity and improves the efficacy of murine antibodies elicited by sublingual vaccination with the N-terminal domain of Streptococcus mutans P1,ar,Article,Batista M.T.,,Universidade de São Paulo;Arizona State University,Sao Paulo;Tempe,Brazil;United States,,,,,2017-12-19,19 December 2017,Vaccine,0264410X,21376,18732518,Journal,35,52,,7273-7282,,,17,0,,,,,
2-s2.0-85033599056,10.1016/j.vaccine.2017.11.003,S0264410X17315451,29137821,Equination (inoculation of horsepox): An early alternative to vaccination (inoculation of cowpox) and the potential role of horsepox virus in the origin of the smallpox vaccine,re,Review,Esparza J.,,University of Maryland School of Medicine,Baltimore,United States,,,,,2017-12-19,19 December 2017,Vaccine,0264410X,21376,18732518,Journal,35,52,,7222-7230,,,60,1,all publisherhybridgold repository repositoryvor,All Open Access Hybrid Gold Green,,,
2-s2.0-85038080229,10.1186/s13071-017-2543-4,,29246237,Zika virus can be venereally transmitted between Aedes aegypti mosquitoes,ar,Article,Campos S.S.,,Fundacao Oswaldo Cruz,Rio de Janeiro,Brazil,,,,,2017-12-15,15 December 2017,Parasites and Vectors,,17500154721,17563305,Journal,10,1,605,,,,27,1,all publisherfullgold repository repositoryvor,All Open Access Gold Green,,,
2-s2.0-85034115953,10.1016/j.vetpar.2017.11.003,S0304401717304740,29173548,Haemonchus contortus β-tubulin isotype 1 gene F200Y and F167Y SNPs are both selected by ivermectin and oxfendazole treatments with differing impacts on anthelmintic resistance,ar,Article,Santos J.M.L.d.,,Universidade Estadual do Ceará,Fortaleza,Brazil,,,,,2017-12-15,15 December 2017,Veterinary Parasitology,03044017,19537,18732550,Journal,248,,,90-95,,,16,0,,,,,
2-s2.0-85033712680,10.1016/j.vaccine.2017.10.043,S0264410X17314512,29100708,"Safety and immune response after two-dose meningococcal C conjugate immunization in HIV-infected children and adolescents in Rio de Janeiro, Brazil",ar,Article,Frota A.C.C.,,Universidade Federal do Rio de Janeiro,Rio de Janeiro,Brazil,,,,,2017-12-15,15 December 2017,Vaccine,0264410X,21376,18732518,Journal,35,50,,7042-7048,,,7,0,,,,,
2-s2.0-85033228966,10.1016/j.vetpar.2017.10.023,S0304401717304703,29173546,Season-long control of flea and tick infestations in a population of cats in the Aeolian archipelago using a collar containing 10% imidacloprid and 4.5% flumethrin,ar,Article,Otranto D.,,Università degli studi di Bari Aldo Moro,Bari,Italy,,,,,2017-12-15,15 December 2017,Veterinary Parasitology,03044017,19537,18732550,Journal,248,,,80-83,,,16,1,all publisherhybridgold repository repositoryvor,All Open Access Hybrid Gold Green,,,
2-s2.0-85032720741,10.1016/j.vetpar.2017.10.020,S0304401717304673,29173543,Canine visceral leishmaniasis follow-up: a new anti-IgG serological test more sensitive than ITS-1 conventional PCR,ar,Article,Faria A.R.,,Universidade Federal de Minas Gerais,Belo Horizonte,Brazil,,,,,2017-12-15,15 December 2017,Veterinary Parasitology,03044017,19537,18732550,Journal,248,,,62-67,,,11,1,all publisherhybridgold,All Open Access Hybrid Gold,,,
2-s2.0-85032303512,10.1016/j.vetpar.2017.10.008,S0304401717304454,29173534,Canine neutrophils activate effector mechanisms in response to Leishmania infantum,re,Review,Pereira M.,,Instituto de Higiene e Medicina Tropical;Politécnico de Portalegre,Lisbon;Portalegre,Portugal;Portugal,,,,,2017-12-15,15 December 2017,Veterinary Parasitology,03044017,19537,18732550,Journal,248,,,10-20,,,18,2,all repository repositoryvor,All Open Access Green,,,
2-s2.0-85031776775,10.1016/j.vaccine.2017.09.065,S0264410X1731318X,29056425,"Ethics, pregnancy, and ZIKV vaccine research & development",no,Note,Faden R.R.,,Johns Hopkins University,Baltimore,United States,,,,,2017-12-14,14 December 2017,Vaccine,0264410X,21376,18732518,Journal,35,49,,6819-6822,,,15,2,all repository repositoryam,All Open Access Green,,,
2-s2.0-85045855326,10.21708/avb.2017.11.4.6965,,,Different dissociative anesthesia protocols for coatis (Nasua nasua),ar,Article,Martini A.d.C.,,Universidade Federal de Mato Grosso,Cuiaba,Brazil,,,,,2017-12-11,11 December 2017,Acta Veterinaria Brasilica,,21100202112,19815484,Journal,11,4,,200-204,,,0,1,all publisherfullgold repository repositoryam,All Open Access Gold Green,,,
2-s2.0-85045854203,10.21708/avb.2017.11.4.7184,,,Necrotizing Soft Tissue Infection in Dog – Case Report,ar,Article,Villarreal Laguna A.,,Universidade Federal Rural do Rio de Janeiro,Seropedica,Brazil,,,,,2017-12-11,11 December 2017,Acta Veterinaria Brasilica,,21100202112,19815484,Journal,11,4,,191-195,,,0,1,all publisherfullgold repository repositoryam,All Open Access Gold Green,,,
2-s2.0-85045852680,10.21708/avb.2017.11.4.7167,,,"Histopathological diagnosis of eyelid tumor in Moustached wren (Pheugopedius genibarbis SWAINSON, 1838) (Passeriforme, Troglodytidae). A case report.",ar,Article,de Araújo Santos F.,,Universidade Federal do Acre,Rio Branco,Brazil,,,,,2017-12-11,11 December 2017,Acta Veterinaria Brasilica,,21100202112,19815484,Journal,11,4,,187-190,,,1,1,all publisherfullgold repository repositoryam,All Open Access Gold Green,,,
2-s2.0-85045851781,10.21708/avb.2017.11.4.7258,,,Anesthesia in a giant armadillo (Priodontes maximus) for femoral fracture fixation,ar,Article,Stocco M.B.,,Universidade Federal de Mato Grosso,Cuiaba,Brazil,,,,,2017-12-11,11 December 2017,Acta Veterinaria Brasilica,,21100202112,19815484,Journal,11,4,,196-199,,,2,1,all publisherfullgold repository repositoryam,All Open Access Gold Green,,,
2-s2.0-85045850080,10.21708/avb.2017.11.4.7266,,,"Etiology and in vitro antimicrobial susceptibility profile of strains isolated from bovine mastitis in dairy herds from the midwest region of Santa Catarina state, Brazil",ar,Article,Valmorbida M.K.,,"Instituto Federal De Educação, Ciência E Tecnologia Catarinense - IFC",Blumenau,Brazil,,,,,2017-12-11,11 December 2017,Acta Veterinaria Brasilica,,21100202112,19815484,Journal,11,4,,219-225,,,5,1,all publisherfullgold repository repositoryam,All Open Access Gold Green,,,
2-s2.0-85045847419,10.21708/avb.2017.11.4.7333,,,The profiles of cat and dog tutors participating in a pet neutering campaign,ar,Article,do Nascimento Silva F.A.,,Universidade Federal do Piauí,Teresina,Brazil,,,,,2017-12-11,11 December 2017,Acta Veterinaria Brasilica,,21100202112,19815484,Journal,11,4,,184-186,,,3,1,all publisherfullgold,All Open Access Gold,,,
2-s2.0-85045844427,10.21708/avb.2017.11.4.7299,,,"Morphology and biometry of the thymus in Gallus gallus domesticus (Linnaeus, 1758) from the isa brow lineage",ar,Article,Pereira C.C.H.,,Titular da Universidade de Rio Verde,,Portugal,,,,,2017-12-11,11 December 2017,Acta Veterinaria Brasilica,,21100202112,19815484,Journal,11,4,,235-240,,,2,1,all publisherfullgold repository repositoryam,All Open Access Gold Green,,,
2-s2.0-85045838615,10.21708/avb.2017.11.4.7261,,,In vitro nematophagous activity of predatory fungi on infective larvae of Strongyloides papillosus,ar,Article,Campos A.K.,,Universidade Federal de Vicosa,Vicosa,Brazil,,,,,2017-12-11,11 December 2017,Acta Veterinaria Brasilica,,21100202112,19815484,Journal,11,4,,213-218,,,4,1,all publisherfullgold repository repositoryam,All Open Access Gold Green,,,
2-s2.0-85045838608,10.21708/avb.2017.11.4.7122,,,Electrocardiographic evaluation in pregnant mares and neonate foals of Paint Horse breed,ar,Article,Alfonso A.,,"Universidade Estadual Paulista ""Júlio de Mesquita Filho""",Sao Paulo,Brazil,,,,,2017-12-11,11 December 2017,Acta Veterinaria Brasilica,,21100202112,19815484,Journal,11,4,,205-212,,,1,1,all publisherfullgold repository repositoryam,All Open Access Gold Green,,,
2-s2.0-85045835598,10.21708/avb.2017.11.4.7274,,,Effect of gallium arsenide low-level laser therapy on the inflammatory phase of skin wound healing in rats,ar,Article,Carvalho A.d.M.,,Universidade Federal de Minas Gerais,Belo Horizonte,Brazil,,,,,2017-12-11,11 December 2017,Acta Veterinaria Brasilica,,21100202112,19815484,Journal,11,4,,226-230,,,1,1,all publisherfullgold repository repositoryam,All Open Access Gold Green,,,
2-s2.0-85045830136,10.21708/avb.2017.11.4.7279,,,Comparison of the cutaneous response of the comparative cervical tuberculin (CCT) test with different reading times in buffaloes,ar,Article,de Moraes Pereira H.,,Universidade Estadual do Maranhão,Sao Luis,Brazil,,,,,2017-12-11,11 December 2017,Acta Veterinaria Brasilica,,21100202112,19815484,Journal,11,4,,231-234,,,0,1,all publisherfullgold repository repositoryam,All Open Access Gold Green,,,
2-s2.0-85041728034,10.4314/ovj.v7i4.10,,,Medical infrared imaging and orthostatic analysis to determine lameness in the pelvic limbs of dogs,ar,Article,Garcia E.F.V.,,,,,,,,,2017-12-08,8 December 2017,Open Veterinary Journal,22264485,21100438194,22186050,Journal,7,4,,342-348,,,17,1,all publisherfullgold repository repositoryvor repositoryam,All Open Access Gold Green,,,
2-s2.0-85037343565,10.1186/s12917-017-1304-0,,29207991,"Investigation of c-KIT and Ki67 expression in normal, preneoplastic and neoplastic canine prostate",ar,Article,Fonseca-Alves C.E.,,"Universidade Estadual Paulista ""Júlio de Mesquita Filho""",Sao Paulo,Brazil,,,,,2017-12-06,6 December 2017,BMC Veterinary Research,,4300151401,17466148,Journal,13,1,380,,,,25,1,all publisherfullgold repository repositoryvor,All Open Access Gold Green,,,
2-s2.0-85031819799,10.1016/j.vaccine.2017.10.026,S0264410X17314226,29056423,Effect of recombinant glutathione S-transferase as vaccine antigen against Rhipicephalus appendiculatus and Rhipicephalus sanguineus infestation,ar,Article,Sabadin G.A.,,Universidade Federal do Rio Grande do Sul,Porto Alegre,Brazil,,,,,2017-12-04,4 December 2017,Vaccine,0264410X,21376,18732518,Journal,35,48,,6649-6656,,,37,1,all publisherhybridgold repository repositoryvor,All Open Access Hybrid Gold Green,,,
2-s2.0-85050905398,10.2527/tas2017.0056,,,The comparison of the lactation and milk yield and composition of selected breeds of sheep and goats,ar,Article,Ferro M.M.,,Texas A&M University;Universidade Federal de Mato Grosso,College Station;Cuiaba,United States;Brazil,,,,,2017-12-01,1 December 2017,Translational Animal Science,,21100871108,25732102,Journal,1,4,,498-506,,,59,1,all publisherfullgold repository repositoryvor,All Open Access Gold Green,,,
2-s2.0-85045530864,10.3390/vetsci4040067,,,Urinary fractional excretion of phosphorus in dogs with spontaneous chronic kidney disease,ar,Article,Martorelli C.,,Universidade de São Paulo,Sao Paulo,Brazil,,,,,2017-12-01,1 December 2017,Veterinary Sciences,,21100856030,23067381,Journal,4,4,67,,,,9,1,all publisherfullgold repository repositoryvor repositoryam,All Open Access Gold Green,,,
2-s2.0-85045168597,,,,Determination of the optimal conditions of an apitoxin extractor in bees (Apis mellifera),ar,Article,Guatemal Sánchez A.,,Pontificia Universidad Católica del Ecuador,Quito,Ecuador,,,,,2017-12-01,December 2017,Revista Electronica De Veterinaria,,19900193646,16957504,Journal,18,12,,,,,1,0,,,,,
2-s2.0-85044395557,,,,Determinación de las condiciones óptimas de un equipo extractor de apitoxina en abejas (Apis mellifera),ar,Article,Guatemal Sánchez A.,,Pontificia Universidad Católica del Ecuador,Quito,Ecuador,,,,,2017-12-01,December 2017,Revista Electronica De Veterinaria,,19900193646,16957504,Journal,18,12,,,,,3,0,,,,,
2-s2.0-85044393246,,,,The impact of maternal nutrition in the growth and development of ruminants,ar,Article,Simioni T.A.,,"Universidade Estadual Paulista ""Júlio de Mesquita Filho""",Sao Paulo,Brazil,,,,,2017-12-01,December 2017,Revista Electronica De Veterinaria,,19900193646,16957504,Journal,18,12,,,,,0,0,,,,,
2-s2.0-85044392511,,,,Model conceptual of the integration system crop-corn cattle,ar,Article,Pereira J.R.,,Universidade Estadual do Oeste do Paraná;Pós-graduação em Zootecnia (PPZ),Cascavel;,Brazil;Brazil,,,,,2017-12-01,December 2017,Revista Electronica De Veterinaria,,19900193646,16957504,Journal,18,12,,,,,1,0,,,,,
2-s2.0-85044391400,,,,Relationship between technicians and milk farmers in the south of Brazil,ar,Article,Ollé M.D.A.,,Universidade Federal de Pelotas,Pelotas,Brazil,,,,,2017-12-01,December 2017,Revista Electronica De Veterinaria,,19900193646,16957504,Journal,18,12,,,,,1,0,,,,,
2-s2.0-85044389506,,,,"Evaluation of physiological parameters of Anglonubian goats in Teresina, Piauí",ar,Article,Barros C.P.,,Universidade Federal do Piauícidade de Teresina,,Brazil,,,,,2017-12-01,December 2017,Revista Electronica De Veterinaria,,19900193646,16957504,Journal,18,12,,,,,0,0,,,,,
2-s2.0-85044385569,,,,Spermatogenesis in sheep and factors that may interfere with this process,ar,Article,Araújo M.S.,,Universidade Federal do Piauí,Teresina,Brazil,,,,,2017-12-01,December 2017,Revista Electronica De Veterinaria,,19900193646,16957504,Journal,18,12,,,,,1,0,,,,,
2-s2.0-85044380709,,,,Management of corneal ulcers in domestic animals: Literature review,ar,Article,Trujillo Piso D.,,Universidad Cooperativa de Colombia,Medellin,Colombia,,,,,2017-12-01,December 2017,Revista Electronica De Veterinaria,,19900193646,16957504,Journal,18,12,,,,,1,0,,,,,
2-s2.0-85044379848,,,,Cattle behavioral characteristics: Influences of domestication and human-animal interaction,ar,Article,Fernandes T.A.,,Universidade Federal de Pelotas,Pelotas,Brazil,,,,,2017-12-01,December 2017,Revista Electronica De Veterinaria,,19900193646,16957504,Journal,18,12,,,,,4,0,,,,,
2-s2.0-85044379721,,,,"Etiologic factors affecting milk quality, Milk unstable and not acid (LINA)",ar,Article,Rosa P.P.,,Universidade Federal de Pelotas,Pelotas,Brazil,,,,,2017-12-01,December 2017,Revista Electronica De Veterinaria,,19900193646,16957504,Journal,18,12,,,,,3,0,,,,,
2-s2.0-85044374662,,,,Performance of texel and corriedale lambs kept in end of cycle ryegrass,ar,Article,Menezes L.,,Universidade Estadual do Rio Grande do Sul,Porto Alegre,Brazil,,,,,2017-12-01,December 2017,Revista Electronica De Veterinaria,,19900193646,16957504,Journal,18,12,,,,,0,0,,,,,
2-s2.0-85044374645,,,,Polycystic kidney disease in Persian half-breed cat - Case report,ar,Article,Carvalho L.L.P.,,Universidade Federal do Piauí,Teresina,Brazil,,,,,2017-12-01,December 2017,Revista Electronica De Veterinaria,,19900193646,16957504,Journal,18,12,,,,,0,0,,,,,
2-s2.0-85044373869,,,,Distribution of winter forage yield in single crop and mixed system,ar,Article,Ferreira O.,,Universidade Federal de Pelotas,Pelotas,Brazil,,,,,2017-12-01,December 2017,Revista Electronica De Veterinaria,,19900193646,16957504,Journal,18,12,,,,,1,0,,,,,
2-s2.0-85044371994,,,,Carcass tissue and regional composition of naturalized goats in the Alto Camaquã region - Brazil,ar,Article,Da Silva Martins L.,,Universidade Federal de Pelotas,Pelotas,Brazil,,,,,2017-12-01,December 2017,Revista Electronica De Veterinaria,,19900193646,16957504,Journal,18,12,,,,,0,0,,,,,
2-s2.0-85044371162,,,,Pre-lambing shearing as a management tool to increase the productive efficiency of sheep,ar,Article,Tavares Costa P.,,Universidade Federal de Pelotas,Pelotas,Brazil,,,,,2017-12-01,December 2017,Revista Electronica De Veterinaria,,19900193646,16957504,Journal,18,12,,,,,0,0,,,,,
2-s2.0-85044370810,,,,Effect of humic substances during the long fast of laying hens on the Heterophilic / Lymphocyte ratio and Heart Rate Variability as stress indicators,ar,Article,Sanmiguel Plazas R.A.,,Universidad Cooperativa de Colombia,Medellin,Colombia,,,,,2017-12-01,December 2017,Revista Electronica De Veterinaria,,19900193646,16957504,Journal,18,12,,,,,0,0,,,,,
2-s2.0-85044368793,,,,"Characteristics and slaughter yield of lambs castrated, uncastrated and induced to cryptorchidism",ar,Article,Costa P.T.,,Universidade Federal de Pelotas,Pelotas,Brazil,,,,,2017-12-01,December 2017,Revista Electronica De Veterinaria,,19900193646,16957504,Journal,18,12,,,,,0,0,,,,,
2-s2.0-85044365077,,,,Quality physicochemical and microbiological of beef meat in butchers,ar,Article,Oliveira M.S.,,Universidade Federal do Piauí,Teresina,Brazil,,,,,2017-12-01,December 2017,Revista Electronica De Veterinaria,,19900193646,16957504,Journal,18,12,,,,,1,0,,,,,
2-s2.0-85044364941,,,,Use of heterospermic semen in fixed-time artificial insemination of Nelore cows,ar,Article,De Almeida R.G.,,Universidade Federal de Mato Grosso do Sul,Campo Grande,Brazil,,,,,2017-12-01,December 2017,Revista Electronica De Veterinaria,,19900193646,16957504,Journal,18,12,,,,,2,0,,,,,
2-s2.0-85044361718,,,,"Physicochemical, characteristics of low-fat, low-salt fresh lamb sausage",ar,Article,De Azevedo Maia J.,,Universidade Estadual do Norte Fluminense,Campos dos Goitacazes,Brazil,,,,,2017-12-01,December 2017,Revista Electronica De Veterinaria,,19900193646,16957504,Journal,18,12,,,,,1,0,,,,,
2-s2.0-85044359336,,,,Yeast supplementation in cattle feeding,ar,Article,Ollé M.D.A.,,Universidade Federal de Pelotas,Pelotas,Brazil,,,,,2017-12-01,December 2017,Revista Electronica De Veterinaria,,19900193646,16957504,Journal,18,12,,,,,0,0,,,,,
2-s2.0-85044357228,,,,"Philosophical, axiological, psychosocial and pedagogical proposals for the pedagogical-environmental professional performance in the Agricultural Sciences",ar,Article,Romero M.,,Universidad de Camagüey,Camaguey,Cuba,,,,,2017-12-01,December 2017,Revista Electronica De Veterinaria,,19900193646,16957504,Journal,18,12,,,,,0,0,,,,,
2-s2.0-85044354826,,,,Protected fat on the diet for sheep,ar,Article,Simionatto M.,,Universidade Tecnológica Federal do Paraná,Curitiba,Brazil,,,,,2017-12-01,December 2017,Revista Electronica De Veterinaria,,19900193646,16957504,Journal,18,12,,,,,0,0,,,,,
2-s2.0-85044352458,,,,Characterization of canine population attended in the Municipal Dog Care Center in Guatemala City,ar,Article,Alvarado-Pérez A.M.,,Universidad de San Carlos de Guatemala,San Carlos,Brazil,,,,,2017-12-01,December 2017,Revista Electronica De Veterinaria,,19900193646,16957504,Journal,18,12,,,,,4,0,,,,,
2-s2.0-85044345968,,,,Allometric coefficients of cuts and tissues of goat carcasses slaughtered in different ages,ar,Article,Da Silva Martins L.,,Universidade Federal de Pelotas,Pelotas,Brazil,,,,,2017-12-01,December 2017,Revista Electronica De Veterinaria,,19900193646,16957504,Journal,18,12,,,,,0,0,,,,,
2-s2.0-85044344272,,,,The teaching function in the professional agricultural education: A differentiated approach and the challenges of the pedagogical experience,ar,Article,Ferreira O.G.L.,,Universidade Federal de Pelotas,Pelotas,Brazil,,,,,2017-12-01,December 2017,Revista Electronica De Veterinaria,,19900193646,16957504,Journal,18,12,,,,,0,0,,,,,
2-s2.0-85044343146,,,,Barley and its by-products in animal nutrition - Cevada e seus subprodutos na alimentação animal,ar,Article,Ferro M.M.,,Universidade Federal de Mato Grosso,Cuiaba,Brazil,,,,,2017-12-01,December 2017,Revista Electronica De Veterinaria,,19900193646,16957504,Journal,18,12,,,,,0,0,,,,,
2-s2.0-85044250286,10.1590/S0100-736X2017001200010,,,"Molecular and serological detection of Theileria equi, Babesia caballi and Anaplasma phagocytophilum in horses and ticks in Maranhão, Brazil",ar,Article,Nogueira R.,,Universidade Estadual do Maranhão,Sao Luis,Brazil,,,,,2017-12-01,1 December 2017,Pesquisa Veterinaria Brasileira,0100736X,18819,16785150,Journal,37,12,,1416-1422,,,11,1,all publisherfullgold repository repositoryvor,All Open Access Gold Green,,,
2-s2.0-85044242905,10.1590/S0100-736X2017001200027,,,Radiographic measurements related with the cardiac size in young female Bergamasca sheep,ar,Article,Babicsak V.,,"Universidade Estadual Paulista ""Júlio de Mesquita Filho""",Sao Paulo,Brazil,,,,,2017-12-01,1 December 2017,Pesquisa Veterinaria Brasileira,0100736X,18819,16785150,Journal,37,12,,1526-1530,,,3,1,all publisherfullgold repository repositoryvor repositoryam,All Open Access Gold Green,,,
2-s2.0-85044241615,10.1590/S0100-736X2017001200019,,,Epithelial to mesenchymal transition immunostaining in canine primary mammary tumor and lymph node,ar,Article,Magalhães L.F.,,Universidade Federal de Uberlândia,Uberlandia,Brazil,,,,,2017-12-01,1 December 2017,Pesquisa Veterinaria Brasileira,0100736X,18819,16785150,Journal,37,12,,1479-1482,,,1,1,all publisherfullgold repository repositoryvor,All Open Access Gold Green,,,
2-s2.0-85044235793,10.1590/S0100-736X2017001200015,,,"Dog owners consider homemade diet as adequate, but change the prescribed formulas",ar,Article,Halfen D.P.,,Universidade de São Paulo,Sao Paulo,Brazil,,,,,2017-12-01,1 December 2017,Pesquisa Veterinaria Brasileira,0100736X,18819,16785150,Journal,37,12,,1453-1459,,,6,1,all publisherfullgold repository repositoryvor,All Open Access Gold Green,,,
2-s2.0-85044232093,10.1590/S0100-736X2017001200003,,,MALDI-TOF mass spectrometry identification of Salmonella spp. and Escherichia coli isolated from bovine carcasses,ar,Article,Bier D.,,Universidade Federal de Mato Grosso do Sul;Universidade Catolica Dom Bosco,Campo Grande;Campo Grande,Brazil;Brazil,,,,,2017-12-01,1 December 2017,Pesquisa Veterinaria Brasileira,0100736X,18819,16785150,Journal,37,12,,1373-1379,,,11,1,all publisherfullgold repository repositoryvor repositoryam,All Open Access Gold Green,,,
2-s2.0-85044231353,10.1590/S0100-736X2017001200025,,,Pathological and parasitological characterization of Prosthenorchis elegans in a free-ranging marmoset Callithrix geofroyi from the Brazilian Atlantic Forest,ar,Article,de Oliveira A.R.,,Universidade Vila Velha,Vila Velha,Brazil,,,,,2017-12-01,1 December 2017,Pesquisa Veterinaria Brasileira,0100736X,18819,16785150,Journal,37,12,,1514-1518,,,14,1,all publisherfullgold repository repositoryvor repositoryam,All Open Access Gold Green,,,
2-s2.0-85044223746,10.1590/S0100-736X2017001200026,,,Histochemical and immunohistochemical evaluation of angiogenesis in rabbits (Oryctolagus cuniculus) submitted to skin grafts associated with platelet-rich plasma,ar,Article,Pazzini J.M.,,"Universidade Estadual Paulista ""Júlio de Mesquita Filho""",Sao Paulo,Brazil,,,,,2017-12-01,1 December 2017,Pesquisa Veterinaria Brasileira,0100736X,18819,16785150,Journal,37,12,,1519-1525,,,3,1,all publisherfullgold repository repositoryvor,All Open Access Gold Green,,,
2-s2.0-85044223744,10.1590/S0100-736X2017001200004,,,False-negative reactions to the comparative intradermal tuberculin test for bovine tuberculosis,ar,Article,Rodrigues R.A.,,Universidade Federal de Mato Grosso do Sul,Campo Grande,Brazil,,,,,2017-12-01,1 December 2017,Pesquisa Veterinaria Brasileira,0100736X,18819,16785150,Journal,37,12,,1380-1384,,,4,1,all publisherfullgold repository repositoryvor repositoryam,All Open Access Gold Green,,,
2-s2.0-85044218634,10.1590/S0100-736X2017001200024,,,Pathological aspects of diminazene aceturate toxicosis in american camelids,ar,Article,Seixas J.,,Universidade Federal de Lavras,Lavras,Brazil,,,,,2017-12-01,1 December 2017,Pesquisa Veterinaria Brasileira,0100736X,18819,16785150,Journal,37,12,,1509-1513,,,1,1,all publisherfullgold repository repositoryvor,All Open Access Gold Green,,,
