eid,doi,pii,pubmed_id,title,subtype,subtypeDescription,creator,afid,affilname,affiliation_city,affiliation_country,author_count,author_names,author_ids,author_afids,coverDate,coverDisplayDate,publicationName,issn,source_id,eIssn,aggregationType,volume,issueIdentifier,article_number,pageRange,description,authkeywords,citedby_count,openaccess,freetoread,freetoreadLabel,fund_acr,fund_no,fund_sponsor
2-s2.0-85029716011,10.1590/1678-4162-9258,,,Displacement patterns of beef heifers receiving supplement in Italian ryegrass pasture,ar,Article,Moterle P.,,Universidade Federal de Santa Maria,Santa Maria,Brazil,,,,,2017-01-01,2017,Arquivo Brasileiro De Medicina Veterinaria E Zootecnia,01020935,17672,16784162,Journal,69,4,,1021-1029,,,2,1,all publisherfullgold repository repositoryvor,All Open Access Gold Green,,,
2-s2.0-85029715613,10.1590/1678-4162-9285,,,Reproductive performance of gilts submitted to post-cervical artificial insemination,ar,Article,Ternus E.M.,,Universidade do Estado de Santa Catarina,Florianopolis,Brazil,,,,,2017-01-01,2017,Arquivo Brasileiro De Medicina Veterinaria E Zootecnia,01020935,17672,16784162,Journal,69,4,,777-784,,,6,1,all publisherfullgold repository repositoryvor,All Open Access Gold Green,,,
2-s2.0-85029715167,10.1590/1678-4162-9282,,,Evaluation of quicklime efficiency in inactivating nematode eggs (Strongyloides sp.) parasites of paca (Cuniculus paca) created in captivity,ar,Article,Ribeiro V.M.F.,,Universidade Federal do Acre,Rio Branco,Brazil,,,,,2017-01-01,2017,Arquivo Brasileiro De Medicina Veterinaria E Zootecnia,01020935,17672,16784162,Journal,69,4,,989-996,,,2,0,,,,,
2-s2.0-85029711114,10.1590/1678-4162-9318,,,Cloprostenol administration in the first week postpartum reduces expression of oxytocin receptors in the endometrium in Holstein-Zebu cows,ar,Article,Camargos A.,,Instituto Federal Goiano (IF Goiano),Goias,Brazil,,,,,2017-01-01,2017,Arquivo Brasileiro De Medicina Veterinaria E Zootecnia,01020935,17672,16784162,Journal,69,4,,821-829,,,0,1,all publisherfullgold repository repositoryvor,All Open Access Gold Green,,,
2-s2.0-85029710211,10.1590/1678-4162-9298,,,AB blood group system in neotropical felids and compatibility with domestic cats,ar,Article,Silva T.,,Universidade Federal de Goiás,Goiania,Brazil,,,,,2017-01-01,2017,Arquivo Brasileiro De Medicina Veterinaria E Zootecnia,01020935,17672,16784162,Journal,69,4,,889-895,,,3,1,all publisherfullgold repository repositoryvor,All Open Access Gold Green,,,
2-s2.0-85029709498,10.1590/1678-4162-9074,,,Effect of vitamins added to the ACP-104 extender on the quality of cryopreserved semen of common carp (Cyprinus carpio),ar,Article,Linhares F.R.A.,,Universidade Estadual do Ceará,Fortaleza,Brazil,,,,,2017-01-01,2017,Arquivo Brasileiro De Medicina Veterinaria E Zootecnia,01020935,17672,16784162,Journal,69,4,,980-988,,,4,1,all publisherfullgold repository repositoryvor,All Open Access Gold Green,,,
2-s2.0-85029709313,10.3906/vet-1609-1,,,Effect of phytase on true total tract digestibility of phosphorus in full-fat rice bran determined in pigs by regression method,ar,Article,Lucca W.,,Federal Institute of Rio Grande do Sul,Pelotas,Brazil,,,,,2017-01-01,2017,Turkish Journal of Veterinary and Animal Sciences,13000128,89762,13036181,Journal,41,4,,490-495,,,3,0,,,,,
2-s2.0-85029708695,10.1590/1678-4162-8995,,,Effects of trans surgical fluid therapy over the post surgical packed cell volume in bitches undergoing elective ovariohisterectomy,ar,Article,Druziani J.T.,,Universidade Federal do Parana,Curitiba,Brazil,,,,,2017-01-01,2017,Arquivo Brasileiro De Medicina Veterinaria E Zootecnia,01020935,17672,16784162,Journal,69,4,,921-926,,,0,1,all publisherfullgold repository repositoryvor,All Open Access Gold Green,,,
2-s2.0-85029707216,10.1590/1678-4162-9362,,,"Occurrence of ticks in Tamandua tetradactyla (Linnaeus, 1758) in Caatinga biome, northeastern Brazil",ar,Article,Oliveira G.,,Fundacao Universidade Federal do Vale do Sao Francisco,Petrolina,Brazil,,,,,2017-01-01,2017,Arquivo Brasileiro De Medicina Veterinaria E Zootecnia,01020935,17672,16784162,Journal,69,4,,865-869,,,7,1,all publisherfullgold,All Open Access Gold,,,
2-s2.0-85029706509,10.1590/1678-4162-8434,,,Mechanical analysis of transversal iliac fracture stabilization using dynamic compression plate or screws and PMM in polyurethane bone model,ar,Article,Prada T.C.,,"Universidade Estadual Paulista ""Júlio de Mesquita Filho""",Sao Paulo,Brazil,,,,,2017-01-01,2017,Arquivo Brasileiro De Medicina Veterinaria E Zootecnia,01020935,17672,16784162,Journal,69,4,,901-907,,,0,1,all publisherfullgold repository repositoryvor,All Open Access Gold Green,,,
2-s2.0-85029705829,10.1590/1678-4162-8971,,,Tomographic appearance of calcified intervertebral discs in miniature dachshund,ar,Article,Baraúna D.,,Fundacao Universidade Federal do Vale do Sao Francisco,Petrolina,Brazil,,,,,2017-01-01,2017,Arquivo Brasileiro De Medicina Veterinaria E Zootecnia,01020935,17672,16784162,Journal,69,4,,941-947,,,1,1,all publisherfullgold repository repositoryvor,All Open Access Gold Green,,,
2-s2.0-85029704586,10.1590/1678-4162-8398,,,Development and evaluation of a traction device for reducing long bone fractures in dogs,ar,Article,Tudury E.A.,,Universidade Federal Rural de Pernambuco,Recife,Brazil,,,,,2017-01-01,2017,Arquivo Brasileiro De Medicina Veterinaria E Zootecnia,01020935,17672,16784162,Journal,69,4,,933-940,,,0,1,all publisherfullgold repository repositoryvor,All Open Access Gold Green,,,
2-s2.0-85029704345,10.1590/1678-4162-9260,,,Characterization of virulence and antibiotic profile and agr typing of Staphylococcus aureus from milk of subclinical mastitis bovine in State of Rio de Janeiro,ar,Article,Soares B.S.,,Universidade Federal Rural do Rio de Janeiro,Seropedica,Brazil,,,,,2017-01-01,2017,Arquivo Brasileiro De Medicina Veterinaria E Zootecnia,01020935,17672,16784162,Journal,69,4,,843-850,,,9,1,all publisherfullgold repository repositoryvor,All Open Access Gold Green,,,
2-s2.0-85029703442,10.1590/1678-4162-9117,,,Esophageal stricture in two female dogs after ovariohysterectomy: Case report,ar,Article,Luciani M.,,Universidade do Estado de Santa Catarina,Florianopolis,Brazil,,,,,2017-01-01,2017,Arquivo Brasileiro De Medicina Veterinaria E Zootecnia,01020935,17672,16784162,Journal,69,4,,908-914,,,0,1,all publisherfullgold repository repositoryvor,All Open Access Gold Green,,,
2-s2.0-85029701039,10.1590/1678-4162-9194,,,Economic-financial analysis of cow-calf systems: Multiple case studies,ar,Article,Garcia F.Z.,,Universidade Federal Rural do Rio de Janeiro,Seropedica,Brazil,,,,,2017-01-01,2017,Arquivo Brasileiro De Medicina Veterinaria E Zootecnia,01020935,17672,16784162,Journal,69,4,,1030-1038,,,3,1,all publisherfullgold repository repositoryvor,All Open Access Gold Green,,,
2-s2.0-85029700773,10.1590/1678-4162-9091,,,Osteochondral autograft transfer for treatment of osteochondritis dissecans of the femoral condyle in a dog,ar,Article,Paes F.,,Universidade de São Paulo,Sao Paulo,Brazil,,,,,2017-01-01,2017,Arquivo Brasileiro De Medicina Veterinaria E Zootecnia,01020935,17672,16784162,Journal,69,4,,927-932,,,0,1,all publisherfullgold repository repositoryvor,All Open Access Gold Green,,,
2-s2.0-85029699942,10.1590/1678-4162-9164,,,Biomechanics and dimensional evaluation of the suture based on chitosan,ar,Article,Alves A.P.,,Universidade Federal de Campina Grande,Campina Grande,Brazil,,,,,2017-01-01,2017,Arquivo Brasileiro De Medicina Veterinaria E Zootecnia,01020935,17672,16784162,Journal,69,4,,896-900,,,4,1,all publisherfullgold,All Open Access Gold,,,
2-s2.0-85029698540,10.1590/1678-4162-9237,,,Effects of parenteral over-supplementation of cooper and zinc on immune response of Nellore cows,ar,Article,Silva J.S.,,Universidade de São Paulo,Sao Paulo,Brazil,,,,,2017-01-01,2017,Arquivo Brasileiro De Medicina Veterinaria E Zootecnia,01020935,17672,16784162,Journal,69,4,,870-876,,,0,1,all publisherfullgold repository repositoryvor,All Open Access Gold Green,,,
2-s2.0-85029698066,10.1590/1678-4162-9338,,,Testicular morphology and dynamic in adult agoutis (Dasyprocta prymnolopha),ar,Article,Menezes D.J.A.,,Universidade Federal do Rio Grande do Norte,Natal,Brazil,,,,,2017-01-01,2017,Arquivo Brasileiro De Medicina Veterinaria E Zootecnia,01020935,17672,16784162,Journal,69,4,,997-1005,,,4,1,all publisherfullgold repository repositoryvor,All Open Access Gold Green,,,
2-s2.0-85029697609,10.1590/1678-4162-9155,,,Response of three digital anesthetic technics in horses with forelimb hoof lameness,ar,Article,Dau S.L.,,Universidade Federal de Santa Maria,Santa Maria,Brazil,,,,,2017-01-01,2017,Arquivo Brasileiro De Medicina Veterinaria E Zootecnia,01020935,17672,16784162,Journal,69,4,,793-801,,,1,1,all publisherfullgold repository repositoryvor,All Open Access Gold Green,,,
2-s2.0-85029696700,10.1590/1678-4162-9034,,,Tiller density and tillering on Brachiaria brizantha cv. Marandu pastures inoculated with Azospirillum brasilense,ar,Article,Pedreira B.C.,,Empresa Brasileira de Pesquisa Agropecuária - Embrapa,Brasilia,Brazil,,,,,2017-01-01,2017,Arquivo Brasileiro De Medicina Veterinaria E Zootecnia,01020935,17672,16784162,Journal,69,4,,1039-1046,,,17,1,all publisherfullgold repository repositoryvor,All Open Access Gold Green,,,
2-s2.0-85029695786,10.1590/1678-4162-8361,,,Tenorrhaphy in horses: Comparison of the mechanical properties of two different suture patterns and suture materials,ar,Article,Corrêa R.,,Universidade de São Paulo,Sao Paulo,Brazil,,,,,2017-01-01,2017,Arquivo Brasileiro De Medicina Veterinaria E Zootecnia,01020935,17672,16784162,Journal,69,4,,807-814,,,0,1,all publisherfullgold repository repositoryvor,All Open Access Gold Green,,,
2-s2.0-85029695067,10.1590/1678-4162-9045,,,Videoassisted diaphragmatic hernia repair in a cat: Case report,ar,Article,Copat B.,,Universidade Luterana do Brasil,Canoas,Brazil,,,,,2017-01-01,2017,Arquivo Brasileiro De Medicina Veterinaria E Zootecnia,01020935,17672,16784162,Journal,69,4,,883-888,,,4,1,all publisherfullgold repository repositoryvor,All Open Access Gold Green,,,
2-s2.0-85029694046,10.1590/1678-4162-9311,,,Metaphylactic effect of injectable zinc on metabolic and oxidative parameters of sheep in the immediate postpartum,ar,Article,Rocha J.,,Universidade do Oeste de Santa Catarina,Joacaba,Brazil,,,,,2017-01-01,2017,Arquivo Brasileiro De Medicina Veterinaria E Zootecnia,01020935,17672,16784162,Journal,69,4,,1062-1065,,,1,1,all publisherfullgold repository repositoryvor,All Open Access Gold Green,,,
2-s2.0-85029688905,10.1590/1678-4162-9175,,,Excess maternal thyroxine associated with postnatal hyperthyroidism reduces bone growth and proliferative and angiogenic profile of rats growth cartilage,ar,Article,Ribeiro L.,,Universidade Federal de Minas Gerais,Belo Horizonte,Brazil,,,,,2017-01-01,2017,Arquivo Brasileiro De Medicina Veterinaria E Zootecnia,01020935,17672,16784162,Journal,69,4,,962-972,,,1,1,all publisherfullgold repository repositoryvor,All Open Access Gold Green,,,
2-s2.0-85029687902,10.1590/1678-4162-9404,,,Papillary Adenocarcinoma of the descending colon in a dog: Case report,ar,Article,Ferreira M.G.P.A.,,"Universidade Estadual Paulista ""Júlio de Mesquita Filho""",Sao Paulo,Brazil,,,,,2017-01-01,2017,Arquivo Brasileiro De Medicina Veterinaria E Zootecnia,01020935,17672,16784162,Journal,69,4,,830-834,,,2,0,,,,,
2-s2.0-85029687564,10.1590/1678-4162-8867,,,"Comparison between Holstein and Holstein × Jersey crossbred cows for health, immunity and easy calving",ar,Article,Dal Pizzol J.G.,,Universidade do Estado de Santa Catarina,Florianopolis,Brazil,,,,,2017-01-01,2017,Arquivo Brasileiro De Medicina Veterinaria E Zootecnia,01020935,17672,16784162,Journal,69,4,,955-961,,,3,1,all publisherfullgold repository repositoryvor,All Open Access Gold Green,,,
2-s2.0-85029684252,10.1590/1678-4162-9344,,,"Histomorphological characterization of collared peccary (Pecari tajacu Linnaeus, 1758) ear integumentary system",ar,Article,Borges A.A.,,Universidade Federal Rural do Semi-Árido,Mossoro,Brazil,,,,,2017-01-01,2017,Arquivo Brasileiro De Medicina Veterinaria E Zootecnia,01020935,17672,16784162,Journal,69,4,,948-954,,,7,1,all publisherfullgold repository repositoryvor,All Open Access Gold Green,,,
2-s2.0-85029682099,10.1590/1678-4162-9229,,,Retrospective study of ocular complication following phacoemulsification with intraocular acrylic lens implantation in dogs,ar,Article,Guimarães T.G.,,Universidade de Franca,Franca,Brazil,,,,,2017-01-01,2017,Arquivo Brasileiro De Medicina Veterinaria E Zootecnia,01020935,17672,16784162,Journal,69,4,,915-920,,,1,1,all publisherfullgold repository repositoryvor,All Open Access Gold Green,,,
2-s2.0-85029681708,10.1590/1678-4162-9093,,,Endometrial transcription of microbial molecular patterns receptors in Gyr and F1 Holstein × Gyr postpartum cows,ar,Article,Martins T.,,Universidade Federal de Minas Gerais,Belo Horizonte,Brazil,,,,,2017-01-01,2017,Arquivo Brasileiro De Medicina Veterinaria E Zootecnia,01020935,17672,16784162,Journal,69,4,,835-842,,,0,1,all publisherfullgold repository repositoryvor,All Open Access Gold Green,,,
2-s2.0-85029680050,10.1590/1678-4162-9300,,,Main causes of bovine liver condemnation in an abattoir under the Federal Inspection Services in the Zona da Mata of the state of Minas Gerais,ar,Article,Souza S.,,Faculdade Vértice,,Brazil,,,,,2017-01-01,2017,Arquivo Brasileiro De Medicina Veterinaria E Zootecnia,01020935,17672,16784162,Journal,69,4,,1054-1061,,,1,1,all publisherfullgold repository repositoryvor,All Open Access Gold Green,,,
2-s2.0-85029678465,10.1590/1678-4162-9205,,,Early and late analysis of postpartum stress in newborn foals,ar,Article,Cruz R.,,"Universidade Estadual Paulista ""Júlio de Mesquita Filho""",Sao Paulo,Brazil,,,,,2017-01-01,2017,Arquivo Brasileiro De Medicina Veterinaria E Zootecnia,01020935,17672,16784162,Journal,69,4,,785-792,,,0,1,all publisherfullgold repository repositoryvor,All Open Access Gold Green,,,
2-s2.0-85029678128,10.1590/1678-4162-9445,,,Vitamin K supplementation for meat quail in growth of 15 to 35 days old,ar,Article,Stanquevis C.,,Universidade Estadual de Maringá,Maringa,Brazil,,,,,2017-01-01,2017,Arquivo Brasileiro De Medicina Veterinaria E Zootecnia,01020935,17672,16784162,Journal,69,4,,1006-1012,,,1,1,all publisherfullgold repository repositoryvor,All Open Access Gold Green,,,
2-s2.0-85029677576,10.1590/1678-4162-9116,,,Morpho-fuctional evaluation of porcine tunica albuginea as a graft for cystoplasty in rats,ar,Article,Moraes T.,,Universidade Federal Fluminense,Niteroi,Brazil,,,,,2017-01-01,2017,Arquivo Brasileiro De Medicina Veterinaria E Zootecnia,01020935,17672,16784162,Journal,69,4,,973-979,,,1,1,all publisherfullgold repository repositoryvor,All Open Access Gold Green,,,
2-s2.0-85029674037,10.1590/1678-4162-8972,,,Plasma blood associated with the treatment of bothropic poisoning in equine: Case report,ar,Article,Camplesi A.C.,,"Universidade Estadual Paulista ""Júlio de Mesquita Filho""",Sao Paulo,Brazil,,,,,2017-01-01,2017,Arquivo Brasileiro De Medicina Veterinaria E Zootecnia,01020935,17672,16784162,Journal,69,4,,815-820,,,1,1,all publisherfullgold repository repositoryvor,All Open Access Gold Green,,,
2-s2.0-85029671973,10.1590/1678-4162-9222,,,Cytocentrifugation and conventional methods in endometrial cytology of estrus and diestrus mares,ar,Article,Jorge M.L.N.,,"Universidade Estadual Paulista ""Júlio de Mesquita Filho""",Sao Paulo,Brazil,,,,,2017-01-01,2017,Arquivo Brasileiro De Medicina Veterinaria E Zootecnia,01020935,17672,16784162,Journal,69,4,,802-806,,,0,1,all publisherfullgold repository repositoryvor,All Open Access Gold Green,,,
2-s2.0-85029668980,10.1590/1678-4162-9239,,,New perspectives in the diagnosis and treatment of acropostitis-phimosis of bulls,ar,Article,Rabelo R.E.,,Universidade Federal de Goiás,Goiania,Brazil,,,,,2017-01-01,2017,Arquivo Brasileiro De Medicina Veterinaria E Zootecnia,01020935,17672,16784162,Journal,69,4,,851-859,,,2,1,all publisherfullgold repository repositoryvor,All Open Access Gold Green,,,
2-s2.0-85029668819,10.1590/1678-4162-9060,,,Evaluation of the cryosurgery for treatment of squamous cell carcinoma in cats,ar,Article,Prado L.O.C.,,"Universidade Estadual Paulista ""Júlio de Mesquita Filho""",Sao Paulo,Brazil,,,,,2017-01-01,2017,Arquivo Brasileiro De Medicina Veterinaria E Zootecnia,01020935,17672,16784162,Journal,69,4,,877-882,,,5,1,all publisherfullgold repository repositoryvor,All Open Access Gold Green,,,
2-s2.0-85029626270,10.1111/vaa.12399,S1467298716313964,28237684,Effects of dexmedetomidine combined with ropivacaine on sciatic and femoral nerve blockade in dogs,ar,Article,Trein T.A.,,"Universidade Estadual Paulista ""Júlio de Mesquita Filho""",Sao Paulo,Brazil,,,,,2017-01-01,January 2017,Veterinary Anaesthesia and Analgesia,14672987,19498,14672995,Journal,44,1,,144-153,,,29,1,all publisherfree2read,All Open Access Bronze,,,
2-s2.0-85029432541,10.3415/VCOT-16-09-0130,,28763519,Effects of nandrolone decanoate on time to consolidation of bone defects resulting from osteotomy for tibial tuberosity advancement,ar,Article,Marques D.R.C.,,Universidade Federal do Parana,Curitiba,Brazil,,,,,2017-01-01,2017,Veterinary and Comparative Orthopaedics and Traumatology,09320814,19501,,Journal,30,5,,351-356,,,1,0,,,,,
2-s2.0-85029392972,10.1590/0103-8478cr20170116,,,Sample size for estimation of the pearson correlation coefficient in cherry tomato tests,ar,Article,Sari B.G.,,Universidade Federal de Santa Maria,Santa Maria,Brazil,,,,,2017-01-01,2017,Ciencia Rural,01038478,4000151812,16784596,Journal,47,10,e20170116,,,,7,1,all publisherfullgold repository repositoryvor repositoryam,All Open Access Gold Green,,,
2-s2.0-85029379727,10.1590/0103-8478cr20161042,,,Milk coagulation properties and methods of detection,ar,Article,Beux S.,,Universidade Federal do Parana,Curitiba,Brazil,,,,,2017-01-01,2017,Ciencia Rural,01038478,4000151812,16784596,Journal,47,10,e20161042,,,,8,1,all publisherfullgold repository repositoryvor repositoryam,All Open Access Gold Green,,,
2-s2.0-85029378459,10.1590/0103-8478cr20151498,,,Chemical thinning of flowers and fruits of the peach cultivar coral with hydrogen cyanamide,ar,Article,Anzanello R.,,Departamento de Diagnóstico e Pesquisa Agropecuária - DDPA,São Gabriel,Brazil,,,,,2017-01-01,2017,Ciencia Rural,01038478,4000151812,16784596,Journal,47,10,e20151498,,,,2,1,all publisherfullgold repository repositoryvor repositoryam,All Open Access Gold Green,,,
2-s2.0-85029373051,10.1590/0103-8478cr20160937,,,"Soil macrofauna in a cerrado/caatinga ecotone under different crops in southwestern Piauí state, Brazil",ar,Article,Santos D.P.,,Universidade Federal de Goiás,Goiania,Brazil,,,,,2017-01-01,2017,Ciencia Rural,01038478,4000151812,16784596,Journal,47,10,e20160937,,,,4,1,all publisherfullgold repository repositoryvor repositoryam,All Open Access Gold Green,,,
2-s2.0-85029360513,10.1590/0103-8478cr20170029,,,"Ocular diseases in dogs naturally affected by visceral leishmaniasis in Teresina, Piauí, Brazil",ar,Article,Freitas M.V.d.M.,,Universidade Federal do Piauí,Teresina,Brazil,,,,,2017-01-01,2017,Ciencia Rural,01038478,4000151812,16784596,Journal,47,10,e20170029,,,,3,1,all publisherfullgold repository repositoryvor repositoryam,All Open Access Gold Green,,,
2-s2.0-85029325471,10.26605/medvet-n1-1591,,,Evaluation of the immune response in dogs vaccinated against canine distemper associated to acupuncture stimuli,ar,Article,Portela V.A.B.,,Universidade Federal Rural de Pernambuco,Recife,Brazil,,,,,2017-01-01,2017,Medicina Veterinaria Brazil,18094678,21100829266,,Journal,11,1,,1-7,,,0,1,all publisherfullgold,All Open Access Gold,,,
2-s2.0-85029314524,10.26605/medvet-n1-1627,,,"Perception assessment on zoonoses with health agents, endemic diseases agentes and school teachers public surrounding the Estação Ecológica de Caetés, Metropolitan Region of Recife-PE, Brazil",ar,Article,Costa G.,,Universidade Federal Rural de Pernambuco,Recife,Brazil,,,,,2017-01-01,2017,Medicina Veterinaria Brazil,18094678,21100829266,,Journal,11,1,,67-75,,,2,1,all publisherfullgold,All Open Access Gold,,,
2-s2.0-85029311400,10.26605/medvet-n1-1597,,,Late complications of the use of nylon clamp for ovarian pedicles ligation in a bitch: Case report,ar,Article,Trajano S.C.,,Universidade Federal Rural de Pernambuco,Recife,Brazil,,,,,2017-01-01,2017,Medicina Veterinaria Brazil,18094678,21100829266,,Journal,11,1,,41-46,,,1,1,all publisherfullgold repository repositoryam,All Open Access Gold Green,,,
2-s2.0-85029309643,10.26605/medvet-n1-1628,,,"Analysis of traffic accidents caused by animals on federal highways in the state of Pernambuco, Brazil",ar,Article,Jardim J.M.M.,,Universidade Federal Rural de Pernambuco;Polícia Rodoviária Federal,Recife;Recife,Brazil;Brazil,,,,,2017-01-01,2017,Medicina Veterinaria Brazil,18094678,21100829266,,Journal,11,1,,76-84,,,2,1,all publisherfullgold,All Open Access Gold,,,
2-s2.0-85029299819,10.26605/medvet-n1-1596,,,"Pain treatment in small animals: Classification, indications and administration routes of analgesics drugs (literature review: Part II)",re,Review,Aleixo G.A.S.,,Universidade Federal Rural de Pernambuco,Recife,Brazil,,,,,2017-01-01,2017,Medicina Veterinaria Brazil,18094678,21100829266,,Journal,11,1,,29-40,,,1,1,all publisherfullgold,All Open Access Gold,,,
2-s2.0-85029295830,10.26605/medvet-n1-1595,,,"Clinical evaluation of superficial lymph nodes in small ruminants bred in the State of Sergipe, Brazil",ar,Article,Rizzo H.,,Universidade Federal Rural de Pernambuco,Recife,Brazil,,,,,2017-01-01,2017,Medicina Veterinaria Brazil,18094678,21100829266,,Journal,11,1,,18-28,,,1,1,all publisherfullgold,All Open Access Gold,,,
2-s2.0-85029290868,10.26605/medvet-n1-1625,,,Effect of frequency of milking crossbred cows in the profitability of dairy farming,ar,Article,Teixeira Júnior F.E.P.,,Universidade Estadual de Montes Claros,Montes Claros,Brazil,,,,,2017-01-01,2017,Medicina Veterinaria Brazil,18094678,21100829266,,Journal,11,1,,53-61,,,2,1,all publisherfullgold,All Open Access Gold,,,
2-s2.0-85029284218,10.26605/medvet-n1-1624,,,Sebaceous adenitis in dogs: Report of three cases,ar,Article,Schellin P.C.,,Universidade Federal Rural de Pernambuco,Recife,Brazil,,,,,2017-01-01,2017,Medicina Veterinaria Brazil,18094678,21100829266,,Journal,11,1,,47-52,,,0,1,all publisherfullgold,All Open Access Gold,,,
2-s2.0-85029282313,10.26605/medvet-n1-1592,,,"Clinical, haematological, biochemical and cytological aspects of canine transmissible venereal tumor in dogs treated with vincristine sulfate",ar,Article,Ferreira M.A.Q.B.,,Universidade Federal Rural de Pernambuco;Faculdade Instituto Brasileiro de Gestão e Marketing,Recife;Recife,Brazil;Brazil,,,,,2017-01-01,2017,Medicina Veterinaria Brazil,18094678,21100829266,,Journal,11,1,,8-17,,,4,1,all publisherfullgold,All Open Access Gold,,,
2-s2.0-85029280363,10.26605/medvet-n1-1626,,,Polymorphisms within the 3’UTR region of SLC11A1 gene in Holstein and Girolando dairy herds,ar,Article,Diniz W.J.S.,,Universidade Federal Rural de Pernambuco,Recife,Brazil,,,,,2017-01-01,2017,Medicina Veterinaria Brazil,18094678,21100829266,,Journal,11,1,,62-66,,,0,1,all publisherfullgold repository repositoryam,All Open Access Gold Green,,,
2-s2.0-85028998435,10.1590/0103-8478cr20170189,,,Net energy levels on the lipid profile of pork,ar,Article,Alencar S.A.d.S.,,Universidade Federal de Mato Grosso do Sul,Campo Grande,Brazil,,,,,2017-01-01,2017,Ciencia Rural,01038478,4000151812,16784596,Journal,47,10,e20170189,,,,1,1,all publisherfullgold repository repositoryvor repositoryam,All Open Access Gold Green,,,
2-s2.0-85028994217,10.1590/0103-8478cr20161044,,,Serological response to rabies virus induced by commercial vaccines in cattle,ar,Article,Martins M.,,Universidade Federal de Santa Maria,Santa Maria,Brazil,,,,,2017-01-01,2017,Ciencia Rural,01038478,4000151812,16784596,Journal,47,10,e20161044,,,,0,1,all publisherfullgold repository repositoryam,All Open Access Gold Green,,,
2-s2.0-85028989510,10.1590/0103-8478cr20170248,,,Peripheral neuropathy in a copper-deficient goat,ar,Article,de Almeida V.M.,,Universidade Federal Rural de Pernambuco,Recife,Brazil,,,,,2017-01-01,2017,Ciencia Rural,01038478,4000151812,16784596,Journal,47,10,e20170248,,,,2,1,all publisherfullgold repository repositoryvor repositoryam,All Open Access Gold Green,,,
2-s2.0-85028970596,10.1590/0103-8478cr20161120,,,Estimated live weight of growing pêga breed donkeys,ar,Article,Moreira C.G.,,Universidade de São Paulo,Sao Paulo,Brazil,,,,,2017-01-01,2017,Ciencia Rural,01038478,4000151812,16784596,Journal,47,10,e20161120,,,,6,1,all publisherfullgold repository repositoryvor repositoryam,All Open Access Gold Green,,,
2-s2.0-85028960801,10.1590/0103-8478cr20170011,,,"Single- and multispecies biofilms by escherichia coli, staphylococcus aureus, and salmonella spp. Isolated from raw fish and a fish processing unit",ar,Article,Frozi J.,,Universidade Federal Fluminense,Niteroi,Brazil,,,,,2017-01-01,2017,Ciencia Rural,01038478,4000151812,16784596,Journal,47,10,e20170011,,,,16,1,all publisherfullgold repository repositoryvor repositoryam,All Open Access Gold Green,,,
2-s2.0-85028954609,10.1590/0103-8478cr20160470,,,Relevant aspects of golden retriever muscular dystrophy for the study of duchenne muscular dystrophy in humans,ar,Article,De Moraes J.R.E.,,"Universidade Estadual Paulista ""Júlio de Mesquita Filho""",Sao Paulo,Brazil,,,,,2017-01-01,2017,Ciencia Rural,01038478,4000151812,16784596,Journal,47,10,e20160470,,,,1,1,all publisherfullgold repository repositoryvor repositoryam,All Open Access Gold Green,,,
