eid,doi,pii,pubmed_id,title,subtype,subtypeDescription,creator,afid,affilname,affiliation_city,affiliation_country,author_count,author_names,author_ids,author_afids,coverDate,coverDisplayDate,publicationName,issn,source_id,eIssn,aggregationType,volume,issueIdentifier,article_number,pageRange,description,authkeywords,citedby_count,openaccess,freetoread,freetoreadLabel,fund_acr,fund_no,fund_sponsor
2-s2.0-85014666190,10.1177/1040638716682564,,28064563,Embryotoxic effects of Poincianella (Caesalpinia) pyramidalis leaves on pregnant rats,ar,Article,Câmara A.C.L.,,Universidade Federal Rural do Semi-Árido,Mossoro,Brazil,,,,,2017-03-01,1 March 2017,Journal of Veterinary Diagnostic Investigation,10406387,18313,19434936,Journal,29,2,,137-142,,,8,1,all publisherfree2read,All Open Access Bronze,,,
2-s2.0-85014657552,10.1177/1040638716686641,,28068884,Evaluation of protein spectra cluster analysis for Streptococcus spp. identification from various swine clinical samples,ar,Article,Matajira C.E.C.,,Universidade de São Paulo,Sao Paulo,Brazil,,,,,2017-03-01,1 March 2017,Journal of Veterinary Diagnostic Investigation,10406387,18313,19434936,Journal,29,2,,245-249,,,5,1,all publisherfree2read,All Open Access Bronze,,,
2-s2.0-85014588204,10.1111/jsap.12609,,28267221,"Single-aliquot, non-bronchoscopic bronchoalveolar lavage in the diagnosis of metastatic mammary tumours in dogs",ar,Article,Pavelski M.,,Universidade Federal do Parana,Curitiba,Brazil,,,,,2017-03-01,1 March 2017,Journal of Small Animal Practice,00224510,18300,17485827,Journal,58,3,,168-173,,,4,0,,,,,
2-s2.0-85013647403,10.1139/cjas-2015-0147,,,"Relative contribution of breed, gender, and diet to the fatty acid profile of young crossbred beef cattle finished on feedlot",ar,Article,Silva M.L.P.,,"Universidade Estadual Paulista ""Júlio de Mesquita Filho""",Sao Paulo,Brazil,,,,,2017-03-01,March 2017,Canadian Journal of Animal Science,00083984,37794,19181825,Journal,97,1,,6-9,,,2,1,all publisherfree2read,All Open Access Bronze,,,
2-s2.0-85013098574,10.1177/0300985816666610,,27586238,Natural Outbreak of BVDV-1d–Induced Mucosal Disease Lacking Intestinal Lesions,ar,Article,Bianchi M.,,Universidade Federal do Rio Grande do Sul,Porto Alegre,Brazil,,,,,2017-03-01,1 March 2017,Veterinary Pathology,03009858,19538,15442217,Journal,54,2,,242-248,,,26,1,all publisherfree2read,All Open Access Bronze,,,
2-s2.0-85013004943,10.1111/vcp.12461,,28186645,Occult gastrointestinal bleeding is a common finding in dogs with chronic kidney disease,ar,Article,Crivellenti L.Z.,,"Universidade Estadual Paulista ""Júlio de Mesquita Filho"";Universidade de Franca",Sao Paulo;Franca,Brazil;Brazil,,,,,2017-03-01,1 March 2017,Veterinary Clinical Pathology,02756382,19504,1939165X,Journal,46,1,,132-137,,,13,0,,,,,
2-s2.0-85012885235,10.1111/vcp.12454,,28165629,Renal biochemistry variables and ultrasonographic imaging in healthy Squirrel monkeys (Saimiri collinsi),ar,Article,Lins e Lins F.,,Universidade Federal Rural da Amazonia,Belem,Brazil,,,,,2017-03-01,1 March 2017,Veterinary Clinical Pathology,02756382,19504,1939165X,Journal,46,1,,126-131,,,4,1,all publisherfree2read,All Open Access Bronze,,,
2-s2.0-85012277253,10.1016/j.livsci.2017.01.010,S1871141317300185,,"Relationship between pig carcass characteristics measured in live pigs or carcasses with Piglog, Fat-o-Meat'er and computed tomography",ar,Article,Lucas D.,,Universidade Federal Fluminense;Institut de Recerca I Technologia Agroalimentaries,Niteroi;Caldes de Montbui,Brazil;Spain,,,,,2017-03-01,1 March 2017,Livestock Science,18711413,3300147807,,Journal,197,,,88-95,,,18,0,,,,,
2-s2.0-85012277242,10.1016/j.vetmic.2017.01.016,S0378113516308355,28284597,Pseudomonas aeruginosa strain PA01 impairs enzymes of the phosphotransfer network in the gills of Rhamdia quelen,ar,Article,Baldissera M.D.,,Universidade Federal de Santa Maria,Santa Maria,Brazil,,,,,2017-03-01,1 March 2017,Veterinary Microbiology,03781135,20882,18732542,Journal,201,,,121-125,,,30,0,,,,,
2-s2.0-85012254028,10.1016/j.vetmic.2017.01.023,S037811351730086X,28284602,A novel chimeric protein composed of recombinant Mycoplasma hyopneumoniae antigens as a vaccine candidate evaluated in mice,ar,Article,de Oliveira N.R.,,Universidade Federal de Pelotas,Pelotas,Brazil,,,,,2017-03-01,1 March 2017,Veterinary Microbiology,03781135,20882,18732542,Journal,201,,,146-153,,,16,0,,,,,
2-s2.0-85012136630,10.1016/j.jevs.2016.11.010,S0737080616303926,,Differential Expression of Monocarboxylate Transporter 1 and Ancillary Protein CD147 in Red Blood Cells of Show Jumping Horses,ar,Article,Feringer Júnior W.H.,,"Universidade Estadual Paulista ""Júlio de Mesquita Filho""",Sao Paulo,Brazil,,,,,2017-03-01,1 March 2017,Journal of Equine Veterinary Science,07370806,18296,,Journal,50,,,139-144,,,0,1,all publisherhybridgold repository repositoryvor,All Open Access Hybrid Gold Green,,,
2-s2.0-85011845012,10.1016/j.livsci.2017.01.005,S1871141317300057,,Effect of dietary amino acid supplementation during gestation on placental efficiency and litter birth weight in gestating gilts,ar,Article,Dallanora D.,,Universidade Federal do Rio Grande do Sul;Universidade do Oeste de Santa Catarina,Porto Alegre;Joacaba,Brazil;Brazil,,,,,2017-03-01,1 March 2017,Livestock Science,18711413,3300147807,,Journal,197,,,30-35,,,19,0,,,,,
2-s2.0-85011708547,10.1016/j.vetimm.2017.01.006,S0165242717300417,28241998,The uremic toxin methylguanidine increases the oxidative metabolism and accelerates the apoptosis of canine neutrophils,ar,Article,Bosco A.,,"Universidade Estadual Paulista ""Júlio de Mesquita Filho""",Sao Paulo,Brazil,,,,,2017-03-01,1 March 2017,Veterinary Immunology and Immunopathology,01652427,19520,18732534,Journal,185,,,14-19,,,10,2,all repository repositoryvor,All Open Access Green,,,
2-s2.0-85011655592,10.1007/s00436-017-5375-4,,28160074,Parasitism and inflammation in ear skin and in genital tissues of symptomatic and asymptomatic male dogs with visceral leishmaniasis,ar,Article,Carvalho Junior C.G.,,Universidade Federal de Sao Joao del-Rei,Sao Joao del Rei,Brazil,,,,,2017-03-01,1 March 2017,Parasitology Research,09320113,20340,14321955,Journal,116,3,,987-995,,,9,0,,,,,
2-s2.0-85011559297,10.1016/j.cvsm.2016.11.004,S0195561616301504,28164837,Perioperative Fluid Therapy,re,Review,Fantoni D.,,Universidade de São Paulo,Sao Paulo,Brazil,,,,,2017-03-01,1 March 2017,Veterinary Clinics of North America Small Animal Practice,01955616,19516,18781306,Journal,47,2,,423-434,,,20,0,,,,,
2-s2.0-85011409882,10.1016/j.vetmic.2017.01.024,S0378113517300871,28284605,Pro-apoptotic effect of a Mycoplasma hyopneumoniae putative type I signal peptidase on PK(15) swine cells,ar,Article,Paes J.A.,,Universidade Federal do Rio Grande do Sul,Porto Alegre,Brazil,,,,,2017-03-01,1 March 2017,Veterinary Microbiology,03781135,20882,18732542,Journal,201,,,170-176,,,13,0,,,,,
2-s2.0-85011356946,10.1016/j.vetmic.2017.01.029,S0378113517301049,28284599,The oral microbiota of domestic cats harbors a wide variety of Staphylococcus species with zoonotic potential,ar,Article,Rossi C.C.,,Universidade Federal do Rio de Janeiro,Rio de Janeiro,Brazil,,,,,2017-03-01,1 March 2017,Veterinary Microbiology,03781135,20882,18732542,Journal,201,,,136-140,,,19,0,,,,,
2-s2.0-85011034344,10.1016/j.vaccine.2017.01.030,S0264410X17300798,28161422,IL-17A and complement contribute to killing of pneumococci following immunization with a pneumococcal whole cell vaccine,ar,Article,Campos I.B.,,Universidade de São Paulo;Instituto Butantan,Sao Paulo;Sao Paulo,Brazil;Brazil,,,,,2017-03-01,1 March 2017,Vaccine,0264410X,21376,18732518,Journal,35,9,,1306-1315,,,20,0,,,,,
2-s2.0-85011022614,10.1016/j.livsci.2017.01.013,S1871141317300215,,Short term culture with cAMP modulators before vitrification significantly improve actin integrity in bovine oocytes,ar,Article,Monteiro C.A.S.,,Universidade Federal Fluminense;Empresa Brasileira de Pesquisa Agropecuária - Embrapa,Niteroi;Brasilia,Brazil;Brazil,,,,,2017-03-01,1 March 2017,Livestock Science,18711413,3300147807,,Journal,197,,,96-101,,,7,2,all repository repositoryvor,All Open Access Green,,,
2-s2.0-85010877242,10.1016/j.livsci.2017.01.011,S1871141317300197,,Development and validation of an objective method for the assessment of body condition scores and selection of beef cows for timed artificial insemination,ar,Article,Pfeifer L.F.M.,,Empresa Brasileira de Pesquisa Agropecuária - Embrapa,Brasilia,Brazil,,,,,2017-03-01,1 March 2017,Livestock Science,18711413,3300147807,,Journal,197,,,82-87,,,20,2,all repository repositoryvor,All Open Access Green,,,
2-s2.0-85010868136,10.1111/vcp.12449,,28112826,Analysis of synovial fluid of the Capybara's stifle joints,ar,Article,Brombini G.C.,,"Universidade Estadual Paulista ""Júlio de Mesquita Filho""",Sao Paulo,Brazil,,,,,2017-03-01,1 March 2017,Veterinary Clinical Pathology,02756382,19504,1939165X,Journal,46,1,,179-182,,,2,0,,,,,
2-s2.0-85010831564,10.1007/s11250-017-1227-6,,28124730,Occurrence of anti-Leptospira spp. antibodies in Rhipidomys spp. from a forest fragment of the Brazilian Cerrado,ar,Article,Gomes D.O.,,Universidade Federal de Uberlândia,Uberlandia,Brazil,,,,,2017-03-01,1 March 2017,Tropical Animal Health and Production,00494747,18937,15737438,Journal,49,3,,555-559,,,3,0,,,,,
2-s2.0-85010806816,10.1007/s00436-017-5384-3,,28124738,"Morphological and histochemical changes associated with massive infection by Neoechinorhynchus buttnerae (Acanthocephala: Neoechinorhynchidae) in the farmed freshwater fish Colossoma macropomum Cuvier, 1818 from the Amazon State, Brazil",ar,Article,de Matos L.V.,,Amazon Federal University,,Brazil,,,,,2017-03-01,1 March 2017,Parasitology Research,09320113,20340,14321955,Journal,116,3,,1029-1037,,,48,0,,,,,
2-s2.0-85010723540,10.1007/s11250-017-1224-9,,28124731,Digestion and metabolism of low and high residual feed intake Nellore bulls,ar,Article,Bonilha S.,,Agência Paulista de Tecnologia dos Agronegócios,Sao Paulo,Brazil,,,,,2017-03-01,1 March 2017,Tropical Animal Health and Production,00494747,18937,15737438,Journal,49,3,,529-535,,,35,0,,,,,
2-s2.0-85010471761,10.1016/j.jevs.2016.11.007,S073708061630212X,,"Enteral Fluid Therapy in Horses: Effects of Maintenance Hypotonic Electrolyte Solutions Containing Maltodextrin, Sucrose, or Dextrose Administered in Continuous Flow",ar,Article,Ribeiro Filho J.D.,,Universidade Federal de Vicosa,Vicosa,Brazil,,,,,2017-03-01,1 March 2017,Journal of Equine Veterinary Science,07370806,18296,,Journal,50,,,96-101,,,4,0,,,,,
2-s2.0-85009971485,10.1016/j.anireprosci.2017.01.008,S0378432016302962,28118946,High frequency of leptospiral vaginal carriers among slaughtered cows,ar,Article,Loureiro A.,,Universidade Federal Fluminense,Niteroi,Brazil,,,,,2017-03-01,1 March 2017,Animal Reproduction Science,03784320,36360,,Journal,178,,,50-54,,,46,0,,,,,
2-s2.0-85009238255,10.1007/s00436-016-5355-0,,28083657,Peripheral blood CD4+/CD25+ regulatory T cells in alcoholic patients with Strongyloides stercoralis infection,ar,Article,Ribeiro S.,,Universidade Federal do Espírito Santo,Vitoria,Brazil,,,,,2017-03-01,1 March 2017,Parasitology Research,09320113,20340,14321955,Journal,116,3,,1071-1074,,,4,0,,,,,
2-s2.0-85009063011,10.1016/j.livsci.2017.01.006,S1871141317300069,,Genome-wide search for signatures of selection in three major Brazilian locally adapted sheep breeds,ar,Article,de Simoni Gouveia J.J.,,Universidade Federal do Ceará;Fundacao Universidade Federal do Vale do Sao Francisco,Fortaleza;Petrolina,Brazil;Brazil,,,,,2017-03-01,1 March 2017,Livestock Science,18711413,3300147807,,Journal,197,,,36-45,,,47,0,,,,,
2-s2.0-85008600056,10.1016/j.theriogenology.2016.12.011,S0093691X16305933,28166981,Sperm quality and its freezing ability throughout the spawning season in Prochilodus lineatus and Brycon orbignyanus,ar,Article,Di Chiacchio I.,,Universidade Federal de Lavras,Lavras,Brazil,,,,,2017-03-01,1 March 2017,Theriogenology,0093691X,18903,,Journal,90,,,284-288,,,21,0,,,,,
2-s2.0-85008502095,10.1016/j.smallrumres.2016.12.030,S0921448816303819,,Genetic diversity analysis of major Sri Lankan goat populations using microsatellite and mitochondrial DNA D-loop variations,ar,Article,Silva P.,,University of Peradeniya,Peradeniya,Sri Lanka,,,,,2017-03-01,1 March 2017,Small Ruminant Research,09214488,92166,,Journal,148,,,51-61,,,8,1,all publisherfree2read repository repositoryvor,All Open Access Bronze Green,,,
2-s2.0-85008490293,10.1007/s00436-016-5366-x,,28058537,In vivo efficacy of a biotherapic and eugenol formulation against Rhipicephalus microplus,ar,Article,Valente P.P.,,"Universidade Estadual Paulista ""Júlio de Mesquita Filho""",Sao Paulo,Brazil,,,,,2017-03-01,1 March 2017,Parasitology Research,09320113,20340,14321955,Journal,116,3,,929-938,,,21,0,,,,,
2-s2.0-85008465371,10.1016/j.smallrumres.2016.12.031,S0921448816303820,,Microsatellite based genetic diversity and mitochondrial DNA D-Loop variation in economically important goat breeds of Pakistan,ar,Article,Naqvi A.N.,,Karakoram International University,Gilgit,Pakistan,,,,,2017-03-01,1 March 2017,Small Ruminant Research,09214488,92166,,Journal,148,,,62-71,,,9,2,all repository repositoryvor,All Open Access Green,,,
2-s2.0-85008430556,10.1016/j.smallrumres.2016.12.035,S0921448816303868,,Mapping molecular diversity of indigenous goat genetic resources of Asia,ar,Article,Periasamy K.,,"International Atomic Energy Agency, Vienna",Vienna,Austria,,,,,2017-03-01,1 March 2017,Small Ruminant Research,09214488,92166,,Journal,148,,,2-10,,,18,2,all repository repositoryvor,All Open Access Green,,,
2-s2.0-85008430062,10.1016/j.smallrumres.2016.12.032,S0921448816303832,,Assessment of genetic diversity and structure of major sheep breeds from Pakistan,ar,Article,Naqvi A.N.,,Karakoram International University,Gilgit,Pakistan,,,,,2017-03-01,1 March 2017,Small Ruminant Research,09214488,92166,,Journal,148,,,72-79,,,11,2,all repository repositoryvor,All Open Access Green,,,
2-s2.0-85008315505,10.1016/j.livsci.2016.12.014,S1871141316302931,,Contributions to diversity rather than basic measures of genetic diversity characterise the spreading of donkey throughout the American continent,ar,Article,Jordana J.,,Universitat Autònoma de Barcelona,Cerdanyola del Valles,Spain,,,,,2017-03-01,1 March 2017,Livestock Science,18711413,3300147807,,Journal,197,,,1-7,,,7,0,,,,,
2-s2.0-85008158289,10.1016/j.cvsm.2016.10.010,S0195561616301280,27939864,A Quick Reference on Hypokalemia,re,Review,Kogika M.,,Universidade de São Paulo,Sao Paulo,Brazil,,,,,2017-03-01,1 March 2017,Veterinary Clinics of North America Small Animal Practice,01955616,19516,18781306,Journal,47,2,,229-234,,,16,0,,,,,
2-s2.0-85007564476,10.1016/j.actatropica.2016.12.030,S0001706X16311421,28040482,Schistosoma antigens downregulate CXCL9 production by PBMC of HTLV-1-infected individuals,ar,Article,Lima L.M.,,Universidade Federal da Bahia,Salvador,Brazil,,,,,2017-03-01,1 March 2017,Acta Tropica,0001706X,21288,18736254,Journal,167,,,157-162,,,6,2,all repository repositoryvor,All Open Access Green,,,
2-s2.0-85007551039,10.1016/j.cvsm.2016.10.009,S0195561616301279,27939860,A Quick Reference on Hyperkalemia,re,Review,Kogika M.,,Universidade de São Paulo,Sao Paulo,Brazil,,,,,2017-03-01,1 March 2017,Veterinary Clinics of North America Small Animal Practice,01955616,19516,18781306,Journal,47,2,,223-228,,,9,0,,,,,
2-s2.0-85007448398,10.1007/s11250-016-1215-2,,28028634,Evaluation of body weight and visual scores for genetic improvement of Nelore cattle,ar,Article,Paterno F.,,"Universidade Estadual Paulista ""Júlio de Mesquita Filho""",Sao Paulo,Brazil,,,,,2017-03-01,1 March 2017,Tropical Animal Health and Production,00494747,18937,15737438,Journal,49,3,,467-473,,,12,0,,,,,
2-s2.0-85007415422,10.1007/s00436-016-5367-9,,28039497,Synergistic effects of fenbendazole and metronidazole against Giardia muris in Swiss mice naturally infected,ar,Article,Bezagio R.,,Universidade Estadual de Maringá,Maringa,Brazil,,,,,2017-03-01,1 March 2017,Parasitology Research,09320113,20340,14321955,Journal,116,3,,939-944,,,12,0,,,,,
2-s2.0-85007255938,10.1007/s11250-016-1216-1,,28013440,Equine salmonellosis in southern Brazil,ar,Article,Juffo G.D.,,Universidade Federal do Rio Grande do Sul,Porto Alegre,Brazil,,,,,2017-03-01,1 March 2017,Tropical Animal Health and Production,00494747,18937,15737438,Journal,49,3,,475-482,,,14,0,,,,,
2-s2.0-85006374959,10.1016/j.actatropica.2016.12.008,S0001706X16308658,27986544,"“Candidatus Rickettsia asemboensis” in Rhipicephalus sanguineus ticks, Brazil",ar,Article,Dall'Agnol B.,,Pontifícia Universidade Católica do Rio Grande do Sul;Fundacao Estadual de Pesquisa Agropecuaria,Porto Alegre;Porto Alegre,Brazil;Brazil,,,,,2017-03-01,1 March 2017,Acta Tropica,0001706X,21288,18736254,Journal,167,,,18-20,,,23,1,all publisherhybridgold repository repositoryvor,All Open Access Hybrid Gold Green,,,
2-s2.0-85006039275,10.1111/mve.12208,,27879002,"A study of Culicoides in Rondônia, in the Brazilian Amazon: species composition, relative abundance and potential vectors",ar,Article,Carvalho L.P.C.,,Instituto Nacional de Pesquisas Da Amazonia;Fiocruz Amazônia,Manaus;Manaus,Brazil;Brazil,,,,,2017-03-01,1 March 2017,Medical and Veterinary Entomology,0269283X,17778,13652915,Journal,31,1,,117-122,,,13,0,,,,,
2-s2.0-85003845784,10.1016/j.theriogenology.2016.12.004,S0093691X16305787,28166964,Toxoplasma gondii transmission by artificial insemination in sheep with experimentally contaminated frozen semen,ar,Article,Consalter A.,,Universidade Federal Fluminense,Niteroi,Brazil,,,,,2017-03-01,1 March 2017,Theriogenology,0093691X,18903,,Journal,90,,,169-174,,,12,1,all publisherfree2read,All Open Access Bronze,,,
2-s2.0-85002974837,10.1016/j.theriogenology.2016.11.024,S0093691X16305659,28166954,"Impacts of dose and time of boldenone and stanazolol exposure in inflammatory markers, oxidative and nitrosative stress and histopathological changes in the rat testes",ar,Article,Bueno A.,,Universidade Federal de Santa Maria,Santa Maria,Brazil,,,,,2017-03-01,1 March 2017,Theriogenology,0093691X,18903,,Journal,90,,,101-108,,,16,0,,,,,
2-s2.0-85002548515,10.1016/j.theriogenology.2016.12.001,S0093691X16305751,28166957,Chemical castration in cattle with intratesticular injection of sodium chloride: Effects on stress and inflammatory markers,ar,Article,Oliveira F.C.,,Universidade Federal de Pelotas,Pelotas,Brazil,,,,,2017-03-01,1 March 2017,Theriogenology,0093691X,18903,,Journal,90,,,114-119,,,13,0,,,,,
2-s2.0-85002406518,10.1016/j.theriogenology.2016.11.016,S0093691X16305568,28166990,Use of FSH in two different regimens for ovarian superstimulation prior to ovum pick up and in vitro embryo production in Holstein cows,ar,Article,da Silva J.C.B.,,Universidade de São Paulo,Sao Paulo,Brazil,,,,,2017-03-01,1 March 2017,Theriogenology,0093691X,18903,,Journal,90,,,65-73,,,27,0,,,,,
2-s2.0-85002397918,10.1016/j.theriogenology.2016.10.023,S0093691X16305222,28166994,Deoxynivalenol induces toxic effects in the ovaries of pigs: An ex vivo approach,ar,Article,Gerez J.R.,,Universidade Estadual de Londrina,Londrina,Brazil,,,,,2017-03-01,1 March 2017,Theriogenology,0093691X,18903,,Journal,90,,,94-100,,,29,0,,,,,
2-s2.0-85002168841,10.1016/j.theriogenology.2016.11.003,S0093691X16305362,28166976,Biopsy of bovine embryos produced in vivo and in vitro does not affect pregnancy rates,ar,Article,de Sousa R.V.,,Universidade de Brasília;Embrapa Recursos Geneticos e Biotecnologia,Brasília;Brasilia,Brazil;Brazil,,,,,2017-03-01,1 March 2017,Theriogenology,0093691X,18903,,Journal,90,,,25-31,,,29,0,,,,,
2-s2.0-85001913285,10.1016/j.theriogenology.2016.10.027,S0093691X1630526X,28166987,"Transuterine embryo migration, distribution of sexes within uterine horns, and fetometry in Nellore (Bos indicus) cattle",ar,Article,Borges G.,,Universidade de Brasília,Brasília,Brazil,,,,,2017-03-01,1 March 2017,Theriogenology,0093691X,18903,,Journal,90,,,49-53,,,7,1,all publisherhybridgold,All Open Access Hybrid Gold,,,
2-s2.0-85001889539,10.1016/j.theriogenology.2016.11.002,S0093691X16305350,28166988,Beef donor cows with high number of retrieved COC produce more in vitro embryos compared with cows with low number of COC after repeated ovum pick-up sessions,ar,Article,Monteiro F.M.,,Agência Paulista de Tecnologia dos Agronegócios,Sao Paulo,Brazil,,,,,2017-03-01,1 March 2017,Theriogenology,0093691X,18903,,Journal,90,,,54-58,,,31,0,,,,,
2-s2.0-85001849164,10.1007/s11259-016-9669-2,,27933442,Arterial pulse wave propagation velocity in healthy dogs by pulse wave Doppler ultrasound,ar,Article,Nogueira R.,,Universidade Federal de Lavras,Lavras,Brazil,,,,,2017-03-01,1 March 2017,Veterinary Research Communications,01657380,19557,15737446,Journal,41,1,,33-40,,,1,0,,,,,
2-s2.0-85001038008,10.1016/j.jevs.2016.11.003,S0737080616303616,,Morphology and Morphometry of Seminiferous Tubules in Crioulo Horses,ar,Article,Figueiró G.,,Universidade Federal de Santa Catarina,Florianopolis,Brazil,,,,,2017-03-01,1 March 2017,Journal of Equine Veterinary Science,07370806,18296,,Journal,50,,,20-26,,,2,0,,,,,
2-s2.0-84999053470,10.1016/j.theriogenology.2016.11.015,S0093691X1630557X,28166953,"mRNA expression profile of the TNF-α system in LH-induced bovine preovulatory follicles and effects of TNF-α on gene expression, ultrastructure and expansion of cumulus-oocyte complexes cultured in vitro",ar,Article,Silva A.W.B.,,Universidade Federal do Ceará,Fortaleza,Brazil,,,,,2017-03-01,1 March 2017,Theriogenology,0093691X,18903,,Journal,90,,,1-10,,,9,0,,,,,
2-s2.0-84999009659,10.1016/j.theriogenology.2016.10.026,S0093691X16305258,28166985,"In vitro growth and maturation of isolated caprine preantral follicles: Influence of insulin and FSH concentration, culture dish, coculture, and oocyte size on meiotic resumption",ar,Article,Silva G.M.,,Universidade Estadual do Ceará,Fortaleza,Brazil,,,,,2017-03-01,1 March 2017,Theriogenology,0093691X,18903,,Journal,90,,,32-41,,,14,0,,,,,
2-s2.0-84998995966,10.1016/j.theriogenology.2016.11.001,S0093691X16305295,28166956,Impact of induced levels of specific free radicals and malondialdehyde on chicken semen quality and fertility,ar,Article,Rui B.R.,,Universidade de São Paulo,Sao Paulo,Brazil,,,,,2017-03-01,1 March 2017,Theriogenology,0093691X,18903,,Journal,90,,,11-19,,,54,0,,,,,
2-s2.0-84995793713,10.1007/s11259-016-9666-5,,27864728,Variation in pestivirus growth in testicle primary cell culture is more dependent on the individual cell donor than cattle breed,ar,Article,Weber M.N.,,Universidade Federal do Rio Grande do Sul,Porto Alegre,Brazil,,,,,2017-03-01,1 March 2017,Veterinary Research Communications,01657380,19557,15737446,Journal,41,1,,1-7,,,4,0,,,,,
2-s2.0-84961771379,10.1016/j.vaccine.2016.03.026,S0264410X16003376,27002503,On the need to wait 4 weeks between two live attenuated vaccines,le,Letter,Camacho L.,,Fundacao Oswaldo Cruz,Rio de Janeiro,Brazil,,,,,2017-03-01,1 March 2017,Vaccine,0264410X,21376,18732518,Journal,35,9,,1207,,,0,0,,,,,
2-s2.0-84961755652,10.1111/evj.12571,,26875684,Detection of Vaccinia virus during an outbreak of exanthemous oral lesions in Brazilian equids,ar,Article,Abrahão J.S.,,Universidade Federal de Minas Gerais,Belo Horizonte,Brazil,,,,,2017-03-01,1 March 2017,Equine Veterinary Journal,04251644,17777,20423306,Journal,49,2,,221-224,,,9,0,,,,,
2-s2.0-85021358322,10.4314/ovj.v7i1.7,,,Survey of spatial distribution of vector-borne disease in neighborhood dogs in southern Brazil,ar,Article,Constantino C.,,Universidade Federal do Parana,Curitiba,Brazil,,,,,2017-02-27,27 February 2017,Open Veterinary Journal,22264485,21100438194,22186050,Journal,7,1,,50-56,,,5,1,all publisherfullgold repository repositoryvor repositoryam,All Open Access Gold Green,,,
2-s2.0-85019959624,10.1007/978-3-319-45007-0_8,,,How to enter PDT in clinical practice?,ch,Book Chapter,Nascimento C.,,Veterinary Unit of Santos Aquarium,Santos,Brazil,,,,,2017-02-27,27 February 2017,Photodynamic Therapy in Veterinary Medicine from Basics to Clinical Practice,,21100815392,,Book,,,,111-123,,,1,0,,,,,
2-s2.0-85019952508,10.1007/978-3-319-45007-0_4,,,Molecular damage,ch,Book Chapter,Sabino C.P.,,"Universidade de São Paulo;University of Toronto Faculty of Medicine;Instituto de Pesquisas Energeticas e Nucleares, Sao Paulo",Sao Paulo;Toronto;Sao Paulo,Brazil;Canada;Brazil,,,,,2017-02-27,27 February 2017,Photodynamic Therapy in Veterinary Medicine from Basics to Clinical Practice,,21100815392,,Book,,,,45-56,,,1,0,,,,,
2-s2.0-85019948406,10.1007/978-3-319-45007-0_7,,,Multimodality dosimetry,ch,Book Chapter,Ribeiro M.S.,,"Instituto de Pesquisas Energeticas e Nucleares, Sao Paulo",Sao Paulo,Brazil,,,,,2017-02-27,27 February 2017,Photodynamic Therapy in Veterinary Medicine from Basics to Clinical Practice,,21100815392,,Book,,,,93-109,,,0,0,,,,,
2-s2.0-85019943803,10.1007/978-3-319-45007-0_3,,,Photosensitizers,ch,Book Chapter,Hamblin M.R.,,Harvard Medical School;Massachusetts General Hospital;Harvard-MIT Health Sciences and Technology,Boston;Boston;Cambridge,United States;United States;United States,,,,,2017-02-27,27 February 2017,Photodynamic Therapy in Veterinary Medicine from Basics to Clinical Practice,,21100815392,,Book,,,,25-43,,,4,0,,,,,
2-s2.0-85019940580,10.1007/978-3-319-45007-0,,,Photodynamic therapy in veterinary medicine: From basics to clinical practice,bk,Book,Sellera F.,,Universidade de São Paulo,Sao Paulo,Brazil,,,,,2017-02-27,27 February 2017,Photodynamic Therapy in Veterinary Medicine from Basics to Clinical Practice,,21100815392,,Book,,,,1-228,,,8,0,,,,,
2-s2.0-85019924448,10.1007/978-3-319-45007-0_6,,,Systemic effects,ch,Book Chapter,Hamblin M.R.,,Harvard Medical School;Massachusetts General Hospital;Harvard-MIT Health Sciences and Technology,Boston;Boston;Cambridge,United States;United States;United States,,,,,2017-02-27,27 February 2017,Photodynamic Therapy in Veterinary Medicine from Basics to Clinical Practice,,21100815392,,Book,,,,73-91,,,0,0,,,,,
